status_id,status_message,link_name,status_type,status_link,status_published,status_video_length,num_reactions,num_comments,num_shares,num_likes,num_loves,num_wows,num_hahas,num_sads,num_angrys
64067037679_10153038605547680,"There are several ways to personalize your cruise experience, even when traveling on a large ship.",8 best ways to personalize your cruise,link,http://expd.us/1hf387,2015-10-20 20:00:01,,25,16,2,25,0,0,0,0,0
64067037679_10153038714227680,"Sail to the Caribbean with Princess Cruises and save up to $1,000.",Sweet Deals on Caribbean Cruises,link,http://expd.us/fCgh03,2015-10-20 15:00:00,,8000,63,253,8000,0,0,0,0,0
64067037679_10153037216532680,"Cruises are notorious for their endless buffets, 24-hour dining options, and fabulous cuisine. But you don't have to ruin that bikini body you've worked so hard for when going on a cruise. Our expert's tips...",How to Stay Healthy on a Cruise,link,http://expd.us/VdSgv9,2015-10-19 20:00:00,,59,6,6,59,0,0,0,0,0
64067037679_10153037007587680,Would you rather have free unlimited drinks or a free dining package? via Norwegian Cruise Line.,Get one of these free perks when you book a sailing with Norwegian Cruise Line,link,http://expd.us/9AnJTy,2015-10-19 16:00:00,,6768,161,212,6768,0,0,0,0,0
64067037679_10153037052602680,It's National Cruise Month! We're sharing the best deals from our favorite cruise lines all week long. Check back everyday for new offers.,Expedia's cover photo,photo,https://www.facebook.com/expedia/photos/a.10150564461032680.377713.64067037679/10153037052602680/?type=3,2015-10-19 13:31:12,,134,5,8,134,0,0,0,0,0
64067037679_10153035753562680,To Cancun? Or to not Cancun? That is the question. http://expd.us/zWCTDN,Timeline Photos,photo,https://www.facebook.com/expedia/photos/a.10150326748327680.344475.64067037679/10153035753562680/?type=3,2015-10-19 00:00:01,,131,5,7,131,0,0,0,0,0
64067037679_10153031663942680,TIP: Stop frequently for gelato.,How to roam Rome like a pro,link,http://expd.us/CiERnU,2015-10-16 15:00:01,,28,14,6,28,0,0,0,0,0
64067037679_10153031599282680,"Trip Styler shares her itinerary for the perfect day in Rome:

✔ St. Peter's Basilica 
✔ Gelato #1
✔ Colosseum
✔ Getato #2
✔ Pasta Making Class
✔ Getato #3

Ciao! ✈🍝🍦",Things to Do in Rome | Expedia Viewfinder Travel Blog,video,http://expd.us/iLAiff,2015-10-16 12:57:59,,21,6,5,21,0,0,0,0,0
64067037679_10153030601392680,"Bar crawls, helicopter rides, stunning shows...",200+ Things to Do in Las Vegas,link,http://expd.us/TwAoEB,2015-10-15 22:05:01,,7050,174,422,7050,0,0,0,0,0
64067037679_10153029971712680,"Colombia's capital city is home to welcoming locals, quaint neighborhoods, and a booming social scene.","Why Bogotá, Colombia is a Travel Expert's Favorite",link,http://expd.us/Xa7Xgw,2015-10-15 20:00:00,,39,5,8,39,0,0,0,0,0
64067037679_10153028992532680,"In honor of Oktoberfest season, here's the top 5 craft brew cities in the US.",5 Craft Brew-tastic Cities,link,http://expd.us/Et2PLQ,2015-10-14 20:00:00,,26,19,1,26,0,0,0,0,0
64067037679_10153028985682680,"We asked, you answered! Here's the spookiest cities for Halloween according to Instagram.",10 Best Cities for Halloween,link,http://expd.us/5RIwaC,2015-10-14 18:01:01,,1131,27,98,1131,0,0,0,0,0
64067037679_10153028979182680,Istanbul is gorgeous in the fall. Turkish Airlines has flights departing from Miami to this famous city in Turkey.,Flights from Miami to Istanbul,link,http://expd.us/AMQIfe,2015-10-14 16:01:01,,4901,140,218,4901,0,0,0,0,0
64067037679_10153026911967680,Where to see the best fall foliage in the Golden State.,Top Harvest Road Trips in California,link,http://expd.us/0hb1FL,2015-10-13 20:00:00,,32,10,4,32,0,0,0,0,0
64067037679_10153025440062680,Are these items on your packing list?,9 Essential Travel Accessories,link,http://expd.us/fa84MS,2015-10-12 23:00:01,,24,8,0,24,0,0,0,0,0
64067037679_10153025379997680,"Girl Gone Travel shares some of the best things to do in Puerto Vallarta, Mexico via Expedia Local Expert.",Expedia Viewfinder Travel Blog | Puerto Vallarta,video,http://expd.us/KZDlkb,2015-10-12 20:01:00,,14,5,1,14,0,0,0,0,0
64067037679_10153025349962680,Wind surfers will fall in love with Barbados. You'll find crystal clear waters and plenty of adventure when you Visit Barbados.,Barbados: Things to Do + Where to Stay,link,http://expd.us/7Yx1H4,2015-10-12 17:01:01,,4118,65,123,4118,0,0,0,0,0
64067037679_10153020934377680,Where do you want to travel before the year ends? http://expd.us/wF3XnW,Timeline Photos,photo,https://www.facebook.com/expedia/photos/a.10150326748327680.344475.64067037679/10153020934377680/?type=3,2015-10-11 11:00:01,,52,13,5,52,0,0,0,0,0
64067037679_10153020930652680,Cozumel or Costa Rica?,Bundle deals to Mexico & Central America that are too good to pass up,link,http://expd.us/ysYK4x,2015-10-09 20:28:00,,60,28,1,60,0,0,0,0,0
64067037679_10153020914032680,Missing summer already? We are too. Head to Cancun to get your beach fix.,Cancun Hotel Sale: Up to 45% Off,link,http://expd.us/RZnILg,2015-10-09 16:56:42,,9243,113,311,9243,0,0,0,0,0
64067037679_10153016268262680,"From Bali to Vancouver, here's where you can find the best rooftop bars in the world.",The Best Rooftop Bars,link,http://expd.us/kVf74i,2015-10-08 23:00:01,,49,6,4,49,0,0,0,0,0
64067037679_10153019604912680,What's on your bucket list?,100+ Things to Do in Cancun,link,http://expd.us/1NLkYG,2015-10-08 19:43:20,,7609,174,489,7609,0,0,0,0,0
64067037679_10153017849247680,*swoon*,You won't believe how luxurious this villa is on Maui,link,http://expd.us/cmcs9d,2015-10-07 20:00:01,,43,13,0,43,0,0,0,0,0
64067037679_10153016265587680,Have you dined in any of these cities?,5 Fabulous Foodie Destinations,link,http://expd.us/u3mdoC,2015-10-06 20:00:00,,40,15,6,40,0,0,0,0,0
64067037679_10153016194407680,Been dreaming of a trip to Hawaii? We'll reward you for it. Book a Hawaiian Airlines flight on Expedia by 10/31/2015 and we'll give you a $50 MasterCard® Gift Card.,Book a Hawaiian Airlines Flight & Get Rewarded,link,http://expd.us/Z2QH1w,2015-10-06 17:00:00,,5156,85,200,5156,0,0,0,0,0
64067037679_10153015095537680,Mexico or Jamaica? Your choice. Save on a 4+ night flight & hotel booking at Palace Resorts in Mexico and Jamaica. Use code PR200 at checkout. http://expd.us/36VpaW,Timeline Photos,photo,https://www.facebook.com/expedia/photos/a.10150326748327680.344475.64067037679/10153015095537680/?type=3,2015-10-05 23:04:01,,126,16,14,126,0,0,0,0,0
64067037679_10153015087357680,"Find the perfect seaside retreat in Los Cabos. Save up to 45% on hotels right now: http://expd.us/aKw6gV

Photo Credit: Los Cabos Tourism",Timeline Photos,photo,https://www.facebook.com/expedia/photos/a.10150326748327680.344475.64067037679/10153015087357680/?type=3,2015-10-05 20:42:05,,8441,113,250,8441,0,0,0,0,0
64067037679_10153007486897680,Where do we start?! Sampling dishes + drinks at the 20th Epcot International Food & Wine Festival. #ExpediaAtDisney,Timeline Photos,photo,https://www.facebook.com/expedia/photos/a.10150326748327680.344475.64067037679/10153007486897680/?type=3,2015-09-30 15:57:02,,66,39,3,66,0,0,0,0,0
64067037679_10153006448527680,"You could win a trip to Walt Disney World for 4! Join #ExpediaChat on Twitter on Wednesday, September 30 from 2 - 3pm ET (11am - 12pm PT). Simply tweet with the hashtag and follow @Expedia on Twitter to enter to win. The prize includes four 3-day Park Hopper tickets, a 2-night stay at a Disney Deluxe Resort Hotel and an Expedia travel voucher for $1,500. http://expd.us/IcWijT",Timeline Photos,photo,https://www.facebook.com/expedia/photos/a.10150326748327680.344475.64067037679/10153006448527680/?type=3,2015-09-29 22:12:30,,10283,108,319,10283,0,0,0,0,0
64067037679_10153005545662680,"Wake up to views of giraffes, zebras and other African animals at Disney's Animal Kingdom Lodge. More than 200 animals and birds freely roam the savannas outside of the guest rooms. Staying at this resort is like experiencing an African safari! 🌿 #ExpediaAtDisney",Timeline Photos,photo,https://www.facebook.com/expedia/photos/a.10150326748327680.344475.64067037679/10153005545662680/?type=3,2015-09-29 09:41:45,,223,17,21,223,0,0,0,0,0
64067037679_10153004255607680,"Guess where we are! The place where dreams come true. The #ExpediaViewfinder blog team is live from Walt Disney World this week. We'll be sharing an insider's look at the best hidden gems, hacks, thrills, sweet treats and more. Stay tuned for more #ExpediaAtDisney action! ✨🐭🏰",Timeline Photos,photo,https://www.facebook.com/expedia/photos/a.10150326748327680.344475.64067037679/10153004255607680/?type=3,2015-09-28 11:04:54,,166,19,21,166,0,0,0,0,0
64067037679_10153000425432680,Island dreams. http://expd.us/dXWVJv,Timeline Photos,photo,https://www.facebook.com/expedia/photos/a.10150326748327680.344475.64067037679/10153000425432680/?type=3,2015-09-27 13:00:01,,169,14,10,169,0,0,0,0,0
64067037679_10153000413902680,It's not too late to book a holiday cruise. Check out this 5-day sale: http://expd.us/IoKuI1,Timeline Photos,photo,https://www.facebook.com/expedia/photos/a.10150326748327680.344475.64067037679/10153000413902680/?type=3,2015-09-26 18:00:01,,91,11,9,91,0,0,0,0,0
64067037679_10153000409422680,Are the Northern Lights on your bucket list? http://expd.us/4bKmTE,Timeline Photos,photo,https://www.facebook.com/expedia/photos/a.10150326748327680.344475.64067037679/10153000409422680/?type=3,2015-09-26 12:00:01,,238,23,20,238,0,0,0,0,0
64067037679_10153000134717680,NEW: You can choose your flight class when you book a flight + hotel bundle deal. http://expd.us/SiVDQB,Timeline Photos,photo,https://www.facebook.com/expedia/photos/a.10150326748327680.344475.64067037679/10153000134717680/?type=3,2015-09-25 12:06:34,,86,18,8,86,0,0,0,0,0
64067037679_10152998982762680,Helicopter ride or broadway show? Take your pick.,Things to Do in New York,link,http://expd.us/iCsS7d,2015-09-24 18:00:00,,5082,201,246,5082,0,0,0,0,0
64067037679_10152998901237680,All-inclusive vacations take the stress out of vacation planning. Check out IBEROSTAR Hotels & Resorts English: http://expd.us/cWNKen,Timeline Photos,photo,https://www.facebook.com/expedia/photos/a.10150326748327680.344475.64067037679/10152998901237680/?type=3,2015-09-24 15:00:01,,10023,119,353,10023,0,0,0,0,0
64067037679_10152997635272680,Your next trip to Europe is only a few clicks away. Fly with Turkish Airlines for award-winning service and luxury business class options. http://expd.us/9QDDAz,Timeline Photos,photo,https://www.facebook.com/expedia/photos/a.10150326748327680.344475.64067037679/10152997635272680/?type=3,2015-09-23 16:00:26,,4816,73,142,4816,0,0,0,0,0
64067037679_10152995582192680,"Cooking classes, local markets and more...",The Best Food in Guatemala,link,http://expd.us/dfXUXZ,2015-09-22 16:00:00,,33,10,4,33,0,0,0,0,0
64067037679_10152995556087680,"Roatan, Honduras is an ocean-lovers paradise. Snorkel, scuba dive or bask on the beaches. Avianca flies to Honduras and every other country in Central America. Check out their fares: http://expd.us/603fiu",Timeline Photos,photo,https://www.facebook.com/expedia/photos/a.10150326748327680.344475.64067037679/10152995556087680/?type=3,2015-09-22 13:19:05,,9444,160,428,9444,0,0,0,0,0
64067037679_10152993805517680,"Would you rather be here? La Paz, Mexico is a great spot for a beach getaway. http://expd.us/hc4X7x",Timeline Photos,photo,https://www.facebook.com/expedia/photos/a.10150326748327680.344475.64067037679/10152993805517680/?type=3,2015-09-21 15:00:01,,19687,353,683,19687,0,0,0,0,0
64067037679_10152990525962680,"Last chance! Book a cruise by 9/20 and get a $40 onboard credit/per day. Plus, earn 2x Expedia+ rewards points",Carnival Cruise Lines Deals | Expedia,link,http://expd.us/MvDWth,2015-09-19 18:06:35,,47,22,3,47,0,0,0,0,0
64067037679_10152987001812680,The beach is calling...,Things to Do in Los Cabos,link,http://expd.us/KJSsYz,2015-09-17 21:00:00,,8907,171,403,8907,0,0,0,0,0
64067037679_10152986983357680,"Pretty neat, right?",How to turn Expedia+ points into free hotel stays,link,http://expd.us/g33ZKi,2015-09-17 18:00:01,,25,9,0,25,0,0,0,0,0
64067037679_10152986968842680,NEW: How to turn your Expedia+ points into free hotel stays. http://expd.us/YFB5Bq,Timeline Photos,photo,https://www.facebook.com/expedia/photos/a.10150326748327680.344475.64067037679/10152986968842680/?type=3,2015-09-17 16:50:33,,23,4,0,23,0,0,0,0,0
64067037679_10152985007052680,HAPPENING NOW: Join #ExpediaChat on Twitter from 11am - 12pm PT to chat about capturing travel memories. We're giving away a $500 Expedia voucher. Special guest: Avianca. http://expd.us/jQrnuH,Timeline Photos,photo,https://www.facebook.com/expedia/photos/a.10150326748327680.344475.64067037679/10152985007052680/?type=3,2015-09-16 13:38:33,,46,16,0,46,0,0,0,0,0
64067037679_10152983305127680,"Berlin has a ton of LGBT-friendly activities, restaurants, bars and hotels (including Marriott Rewards). Check out how Love Travels With Me.",LGBT destination guide: Berlin,link,http://expd.us/3MHiW4,2015-09-16 11:00:01,,2037,95,81,2037,0,0,0,0,0
64067037679_10152983288267680,The golden sunsets in Honduras are hard to beat. Avianca flies to Honduras and every other country in Central America. Check out their fares: http://expd.us/c4dXoa,Timeline Photos,photo,https://www.facebook.com/expedia/photos/a.10150326748327680.344475.64067037679/10152983288267680/?type=3,2015-09-15 15:00:01,,7178,106,331,7178,0,0,0,0,0
64067037679_10152981586832680,Love the outdoors but don't want to rough it? Try glamping.,Where to Go Glamping in National Parks,link,http://expd.us/vmg3Yp,2015-09-14 20:00:01,,78,11,34,78,0,0,0,0,0
64067037679_10152981243087680,"Orlando has a large LGBT community. Our travel experts highlight the best restaurants, bars, activities and hotels (including Marriott Rewards) for LGBT travelers. Check out how they're sharing the message that Love Travels With Me.",LGBT Destination Guide: Orlando,link,http://expd.us/PJ7l4r,2015-09-14 16:00:01,,1438,65,51,1438,0,0,0,0,0
64067037679_10152981399207680,"Connect with the people and places that matter. With the Expedia App, you can search and book more than 11,000 local activities.",Bucket List,video,https://www.facebook.com/expedia/videos/10152981399207680/,2015-09-14 13:41:03,00:31,47,11,27,47,0,0,0,0,0
64067037679_10152981206172680,"Washington, DC is a dynamic cultural hot spot and one of the most LGBT-friendly cities in the country. Our travel experts experienced the essence of Love Travels With Me through Marriott Rewards.","LGBT Destination Guide: Washington, DC",link,http://expd.us/tBn1sM,2015-09-14 11:41:48,,1843,58,53,1843,0,0,0,0,0
64067037679_10152973962227680,"Our Hotel of the Day is Hyatt Ziva Cancun! Opening this fall, this new beachfront resort redefines all-inclusive luxury.",Hotel of the Day: Hyatt Ziva Cancun,link,http://expd.us/YRRtjq,2015-09-11 18:02:43,,51,20,7,51,0,0,0,0,0
64067037679_10152973264802680,Life at Expedia means lending a helping hand. Our employees rally at Expedia HQ before a big day of volunteering for our global Day of Caring. #ExpediaCares,Life at Expedia,photo,https://www.facebook.com/lifeatexpedia/photos/a.282699115193873.1073741825.172733519523767/710442979086149/?type=3,2015-09-11 11:24:19,,45,9,0,45,0,0,0,0,0
64067037679_10152971647407680,18 awe-inspiring things to do in Argentina: http://expd.us/JljQl6,Timeline Photos,photo,https://www.facebook.com/expedia/photos/a.10150326748327680.344475.64067037679/10152971647407680/?type=3,2015-09-10 19:00:02,,128,14,11,128,0,0,0,0,0
64067037679_10152971127942680,The beaches in Brazil are unbelievable. Wish you were here? TAM Airlines flies from the US to Brazil. Check them out: http://expd.us/iwsdJX,Timeline Photos,photo,https://www.facebook.com/expedia/photos/a.10150326748327680.344475.64067037679/10152971127942680/?type=3,2015-09-10 15:00:00,,8510,138,265,8510,0,0,0,0,0
64067037679_10152970256637680,"Hyatt Ziva Cancun is our hotel of the day! Opening this fall, this new beachfront resort redefines all-inclusive luxury.",Hotel of the Day: Hyatt Ziva Cancun,link,http://expd.us/FdIvnd,2015-09-09 18:00:00,,4166,73,132,4166,0,0,0,0,0
64067037679_10152968443107680,Cancun or Punta Cana? Take your pick: http://expd.us/ZbbAaI,Timeline Photos,photo,https://www.facebook.com/expedia/photos/a.10150326748327680.344475.64067037679/10152968443107680/?type=3,2015-09-08 19:29:27,,337,45,43,337,0,0,0,0,0
64067037679_10152956285137680,Oktoberfests around the world...,6 Best Places to Travel to in October,link,http://expd.us/ozvY7m,2015-09-07 11:00:01,,59,18,11,59,0,0,0,0,0
64067037679_10152960390002680,Sometimes you just need to get away... http://expd.us/zVRLOJ,Timeline Photos,photo,https://www.facebook.com/expedia/photos/a.10150326748327680.344475.64067037679/10152960390002680/?type=3,2015-09-06 22:56:00,,206,16,19,206,0,0,0,0,0
64067037679_10152960383042680,A cruise is an easy way to explore South America.  http://expd.us/nSnbBP,Timeline Photos,photo,https://www.facebook.com/expedia/photos/a.10150326748327680.344475.64067037679/10152960383042680/?type=3,2015-09-06 18:52:00,,162,6,14,162,0,0,0,0,0
64067037679_10152957639207680,Can you imagine swimming in this secluded pool? Visit Peru to find a land of hidden treasures. http://expd.us/5oc6Hz,Timeline Photos,photo,https://www.facebook.com/expedia/photos/a.10150326748327680.344475.64067037679/10152957639207680/?type=3,2015-09-06 11:00:04,,10032,137,227,10032,0,0,0,0,0
64067037679_10152957591632680,"Peru is home to the Machu Picchu ruins, the Ica Desert and the Amazon rainforest. See it all on your next vacation. Save up to 40% on hotels when you Visit Peru. http://expd.us/eY9m7X",Timeline Photos,photo,https://www.facebook.com/expedia/photos/a.10150326748327680.344475.64067037679/10152957591632680/?type=3,2015-09-05 16:00:01,,8554,180,576,8554,0,0,0,0,0
64067037679_10152962588117680,"Avianca has flights from the US to Peru. Visit South America's archeological paradise and see the legendary Machu Picchu, historic Cuzco and scenic Lake Titicaca. http://expd.us/TV7Iu7",Timeline Photos,photo,https://www.facebook.com/expedia/photos/a.10150326748327680.344475.64067037679/10152962588117680/?type=3,2015-09-05 15:05:01,,5532,117,457,5532,0,0,0,0,0
64067037679_10152960376987680,30+ things to do in Rio de Janeiro: http://expd.us/II4hJb,Timeline Photos,photo,https://www.facebook.com/expedia/photos/a.10150326748327680.344475.64067037679/10152960376987680/?type=3,2015-09-04 22:00:01,,5550,107,279,5550,0,0,0,0,0
64067037679_10152960371817680,Sneak in a Labor Day weekend getaway. Here's a coupon for $75 off your first hotel booking on the Expedia app ($300 minimum stay): http://expd.us/TeUIUK,Timeline Photos,photo,https://www.facebook.com/expedia/photos/a.10150326748327680.344475.64067037679/10152960371817680/?type=3,2015-09-04 18:32:35,,24,9,5,24,0,0,0,0,0
64067037679_10152959759202680,Sept 7 is Brazil Independence Day. Don't miss out on these limited-time low fares from TAM Airlines: http://expd.us/qAFdqh,Timeline Photos,photo,https://www.facebook.com/expedia/photos/a.10150326748327680.344475.64067037679/10152959759202680/?type=3,2015-09-04 15:00:01,,6683,101,196,6683,0,0,0,0,0
64067037679_10152957678042680,Dreaming of a trip to South America? Aerolíneas Argentinas has  many flights from the US.,Flights from the US to South America on Aerolíneas Argentinas,link,http://expd.us/ky4FXr,2015-09-03 15:30:00,,14940,229,716,14940,0,0,0,0,0
64067037679_10152954602062680,Where to go for fine wine around the globe.,Wine Around the World,link,http://expd.us/jX6F0u,2015-09-01 23:10:01,,32,10,2,32,0,0,0,0,0
64067037679_10152954555647680,Is Colombia on your bucket list? It should be. There's an abundance of natural beauty from the oceans to the mountains. Fly there with Avianca. expd.us/gqsjDf,Timeline Photos,photo,https://www.facebook.com/expedia/photos/a.10150326748327680.344475.64067037679/10152954555647680/?type=3,2015-09-01 21:30:18,,5534,108,236,5534,0,0,0,0,0
64067037679_10152945637027680,Chile is filled with icon scenes like the incredible sculptures in Chile's Atacama Desert. Hurry—It's the last day to save on great fares to Chile on LAN-Airlines. http://expd.us/rKgAEO,Timeline Photos,photo,https://www.facebook.com/expedia/photos/a.10150326748327680.344475.64067037679/10152945637027680/?type=3,2015-08-31 17:00:01,,7183,137,486,7183,0,0,0,0,0
64067037679_10152952535917680,It's South America Week! We're sharing the best places to travel in South America all week long. Check back each day for new destinations.,Expedia's cover photo,photo,https://www.facebook.com/expedia/photos/a.10150564461032680.377713.64067037679/10152952535917680/?type=3,2015-08-31 15:12:42,,222,18,28,222,0,0,0,0,0
64067037679_10152945551437680,"Ready for leaf-peeping season? Save even more when you register for Expedia+ Rewards and get 2x points on hotels, packages and cruises this fall. http://expd.us/t781T5",Timeline Photos,photo,https://www.facebook.com/expedia/photos/a.10150326748327680.344475.64067037679/10152945551437680/?type=3,2015-08-31 11:00:02,,64,7,7,64,0,0,0,0,0
64067037679_10152941291127680,Final Hours! Score on 400+ deals on this special 24 Hour Sale featuring our newest hotels to Expedia. http://expd.us/WR6hqT,Timeline Photos,photo,https://www.facebook.com/expedia/photos/a.10150326748327680.344475.64067037679/10152941291127680/?type=3,2015-08-30 12:00:01,,46,11,5,46,0,0,0,0,0
64067037679_10152899844222680,Have you ever been on a cruise? http://expd.us/LSwtLu,Timeline Photos,photo,https://www.facebook.com/expedia/photos/a.10150326748327680.344475.64067037679/10152899844222680/?type=3,2015-08-29 18:29:01,,95,7,7,95,0,0,0,0,0
64067037679_10152941280647680,"Our rewards program just got better! We now offer bigger rental discounts exclusively for our Expedia+ members. To see these deals, be sure to sign in to your Expedia+ account and look for the cars that say ""Member Deal!"" next to the price. http://expd.us/uQ5H3S",NEW! Exclusive Car Discounts for Expedia+ Members.,link,http://expd.us/uQ5H3S,2015-08-29 11:00:01,,18,6,1,18,0,0,0,0,0
64067037679_10152945208212680,"After sifting through millions of reviews, we've released a list of the 101 most comfy cities. Did we miss any?",101 most comfortable cities for travelers,link,https://viewfinder.expedia.com/features/101-most-comfortable-cities-for-travelers,2015-08-28 11:00:02,,35,11,1,35,0,0,0,0,0
64067037679_10152899805947680,200+ things to do in New York: http://expd.us/xaJrmY,Timeline Photos,photo,https://www.facebook.com/expedia/photos/a.10150326748327680.344475.64067037679/10152899805947680/?type=3,2015-08-27 18:09:01,,5567,128,224,5567,0,0,0,0,0
64067037679_10152941271482680,"We've got the low down on free things to do, cheap alternatives, and outside-the-box ideas for Las Vegas.",21 things to do in Vegas for less than $21,link,http://expd.us/OjC7dm,2015-08-27 12:00:01,,62,11,9,62,0,0,0,0,0
64067037679_10152933330212680,"For a limited time save on package deals when you book your flights to Playa Conchal with Avianca and stay at the The Westin Golf Resort & Spa, Playa Conchal, an All Inclusive Resort. Gorgeous! http://expd.us/g9KHCm",Timeline Photos,photo,https://www.facebook.com/expedia/photos/a.10150326748327680.344475.64067037679/10152933330212680/?type=3,2015-08-25 17:00:00,,5890,63,133,5890,0,0,0,0,0
64067037679_10152879079242680,The sun is setting on summer! Plan a last minute road trip before fall. HoJo has a bunch of convenient hotel options for road tripping. http://expd.us/dM1wXJ,Timeline Photos,photo,https://www.facebook.com/expedia/photos/a.10150326748327680.344475.64067037679/10152879079242680/?type=3,2015-08-24 16:00:01,,3337,85,129,3337,0,0,0,0,0
64067037679_10152899715112680,Vacation envy. http://expd.us/zVciNI,Timeline Photos,photo,https://www.facebook.com/expedia/photos/a.10150326748327680.344475.64067037679/10152899715112680/?type=3,2015-08-23 12:05:01,,463,29,30,463,0,0,0,0,0
64067037679_10152899837152680,Punta Cana is synonymous with paradise. http://expd.us/bHPcrF,Timeline Photos,photo,https://www.facebook.com/expedia/photos/a.10150326748327680.344475.64067037679/10152899837152680/?type=3,2015-08-22 10:24:00,,558,28,48,558,0,0,0,0,0
64067037679_10152879070847680,When was the last time you took a road trip? Plan your next adventure and stay with HoJo. expd.us/wIJ1Kh,Timeline Photos,photo,https://www.facebook.com/expedia/photos/a.10150326748327680.344475.64067037679/10152879070847680/?type=3,2015-08-21 16:00:00,,3425,100,115,3425,0,0,0,0,0
64067037679_10152931202107680,"Today Only! Beginning at 9am PDT enjoy 50% off top-rated select hotels in Vegas, Cancun, Paris, New York, and more–only when you book on the Expedia App. Hurry, supply is limited! Get Code Here: http://expd.us/6CjZM5",Timeline Photos,photo,https://www.facebook.com/expedia/photos/a.10150326748327680.344475.64067037679/10152931202107680/?type=3,2015-08-21 10:00:01,,42,19,19,42,0,0,0,0,0
64067037679_10152929473317680,"Don't miss our special End-of-Summer Flash Coupon beginning at 9am PDT August 21st, for one day only. Enjoy 50% off top-rated select hotels in Vegas, Cancun, Paris, New York, and more–only when you book on the Expedia App. http://expd.us/5wjfUy",Timeline Photos,photo,https://www.facebook.com/expedia/photos/a.10150326748327680.344475.64067037679/10152929473317680/?type=3,2015-08-20 17:00:00,,30,27,4,30,0,0,0,0,0
64067037679_10152899796677680,What's your ideal day in London?,100+ Things to Do in London,link,http://expd.us/FjGCyK,2015-08-20 10:05:00,,67,15,6,67,0,0,0,0,0
