status_id,status_message,link_name,status_type,status_link,status_published,status_video_length,num_reactions,num_comments,num_shares,num_likes,num_loves,num_wows,num_hahas,num_sads,num_angrys
64067037679_10153406864787680,Kick back and relax in the heart of Playa del Carmen at The ROYAL Playa del Carmen.,Stay at Royal Playa del Carmen and save up to 55% off,link,http://www.expedia.com/g/u/ms-hotel-playa-gran-theroyal?langid=1033&brandcid=social.facebook.published.meso.partnerpage.playaresorts1.160502,2016-05-02 12:44:15,,1485,26,78,0,0,0,0,0,0
64067037679_10153405453472680,Happy May! Where do you plan to travel for Cinco de Mayo? http://bit.ly/21op7eq,Timeline Photos,photo,https://www.facebook.com/expedia/photos/a.10150326748327680.344475.64067037679/10153405453472680/?type=3,2016-05-01 18:00:12,,53,13,4,0,0,0,0,0,0
64067037679_10153404932852680,"If your vacation style is more thrill than chill, this is a must-read! Get your blood pumping when you Visit San Diego.",8 adrenaline-fueled San Diego experiences that barely require sneakers,link,https://viewfinder.expedia.com/san-diego/8-adrenaline-fueled-san-diego-experiences-barely-require-sneakers/?utm_medium=facebook&utm_campaign=guest&utm_source=social,2016-05-01 12:00:13,,1849,42,62,0,0,0,0,0,0
64067037679_10153401850977680,Where do you go to celebrate Cinco de Mayo? Here are 5 of the best U.S. cities for festivities!,5 best cities to celebrate Cinco de Mayo,link,https://viewfinder.expedia.com/features/5-best-cities-celebrate-cinco-de-mayo-north-border/?utm_campaign=blog&utm_source=facebook&utm_medium=organicpost,2016-04-29 20:00:07,,96,12,21,0,0,0,0,0,0
64067037679_10153401514822680,Spring into summer with up to 35% off at Barceló Hotels & Resorts in Mexico.,Explore Mexico at Barceló Hotels & Resorts,link,https://www.expedia.com/g/pt/ms-hotel-barcelo?langid=1033&brandcid=social.facebook.published.meso.partnerpage.barcelo2.160429,2016-04-29 16:00:43,,1656,21,56,0,0,0,0,0,0
64067037679_10153401161507680,How about relaxing in a Mexican oasis this summer at Barceló Hotels & Resorts? Yes please!,Save up to 35% on Barcelo Hotels & Resorts,link,https://www.expedia.com/g/pt/ms-hotel-barcelo?langid=1033&brandcid=social.facebook.published.meso.partnerpage.barcelo1.160429,2016-04-29 12:01:36,,4131,58,93,0,0,0,0,0,0
64067037679_10153399902067680,Looking for a Caribbean adventure? Try the Seabreacher.,Things to do in Cancun: Seabreacher Experience,link,https://www.expedia.com/things-to-do/seabreacher-experience.a347018.activity-details?srp=true&location=Cancun+%28and+vicinity%29%2C+Quintana+Roo%2C+Mexico&brandcid=social.facebook.published.lx.thingstodo.seabreachercancun.160428,2016-04-28 18:00:09,,29,15,9,0,0,0,0,0,0
64067037679_10153399754337680,Dreaming of paradise? Find it at Paradisus Resorts.,Hotel of the Day: Paradisus Resorts,link,http://www.expedia.com/g/pt/ms-hotel-melia?langid=1033&brandcid=social.facebook.published.meso.partnerpage.meliahotels2.160428,2016-04-28 16:00:27,,4216,32,77,0,0,0,0,0,0
64067037679_10153399316232680,Escape to your favorite destination with these MELIÁ Hotels & Resorts deals.,Cinco de Mayo Sale: Melia Hotels & Resorts,link,http://www.expedia.com/g/pt/ms-hotel-melia?langid=1033&brandcid=social.facebook.published.meso.partnerpage.meliahotels1.160428,2016-04-28 12:00:28,,1578,26,56,0,0,0,0,0,0
64067037679_10153398103312680,What hotels are you pining to stay at in Mexico?,Best luxury hotels in the Riviera Maya,link,https://viewfinder.expedia.com/riviera-maya/best-luxury-hotels-riviera-maya/?utm_campaign=blog&utm_source=facebook&utm_medium=organicpost,2016-04-27 19:00:09,,48,12,4,0,0,0,0,0,0
64067037679_10153397861907680,Did you know you can use Aeromexico's Cross Border Xpress from San Diego to take a nonstop flight from Tijuana?,Fly to Mexico using Aeromexico,link,https://www.expedia.com/g/pt/ms-air-aeromexico?langid=1033&brandcid=social.facebook.published.meso.partnerpage.aeromexico2.160427,2016-04-27 16:00:09,,3713,52,80,0,0,0,0,0,0
64067037679_10153397524242680,Celebrating Cinco de Mayo in Cabo?  Start the fiesta early on Aeromexico with nonstop flights—and tequila!,Aeromexico offers nonstop service to Cabo,link,https://www.expedia.com/g/pt/ms-air-aeromexico?langid=1033&brandcid=social.facebook.published.meso.partnerpage.aeromexico1.160427,2016-04-27 12:00:11,,2440,46,144,0,0,0,0,0,0
64067037679_10153396472822680,What's the best way to experience Los Cabos? In the lap of luxury.,"A taste of luxury in Los Cabos, Mexico",link,https://viewfinder.expedia.com/los-cabos/taste-luxury-los-cabos-mexico/?utm_campaign=blog&utm_source=facebook&utm_medium=organicpost,2016-04-26 21:00:11,,64,14,7,0,0,0,0,0,0
64067037679_10153396126692680,How about celebrating #CincoDeMayo in this Mexican beach town?,Celebrate in Los Cabos,link,https://www.expedia.com/g/pt/ms-dest-loscaboscvb?langid=1033&brandcid=social.facebook.published.meso.partnerpage.loscabos2.160426,2016-04-26 16:00:27,,2754,49,131,0,0,0,0,0,0
64067037679_10153395775227680,Wish you were here? Make a plan to celebrate Cinco de Mayo in Los Cabos Tourism.,Destination of the Day: Los Cabos,link,https://www.expedia.com/g/pt/ms-dest-loscaboscvb?langid=1033&brandcid=social.facebook.published.meso.partnerpage.loscabos1.160426,2016-04-26 12:01:01,,5200,95,151,0,0,0,0,0,0
64067037679_10153394527527680,Celebrate Cinco de Mayo at IBEROSTAR Hotels & Resorts English's Cozumel resort and save up to 25%!,Enjoy the fiesta at IBEROSTAR Cozumel resort,link,http://www.expedia.com/g/pt/ms-hotel-iberostar?langid=1033&brandcid=social.facebook.published.meso.partnerpage.iberostar2.160425,2016-04-25 19:00:07,,1449,20,61,0,0,0,0,0,0
64067037679_10153394297857680,Ready for Cinco de Mayo? Celebrate with the fiesta of all time at IBEROSTAR Hotels & Resorts English.,Save up to 35% on IBEROSTAR Hotels & Resorts,link,http://www.expedia.com/g/pt/ms-hotel-iberostar?langid=1033&brandcid=social.facebook.published.meso.partnerpage.iberostar1.160425,2016-04-25 15:56:25,,3478,33,53,0,0,0,0,0,0
64067037679_10153394282782680,It's #CincoDeMayoWeek! We'll be sharing some of our favorite destinations and hotels in Mexico for the next two weeks. Stay tuned!,Expedia's cover photo,photo,https://www.facebook.com/expedia/photos/a.10150564461032680.377713.64067037679/10153394282782680/?type=3,2016-04-25 15:44:20,,25,5,1,0,0,0,0,0,0
64067037679_10153392626837680,What's your ideal spring getaway? http://bit.ly/1raQH2a,Timeline Photos,photo,https://www.facebook.com/expedia/photos/a.10150326748327680.344475.64067037679/10153392626837680/?type=3,2016-04-24 18:00:07,,32,18,5,0,0,0,0,0,0
64067037679_10153390709362680,Need a vacation? Save on your flight + hotel package to the Bahamas!,Save on your Bahamas vacation,link,https://www.expedia.com/packagesearch?cadu1=2&drtn1=07%2F14%2F2016&drid1=601784&qryt=8&paandi=true&hids=3652%2C3645%2C13636%2C460393%2C460427%2C460429%2C1631751%2C1782699%2C8870%2C69328&subm=1&rdct=1&cmbt=2&crom=1&tair1=NAS&dcty=MIA&ddpt1=07%2F10%2F2016&brandcid=social.facebook.published.merch.searchresults.bahamaspackagedeals.160423,2016-04-23 18:00:17,,19,10,1,0,0,0,0,0,0
64067037679_10153390544577680,"Ever wanted to just get out of the city and go on an adventure? We teamed up with Canoe & Kayak Magazine to create our #carryonadventures series that shares the best places for an adventure with just your carry-on. Follow them as they escape from Vegas with just their Oru Kayak, Kammok, and Cotopaxi bags: http://bit.ly/1S5F6x6",Carry-On Adventures Episode 1: Escape from Las Vegas,video,https://www.facebook.com/expedia/videos/10153390544577680/,2016-04-23 16:00:38,00:39,13,8,1,0,0,0,0,0,0
64067037679_10153390223752680,Now there are more ways to pay for your hotel bookings. Eligible Citi Cardmembers can use ThankYou Points on Expedia!,Pay with Citi ThankYou Points on Expedia,link,https://www.expedia.com/shopwithpoints/CitiThankYou?brandcid=social.facebook.published.loyalty.thankyoupoints.citi.160423,2016-04-23 12:00:13,,38,5,2,0,0,0,0,0,0
64067037679_10153388984722680,Head to Louisville for the highly anticipated annual horse races and save on your stay!,Save on your hotel over the Kentucky Derby weekend,link,https://www.expedia.com/packagesearch?cadu1=2&drtn1=05%2F05%2F2016&drid1=603002&qryt=8&paandi=true&hids=191434%2C326983%2C11386%2C16068%2C9027531%2C983268%2C17862%2C18513&subm=1&rdct=1&cmbt=2&crom=1&tair1=SDF&dcty=NYC&ddpt1=05%2F01%2F2016&&mcicid=479944081&brandcid=social.facebook.published.merch.searchresults.louisvillepackagedeals.160422,2016-04-22 18:00:26,,12,7,0,0,0,0,0,0,0
64067037679_10153388844637680,"Want warm, white-powdery sand beaches and turquoise crystal clear waters? Head to Cancun!",Destination of the Day: Cancun,link,http://www.expedia.com/g/pt/ms-dest-co-op-cancun?langid=1033&brandcid=social.facebook.published.meso.partnerpage.cancun2.160422,2016-04-22 16:00:45,,6837,159,212,0,0,0,0,0,0
64067037679_10153388534342680,"It's time for some sun, sand, and soothing ocean waves! Check out these Cancun deals.",Cancun Sale: Save up to 50% off on hotels,link,http://www.expedia.com/g/pt/ms-dest-co-op-cancun?langid=1033&brandcid=social.facebook.published.meso.partnerpage.cancun1.160422,2016-04-22 12:00:28,,1535,26,80,0,0,0,0,0,0
64067037679_10153382825912680,"Good morning from the Epcot International Flower and Garden Festival! Disney character topiaries, fresh garden food and spring time entertainment have bloomed all around the park. #ExpediaAtDisney 🌷🌻",Timeline Photos,photo,https://www.facebook.com/expedia/photos/a.10150326748327680.344475.64067037679/10153382825912680/?type=3,2016-04-19 10:06:34,,176,44,21,0,0,0,0,0,0
64067037679_10153381258522680,Last day of our video shoot with Disney Cruise Line! We're filming a series about how to plan and maximize a Disney Cruise vacation. Coming to our YouTube channel this summer! Watch the #ExpediaAtDisney playlist on our channel now to get top tips for a Walt Disney World vacation. Check back this summer for the cruise videos! 🚢🎥,Timeline Photos,photo,https://www.facebook.com/expedia/photos/a.10150326748327680.344475.64067037679/10153381258522680/?type=3,2016-04-18 13:51:46,,38,20,7,0,0,0,0,0,0
64067037679_10153379006852680,Today we're on deck of the Disney Magic ship shooting a video series with Disney Cruise Line. Add us on snapchat at expedia.com for a behind the scenes look! ✨🎥🐭🚢,Timeline Photos,photo,https://www.facebook.com/expedia/photos/a.10150326748327680.344475.64067037679/10153379006852680/?type=3,2016-04-17 08:27:55,,22,17,2,0,0,0,0,0,0
64067037679_10153377254007680,Captain Mickey Mouse and the Expedia Viewfinder blog team. On deck of the Disney Fantasy ship! #ExpediaAtDisney,Timeline Photos,photo,https://www.facebook.com/expedia/photos/a.10150326748327680.344475.64067037679/10153377254007680/?type=3,2016-04-16 08:49:01,,40,22,4,0,0,0,0,0,0
64067037679_10153375754077680,"Fireworks lighting up the sky over the Disney Dream ship. Don't miss the Pirates in the Caribbean celebration on Disney Cruise Line. There are appearances from everyone's favorite pirate characters, a stage show, a fireworks display and a dance party to end the night. #ExpediaAtDisney",Timeline Photos,photo,https://www.facebook.com/expedia/photos/a.10150326748327680.344475.64067037679/10153375754077680/?type=3,2016-04-15 12:32:27,,30,22,5,0,0,0,0,0,0
64067037679_10153372257077680,"Serenity Bay on Castaway Cay. This adults-only beach is the perfect retreat during a Disney Cruise. There are plenty of beach chairs and umbrellas, so you don't have to rush to get there in the morning. The sand is soft, the water is clear and there's even a bar and BBQ next door. There's no reason to leave! #ExpediaAtDisney 🌴",Timeline Photos,photo,https://www.facebook.com/expedia/photos/a.10150326748327680.344475.64067037679/10153372257077680/?type=3,2016-04-13 15:04:36,,51,16,8,0,0,0,0,0,0
64067037679_10153371630157680,"Good morning from Disney's private island, Castaway Cay! We arrived this morning via Disney Cruise Line. There are three beaches: two for families and one for adults. A tram connects all of the beaches for easy access. There are lots of water activities to enjoy like sting ray encounters and jet skiing. This is paradise! #ExpediaAtDisney ☀️",Timeline Photos,photo,https://www.facebook.com/expedia/photos/a.10150326748327680.344475.64067037679/10153371630157680/?type=3,2016-04-13 08:35:30,,84,21,12,0,0,0,0,0,0
64067037679_10153370935727680,"The Disney Dream ship all lit up at night. Next year, Disney Cruise Line will sail on new itineraries and to new ports, including first-time visits to four destinations in Alaska and Europe. Amsterdam and Portland, England (the gateway to Stonehenge) are among them. Who's in?! #ExpediaAtDisney 🚢",Timeline Photos,photo,https://www.facebook.com/expedia/photos/a.10150326748327680.344475.64067037679/10153370935727680/?type=3,2016-04-12 22:27:10,,33,14,3,0,0,0,0,0,0
64067037679_10153369752017680,We woke up to this! The lobby of the Disney Dream ship couldn't be more stunning. Which Disney movie does it remind you of? Look closely and you might spot a familiar face... #ExpediaAtDisney ✨,Timeline Photos,photo,https://www.facebook.com/expedia/photos/a.10150326748327680.344475.64067037679/10153369752017680/?type=3,2016-04-12 09:54:43,,156,25,10,0,0,0,0,0,0
64067037679_10153368371707680,We're kicking off 10 Days of Disney with Disney Cruise Line! Sailing to the Bahamas on the Disney Dream ship. We'll be live posting insider looks all week. Follow along with #ExpediaAtDisney!,Timeline Photos,photo,https://www.facebook.com/expedia/photos/a.10150326748327680.344475.64067037679/10153368371707680/?type=3,2016-04-11 16:16:40,,30,16,1,0,0,0,0,0,0
64067037679_10153368112092680,We're now on Snapchat! Add us at expedia.com 👻,Timeline Photos,photo,https://www.facebook.com/expedia/photos/a.10150326748327680.344475.64067037679/10153368112092680/?type=3,2016-04-11 13:37:00,,24,21,2,0,0,0,0,0,0
64067037679_10153366387997680,Spring has sprung! Get out there and enjoy it: http://bit.ly/1XpHdKu,Timeline Photos,photo,https://www.facebook.com/expedia/photos/a.10150326748327680.344475.64067037679/10153366387997680/?type=3,2016-04-10 18:00:08,,35,28,6,0,0,0,0,0,0
64067037679_10153366202262680,We traveled from east to west and found 30 of the most beautiful towns in America. Did yours make the list?,The 30 most beautiful towns in America,link,https://viewfinder.expedia.com/features/the-30-most-beautiful-towns-in-america/?utm_source=facebook&utm_medium=organicpost&utm_campaign=seo,2016-04-10 16:00:16,,230,32,125,0,0,0,0,0,0
64067037679_10153364111082680,How to travel in style with these 10 airport outfit tips.,10 tips for blending comfort and class,link,https://viewfinder.expedia.com/tips-trends/airport-style-10-tips-for-blending-comfort-and-class/?utm_campaign=blog&utm_source=facebook&utm_medium=organicpost,2016-04-09 16:00:20,,89,31,17,0,0,0,0,0,0
64067037679_10153363662517680,Need some spring suggestions? Here are our five favorites for New York.,5 ways to enjoy spring in New York City,link,https://viewfinder.expedia.com/new-york-city/5-ways-enjoy-spring-new-york-city/?utm_campaign=blog&utm_source=facebook&utm_medium=organicpost,2016-04-09 12:00:12,,44,18,7,0,0,0,0,0,0
64067037679_10153361607272680,Who says you can't have fun and stay fit? Try these 5 bucket list trips.,5 bucket list trips to a healthier you,link,https://viewfinder.expedia.com/features/5-bucket-list-trips-healthier/?utm_campaign=blog&utm_source=facebook&utm_medium=organicpost,2016-04-08 12:00:24,,63,15,16,0,0,0,0,0,0
64067037679_10153357426327680,"Follow Courtney Scott as she adventures with her mom through the Big Apple, uncovering the best activities and experiences along the way.",Things to Do in New York | Expedia Viewfinder Travel Blog,video,https://www.youtube.com/watch?v=H-7497mxcbk&index=25&list=PLdgCSoJzrmKEU6-my9oAZNlEtKZsdCbDX&facebook.160407,2016-04-07 18:00:00,,11,24,3,0,0,0,0,0,0
64067037679_10153359414957680,What things would you do on your visit to Chicago?,Top 10 things to do in Chicago,link,https://viewfinder.expedia.com/features/top-10-things-to-do-in-chicago/?utm_medium=facebook&utm_campaign=lx&utm_source=social,2016-04-07 12:00:13,,91,30,27,0,0,0,0,0,0
64067037679_10153357730137680,Ready to capture the magic of Africa's wildlife? FlySAA USA has the best deals to get you there.,Destination of the Day: South Africa,link,https://www.expedia.com/g/pt/ms-dest-africa-deals?langid=1033&#offertab=3&page=1&brandcid=social.facebook.published.meso.africasale.saa.160406,2016-04-06 16:00:17,,3839,52,108,0,0,0,0,0,0
64067037679_10153357303527680,Craving the adventure of a lifetime? Check out these flights on FlySAA USA.,Start your adventure with South African Airways,link,https://www.expedia.com/g/pt/ms-air-south-african-airways?langid=1033&brandcid=social.facebook.published.meso.partnerpage.saa.160406,2016-04-06 12:00:12,,1505,27,64,0,0,0,0,0,0
64067037679_10153355260972680,Check out a local's best tips when traveling to San Francisco. #TravelTuesday,Travel like a local: Living in San Francisco,link,https://viewfinder.expedia.com/san-francisco/travel-like-a-local-living-in-san-francisco/?utm_campaign=blog&utm_source=facebook&utm_medium=organicpost,2016-04-05 12:00:13,,69,20,9,0,0,0,0,0,0
64067037679_10153353207267680,"If you had one day at Walt Disney World, what would you do? #ExpediaAtDisney",Top 5 favorite things to do at Walt Disney World,link,https://viewfinder.expedia.com/orlando/top-5-favorite-things-walt-disney-world/?utm_campaign=blog&utm_source=facebook&utm_medium=organicpost,2016-04-04 12:01:05,,67,31,10,0,0,0,0,0,0
64067037679_10153351654872680,Aloha! What time of year would you visit Hawaii?,Best times to visit Hawaii,link,https://viewfinder.expedia.com/hawaii/best-times-to-visit-hawaii/?utm_campaign=blog&utm_source=facebook&utm_medium=organicpost,2016-04-03 18:00:16,,151,36,27,0,0,0,0,0,0
64067037679_10153349425672680,We scoured the country for some of the most unusual and interesting cities you should visit.,18 most interesting U.S. destinations,link,https://viewfinder.expedia.com/features/18-most-interesting-us-destinations/?utm_source=facebook&utm_medium=organicpost&utm_campaign=seo,2016-04-02 16:00:45,,30,19,10,0,0,0,0,0,0
64067037679_10153346926102680,TGIF! Check out these top Las Vegas bar picks on our Viewfinder blog.,Best bars in Las Vegas 2016,link,https://viewfinder.expedia.com/las-vegas/best-bars-in-las-vegas-2016/?utm_campaign=blog&utm_source=facebook&utm_medium=organicpost,2016-04-01 12:00:11,,24,24,7,0,0,0,0,0,0
64067037679_10153345036317680,Looking for something to do this spring? How about whale watching in Washington's San Juan Islands?,San Juan Islands Whale-Watching Eco Tour,link,https://www.expedia.com/things-to-do/san-juan-islands-whale-watching-eco-tour.a272101.activity-details?srp=true&location=San+Juan+Islands%2C+Washington%2C+United+States+of+America&brandcid=social.facebook.published.lx.thingstodo.sanjuan.160331,2016-03-31 18:00:15,,141,19,11,0,0,0,0,0,0
64067037679_10153343828087680,Need some recommendations for Walt Disney World? Here are our faves! #ExpediaAtDisney,Top 5 Favorite Things to Do at Walt Disney World,video,https://www.youtube.com/watch?v=xjeegoHXTSg&index=13&list=PLdgCSoJzrmKFzl7LP0TdECxVXyzUWQBui&facebook.160331,2016-03-31 12:19:27,,1865,47,104,0,0,0,0,0,0
64067037679_10153341000612680,Fly to paradise on Fiji Airways.,Fiji Airways offers new direct routes,link,https://www.expedia.com/g/pt/ms-air-fiji-airways-expedia?langid=1033&brandcid=social.facebook.published.meso.partnerpage.fijiairways2.160330,2016-03-30 16:00:57,,1454,17,65,0,0,0,0,0,0
64067037679_10153340394812680,Never been to Fiji? Now's the time! Fiji Airways has daily nonstop flights from Los Angeles.,Destination of the Day: Fiji,link,https://www.expedia.com/g/pt/ms-air-fiji-airways-expedia?langid=1033&brandcid=social.facebook.published.meso.partnerpage.fijiairways1.160330,2016-03-30 12:00:37,,3959,74,109,0,0,0,0,0,0
64067037679_10153337522647680,Want the perfect paradise? Check out the new MAJESTIC RESORTS Mirage in Punta Cana.,Majestic Resorts Mirage opening in December,link,http://www.expedia.com/g/pt/ms-hotel-majesticresorts-mirage?langid=1033&brandcid=social.facebook.published.meso.partnerpage.majesticresorts2.160329,2016-03-29 16:00:32,,1251,35,87,0,0,0,0,0,0
64067037679_10153336973442680,Experience ultimate luxury at MAJESTIC RESORTS Mirage coming in December.,New Majestic Mirage all-inclusive resort in Punta Cana,link,http://www.expedia.com/g/pt/ms-hotel-majesticresorts-mirage?langid=1033&brandcid=social.facebook.published.meso.partnerpage.majesticresorts1.160329,2016-03-29 12:06:32,,5057,71,186,0,0,0,0,0,0
64067037679_10153334430212680,Time to put on your dancing shoes at Walt Disney World! #ExpediaAtDisney,Top 5 parties for dancing at Walt Disney World,link,https://viewfinder.expedia.com/orlando/top-5-parties-dancing-walt-disney-world/?utm_campaign=blog&utm_source=facebook&utm_medium=organicpost,2016-03-28 18:00:12,,47,15,2,0,0,0,0,0,0
64067037679_10153331031412680,Where are you traveling on your holiday weekend? http://bit.ly/1UvVqI6,Timeline Photos,photo,https://www.facebook.com/expedia/photos/a.10150326748327680.344475.64067037679/10153331031412680/?type=3,2016-03-27 18:00:19,,94,24,0,0,0,0,0,0,0
64067037679_10153326917422680,"Inspired by #ExpediaChat, we compiled a list of lesser-known national parks you should discover.",6 national parks that belong on your radar,link,https://viewfinder.expedia.com/features/6-national-parks-that-belong-on-your-radar/?utm_source=facebook&utm_medium=organicpost&utm_campaign=seo,2016-03-26 16:00:20,,129,18,29,0,0,0,0,0,0
64067037679_10153326342152680,Which attractions at Walt Disney World are your favorites for the kids? #ExpediaAtDisney,Top 5 things to do at Walt Disney World for toddlers,link,https://viewfinder.expedia.com/orlando/top-5-things-walt-disney-world-toddlers/?utm_campaign=blog&utm_source=facebook&utm_medium=organicpost,2016-03-26 12:00:11,,36,16,3,0,0,0,0,0,0
64067037679_10153323681677680,"Based on thousands of reviews, we pinpointed the top airports to rent a car in the nation.",Travel hack: Best airports to rent a car,link,https://viewfinder.expedia.com/features/travel-hack-best-airports-to-rent-a-car/?utm_source=facebook&utm_medium=organicpost&utm_campaign=seo,2016-03-25 16:00:12,,37,18,7,0,0,0,0,0,0
64067037679_10153323082852680,Expedia is bringing travel to the kids at St. Jude Children's Research Hospital. See the full story.,Donate Expedia+ points to St. Jude,link,http://www.expedia.com/dreamadventures?brandcid=social.facebook.published.brand.dreamadventurespage.stjude.160325,2016-03-25 12:00:59,,52,14,11,0,0,0,0,0,0
64067037679_10153320594002680,Looking for things to do on your next vacation? Check out these deals.,"Things to do Thursday: Adventures, tours and more",link,https://www.expedia.com/things-to-do/?theme=deals&brandcid=social.facebook.published.lx.thingstodo.deals.160324,2016-03-24 18:00:24,,35,23,5,0,0,0,0,0,0
64067037679_10153319897792680,Get your groove on with these top places to dance at Walt Disney World! #ExpediaAtDisney,Top 5 Places to Bust a Move at Walt Disney World,video,https://www.youtube.com/watch?v=PAGvfXjMheE&list=PLdgCSoJzrmKFzl7LP0TdECxVXyzUWQBui&index=12&facebook.160324,2016-03-24 13:10:01,,1963,29,62,0,0,0,0,0,0
64067037679_10153312793507680,"Our heartfelt thoughts are with the victims and their families, and the people of Brussels. We are working with our travel partners to help all impacted customers as quickly as possible.",,status,,2016-03-22 11:05:47,,34,26,0,0,0,0,0,0,0
64067037679_10153310557432680,Share the power of travel with the children of St. Jude Children's Research Hospital.,"Technology, travel, and the children of St. Jude",link,https://viewfinder.expedia.com/features/technology-travel-children-st-jude/?utm_campaign=blog&utm_source=facebook&utm_medium=organicpost,2016-03-21 18:00:20,,162,33,42,0,0,0,0,0,0
64067037679_10153309830542680,"For kids at St. Jude Children's Research Hospital who can't travel and see the world, Expedia is bringing the world to them: http://bit.ly/1RfFbJ2",Dream Adventures Film | Expedia + St. Jude Children's Research...,video,https://www.facebook.com/expedia/videos/10153309830542680/,2016-03-21 12:47:13,02:51,394,47,797,0,0,0,0,0,0
64067037679_10153307797067680,Spring break vibes. http://bit.ly/1RdwO0p,Timeline Photos,photo,https://www.facebook.com/expedia/photos/a.10150326748327680.344475.64067037679/10153307797067680/?type=3,2016-03-20 18:00:11,,54,29,4,0,0,0,0,0,0
64067037679_10153305246482680,Maximize your Walt Disney World vacation with these hacks. #ExpediaAtDisney,5 Hacks for Walt Disney World,link,https://viewfinder.expedia.com/orlando/top-5-walt-disney-world-hacks/?utm_campaign=blog&utm_source=facebook&utm_medium=organicpost,2016-03-19 19:00:11,,61,30,5,0,0,0,0,0,0
64067037679_10153302558187680,Experience the magic of Walt Disney World with your little ones. #ExpediaAtDisney,Top 5 Things to Do At Walt Disney World for Toddlers,video,http://bit.ly/1S8JEzz,2016-03-19 12:00:00,,2477,42,143,0,0,0,0,0,0
64067037679_10153302628767680,Cruise into the weekend with this 3-day sale.,Save up to $100 on your cruise,link,https://www.expedia.com/Cruise-Search?cruise-line=royal&sort-by=price&promo-category=3DAYS&brandcid=social.facebook.published.cruise.cruisesearchresults.rci.160318,2016-03-18 16:00:09,,16,26,2,0,0,0,0,0,0
64067037679_10153302169512680,Where would you fly with Turkish Airlines?,Turkish Airlines awarded Best Airline in Europe,link,https://www.expedia.com/g/pt/ms-air-turkish-airlines?langid=1033&brandcid=social.facebook.published.meso.partnerpage.turkishairlines.160318,2016-03-18 12:00:08,,2315,100,67,0,0,0,0,0,0
