status_id,status_message,link_name,status_type,status_link,status_published,status_video_length,num_reactions,num_comments,num_shares,num_likes,num_loves,num_wows,num_hahas,num_sads,num_angrys
104266592953439_1209890129057741,On this day in 1869 — just four years after the Civil War — pro baseball was born with the Cincinnati Red Stockings.,Timeline Photos,photo,https://www.facebook.com/ESPN/photos/a.114588455254586.5908.104266592953439/1209890129057741/?type=3,2016-03-15 13:45:00,,12159,205,4949,11851,208,89,4,5,2
104266592953439_1209855819061172,Ruben Tejada's days with the New York Mets may be numbered:,Sources: Mets Place IF Tejada On Waivers,link,http://es.pn/1R0uaLz,2016-03-15 13:30:00,,475,61,96,420,2,16,1,32,4
104266592953439_1209906789056075,The NFL and NFLPA are working toward a deal that could strip commissioner Roger Goodell of disciplinary power when it comes to off-the-field infractions by players:,Potential Deal Would Strip Goodell Of Discipline,link,http://es.pn/1U4PhT0,2016-03-15 13:15:00,,2650,166,226,2473,99,7,68,1,2
104266592953439_1209873542392733,"Haven't filled out a NCAA March Madness bracket yet? What are you waiting for?

Get it done here with the #AcuraTourney Challenge:",March Advice: Don't Be The Only One Without A Bracket,link,http://es.pn/1QPETKN,2016-03-15 13:00:01,,150,8,15,148,1,1,0,0,0
104266592953439_1209888782391209,Denver Broncos LB (and Kansas City native) Shane Ray has words for anyone who has a problem with his massive KC back tattoo.,Timeline Photos,photo,https://www.facebook.com/ESPN/photos/a.114588455254586.5908.104266592953439/1209888782391209/?type=3,2016-03-15 12:15:08,,6242,404,449,6072,96,47,23,0,4
104266592953439_1209846422395445,"For the first time since 2007, Arnold Palmer reportedly won't hit the ceremonial first shot at The Masters Tournament:",Source: Palmer Won't Hit Tee Shot At Masters,link,http://es.pn/1MkwzyH,2016-03-15 12:00:00,,1223,76,161,948,2,24,0,248,1
104266592953439_1209840639062690,"""If I could just get Andre McGee in a room for 10 minutes, I would say to him: 'Why would you do this? What purpose did it serve? We didn't need this to get recruits.'""",Pitino: Thought We Had People To Prevent Scandal,link,http://es.pn/1YVXoQR,2016-03-15 11:30:00,,590,122,67,572,1,2,10,2,3
104266592953439_1209771322402955,"If the College Football Playoff had as many teams as NCAA March Madness, it'd look something like this:",What Would Happen In A 68-Team College Football Bracket?,link,http://es.pn/1U4b0KV,2016-03-15 11:00:00,,827,141,294,803,13,9,1,0,1
104266592953439_1209762429070511,"Who will be the best players in MLB in the 2016 season? 

The countdown starts with two young stars who are making their debuts in the top 100:","Baseball Tonight's Top 100 Ranking, Players No. 100-91",link,http://es.pn/1Rk0TdS,2016-03-15 10:30:00,,489,46,19,482,5,1,0,1,0
104266592953439_1209752655738155,"What's your bracket strategy?

""I play safe and go chalk."" Whatever that means ...",WATCH: Little Experts Offer Their Best Bracket Advice,link,http://es.pn/1TL7V1Y,2016-03-15 10:00:02,,719,55,142,685,8,0,25,0,1
104266592953439_1209748015738619,"How devastating was Holly Holm's knockout of Ronda Rousey?

She's only just now able to handle eating an apple:",WATCH: Rousey Hits Milestone In Recovery ... By Eating An Apple,link,http://es.pn/1UdneAr,2016-03-15 09:15:00,,5667,479,398,5312,47,107,194,5,2
104266592953439_1209763082403779,"When you have a wide-open layup, but you pass to Stephen Curry for a 3 instead ...",WATCH: Leandro Barbosa Passes On Layup Opportunity For Curry 3-Pointer,link,http://es.pn/1RiW3nq,2016-03-15 08:57:00,,3357,167,226,3248,28,49,27,0,5
104266592953439_1209571029089651,A heated moment in Cleveland Cavaliers-Utah Jazz on Monday night.,WATCH: Frye And Lyles Ejected After Head Butt And Shot Below The Belt,link,http://es.pn/1QZBbvX,2016-03-15 08:30:00,,2450,149,166,2366,9,25,48,1,1
104266592953439_1209508312429256,Stephen Curry's cake > LeBron James' cake?,"Stephen Curry's Cake Joins LeBron, Kobe And Others In NBA Birthday Cake Hall Of Fame",link,http://es.pn/1Rij1Lt,2016-03-15 00:19:00,,3105,102,50,3032,48,16,4,0,5
104266592953439_1209505095762911,Drake helped distract the Chicago Bulls into a late five-second violation.,WATCH: Drake's Trash Talk Helps Cause Turnover,link,http://es.pn/1MjxQ92,2016-03-15 00:00:27,,2959,271,202,2720,17,3,149,4,66
104266592953439_1209414579105296,"That leaked bracket ...

The SportsNation hosts did not have a lot of sympathy for the NCAA.",WATCH: Is A Leaked NCAA Bracket A Big Deal?,link,http://es.pn/1V81Tb0,2016-03-14 21:30:00,,530,49,20,521,3,1,4,0,1
104266592953439_1209420149104739,"Jackrabbit or Terrapin? Panther or Badger?

One animal expert picks the NCAA tournament ... if it were mascot vs. mascot.","WATCH: If NCAA Teams Were Their Mascots, Who Would Be Champs Of The Animal Kingdom?",link,http://es.pn/1pkuA8g,2016-03-14 21:17:13,,1086,175,520,1048,7,0,31,0,0
104266592953439_1209380852442002,D'Angelo Russell has moves on AND off the court.,WATCH: The Young Lakers' Best Celebrations,link,http://es.pn/1U2t7AR,2016-03-14 20:45:00,,839,36,65,812,9,0,18,0,0
104266592953439_1209328909113863,"1. The North Carolina Tar Heels won't even make the Sweet 16

2-10:",One Writer's 10 Bold NCAA Tournament Predictions,link,http://es.pn/1RiSNlI,2016-03-14 20:15:00,,2191,380,406,1973,22,14,74,3,105
104266592953439_1209294832450604,"""They've blown 12 fourth-quarter leads because they don't have a point guard.""",WATCH: Skip Bayless Says Russell Westbrook Is The Big Reason Behind OKC's Late Struggles,link,http://es.pn/22fn5kV,2016-03-14 20:00:00,,3113,390,242,2979,15,16,60,3,40
104266592953439_1209300542450033,"""It comes down to one word. And to me, it's 'selfish.'""",WATCH: Landry Fields Says Cousins Pinning His Suspension On George Karl Is 'Unprofessional',link,http://es.pn/1SO5xGq,2016-03-14 19:30:00,,507,29,24,500,0,0,5,0,2
104266592953439_1209323182447769,"Mark Sanchez, Denver Broncos starting quarterback?",Mark Sanchez Believes He Has Opportunity To Start For Broncos; Does He?,link,http://es.pn/1QYXAtq,2016-03-14 19:15:00,,2530,741,195,2193,20,9,287,8,13
104266592953439_1209342955779125,The women's NCAA tournament bracket is here.,Women's 2016 NCAA Tournament: Full Bracket,link,http://es.pn/22fycu6,2016-03-14 19:15:00,,974,110,93,943,9,1,9,9,3
104266592953439_1209294312450656,"Need to know more about all the NCAA tournament games?

Here is a deep dive inside each one:",Insider: Jay Bilas Breaks Down Every Game In-Depth,link,http://es.pn/1nJL8Wc,2016-03-14 19:00:00,,368,24,23,363,0,0,0,0,5
104266592953439_1209319032448184,"From this position, with almost no time left, the team in red got the shot off.

And made it.",WATCH: Illinois High School Hits One Of The Best Buzzer-Beaters You'll See,link,http://es.pn/1RKkYdO,2016-03-14 18:40:00,,2254,118,718,2146,15,89,2,0,2
104266592953439_1209311375782283,Stephen A. Smith got HEATED over Kobe Bryant's Phil Jackson comments.,WATCH: Stephen A. Tells Kobe To  'Mind Your Business',link,http://es.pn/1S0D5in,2016-03-14 18:20:00,,4231,873,511,3841,19,12,179,0,180
104266592953439_1209294882450599,"""He has zero credibility when it comes to praising quarterbacks.""","WATCH: Stephen A. Says Brandon Marshall Is Hurting, Not Helping, Ryan Fitzpatrick",link,http://es.pn/1UcaSsl,2016-03-14 18:06:00,,472,66,20,451,2,3,7,0,9
104266592953439_1209303455783075,"For the first time, a high-ranking NFL official has acknowledged the link between football-related head trauma and CTE.","NFL Official: Link Exists Between Brain Trauma, Football",link,http://es.pn/1LncpJz,2016-03-14 17:54:44,,1224,157,301,1160,2,32,2,26,2
104266592953439_1209291912450896,Those one-handed passes look just like his dad's.,WATCH: LeBron James Jr. Flashes His Skills In Newest Mixtape,link,http://espn.go.com/sportsnation/story/_/id/14972791/lebron-james-son-lebron-james-jr-shows-moves-court?ex_cid=espnfb,2016-03-14 17:30:27,,2275,122,229,2234,8,29,1,2,1
104266592953439_1209271555786265,Newcastle United had no chance.,"WATCH: Okazaki's Incredible Overhead Kick Gives Leicester The Lead, Win",link,http://es.pn/1pHvwnC,2016-03-14 17:15:00,,1249,48,96,1210,7,31,1,0,0
104266592953439_1209212342458853,"Stolen bases have been declining across MLB.

The man who's sixth on the all-time steals list has an idea as to why:",Where Have All The Stolen Bases Gone?,link,http://es.pn/1QYB1Fd,2016-03-14 17:00:00,,1563,144,216,1537,4,2,0,19,1
104266592953439_1209223662457721,"For Stephen Curry's 28th birthday, here's video of him dancing — for one hour:",WATCH: Steph Curry Gets His Groove On,link,http://es.pn/1WlB3KS,2016-03-14 16:30:00,,3224,90,105,3129,52,2,39,0,2
104266592953439_1209202522459835,Here's how these teams reacted to their inclusion in NCAA March Madness:,WATCH: Tournament-Bound Teams React On Selection Sunday,link,http://es.pn/1ppZOeR,2016-03-14 16:00:00,,724,13,34,715,5,1,2,1,0
104266592953439_1209216199125134,Gordon Hayward wasn't quite ready for DeMarcus Cousins:,WATCH: Boogie Cousins Breaks Hayward's Ankles,link,http://es.pn/1P8TUmH,2016-03-14 15:45:00,,1534,70,120,1478,7,20,28,0,1
104266592953439_1209224582457629,"""I am not exactly sure what the next phase of life will entail, but I am confident that all of the lessons I learned during my NFL journey will provide a solid foundation for success.""",Packers DL Raji To Take 'Hiatus' From Football,link,http://es.pn/1S0p6ck,2016-03-14 15:45:00,,1735,99,94,1662,6,12,6,45,4
104266592953439_1209172002462887,"""Go to Manchester United and give the fans (and players) a reason to stay awake past half time. Go to Arsenal and show them what belief and character looks like. Heck, you can go to Sunderland if you like.""",Dear Zlatan: Please Come To The Premier League,link,http://es.pn/22gghjs,2016-03-14 15:30:00,,2043,111,135,2020,8,0,11,1,3
104266592953439_1209163879130366,The Pittsburgh Steelers will be without Martavis Bryant for this season:,NFL Bans Martavis Bryant For At Least One Year,link,http://es.pn/1QSoqFF,2016-03-14 15:00:00,,2987,442,763,2368,23,31,274,56,235
104266592953439_1209158612464226,"Think you can do better than Kermit the Frog and Miss Piggy in their NCAA March Madness bracket?

Challenge them here: http://es.pn/1oKO32g",WATCH: Kermit And Miss Piggy On Tournament Challenge,link,http://es.pn/22eHsi1,2016-03-14 14:30:00,,353,17,22,345,1,0,7,0,0
104266592953439_1209136382466449,"How are NBA teams supposed to guard Stephen Curry?

Shane Battier has some ideas:",WATCH: Guarding The Unguardable,link,http://es.pn/1M2yHjA,2016-03-14 14:00:00,,2241,151,62,2213,14,8,4,0,2
104266592953439_1209137952466292,"1. Golden State Warriors
2. San Antonio Spurs
3. Cleveland Cavaliers
4-30:",NBA Power Rankings: Get Ready For Warriors-Spurs II,link,http://es.pn/1nJgtZ0,2016-03-14 13:30:00,,1371,38,30,1351,10,7,2,0,1
104266592953439_1209112485802172,"1. Washington Capitals
2. Chicago Blackhawks
3. Anaheim Ducks
4-30:",NHL Power Rankings: Race To The Top Heating Up,link,http://es.pn/1MSCyjz,2016-03-14 13:00:00,,389,23,23,380,9,0,0,0,0
104266592953439_1209060885807332,Dwayne The Rock Johnson took some time out of his filming schedule to visit a children's hospital:,Yet Another Example Of How Cool The Rock Is,link,http://es.pn/1YRFUoN,2016-03-14 12:30:00,,5481,52,259,5337,131,10,1,2,0
104266592953439_1209086395804781,That look Stephen A. Smith gives when Skip Bayless says THIS about Peyton Manning on ESPN First Take:,"WATCH: Stephen A. Smith, Skip Disagree On Peyton Manning's Future",link,http://es.pn/1Mimi6a,2016-03-14 11:53:10,,1365,162,82,1320,5,1,37,2,0
104266592953439_1209052252474862,"""I thought the seeding was idiotic.""",WATCH: Dakich Not Happy With Selection Committee,link,http://es.pn/1Ut9JLN,2016-03-14 11:30:00,,1538,98,126,1517,9,2,8,0,2
104266592953439_1209028392477248,"There are some big-time NBA prospects playing in NCAA March Madness.

ESPN Insider asked NBA GMs and scouts for their thoughts:",Top 30 NBA Draft Prospects In The NCAA Tournament,link,http://es.pn/1nIUXna,2016-03-14 11:00:01,,1671,54,55,1633,8,3,1,1,25
104266592953439_1209020202478067,David Ortiz knows that his final season will be emotional — but he's determined not to let it overwhelm him:,"WATCH: David Ortiz — The Last Walk Off, Chapter One",link,http://es.pn/22dTV5K,2016-03-14 10:30:00,,2416,67,224,2336,26,2,0,52,0
104266592953439_1209000259146728,"There's still a lot of talent left on the NFL free agent market.

Here are the best remaining:",Ranking The Top Unsigned NFL Free Agents,link,http://es.pn/1UblFmx,2016-03-14 10:00:00,,189,18,10,188,0,1,0,0,0
104266592953439_1208981955815225,"""That spot should go, in my opinion, to a little conference team that had a magnificent season ...""",WATCH: Greeny Thinks Syracuse In NCAA Tournament Is An 'Outrage',link,http://es.pn/22fBiLe,2016-03-14 09:30:01,,1881,225,168,1811,26,5,7,2,30
104266592953439_1208971669149587,"""People in New York just need to trust the fact that he knows more about basketball than any of them put together.""

Kobe Bryant has Phil Jackson's back:",Kobe To Knicks Fans: Trust 'Greatest Ever' Jackson,link,http://es.pn/1UbgCSV,2016-03-14 09:00:00,,4758,95,206,4668,63,3,24,0,0
104266592953439_1208667009180053,"Ready to build a better bracket?

This is where to start:",ESPN Insider NCAA Tournament Bracket Tools,link,http://es.pn/21quCaP,2016-03-14 08:30:01,,926,31,33,922,3,0,0,0,1
104266592953439_1208702635843157,So when exactly are the games?,2016 NCAA Tournament: Full Schedule,link,http://es.pn/1Mh6QqI,2016-03-14 00:06:27,,446,14,73,439,6,1,0,0,0
104266592953439_1208686589178095,"Favorite: Kansas

Second-favorites: North Carolina and a non-No. 1 seed",Championship Odds For All 68 Teams In The NCAA Tournament,link,http://es.pn/1nHVqpL,2016-03-13 23:45:52,,2407,151,249,2379,23,4,0,0,1
104266592953439_1208674569179297,The NCAA tournament wasn't the only bracket revealed Sunday.,Heroes Of The Dorm Championship Bracket Reveal,link,http://es.pn/1poPt2K,2016-03-13 23:17:33,,732,74,31,690,2,8,7,2,23
104266592953439_1208663512513736,The Giant Killers are lurking.,Insider: Top 10 NCAA Tournament Games Ripe For An Early Upset,link,http://es.pn/1LlpNhd,2016-03-13 22:55:33,,1149,54,50,1111,6,1,1,0,30
104266592953439_1208639845849436,Basically every number you need to know.,Bracket Facts For 2016 NCAA Tournament,link,http://es.pn/1M1duGP,2016-03-13 22:30:00,,1043,19,144,1036,3,2,1,0,1
104266592953439_1208638872516200,"""Indefensible by every known standard.""",Joe Lunardi: The Selection Committee Got So Much Wrong -- And Here Is How,link,http://es.pn/1TZyW1Y,2016-03-13 22:06:09,,4134,271,704,3987,27,12,7,3,98
104266592953439_1208568682523219,The win probabilities for all the teams.,2016 March Madness Predictions,link,http://es.pn/1YP3AKu,2016-03-13 21:45:00,,1087,73,201,1076,4,5,1,0,1
104266592953439_1208618112518276,LeBron James? He celebrated in a major way.,WATCH: What To Do After A Big Road Win? Take A Snap With DJ Khaled,link,http://es.pn/1XoOv11,2016-03-13 21:33:36,,2275,81,45,2239,7,4,25,0,0
104266592953439_1208608645852556,"""A&M got a 3-seed. Did we not play a basketball game today?""","WATCH: Calipari Gets Animated About Seedings, Does Dick Vitale Impersonation",link,http://es.pn/1Rg0v6v,2016-03-13 21:18:52,,5634,311,620,5373,79,6,162,2,12
104266592953439_1208589305854490,"Dick Vitale's reaction to Monmouth, Saint Mary's and other mid-majors being left out of the bracket.",Timeline Photos,photo,https://www.facebook.com/ESPN/photos/a.114588455254586.5908.104266592953439/1208589305854490/?type=3,2016-03-13 21:01:44,,3016,165,263,2870,12,2,2,27,103
104266592953439_1208520469194707,"He is no longer the ace with the rocket arm.

In 2016, CC Sabathia is another pitcher trying to win a fifth starter spot.",Joe Girardi Admits Yankees' Sabathia Has To Win Spot,link,http://es.pn/1RfQN3X,2016-03-13 20:30:00,,99,8,4,99,0,0,0,0,0
104266592953439_1208568555856565,Ben Simmons' college career is very likely over.,"LSU, Not In NCAA, Bows Out Of Postseason",link,http://es.pn/1TGNzqy,2016-03-13 20:22:45,,2070,232,125,1975,8,17,62,3,5
104266592953439_1208559939190760,"Monmouth? South Carolina? Or was another team a bigger snub?

And what about the teams that DID get in?",Vote: Who Was The Biggest NCAA Tournament Snub? The Biggest Surprise?,link,http://es.pn/1QWIuEE,2016-03-13 20:10:04,,1343,220,74,1313,2,3,3,3,19
104266592953439_1208543152525772,"ESPN 30 for 30's #FantasticLies on the night a Duke lacrosse party gained a nation's attention and changed lives forever.

Fantastic Lies airs Sunday at 9 p.m. ET on ESPN.",,video,https://www.facebook.com/ESPN/videos/1208543152525772/,2016-03-13 19:46:51,00:34,287,52,235,278,0,3,0,0,6
104266592953439_1208494592530628,"The Kansas Jayhawks are rolling.

The Iowa Hawkeyes are not.",Insider: The 10 Hottest And Coldest Teams Heading Into The NCAA Tournament,link,http://es.pn/1TGBstH,2016-03-13 19:30:00,,1760,74,81,1689,23,2,3,3,40
104266592953439_1208488982531189,"Before you pick, read up.",Breaking Down Every NCAA Tournament Team From 68 To 1,link,http://es.pn/1RfLOQS,2016-03-13 19:15:00,,2181,98,406,2164,10,1,5,0,1
104266592953439_1208517302528357,"Before it was officially revealed, it appeared to surface on Twitter.","NCAA Tournament Bracket Apparently Leaked, An Hour In Advance",link,http://es.pn/22c9YRA,2016-03-13 18:55:24,,2472,171,203,2296,8,42,118,1,7
104266592953439_1208488089197945,"Kanye West has a request for L.A. Clippers owner Steve Ballmer.

And Ballmer responded.",Kanye Wants To Redesign Clippers' New Mascot,link,http://es.pn/1XolYZe,2016-03-13 18:42:37,,3255,422,161,3050,25,7,131,2,40
104266592953439_1208468299199924,It's here.,2016 NCAA Tournament Bracket,link,http://es.pn/21qa9TE,2016-03-13 17:50:05,,7074,212,1210,6824,116,28,12,6,88
104266592953439_1208431655870255,The No. 1 seeds are set. Let the madness begin.,Timeline Photos,photo,https://www.facebook.com/ESPN/photos/a.114588455254586.5908.104266592953439/1208431655870255/?type=3,2016-03-13 16:55:15,,1749,136,396,1683,27,9,5,0,25
104266592953439_1208407349206019,"Upcoming plans:

Fill out Tournament Challenge bracket ✔
Watch endless college hoops ✔",Create A Bracket Now For ESPN Tournament Challenge,link,http://es.pn/1QPETKN,2016-03-13 16:44:20,,709,44,91,687,19,1,1,1,0
104266592953439_1208387135874707,"Oregon, Kentucky, Kansas and North Carolina are certainly #PlanningForSuccess in the NCAA tournament. Along with Northwestern Mutual, we recognize and celebrate these teams for capturing their respective conference titles!",Timeline Photos,photo,https://www.facebook.com/ESPN/photos/a.114588455254586.5908.104266592953439/1208387135874707/?type=3,2016-03-13 16:13:55,,1927,74,84,1902,20,1,3,0,1
104266592953439_1208385619208192,"""If they replace the Eiffel Tower with a statue of me, then I will stay. I promise.""",PSG Star Zlatan Ibrahimovic Says He Will Not Be At Club Next Season ... So What's Next?,link,http://es.pn/1pomig5,2016-03-13 16:02:37,,3758,378,393,3525,32,12,182,2,5
104266592953439_1208363375877083,"Things could get a little emotional for Carmelo Anthony when the New York Knicks take on the LA Lakers. 

It won't be because of his team's struggles or any uncertainty over his future ... It will be because of the opponent.",Melo Shares His Thoughts On Kobe Before The Duo's Last Showdown,link,http://es.pn/22dOLTM,2016-03-13 15:45:00,,5811,52,145,5694,48,5,3,61,0
104266592953439_1208356919211062,"After the Kentucky Wildcats won another SEC title, John Calipari became Tyler Ulis' campaign manager:",WATCH: Calipari Pushes Ulis As National POY,link,http://es.pn/1phtABV,2016-03-13 15:07:09,,5785,298,634,5650,89,9,34,1,2
104266592953439_1208311675882253,"UK on top ... again!

Jamal Murray's clutch overtime 3 helps the Kentucky Wildcats sink Texas A&M University 81-77. It's the Wildcats' 30th (!) SEC tourney title. No other school has more than 6.

[Credit: John Bazemore/AP]",Timeline Photos,photo,https://www.facebook.com/ESPN/photos/a.114588455254586.5908.104266592953439/1208311675882253/?type=3,2016-03-13 14:20:36,,951,58,192,902,37,3,1,0,8
104266592953439_1208195439227210,"""Send them my way, and I'll fix that.""",Kobe Jokes That LeBron's Sons 'Pass Too Much',link,http://es.pn/1XnynNc,2016-03-13 13:30:00,,5080,115,296,4881,35,1,162,0,1
104266592953439_1208174625895958,"The length of the average adult male hand, measured from the tip of the thumb to the tip of the pinkie, is 7.4 inches.

For Giannis Antetokounmpo, it's 12 inches.",A Day Spent Breaking Down The NBA's Most Exceptional Body,link,http://es.pn/1RY6s53,2016-03-13 13:00:00,,1841,76,146,1792,6,43,0,0,0
104266592953439_1208161439230610,"""I've just always enjoyed being part of the fraternity of quarterbacks … I wanted to call them, to hear it from me and let them know I appreciated all of those battles.""",Peyton Manning On Saying Goodbye To Brady And Belichick And Missing 'That Handshake',link,http://es.pn/1RHFNqx,2016-03-13 12:30:00,,3838,39,188,3765,38,2,1,31,1
104266592953439_1208154302564657,"Robert Ayers to the Tampa Bay Buccaneers: C
Mark Sanchez to the Denver Broncos: ???",Barnwell: Grading The Latest Free-Agent Deals,link,http://es.pn/22bgk3y,2016-03-13 11:01:00,,681,56,23,668,2,5,4,1,1
104266592953439_1208144122565675,"""I didn't know if I'd ever coach again. I was just trying to survive.""

—Texas A&M University's Billy Kennedy on #SCFeatured",WATCH: SEC Coach Of The Year Hasn't Let Parkinson's Disease Hold Him Back,link,http://es.pn/1QQBbSs,2016-03-13 10:31:03,,1139,16,151,1120,16,1,1,1,0
104266592953439_1208120195901401,"""I will never say anybody's better than me. I don't think those words will ever come out of my mouth.""","Why Bryce Harper Says He's The Best, And Why He Might Be Right",link,http://es.pn/1Wc5i6V,2016-03-13 09:59:35,,824,88,87,799,12,0,3,1,9
104266592953439_1208082715905149,At least three former Louisville basketball recruits have told the NCAA they attended on-campus parties where strippers danced and prostitutes were paid to have sex with them.,OTL Report: Louisville Recruits Told NCAA About Sex Parties,link,http://es.pn/1YNfswq,2016-03-13 09:03:59,,1168,248,336,1054,3,46,57,3,5
104266592953439_1207830762597011,"Who's in? Who's out? And what about those seeds?

Joe Lunardi, your thoughts ...",Bracketology: Stay Updated With The Latest Projection,link,http://es.pn/21p6LZ1,2016-03-13 08:30:01,,1515,66,56,1504,7,2,1,0,1
104266592953439_1207823389264415,Great moves.,WATCH: Roy Williams Celebrates With A Shimmy,link,http://es.pn/1TXfpiE,2016-03-13 07:45:00,,1767,32,74,1724,21,1,20,1,0
104266592953439_1207843555929065,"The University of Michigan and Syracuse Orange have the prestige, but will they make NCAA March Madness?",Bubble Watch: Selection Sunday Update,link,http://es.pn/1RfuCVw,2016-03-13 07:00:00,,601,52,27,596,2,1,0,0,2
104266592953439_1207824242597663,Confidence.,"WATCH: Curry Turns Around, Doesn't Need To See His 3 Go In",link,http://es.pn/1XmBEwg,2016-03-13 01:45:00,,10193,472,912,9803,162,168,41,2,17
104266592953439_1207822815931139,THIS is what March is all about.,WATCH: Buzzer-Beating 3 Sends Cal State Bakersfield To First NCAA Tourney,link,http://es.pn/1RGYaf1,2016-03-13 01:17:50,,8486,193,1600,8257,88,119,11,5,6
104266592953439_1207805822599505,"Nice trifecta.

With Seton Hall's Big East tourney title, Derrick Gordon will become the first player in history to play in the NCAA tournament with three different schools.",Timeline Photos,photo,https://www.facebook.com/ESPN/photos/a.114588455254586.5908.104266592953439/1207805822599505/?type=3,2016-03-13 00:40:21,,4299,131,381,4217,17,59,2,2,2
104266592953439_1207775169269237,The arrest comes two days after Prescott worked out for 30 NFL teams.,Draft Hopeful Dak Prescott Arrested On DUI Charge,link,http://es.pn/1pggdSg,2016-03-12 23:37:23,,2952,483,399,2728,7,78,98,28,13
104266592953439_1207732625940158,"It seems owner Mark Cuban's biggest fear for the Dallas Mavericks is coming true.

They're stuck at mediocrity.","Short Or Long Term, It Doesn't Look Pretty For Mavs",link,http://es.pn/1WhXVek,2016-03-12 22:30:01,,2189,177,102,2067,4,3,30,77,8
104266592953439_1207695235943897,"You can be the most technically skilled player behind closed doors, but the mental strength to perform in front of a crowd is a completely different arena.",Head Games: Injecting Sports Psychology Into Esports,link,http://es.pn/24XwxrZ,2016-03-12 21:30:01,,809,40,104,799,7,1,0,1,1
104266592953439_1207634042616683,"""How can we take you as our franchise savior when you couldn't lead LSU to a tournament bid?""

One writer looks at the presumptive No. 1 overall draft pick.",Insider: Is Ben Simmons Still The No. 1 Draft Pick?,link,http://es.pn/1YLtw9J,2016-03-12 20:15:00,,3813,642,396,3677,6,13,89,6,22
104266592953439_1207604379286316,"""The way we communicate, the way we practice together, the way we bring other guys together, I've never seen that anywhere else.""

– Brandon Marshall on Ryan Fitzpatrick",Jets' Marshall Doesn't Want To Consider Life Without Fitzpatrick,link,http://es.pn/22c0sdN,2016-03-12 19:45:01,,5322,249,224,5236,52,10,19,3,2
104266592953439_1207640662616021,A master class in photobombing.,WATCH: Jamal Murray Steals Spotlight During Calipari Interview,link,http://es.pn/22c7dfp,2016-03-12 19:15:21,,1480,17,158,1437,14,2,27,0,0
104266592953439_1207618649284889,"One day after his huge dunk, Wayne Selden Jr. is showing up everywhere.",WATCH: Kansas' Wayne Selden Jr. Debuts On His Uncle's Newest Clock,link,http://es.pn/1QPrjZ5,2016-03-12 19:15:00,,1059,48,40,1032,11,0,16,0,0
104266592953439_1207549662625121,"Don't try Jose Bautista in an exercise battle.

The Phillie Phanatic learned that the hard way ...",WATCH: Jose Bautista Battles The Phillie Phanatic,link,http://es.pn/1QN6A7a,2016-03-12 18:15:00,,1206,29,103,1164,10,0,32,0,0
