status_id,status_message,link_name,status_type,status_link,status_published,status_video_length,num_reactions,num_comments,num_shares,num_likes,num_loves,num_wows,num_hahas,num_sads,num_angrys
104266592953439_1205255066187914,"According to the NFL, The Kansas City Chiefs didn't follow protocol while acquiring one of their key offensive stars in 2015.","Chiefs Docked Two Draft Picks, Fined For 2015 Tampering",link,http://es.pn/1QMZCg6,2016-03-09 19:02:39,,1198,128,210,1048,5,7,72,2,64
104266592953439_1205203556193065,"The Chicago Blackhawks are in the ""favorites"" category.

The New York Rangers ...",Placing The NHL Playoff Teams Into Four Categories,link,http://es.pn/1TMsJqc,2016-03-09 18:30:00,,617,41,15,608,5,3,0,0,1
104266592953439_1205199546193466,These jobs aren't what they used to be.,Insider: Top 5 Once-Elite College Coaching Jobs That Are No Longer Top-Shelf,link,http://es.pn/1TMssDw,2016-03-09 18:00:00,,531,43,11,501,1,1,2,4,22
104266592953439_1205216546191766,"""From the moment Kirk [Cousins] was drafted, I think Robert had animosity towards him.""","Chris Cooley Doesn't Hold Back With RG III Comments, Claims Position Groups Didn't Like Him",link,http://es.pn/1py3aMH,2016-03-09 17:47:26,,1443,147,65,1409,5,22,5,0,2
104266592953439_1205200166193404,"1. Jim Harbaugh
2-129. ___________",Ranking The College Football Coaches -- As Players,link,http://es.pn/1UTqXCF,2016-03-09 17:30:00,,1021,47,137,1005,9,3,3,0,1
104266592953439_1205109876202433,"""You gave a father the best gift he could ever have.""",WATCH: Trey Wingo's Heartfelt Thank You To Peyton Manning,link,http://es.pn/1p8zSUc,2016-03-09 17:00:00,,2699,55,263,2626,66,3,1,1,2
104266592953439_1205126132867474,"At 42, the New York Mets pitcher has already made history this MLB season:",Bartolo Colón Is The Last Montreal Expo Standing,link,http://es.pn/1U3YKJP,2016-03-09 16:30:00,,7726,282,716,7568,39,91,18,10,0
104266592953439_1205132206200200,BREAKING: Former Chicago Bears running back Matt Forte has agreed to a contract with the New York Jets:,Source: Jets To Sign RB Forte To Replace Ivory,link,http://es.pn/24RpRf4,2016-03-09 16:15:00,,4466,331,804,4178,53,68,14,118,35
104266592953439_1205094086204012,"Could LeBron James leave the Cleveland Cavaliers — again?

Our analysts debate:",WATCH: How Serious Could LeBron Be About Leaving Cleveland?,link,http://es.pn/1YxR9T8,2016-03-09 16:00:00,,4381,580,453,4140,16,39,166,6,14
104266592953439_1205113229535431,BREAKING: Former Denver Broncos quarterback Brock Osweiler will reportedly sign with the Houston Texans:,Source: Brock Osweiler To Sign With Texans,link,http://es.pn/1M78UBD,2016-03-09 15:45:00,,7344,785,1661,6488,61,336,327,37,95
104266592953439_1205088259537928,"You guys know the dunk contest is over, right?",WATCH: Zach LaVine And Aaron Gordon Are Still Putting On A Show,link,http://es.pn/1SzYfWL,2016-03-09 15:30:00,,2853,62,168,2792,15,41,5,0,0
104266592953439_1205069559539798,"The average adult male hand, measured from thumb to pinkie, is 7.4 inches. 

For Giannis Antetokounmpo, it's 12 inches ...",Breaking Down Measurements Of The NBA's Best Body,link,http://es.pn/1QHpq0D,2016-03-09 15:00:00,,8125,609,1013,7817,65,236,4,1,2
104266592953439_1204971092882978,"Stephen Curry is the first NBA player to make 300 3-pointers in a single season.

Here are all of them in todays Chevrolet Malibu Unexpected Moment:",WATCH: Curry's 300 3s In Two Minutes,link,http://es.pn/1Szy1nf,2016-03-09 14:00:01,,2578,121,207,2507,32,35,3,0,1
104266592953439_1205056309541123,ESPN's Jesse Rogers is live with Chicago Cubs third baseman Kris Bryant:,ESPN Baseball Tonight,video,https://www.facebook.com/ESPNBaseballTonight/videos/1298949456787086/,2016-03-09 13:10:05,,326,18,0,320,6,0,0,0,0
104266592953439_1205040709542683,Dion Waiters' brother was one of six people killed in Philadelphia in three separate acts of violence on Tuesday:,Brother Of Thunder's Waiters Killed In Philadelphia,link,http://es.pn/1QHiK2H,2016-03-09 13:00:01,,4000,152,628,3315,6,61,3,596,19
104266592953439_1205007352879352,Charles Johnson's son is pretty thrilled about his dad coming back to the Carolina Panthers:,WATCH: 'Lil CJ' Happy Panthers Re-Signed His Dad,link,http://es.pn/1W98pg2,2016-03-09 12:30:00,,749,15,13,738,8,1,2,0,0
104266592953439_1204967106216710,"The Carolina Panthers get an A for keeping Charles Johnson.

The rest of the NFL free agent grades:",Barnwell: Grading The Big Free-Agent Deals,link,http://es.pn/21ZCAgA,2016-03-09 12:00:00,,1343,33,43,1324,17,0,1,0,1
104266592953439_1204975492882538,"""These are kids. And they cared and played hard every single night.""",WATCH: Emotions Boil Over For BC Senior After Winless ACC Season,link,http://es.pn/1nwxtkZ,2016-03-09 11:30:00,,3158,226,259,2883,10,6,98,159,2
104266592953439_1204914196222001,"1. Stephen Curry
2. LeBron James
3. Kawhi Leonard
4-20:",NBA Player Power Rankings: Kawhi Can't Be Stopped,link,http://es.pn/1R6MXnx,2016-03-09 11:00:00,,8330,403,567,8164,93,52,12,0,9
104266592953439_1204885536224867,"Money is important. So is location.

But they're not the only things NFL free agents think about when choosing a new team:",Seven Factors That Affect Where NFL Free Agents Sign,link,http://es.pn/1TJbINv,2016-03-09 10:30:01,,940,48,62,936,2,0,2,0,0
104266592953439_1204323646281056,Megatron was clowning defenses long before he was with the Detroit Lions:,WATCH: Calvin Johnson Was A Beast At Georgia Tech,link,http://es.pn/1o07VOh,2016-03-09 10:00:00,,910,25,57,899,1,4,4,2,0
104266592953439_1204610519585702,Incredible.,WATCH: Aaron Gordon's Absolutely Out-Of-Control Windmill Slam,link,http://es.pn/1M5V8PR,2016-03-09 01:18:58,,4553,124,310,4326,29,189,6,1,2
104266592953439_1204306859616068,"""When you go 24-0, your imagination kind of goes crazy after that.""",WATCH: How Many Wins Does Steph Curry Expect This Season?,link,http://es.pn/1Rz3xgv,2016-03-08 23:30:00,,1831,47,48,1806,16,2,5,0,2
104266592953439_1204316222948465,"""You put too much pressure on everybody if you say something like that.""",Kevin Durant Denies Finals-Or-Bust Ultimatum,link,http://es.pn/1UR9hHP,2016-03-08 23:15:00,,1397,46,53,1381,0,1,7,0,8
104266592953439_1204290146284406,Best class ever?,2021 Hall Of Fame Class Has Chance To Be Among The All-Time Greatest,link,http://es.pn/1QFn42q,2016-03-08 23:00:00,,3650,101,140,3585,37,23,3,1,1
104266592953439_1204288819617872,Longtime rival Tom Brady was among his first calls:,Peyton Reveals List Of Calls He Made Prior To Retirement Announcement,link,http://es.pn/1pwiVn3,2016-03-08 22:45:00,,9639,143,460,9422,152,44,4,14,3
104266592953439_1204280549618699,"Calvin Johnson's career?

One SportsNation host calls it an ""underachievement.""",WATCH: Did Megatron's Career Disappoint?,link,http://es.pn/1p6lMTl,2016-03-08 22:30:00,,1246,204,44,1201,2,1,14,4,24
104266592953439_1204420332938054,"SMU and the Louisville Cardinals will be two of the best teams to ever miss NCAA March Madness in the modern era.

More in #AcuraTourney By the Numbers:",WATCH: Best Teams To Miss The NCAA Tournament,link,http://es.pn/1pwtAyg,2016-03-08 22:17:32,,580,60,72,536,1,4,12,21,6
104266592953439_1204413142938773,"""The sad part about that is, listen, he's an old boxing guy who thinks he's smart, and he's not.""

—UFC president Dana White","UFC's Dana White 'Feels Bad' For Holm, Blames Manager",link,http://es.pn/1SylwIM,2016-03-08 22:15:00,,4831,289,236,4662,26,54,71,6,12
104266592953439_1204269949619759,"One writer says Calvin Johnson, Jr. will have to wait for his call to Canton:",Clayton: Why Megatron Isn't A Lock For The Hall Of Fame,link,http://es.pn/1RQqHRX,2016-03-08 22:00:00,,845,68,38,825,1,8,7,0,4
104266592953439_1204284166285004,"Mel Kiper Jr. thinks Robert Nkemdiche will fall.

But how far?",WATCH: This One Team Might Be The Best Fit For 'Top-Five Talent' Nkemdiche,link,http://es.pn/21Xy823,2016-03-08 21:15:00,,584,46,19,579,3,0,2,0,0
104266592953439_1204215232958564,A win in their opener could make the College Football Playoff race very interesting:,Believe It: Houston Can Win The CFP Title In 2016,link,http://es.pn/1UcjaPB,2016-03-08 21:00:00,,1415,176,235,1344,30,3,36,1,1
104266592953439_1204277822952305,"""I'm not saying this is a bad thing, but I'm saying be careful.""",WATCH: Was Bogut's Premature Celebration Of Steph Curry 3 Too Cocky?,link,http://es.pn/1pwiv0e,2016-03-08 20:15:00,,645,61,20,621,6,1,14,0,3
104266592953439_1204319349614819,Happy #internationalwomensday 💯,Timeline Photos,photo,https://www.facebook.com/ESPN/photos/a.114588455254586.5908.104266592953439/1204319349614819/?type=3,2016-03-08 20:14:13,,7779,62,686,7562,211,4,1,1,0
104266592953439_1204204819626272,Calvin Johnson isn't the only athlete to leave fans wanting more.,Johnson Joins These Stars In Taking Early Retirement,link,http://es.pn/21XodJF,2016-03-08 20:00:00,,1839,70,82,1765,10,3,4,42,15
104266592953439_1204268096286611,"""I think he'll come back. It won't even take a year, if you ask me.""",WATCH: Adam 'Pacman' Jones Is Not Buying Calvin Johnson's Retirement,link,http://es.pn/1Xb2dEw,2016-03-08 19:30:00,,2127,143,89,2090,5,11,17,0,4
104266592953439_1204277616285659,Bomani Jones on Around the Horn says the NFL has a decision to make based on Brock Osweiler's actions.,WATCH: Jones Critical Of Osweiler's Actions In Video,link,http://es.pn/1Lc6NBO,2016-03-08 19:15:00,,3043,696,263,2923,17,9,14,3,77
104266592953439_1204199706293450,"1. Anthony Davis
2. ___________
3. Damian Lillard
4-10. __________",Insider: Ranking The NBA's Fourth-Year Players By Potential,link,http://es.pn/1QFd3lR,2016-03-08 19:00:00,,3525,88,47,3441,15,6,6,0,57
104266592953439_1204206056292815,"Ben Simmons a first-team All-American? 

Not on this list:",Insider's 2015-16 All-American Teams,link,http://es.pn/1Lc27Me,2016-03-08 18:15:00,,842,67,14,826,4,2,2,0,8
104266592953439_1204202102959877,"Someday, Cristiano Ronaldo will no longer be scoring goals.

Is Real Madrid C.F. ready?",A Look At Life Without Cristiano Ronaldo For Real Madrid,link,http://es.pn/1nuQswz,2016-03-08 18:00:00,,925,36,19,907,2,1,7,7,1
104266592953439_1204198556293565,His deal is for a reported six years and $90 million.,Malik Jackson Says He's Leaving Broncos For Jaguars,link,http://es.pn/1nuPkZN,2016-03-08 17:45:22,,2604,332,272,2405,40,32,34,56,37
104266592953439_1204195666293854,The Miami Dolphins are making another big move on defense.,Sources: Mario Williams To Sign With Dolphins,link,http://es.pn/1TJ6cdI,2016-03-08 17:38:21,,2463,188,230,2392,13,27,14,3,14
104266592953439_1204131836300237,Mike Tomlin hadn't tweeted in four months before calling out DeAngelo Williams:,Tomlin Tells Williams To Chill Out On Bashing Peyton,link,http://es.pn/1LbQ5Cm,2016-03-08 16:00:00,,6286,458,524,6031,88,11,145,3,8
104266592953439_1204109946302426,"""[The doctors] said if I would have stood up then, the weight of my head — left, right, front, back — I would have died.""",Ricardo Lockette: I Could Have Died On The Field,link,http://es.pn/1Tqn5tb,2016-03-08 15:30:00,,4457,137,574,4041,5,293,4,112,2
104266592953439_1204033032976784,"Zach Lowe's ""Marc Gasol All-Stars"" honors the players with the most entertaining games in the NBA.

Here's this year's list:",The Most Watchable Players In The NBA,link,http://es.pn/21jFF5B,2016-03-08 15:00:00,,762,36,65,753,4,4,1,0,0
104266592953439_1204035429643211,Jason Pierre-Paul is reportedly coming back to the New York Giants,Source: Pierre-Paul Gets 1-Year Deal From Giants,link,http://es.pn/1pvWCy4,2016-03-08 14:30:00,,2263,79,129,2183,66,11,2,1,0
104266592953439_1204029652977122,"Calvin Johnson, Jr.. Peyton Manning. Marshawn Lynch. Charles Woodson. 

The NFL won't be the same next year.",Timeline Photos,photo,https://www.facebook.com/ESPN/photos/a.114588455254586.5908.104266592953439/1204029652977122/?type=3,2016-03-08 13:46:23,,40295,848,8119,38064,123,309,25,1740,34
104266592953439_1203973426316078,"""The hardest part about that dunk is you have to commit. You get up so high, and then you're super off-balance and your legs aren't under you anymore and you're not used to that feeling.""",Aaron Gordon Explains How He Pulled Off His All-Star 'Take A Chair In The Air' Dunk,link,http://es.pn/24OGcAX,2016-03-08 13:30:00,,2990,72,72,2897,41,51,0,0,1
104266592953439_1203980372982050,"Green Bay Packers: Reggie White
New Orleans Saints: Drew Brees

The best-ever free agent signings for the rest of the NFL:",Best-Ever Free Agent Signings For All 32 NFL Teams,link,http://es.pn/1YpdMcy,2016-03-08 13:00:00,,1404,51,40,1392,11,1,0,0,0
104266592953439_1203963606317060,"Calvin Johnson, Jr. had an amazing career.

Here are his best moments:",The Top Five Moments Of Calvin Johnson's Career,link,http://es.pn/1Ysm0Rc,2016-03-08 12:30:00,,1499,46,116,1445,8,9,1,35,1
104266592953439_1203933472986740,"The LA Lakers shocked the Golden State Warriors.

FiveThirtyEight says it wasn't the biggest upset of all time — or even in the top 10:",Here's Where The Lakers' Upset Of The Warriors Ranks,link,http://es.pn/1R5qLjP,2016-03-08 12:00:00,,1872,97,46,1816,19,5,6,2,24
104266592953439_1203915982988489,"""I can sit up here and say that we're a team that's ready to start the playoffs tomorrow, but we're not.""

LeBron James had some harsh words for the Cleveland Cavaliers:",LeBron: Cavaliers Not Yet Ready For Playoffs,link,http://es.pn/1pvDjF1,2016-03-08 11:30:00,,3771,311,349,3638,15,29,71,11,7
104266592953439_1203928162987271,"BREAKING: The Detroit Lions have announced that Calvin Johnson, Jr. is retiring:",Calvin Johnson Retiring From NFL After Nine Seasons,link,http://es.pn/1QEmIcf,2016-03-08 11:10:50,,9268,534,2552,7983,18,366,33,824,44
104266592953439_1203903736323047,"How much can free agency affect the NFL draft?

Mel Kiper Jr.'s latest ESPN Insider Mock Draft breaks it down:","Kiper: NFL Mock Draft 3.0, With Free Agency In Mind",link,http://es.pn/1SwYUIF,2016-03-08 11:00:00,,508,32,7,493,1,1,1,0,12
104266592953439_1203827179664036,"Maria Sharapova says she used meldonium for 10 years.

The company that manufactures it says that's much longer than the normal course of treatment:",Company: Sharapova Drug Only Needed 4-6 Weeks,link,http://es.pn/1pdgfuT,2016-03-08 10:30:00,,1824,263,274,1612,6,96,56,40,14
104266592953439_1203812292998858,"""... [Peyton Manning] had an astonishing career. I just said what everyone's been saying the entire year: he was garbage last year.""",DeAngelo Williams Stands By His Peyton Manning Tweets,link,http://es.pn/1QIHLqy,2016-03-08 10:00:00,,3152,842,314,2857,59,12,114,4,106
104266592953439_1203425003037587,"""Top fighters lose all the time.""",WATCH: Bad Weekend For UFC? SportsNation Hosts Disagree,link,http://es.pn/1W55LrI,2016-03-08 09:30:00,,734,64,22,728,0,2,4,0,0
104266592953439_1203421379704616,Andrew Bogut knew.,WATCH: Bogut Doesn't Even Wait For Ball To Leave Steph Curry's Hands To Celebrate 3,link,http://es.pn/1LNPM0B,2016-03-08 01:22:50,,7690,223,535,7319,93,31,243,0,4
104266592953439_1203404139706340,"First player to hit 300 3s in a season. 

Longest home win streak in NBA history (45 games). 

The run continues for Stephen Curry and the Warriors. 

[Noah Graham/Getty Images]",Timeline Photos,photo,https://www.facebook.com/ESPN/photos/a.114588455254586.5908.104266592953439/1203404139706340/?type=3,2016-03-08 01:00:30,,13211,208,731,12835,192,164,11,1,8
104266592953439_1203392766374144,What a shot.,Rickie Fowler's Hole-In-One In Ernie Els' Autism Charity Event Nets $1 Million,link,http://es.pn/1LNN8Im,2016-03-08 00:47:17,,5917,124,540,5747,86,81,3,0,0
104266592953439_1203305939716160,"This would get high marks in the Slam Dunk Contest.

It happened in a game.","WATCH: Dunk Contest Champ Zach LaVine Throws Down 360-Degree, One-Handed Slam",link,http://es.pn/1X8BAju,2016-03-07 23:05:27,,2538,102,231,2425,31,79,1,0,2
104266592953439_1203290123051075,"King James moves up! The Cavalier passes John Havlicek (26,395 points) on the NBA's all-time scoring list.",Timeline Photos,photo,https://www.facebook.com/ESPN/photos/a.114588455254586.5908.104266592953439/1203290123051075/?type=3,2016-03-07 22:32:04,,4521,152,230,4457,27,25,0,0,12
104266592953439_1203277759718978,"Now that's a way to keep your conference tourney hopes alive.

(They lost in overtime, but even so.)",WATCH: Valpo Player Completes Incredible Full-Court Pass With 0.5 Seconds Left To Force OT,link,http://es.pn/1puS2Qq,2016-03-07 22:08:15,,587,15,39,569,1,15,2,0,0
104266592953439_1203267573053330,Six quarterbacks made the list.,Picking The Best Free-Agent Signing Ever For All 32 NFL Teams,link,http://es.pn/1YpdMcy,2016-03-07 21:44:35,,420,19,26,418,1,1,0,0,0
104266592953439_1203153643064723,"When this Little League star isn't in the ballpark ...

She's balling with the The Original Harlem Globetrotters?","WATCH: Mo'ne Davis Joins Globetrotters In Surprise Appearance, Gets Buckets",link,http://es.pn/1Tny5aN,2016-03-07 21:15:00,,1023,62,67,998,13,6,4,0,2
104266592953439_1203129116400509,"""[Y]ou are and you will FOREVER be the STANDARD!""",Cam Newton Salutes Peyton Manning On Instagram,link,http://es.pn/1QHcS5O,2016-03-07 20:45:00,,13278,168,359,13016,194,18,8,38,4
104266592953439_1203196173060470,"What a save.

[Credit: Chris Horner/Pittsburgh Tribune-Review]",Timeline Photos,photo,https://www.facebook.com/ESPN/photos/a.114588455254586.5908.104266592953439/1203196173060470/?type=3,2016-03-07 20:35:00,,68385,3133,14118,64133,591,3360,270,11,20
104266592953439_1203036923076395,"Some options for the former NFL star include:
- Front-office executive
- Television analyst
- Comedian?",Examining What's Next For Peyton Manning,link,http://es.pn/1p3eK1u,2016-03-07 20:15:00,,840,86,13,829,4,5,0,1,1
104266592953439_1203003006413120,"Landis Sims, who was born without hands or half his legs, signed a minor league contract with the New York Yankees on Monday.",10-Year-Old With No Hands Or Lower Legs Signs Contract With Yankees,link,http://espn.go.com/blog/new-york/yankees/post/_/id/91407/born-with-no-hands-no-lower-legs-now-a-yankee,2016-03-07 19:45:00,,8191,148,906,7881,267,8,3,31,1
104266592953439_1203131536400267,"""I take full responsibility for the inappropriate question I asked at the combine.""",Falcons Coach: Sorry I Asked Eli Apple If He's Gay,link,http://es.pn/1RPiAVM,2016-03-07 19:30:00,,1082,145,63,999,2,8,43,1,29
104266592953439_1203154956397925,The Tennessee Titans have reportedly found their next running back.,Sources: Eagles Trading DeMarco Murray To Titans,link,http://es.pn/21Xts8O,2016-03-07 19:26:21,,10166,1032,3368,9499,105,264,254,10,34
104266592953439_1203086369738117,"1. Himself
2. __________
3. Odell Beckham Jr.",WATCH: Who's On Antonio Brown's List Of Top Five NFL WRs?,link,http://es.pn/1U8Kuy8,2016-03-07 19:15:00,,2639,303,108,2613,11,3,7,0,5
104266592953439_1203030099743744,"""Oh my gosh, he was a lot better than I ever was.""",Peyton Manning's Career Was Father Archie's Long Overdue Reward,link,http://es.pn/1U8Ishq,2016-03-07 18:45:00,,4803,47,110,4685,83,3,3,28,1
104266592953439_1203089383071149,Analysts and former players have wildly varying opinions about Maria Sharapova's disclosure of a failed drug test.,"Athletes, Tennis Community React To Sharapova's Failed Drug Test",link,http://espn.go.com/tennis/story/_/id/14922088/social-reaction-tennis-community-reacts-maria-sharapova-failed-drug-test,2016-03-07 18:15:00,,933,145,85,884,3,21,3,14,8
104266592953439_1203013713078716,"Tracy McGrady skipped college basketball.

Tracy McGrady thinks players should not be able to skip college basketball.","WATCH: McGrady Thinks Players Should Go To School, And Not Just For One Year",link,http://es.pn/1R1jHP5,2016-03-07 18:00:00,,9097,413,588,8872,136,14,70,0,5
104266592953439_1203000963079991,"The loss to the LA Lakers put a dent in the Golden State Warriors' chances of reaching 73 wins.

Here's an updated look at where they stand:",Chase For 73: Warriors' Chances Of Beating The Bulls' Record,link,http://es.pn/1R1g7Et,2016-03-07 17:30:00,,3614,128,105,3531,17,28,32,5,1
104266592953439_1202985163081571,"Eddie Hall's nickname is ""The Beast"".

With lifts like this, it's no wonder:",WATCH: 'The Beast' Breaks World Deadlift Record,link,http://es.pn/1U08O6D,2016-03-07 17:15:00,,7931,1098,2042,7493,38,388,11,1,0
104266592953439_1203012203078867,Robert Griffin III posted a heartfelt message to Washington fans on social media after being released on Monday. (via @rgiii),Timeline Photos,photo,https://www.facebook.com/ESPN/photos/a.114588455254586.5908.104266592953439/1203012203078867/?type=3,2016-03-07 17:03:49,,5333,208,226,5203,43,9,12,63,3
104266592953439_1203004456412975,The Miami Dolphins are about to get a pair of defensive starters.,Source: Miami To Acquire Defensive Duo From Eagles,link,http://es.pn/1pbFoGd,2016-03-07 17:00:00,,4503,403,685,4384,29,20,48,5,17
104266592953439_1202988546414566,"DeAngelo Williams says Peyton Manning had an ""astonishing"" career.

His final season? Not so much.",DeAngelo Williams: Manning 'Couldn't Play Dead In A Western' In 2015,link,http://es.pn/1p32YUZ,2016-03-07 16:45:00,,2954,1170,460,2606,31,13,124,2,178
104266592953439_1202922616421159,"LeBron James has been sending out some cryptic tweets lately.

He says there's a method to it all:",LeBron OK If 'Beautiful Mind' Starts Social Conflict,link,http://es.pn/1LavzSB,2016-03-07 16:30:00,,713,61,20,700,5,2,6,0,0
104266592953439_1202955236417897,"""Football has taught me not to be led by obstructions and setbacks but instead to be led by dreams.""",Full Transcript Of Peyton Manning's Retirement Speech,link,http://es.pn/1TFfmYB,2016-03-07 16:00:00,,5832,86,641,5557,153,8,5,108,1
104266592953439_1202941689752585,This Minnesota high school hockey tournament had haircuts so good that it required an entire video to document — and Barry Melrose:,The 2016 Minnesota State High School All Hockey Hair Team Is Amazing,link,http://es.pn/1Rx2tcQ,2016-03-07 15:45:00,,2830,262,738,2748,28,6,48,0,0
104266592953439_1202963323083755,BREAKING: Maria Sharapova announced that she failed a drug test at the Australian Open in January:,Sharapova Flunked Drug Test At Aussie Open,link,http://es.pn/1Qyo9HT,2016-03-07 15:27:06,,2093,233,324,1793,7,162,63,58,10
104266592953439_1202927093087378,Peyton Manning held back tears during his retirement speech when saying that he hopes Johnny Unitas is proud of him:,WATCH: Retiring Manning Fights Back Tears,link,http://es.pn/24MtVNy,2016-03-07 15:00:00,,15169,364,1477,14083,536,14,9,524,3
104266592953439_1202839466429474,"Robert Griffin III was supposed to be the Washington Redskins' savior. 

Four years later, he's gone:",What Went Wrong With RG III's Redskins Career,link,http://es.pn/1RwSCUh,2016-03-07 14:30:00,,1614,431,89,1539,6,8,40,20,1
104266592953439_1202912606422160,Legend.,Timeline Photos,photo,https://www.facebook.com/ESPN/photos/a.114588455254586.5908.104266592953439/1202912606422160/?type=3,2016-03-07 13:54:07,,6113,72,902,5861,170,5,1,76,0
104266592953439_1202838169762937,"1. Golden State Warriors
2. San Antonio Spurs
3. Cleveland Cavaliers
4-30:","NBA Power Rankings: Warriors, Spurs Still On Top",link,http://es.pn/1W3DPnS,2016-03-07 13:30:00,,2794,73,54,2742,23,14,8,1,6
104266592953439_1202826029764151,Antonio Brown will be the latest athlete to try his luck on Dancing with the Stars:,Steelers WR Brown High-Steps Onto DWTS Stage,link,http://es.pn/1QGjvWg,2016-03-07 13:00:00,,1264,53,130,1229,24,0,10,0,1
104266592953439_1202793956434025,Both Conor McGregor and Holly Holm booked post-fight parties at the same nightclub — which had a very unfortunate name:,Did McGregor And Holm's Choice Of Post-Fight Nightclub Predict Their Defeats?,link,http://es.pn/1R3cEeV,2016-03-07 12:30:00,,7882,420,1028,7433,25,62,353,8,1
104266592953439_1202760669770687,"How bad was the Golden State Warriors' loss to the LA Lakers?

FiveThirtyEight predicts another team is now more likely to win the NBA title:",FiveThirtyEight's Latest NBA Predictions,link,http://es.pn/1YUUwEi,2016-03-07 12:00:00,,1688,164,91,1614,8,13,47,1,5
104266592953439_1202779923102095,"If Victor Cruz wants to stay with the New York Giants, he'll have to reportedly take a pay cut:","Source: If No Pay Cut, Giants To Cut Ties With Cruz",link,http://es.pn/21SHRXd,2016-03-07 11:30:00,,2662,376,629,2566,5,39,24,15,13
104266592953439_1202755713104516,"How good was Peyton Manning?

FiveThirtyEight says if you split his career in two, both halves would be Hall of Fame-worthy:",Peyton Manning Had A Hall Of Fame Career. Then He Had Another One.,link,http://es.pn/21Sx3bD,2016-03-07 11:00:00,,6548,135,917,6311,174,45,6,11,1
104266592953439_1202764779770276,BREAKING: The Washington Redskins have reportedly informed Robert Griffin III that he will be released:,Sources: Redskins Tell RG III He'll Be Released,link,http://es.pn/1OXArFv,2016-03-07 10:46:31,,3282,385,623,3051,21,61,116,26,7
104266592953439_1202723779774376,Team Secret and Team Liquid battled it out at the Dota 2 Shanghai final — with $1.1 million on the line:,WATCH: Dota 2 Shanghai Major Grand Final,link,http://es.pn/1OXwVLs,2016-03-07 10:30:00,,685,91,65,643,10,12,5,0,15
104266592953439_1202706546442766,Former Chicago Bears and Tampa Bay Buccaneers coach Lovie Smith is headed to the college ranks:,Illini Hire Lovie Smith As Football Head Coach,link,http://es.pn/1R2XpTg,2016-03-07 10:00:00,,3925,179,437,3806,66,36,11,1,5
104266592953439_1202704596442961,Alley-oops are simple when the guy you're throwing them to is 7-foot-6:,WATCH: Alley-Oop To 7-Foot-6 Tacko Fall,link,http://es.pn/1R2WG4l,2016-03-07 09:30:00,,1919,72,142,1882,9,22,6,0,0
104266592953439_1202316179815136,At least they laughed about it ...,WATCH: College Dunk Leads To Awkward Shoulder Carry,link,http://es.pn/1ULJnVP,2016-03-06 23:30:01,,1987,131,379,1831,6,14,136,0,0
