status_id,status_message,link_name,status_type,status_link,status_published,status_video_length,num_reactions,num_comments,num_shares,num_likes,num_loves,num_wows,num_hahas,num_sads,num_angrys
113408673932_10153582762073933,"Change your mood. 
Marathon the first 6 Ballers episodes tomorrow at 8 on HBO2.",Timeline Photos,photo,https://www.facebook.com/HBO/photos/a.10150164248733933.338447.113408673932/10153582762073933/?type=3,2015-07-29 12:03:41,,3321,59,250,3321,0,0,0,0,0
113408673932_10153578004353933,"Snubbed by Baseball's Hall of Fame, but beloved by fans and teammates alike. #FerrellTakesTheField Saturday, September 12 at 10PM on HBO.",Ferrell Takes the Field Trailer,video,https://www.facebook.com/HBO/videos/10153578004353933/,2015-07-27 13:48:36,01:31,13723,681,4876,13723,0,0,0,0,0
113408673932_10153562036968933,"Unexpected. Mysterious. Famous.
Tig Notaro Boyish Girl Interrupted, an #HBO Comedy Special, premieres Aug 22 at 10pm.",,video,https://www.facebook.com/HBO/videos/10153562036968933/,2015-07-20 12:04:40,00:51,360,30,41,360,0,0,0,0,0
113408673932_10153552863133933,"HBO has earned the most Emmy nominations of any network or streaming service for a record 15th consecutive year. 

Thank you, our fans, for helping us make #Emmys history.",Timeline Photos,photo,https://www.facebook.com/HBO/photos/a.10150164248733933.338447.113408673932/10153552863133933/?type=3,2015-07-16 13:46:29,,4289,131,168,4289,0,0,0,0,0
113408673932_10153552787328933,"Get all of HBO on more devices than ever before.
http://itsh.bo/HBONow",HBO's cover photo,photo,https://www.facebook.com/HBO/photos/a.10150763100328933.465203.113408673932/10153552787328933/?type=3,2015-07-16 13:05:38,,328,37,20,328,0,0,0,0,0
113408673932_10153550362503933,"Keep up with Ballers. 

Watch every episode this season with HBO NOW. http://itsh.bo/hbonowfb",Timeline Photos,photo,https://www.facebook.com/HBO/photos/a.10150164248733933.338447.113408673932/10153550362503933/?type=3,2015-07-15 12:22:32,,2249,48,249,2249,0,0,0,0,0
113408673932_10153547998708933,"10 teams. 10 positions. 1 Will Ferrell.

Ferrell Takes The Field premieres Saturday, September 12 at 10. http://itsh.bo/ferrelltakesthefield",Timeline Photos,photo,https://www.facebook.com/HBO/photos/a.10150164248733933.338447.113408673932/10153547998708933/?type=3,2015-07-14 10:59:33,,944,30,66,944,0,0,0,0,0
113408673932_10153538455318933,"Andy Samberg. Kit Harington.
 
Stream 7 Days in Hell right now with HBO NOW: http://itsh.bo/1HKoOVn",7 Days In Hell,video,https://www.facebook.com/HBO/videos/10153538455318933/,2015-07-10 08:49:27,00:31,12798,1048,1789,12798,0,0,0,0,0
113408673932_10153534789208933,"In Memoriam: Jerry Weintraub, our friend and colleague (1937-2015)",HBO Documentary Films,photo,https://www.facebook.com/hbodocs/photos/a.130799990298496.13915.111478545563974/987209234657563/?type=3,2015-07-08 18:00:57,,887,32,0,887,0,0,0,0,0
113408673932_10153534067133933,"Register for HBO Connect and serve Andy Samberg a question about his new tennis persona in 7 Days in Hell.
http://itsh.bo/1IJsDsN",Timeline Photos,photo,https://www.facebook.com/HBO/photos/a.10150164248733933.338447.113408673932/10153534067133933/?type=3,2015-07-08 11:26:49,,432,21,10,432,0,0,0,0,0
113408673932_10153523888143933,Happy Independence Day. Enjoy the show.,Mobile Uploads,photo,https://www.facebook.com/HBO/photos/a.10151984366148933.1073741834.113408673932/10153523888143933/?type=3,2015-07-04 09:22:46,,3638,63,87,3638,0,0,0,0,0
113408673932_10153520992558933,Celebrate the soundtrack to America. A marathon of Foo Fighters: Sonic Highways begins at 4 on HBO Zone.,Mobile Uploads,photo,https://www.facebook.com/HBO/photos/a.10151984366148933.1073741834.113408673932/10153520992558933/?type=3,2015-07-03 11:01:24,,2287,42,1009,2287,0,0,0,0,0
113408673932_10153518534038933,HBO Documentary Films' Larry Kramer In Love & Anger is now available on HBO GO and HBO NOW: http://itsh.bo/1drJO5j,Timeline Photos,photo,https://www.facebook.com/HBO/photos/a.10150164248733933.338447.113408673932/10153518534038933/?type=3,2015-07-02 09:36:29,,552,30,19,552,0,0,0,0,0
113408673932_10153516327568933,"Here's what's new on HBO NOW this month, including 7 Days In Hell and Lone Survivor.

via UPROXX: http://itsh.bo/1f0YgCV",Timeline Photos,photo,https://www.facebook.com/HBO/photos/a.10150164248733933.338447.113408673932/10153516327568933/?type=3,2015-07-01 09:32:46,,2131,58,58,2131,0,0,0,0,0
