status_id,status_message,link_name,status_type,status_link,status_published,status_video_length,num_reactions,num_comments,num_shares,num_likes,num_loves,num_wows,num_hahas,num_sads,num_angrys
14482400667_10154202320890668,These celebrities share what keeps them looking younger than their years.,22 Stars Who Don't Seem to Age,link,http://trib.al/ZAK4Abl,2016-11-16 23:32:10,,568,6,17,0,0,0,0,0,0
14482400667_10154202307730668,Read this if you've been curious about Lasik.,8 Things to Know Before You Get Lasik,link,http://trib.al/E8H7pFb,2016-11-16 23:19:09,,286,18,40,0,0,0,0,0,0
14482400667_10154202262275668,This plank strengthens your entire core 💪,How to Do Plank Hip Dips,link,http://trib.al/L0poHKT,2016-11-16 22:45:10,,1746,10,144,0,0,0,0,0,0
14482400667_10154201860795668,4. Talking about yourself is hard. (via Elite Daily),5 Things Anyone Who Wears Their Heart On Their Sleeve Knows To Be True,link,http://pubx.co/c9FXrJ,2016-11-16 22:34:00,,320,3,12,0,0,0,0,0,0
14482400667_10154202241425668,Don't make them too!,The Same 10 Weight Loss Mistakes All Women Make,link,http://trib.al/pJFQMiz,2016-11-16 22:31:15,,646,7,32,0,0,0,0,0,0
14482400667_10154202214165668,"With certain workouts, your body can actually burn more calories than it normally would—even after you've finished exercising!",The Best Ways to Boost Your Metabolism,link,http://trib.al/aHwwiGN,2016-11-16 22:15:07,,584,3,133,0,0,0,0,0,0
14482400667_10154202177685668,You'll want to curl up with this cozy throw from Target!,8 Relaxing Gift Ideas for a Friend Who's Stressed to the Max,link,http://trib.al/ha3ewZs,2016-11-16 21:46:08,,119,1,6,0,0,0,0,0,0
14482400667_10154202157990668,Stock up on these weight loss superfoods!,The 50 Best Weight Loss Foods of All Time,link,http://trib.al/U0QKrt0,2016-11-16 21:33:07,,3123,7,344,0,0,0,0,0,0
14482400667_10154202130670668,"""I blamed my tight waistband on factors like the dorm dryer, shutting out comments from concerned friends who noticed how much weight I'd gained. It wasn't until I had to grab a size 18 dress for my mother's summer wedding that I finally realized I needed to make my health a priority.""","Weight Loss Success Story: ""I Lost 65 Pounds""",link,http://trib.al/RWhAdUY,2016-11-16 21:18:09,,253,2,7,0,0,0,0,0,0
14482400667_10154128814755668,"These banana-hemp pancakes are PACKED with protein to keep you feeling full!

Get the recipe: http://trib.al/wIkPrLM",Recipe: Banana-Hemp Pancakes,video,https://www.facebook.com/Health/videos/10154128814755668/,2016-11-16 21:03:00,00:54,2589,145,1363,0,0,0,0,0,0
14482400667_10154202090685668,Not flexible? No problem! These 12 yoga poses are for you: http://trib.al/aitBtVb,Timeline Photos,photo,https://www.facebook.com/Health/photos/a.10150092140635668.283454.14482400667/10154202090685668/?type=3,2016-11-16 20:53:08,,1063,6,54,0,0,0,0,0,0
14482400667_10154202052070668,#3: Have a 300-calorie breakfast.,16 Ways to Lose Weight Fast,link,http://trib.al/O8NkyDj,2016-11-16 20:34:05,,2154,18,349,0,0,0,0,0,0
14482400667_10154202015680668,Learn to improve your speed and endurance!,7 Ways to Make Yourself a Better Runner,link,http://trib.al/uzc1pXr,2016-11-16 20:18:10,,446,1,24,0,0,0,0,0,0
14482400667_10154201958665668,See what bras can really support and hold up a bigger chest.,Editor-Tested: 9 Bras for Fuller Busts,link,http://trib.al/ZF5U72a,2016-11-16 19:41:07,,376,2,42,0,0,0,0,0,0
14482400667_10154201936030668,How to pick the right cereal for your body's needs.,Which Cereal Is Healthiest For You?,link,http://trib.al/ms94PwC,2016-11-16 19:27:24,,245,9,23,0,0,0,0,0,0
14482400667_10154201916730668,These pretty matte lipsticks are perfect for every holiday party!,The 5 Best Matte Lipsticks That Won't Dry Out Your Lips,link,http://trib.al/IDXxtc6,2016-11-16 19:13:08,,157,3,21,0,0,0,0,0,0
14482400667_10154201858890668,4. Get the temperature in your room to between 65 and 72 degrees. (via HelloGiggles),9 surprising things you can do to sleep better at night,link,http://pubx.co/cXrq9K,2016-11-16 18:49:00,,221,2,13,0,0,0,0,0,0
14482400667_10154201876615668,"To rev up your engine and speed up your calorie burn, try this salmon noodle bowl recipe! http://trib.al/QT4pXq8",Timeline Photos,photo,https://www.facebook.com/Health/photos/a.10150092140635668.283454.14482400667/10154201876615668/?type=3,2016-11-16 18:47:05,,1331,12,100,0,0,0,0,0,0
14482400667_10154201844615668,Bye-bye blemishes! 👋,"This Video Shows Exactly What Causes Acne, and the Best Ways to Prevent It",link,http://trib.al/WDijg4H,2016-11-16 18:31:10,,510,9,51,0,0,0,0,0,0
14482400667_10154201813190668,"This yummy drink is made with better-for-you ingredients like fresh ginger, maple syrup, and coconut sugar!",This Ginger-Orange Rum Cocktail Has Just 160 Calories,link,http://trib.al/ltKtFRm,2016-11-16 18:17:06,,322,0,18,0,0,0,0,0,0
14482400667_10154201811405668,This cauliflower rice is ready in just 10 minutes!,Health,video,https://www.facebook.com/Health/videos/10153690877685668/,2016-11-16 18:15:51,,758,24,1,0,0,0,0,0,0
14482400667_10154201750170668,The #MannequinChallenge just got WAY more physical.,11 Fitness-Themed Mannequin Challenges That Made Our Jaws Drop,link,http://trib.al/YFKKbZZ,2016-11-16 17:34:04,,416,6,9,0,0,0,0,0,0
14482400667_10154201724340668,Grab all the tissues for this one 😭,Hundreds Join Dog on Final Beach Walk Celebrating His Life,link,http://trib.al/2DFZSUw,2016-11-16 17:16:04,,371,14,25,0,0,0,0,0,0
14482400667_10154201656820668,These booties are designed to support your feet throughout the day!,9 Comfortable Booties Made for Walking,link,http://trib.al/RhastCE,2016-11-16 16:48:07,,650,10,33,0,0,0,0,0,0
14482400667_10154201595850668,"We're doing a calming prenatal yoga sequence with Yoga Girl, founder of oneOeight!",,video,https://www.facebook.com/Health/videos/10154201595850668/,2016-11-16 16:45:02,19:10,1328,144,347,0,0,0,0,0,0
14482400667_10154201621820668,Fix uneven eyeliner in a flash with this pro trick:,10 Clever Beauty Hacks That Will Save You in a Pinch,link,http://trib.al/8N0ckGy,2016-11-16 16:36:10,,141,5,22,0,0,0,0,0,0
14482400667_10154201567280668,Aly Raisman is not having your negative comments.,Aly Raisman Shuts Down the Boys Who Used to Make Fun of Her Muscular Arms,link,http://trib.al/yZyMyom,2016-11-16 16:15:16,,152,5,7,0,0,0,0,0,0
14482400667_10154201477910668,Gaining and losing weight again and again has its drawbacks.,Why Yo-Yo Dieting Is Seriously Bad for Your Heart (Even If You're Not Overweight),link,http://trib.al/I9yz0nE,2016-11-16 15:36:07,,154,16,10,0,0,0,0,0,0
14482400667_10154201376790668,Make homemade almond milk without the added sugar!,Health,video,https://www.facebook.com/Health/videos/10153514963745668/,2016-11-16 14:51:34,,1768,78,2,0,0,0,0,0,0
14482400667_10154201124765668,You could be doing yourself more harm than good.,8 Lies People with Diabetes Should Never Tell Their Doctor,link,http://trib.al/Gz20fo7,2016-11-16 12:34:10,,236,12,24,0,0,0,0,0,0
14482400667_10154200979745668,"""Beauty is not one size fits all."" - Ashley Graham",Ashley Graham Slams Stereotypes About the 'Right' Swimsuit for Your Body,link,http://trib.al/0PAPboP,2016-11-16 11:15:20,,434,8,6,0,0,0,0,0,0
14482400667_10154200870555668,You'll want to sip from this studded water bottle all the time.,11 Fitness Gifts for Women Who Love to Sweat,link,http://trib.al/S856Nwx,2016-11-16 10:18:07,,139,5,10,0,0,0,0,0,0
14482400667_10154200803970668,We're doing a plyometric and core workout with Devan Kline Fitness and Burn Boot Camp. Join in!,,video,https://www.facebook.com/Health/videos/10154200803970668/,2016-11-16 10:09:51,38:12,4849,514,1954,0,0,0,0,0,0
14482400667_10154200784350668,Pin of the day: What you should know before getting a lob,5 Things You Should Know Before Getting a Lob,link,http://trib.al/9ZANYDl,2016-11-16 09:35:18,,207,5,8,0,0,0,0,0,0
14482400667_10154200691075668,Is there a healthier option?,Juice or Smoothie: Which One Is Healthier?,link,http://trib.al/8NjwX78,2016-11-16 08:54:09,,2465,23,159,0,0,0,0,0,0
14482400667_10154200513060668,Say hello to our December #HealthCoverStar Lauren Cohan ! On stands now,"Instagram photo by Health • Nov 8, 2016 at 3:05pm UTC",link,http://trib.al/Ayncp0A,2016-11-16 07:40:13,,357,8,5,0,0,0,0,0,0
14482400667_10154200436030668,This isn't your ordinary smoothie.,How to Make a Fat-Burning Green Smoothie,link,http://trib.al/nYtMhdz,2016-11-16 06:47:12,,502,8,68,0,0,0,0,0,0
14482400667_10154200358665668,Boost your calorie burn at breakfast!,The Best Fat-Burning Breakfasts,link,http://trib.al/TcW3o30,2016-11-16 05:43:09,,1554,12,234,0,0,0,0,0,0
14482400667_10154200238390668,"No, you don't have to give up dessert!",15 Ways to Avoid Holiday Weight Gain,link,http://trib.al/d6odAfR,2016-11-16 03:45:05,,623,5,36,0,0,0,0,0,0
14482400667_10154200115480668,It can take years or even decades for people with MS to be diagnosed.,Could You Have MS? 16 Multiple Sclerosis Symptoms,link,http://trib.al/v4pbjWs,2016-11-16 01:33:08,,442,2,62,0,0,0,0,0,0
14482400667_10154200039295668,The superfit supermodel just got her own Nike billboard.,She Just Did It! Bella Hadid Lands a Major Deal with Nike,link,http://trib.al/kQkOPMo,2016-11-16 00:43:06,,386,9,2,0,0,0,0,0,0
14482400667_10154199981530668,Ditch the body wash—Bar soap is making a comeback.,These Luxurious Bar Soaps Will Have You Ditching Body Wash,link,http://trib.al/psOeiYS,2016-11-16 00:15:05,,216,2,27,0,0,0,0,0,0
14482400667_10154199944130668,Real women share what changed for them.,How 3 Women Transformed Their Sex Lives,link,http://trib.al/WcNb5pQ,2016-11-15 23:47:07,,500,5,6,0,0,0,0,0,0
14482400667_10154199930970668,This move from Jillian Michaels helps you build up core strength and tighten your abs!,Health,video,https://www.facebook.com/Health/videos/10154151051430668/,2016-11-15 23:33:31,,1492,15,0,0,0,0,0,0,0
14482400667_10154199926285668,At least 30 million Americans have a thyroid disorder and half—15 million—are silent sufferers.,19 Signs Your Thyroid Isn't Working Right,link,http://trib.al/ubjJeNZ,2016-11-15 23:28:06,,802,22,262,0,0,0,0,0,0
14482400667_10154199910905668,Ready for some wanderlust?,50 Day Hikes You Must Add to Your Bucket List,link,http://trib.al/vAIJKfD,2016-11-15 23:17:07,,714,6,52,0,0,0,0,0,0
14482400667_10154199402905668,Raisman has been known to trade her leotard for running gear on occasion. (via Women's Running Magazine),"Get To Know Aly Raisman As A Runner, Not Just Gymnast",link,http://pubx.co/9m3tOb,2016-11-15 23:07:00,,110,1,1,0,0,0,0,0,0
14482400667_10154199862105668,"Improve your flexibility, improve your sex life.",4 Yoga Moves for Better Sex,link,http://trib.al/RHctl5q,2016-11-15 22:45:10,,911,5,59,0,0,0,0,0,0
14482400667_10154199850740668,"If you've been on the fence about the no-shampoo movement, here's what you should know.",Can Cleansing Conditioner Really Cause Hair Loss?,link,http://trib.al/ommr4PC,2016-11-15 22:37:07,,252,4,29,0,0,0,0,0,0
14482400667_10154199831910668,"""It got to the point when I was using eye drops two to three times every hour to feel relief because it was so painful and so irritating and itchy. It got in the way of the joys of my daily life.""","Jennifer Aniston on Dry Eyes: ""I Was Addicted to Eye Drops""",link,http://trib.al/eEZe1oP,2016-11-15 22:19:07,,337,16,16,0,0,0,0,0,0
14482400667_10154199792790668,This tote will FINALLY keep you organized.,16 Perfect Yoga Gifts for Women,link,http://trib.al/J62cGPP,2016-11-15 21:46:07,,168,4,5,0,0,0,0,0,0
14482400667_10154199770095668,Look younger than your years with these anti-aging tricks from the experts.,The 27 Best Anti-Aging Tips of All Time,link,http://trib.al/urKvPSo,2016-11-15 21:29:08,,614,2,175,0,0,0,0,0,0
14482400667_10154199754130668,"""What I'm going to say next is totally cliché, but 100% true: I woke up the next morning feeling like a new woman. In the three years since I bought the Lectrofan, I honestly cannot recall a night where I was woken up by outside noise.""",The Life-Changing Sleep Gadget I Never Travel Without,link,http://trib.al/dZPBaVn,2016-11-15 21:17:05,,288,10,38,0,0,0,0,0,0
14482400667_10154141036773773,"This cranberry-almond broccoli salad is just 100 calories per serving!

Get the recipe (via Cooking Light): http://trib.al/SckLu59",How to Make Cranberry-Almond Br...,video,https://www.facebook.com/Health/videos/10154141036773773/,2016-11-15 21:03:00,00:55,5127,190,4391,0,0,0,0,0,0
14482400667_10154199248280668,This is the perfect way to use up leftover Thanksgiving sweet potatoes. (via Cooking Light),How to Make Sweet Potato Hash Breakfast Bake,link,http://pubx.co/tyrvh6,2016-11-15 20:52:01,,530,2,28,0,0,0,0,0,0
14482400667_10154199685485668,"The best weight loss advice, all in one place.","57 Ways to Lose Weight Forever, According to Science",link,http://trib.al/98q4QWI,2016-11-15 20:45:14,,1563,8,326,0,0,0,0,0,0
14482400667_10154199677175668,These eats can help curb inflammation.,14 Foods That Fight Inflammation,link,http://trib.al/NaCtD74,2016-11-15 20:39:09,,2059,3,203,0,0,0,0,0,0
14482400667_10154199645105668,You DO have time for this 12-minute home workout!,12-Minute Dance Cardio Workout With Katie Austin,link,http://trib.al/WgxFVKX,2016-11-15 20:16:07,,1681,5,202,0,0,0,0,0,0
14482400667_10154199597375668,"In case you needed any fitspo to log more miles, this is it.",10 Quotes That Perfectly Capture Why You Love to Run,link,http://trib.al/CnjFeFT,2016-11-15 19:45:11,,602,6,20,0,0,0,0,0,0
14482400667_10154199586325668,We've made the transition easy.,13 Ways to Stop Drinking Soda for Good,link,http://trib.al/b3B6i4J,2016-11-15 19:38:09,,282,13,51,0,0,0,0,0,0
14482400667_10154199554575668,Your new favorite holiday drink is here 😋,How to Make a Peppermint Mocha Latte,link,http://trib.al/09AmiRp,2016-11-15 19:15:07,,1272,2,77,0,0,0,0,0,0
14482400667_10154199399480668,These are amazing! (via Elite Daily),The Supermoon Is Lighting Up Cities Around The World And The Photos Are Unreal,link,http://pubx.co/cC1S7k,2016-11-15 19:04:00,,1910,7,129,0,0,0,0,0,0
14482400667_10154199479775668,"This cranberry, orange, and chocolate smoothie is a fall treat! http://trib.al/miqTDKo",Timeline Photos,photo,https://www.facebook.com/Health/photos/a.10150092140635668.283454.14482400667/10154199479775668/?type=3,2016-11-15 18:44:04,,667,1,29,0,0,0,0,0,0
14482400667_10154199450670668,Katie Austin shares the multitasking workout moves you need to know.,Katie Austin's 6 Exercises to Get Fit in No Time,link,http://trib.al/O7rqVv6,2016-11-15 18:28:07,,219,3,17,0,0,0,0,0,0
14482400667_10154199435750668,Because strapless bra shopping is HARD.,The Best Strapless Bras You Can Buy on Amazon,link,http://trib.al/vLeFstt,2016-11-15 18:18:10,,178,3,7,0,0,0,0,0,0
14482400667_10154199373000668,Cheers! 🍷,The Truth About What Alcohol Does to Your Heart,link,http://trib.al/VnqYBlA,2016-11-15 17:38:05,,362,16,46,0,0,0,0,0,0
14482400667_10154199257660668,It's all about the water.,The Tea Temperature Trick That Will Give You a Perfect Cup Every Time,link,http://trib.al/GOpPz3I,2016-11-15 16:46:08,,213,6,15,0,0,0,0,0,0
14482400667_10154199214770668,Make a whole week's worth of breakfasts with a single muffin tray!,Health,video,https://www.facebook.com/Health/videos/10153511826625668/,2016-11-15 16:29:42,,1242,40,1,0,0,0,0,0,0
14482400667_10154199102235668,Your phone reveals way more than you realize.,Your Phone Is Covered in Molecules That Reveal Personal Lifestyle Secrets,link,http://trib.al/jmDNpYA,2016-11-15 15:38:05,,188,4,6,0,0,0,0,0,0
14482400667_10154198880165668,Use avocado instead of mayo in chicken salad!😱,Health,video,https://www.facebook.com/Health/videos/10154001519960668/,2016-11-15 13:56:35,,5475,147,3,0,0,0,0,0,0
14482400667_10154198740890668,"Meet Jessamyn Stanley, the woman changing the face of yoga.",How Instagram Star Jessamyn Stanley Is Defying Yoga Stereotypes,link,http://trib.al/r1pN1EQ,2016-11-15 12:36:05,,175,3,8,0,0,0,0,0,0
14482400667_10154198656125668,These pumpkin waffles are our new favorite way to enjoy breakfast.,How to Make Pumpkin Waffles with Maple-Walnut Syrup,video,http://trib.al/Imsx1hZ,2016-11-15 11:47:01,,169,1,13,0,0,0,0,0,0
14482400667_10154198651735668,"Trust us, you won't miss the box mix.",Health,video,https://www.facebook.com/Health/videos/10153620724845668/,2016-11-15 11:44:19,,1417,22,0,0,0,0,0,0,0
14482400667_10154198638695668,"Dwayne The Rock Johnson is People's Sexiest Man Alive this year, and it's no surprise why when you see these pictures.",12 Times The Rock's Instagram Inspired Us to Be Better People,link,http://trib.al/q5Cutvo,2016-11-15 11:36:07,,773,10,23,0,0,0,0,0,0
14482400667_10154198516255668,We're doing a martial arts-inspired workout with Phoenix Carnevale from Daily Burn and Everlast. Join us!,,video,https://www.facebook.com/Health/videos/10154198516255668/,2016-11-15 10:31:40,22:34,2299,173,402,0,0,0,0,0,0
14482400667_10154198506865668,This simple sweet potato pudding is an easy Thanksgiving dessert!,Health,video,https://www.facebook.com/Health/videos/10154112699815668/,2016-11-15 10:19:31,,1477,27,2,0,0,0,0,0,0
14482400667_10154198505205668,The flowers in this tea set literally bloom when you pour hot water on them! 😱,10 Must-Have Gifts for Tea Lovers,link,http://trib.al/gjmAOgm,2016-11-15 10:18:02,,138,0,13,0,0,0,0,0,0
14482400667_10154198425090668,Pin of the day: Try this instant metabolism-boosting workout,Instant Metabolism-Boosting Workout,link,http://trib.al/MMUj3Xz,2016-11-15 09:35:18,,239,8,16,0,0,0,0,0,0
14482400667_10154198356225668,Moisturizer: You're doing it wrong.,Watch: This Is the Correct Way to Moisturize Your Face,link,http://trib.al/JA1FexH,2016-11-15 08:56:06,,440,4,36,0,0,0,0,0,0
14482400667_10154198201745668,The answer is always coffee.,"Instagram photo by Health • Nov 9, 2016 at 2:10pm UTC",link,http://trib.al/XMQMhVi,2016-11-15 07:40:10,,1088,21,133,0,0,0,0,0,0
14482400667_10154198130130668,Master these moves one step at a time.,"5 ""Hard"" Yoga Poses Made Easy",link,http://trib.al/eZIVHiu,2016-11-15 06:46:05,,1560,5,100,0,0,0,0,0,0
14482400667_10154198051630668,"If you're not making these easy meals in your NutriBullet, you're missing out.",3 NutriBullet Recipes That Aren't Smoothies,link,http://trib.al/jnIMBYd,2016-11-15 05:40:06,,447,7,19,0,0,0,0,0,0
14482400667_10154197935820668,So THIS is why canker sores seem to come out of nowhere:,How to Get Rid of Canker Sores and Prevent Them From Ever Coming Back,link,http://trib.al/MYB1V6v,2016-11-15 03:49:06,,237,14,11,0,0,0,0,0,0
14482400667_10154197880670668,The condition can be life-threatening.,The Pregnancy Risk That Has Kim Kardashian Considering a Surrogate,link,http://trib.al/mrG4GMB,2016-11-15 02:39:05,,319,23,9,0,0,0,0,0,0
14482400667_10154197824855668,#1: Exercise.,12 Nondrug Remedies for Depression,link,http://trib.al/ZhPvJkb,2016-11-15 01:37:09,,632,12,144,0,0,0,0,0,0
14482400667_10154197736150668,Choose your pain relievers wisely.,Ibuprofen May Not Be As Safe As You Think,link,http://trib.al/xRFkAus,2016-11-15 00:46:05,,711,20,260,0,0,0,0,0,0
14482400667_10154197660410668,"""I love my life and I'm so grateful I decided to make those changes several years ago and committed to my healthy lifestyle.""","Fitness Star Emily Skye Feels 'Happier, Healthier, Stronger and Fitter' After Gaining 28 Lbs.",link,http://trib.al/BTcqKEX,2016-11-15 00:17:08,,1085,14,36,0,0,0,0,0,0
14482400667_10154197630500668,Getting more sleep is good for SO many things!,11 Surprising Health Benefits of Sleep,link,http://trib.al/pO7RjK2,2016-11-14 23:49:06,,351,7,61,0,0,0,0,0,0
14482400667_10154197614510668,Switching birth control pills may make you more susceptible to yeast infections.,6 Things About Yeast Infections Every Woman Should Know,link,http://trib.al/Ylq9G2I,2016-11-14 23:31:12,,258,3,21,0,0,0,0,0,0
14482400667_10154197600675668,Stop that pain in your back.,18 Sciatica Treatments That Really Work,link,http://trib.al/hDoiRQ6,2016-11-14 23:16:11,,1382,21,189,0,0,0,0,0,0
14482400667_10154197565580668,Consider this kale cooking for beginners.,The Best Way to Cook Kale,link,http://trib.al/bwOG30y,2016-11-14 22:43:08,,352,1,35,0,0,0,0,0,0
14482400667_10154197547170668,Protect yourself from these complexion killers!,8 Sneaky Things That Make You Look Older Than You Are,link,http://trib.al/n6zT5VH,2016-11-14 22:27:08,,468,8,64,0,0,0,0,0,0
14482400667_10154197531620668,Experts reveal the biggest diabetes myths and set the record straight. #WorldDiabetesDay,14 Biggest Myths About Type 2 Diabetes,link,http://trib.al/dOaA2KJ,2016-11-14 22:15:14,,549,6,41,0,0,0,0,0,0
14482400667_10154197492865668,How adorable are these tea infusers?,10 Must-Have Gifts for Tea Lovers,link,http://trib.al/a17VqlK,2016-11-14 21:47:06,,432,8,17,0,0,0,0,0,0
14482400667_10154197471045668,Is this the easiest beauty hack ever?,"You Can Style Your Brows with a Bar of Soap, Apparently",link,http://trib.al/MrMbfze,2016-11-14 21:32:05,,914,7,35,0,0,0,0,0,0
14482400667_10154197450140668,Get the support your bigger bust needs with these standout sports bras.,5 Plus-Size Sports Bras for $50 or Less,link,http://trib.al/pAOpmZC,2016-11-14 21:17:08,,143,4,4,0,0,0,0,0,0
14482400667_10154195326315668,"Pumpkin waffles with maple-walnut syrup will become your breakfast go-to!

Get the recipe: http://trib.al/Wreq21M",Recipe: Pumpkin Waffles,video,https://www.facebook.com/Health/videos/10154195326315668/,2016-11-14 21:03:00,00:57,1010,43,681,0,0,0,0,0,0
14482400667_10154197413975668,"See 5 moves for sculpted, sexy legs from Tracy Anderson Method: http://trib.al/CZfqOhU",Timeline Photos,photo,https://www.facebook.com/Health/photos/a.10150092140635668.283454.14482400667/10154197413975668/?type=3,2016-11-14 20:44:03,,1781,6,110,0,0,0,0,0,0
14482400667_10154197399765668,You might want to take a look.,10 Things Your Nails Can Tell You About Your Health,link,http://trib.al/iXvJG2W,2016-11-14 20:32:06,,527,3,33,0,0,0,0,0,0
14482400667_10154197380575668,"These ""fries"" are crunchy on the outside and creamy on the inside!",How to Make Crunchy Avocado Fries,link,http://trib.al/tFlrCY0,2016-11-14 20:17:09,,922,10,63,0,0,0,0,0,0
14482400667_10154197346340668,Everyone will be asking for seconds.,The Easiest Way to Make Thanksgiving Gravy,link,http://trib.al/j6rVZzt,2016-11-14 19:47:09,,226,5,43,0,0,0,0,0,0
14482400667_10154196840970668,This is so smart! (via Cooking Light),How to Make Breakfast for Tomorrow While Making Dinner Tonight,link,http://pubx.co/XpiNxm,2016-11-14 19:42:00,,364,4,20,0,0,0,0,0,0
14482400667_10154197327035668,The healthy eating tricks you should know. #WorldDiabetesDay,Eat These Foods and Fight Diabetes,link,http://trib.al/oPrvhrx,2016-11-14 19:33:08,,743,10,75,0,0,0,0,0,0
14482400667_10154197304765668,"In the trailer alone, we see the Gilmore Girls eating Pop-Tarts, Tater Tots, mini powdered donuts, tacos (to be fair, they were organic), and hot dogs, as well as Chinese, Greek, and Italian takeout in one sitting.",What Would Actually Happen to Your Body If You Ate Like a Gilmore Girl,link,http://trib.al/YxMEjhz,2016-11-14 19:16:08,,255,39,15,0,0,0,0,0,0
14482400667_10154197266375668,Is there anything better than a pumpkin spice latte?,Health,video,https://www.facebook.com/Health/videos/10153614935685668/,2016-11-14 18:47:08,,308,21,0,0,0,0,0,0,0
14482400667_10154197261345668,This four-ingredient dessert comes together quickly and then sets in your freezer overnight! http://trib.al/dwlLRvo,Timeline Photos,photo,https://www.facebook.com/Health/photos/a.10150092140635668.283454.14482400667/10154197261345668/?type=3,2016-11-14 18:43:08,,1172,11,113,0,0,0,0,0,0
14482400667_10154197143355668,We can totally relate.,Amy Schumer Posted About Loving Your Body and It Is Perfection,link,http://trib.al/bH96WkL,2016-11-14 17:35:06,,198,21,3,0,0,0,0,0,0
14482400667_10154197128865668,"This green juice is packed with antioxidants and iron that help keep your muscles healthy and strong!

Get the recipe: http://trib.al/in752zm",Health,video,https://www.facebook.com/Health/videos/10153720122750668/,2016-11-14 17:26:45,,2391,73,2,0,0,0,0,0,0
14482400667_10154197098985668,The secret to a messy hairstyle is all in the prep work.,How to Style a Textured Bob Like a Celeb,link,http://trib.al/7pghs4w,2016-11-14 17:13:09,,189,1,13,0,0,0,0,0,0
14482400667_10154197028350668,These Trader Joe's finds make breakfast extra special.,The Top 5 Trader Joe's Novelty Breakfast Foods,link,http://trib.al/dwrIElc,2016-11-14 16:46:08,,240,8,13,0,0,0,0,0,0
14482400667_10154196854705668,You don't need the treadmill or elliptical machine to get an effective cardio workout.,A 10-Minute Cardio Workout You Can Do At the Office,link,http://trib.al/2EI3uYS,2016-11-14 15:37:09,,420,6,60,0,0,0,0,0,0
14482400667_10154196854670668,"Craving fries, but don't want the bloat? Give these oven roasted sweet potato chips a try! 

Get the recipe: http://trib.al/CwjNAIX",Health,video,https://www.facebook.com/Health/videos/10153620951115668/,2016-11-14 15:37:05,,3222,75,1,0,0,0,0,0,0
14482400667_10154195734815668,Easiest #MeatlessMonday meal EVER.,Health,video,https://www.facebook.com/Health/videos/10153935947060668/,2016-11-14 13:20:50,,1996,52,1,0,0,0,0,0,0
14482400667_10154195707340668,This is HUGE.,Heart Disease Is Way Down In the U.S.,link,http://trib.al/BiXPW0h,2016-11-14 13:05:26,,206,5,17,0,0,0,0,0,0
14482400667_10154195395735668,This workout could help improve your mood! http://trib.al/8QqGQ7A,Timeline Photos,photo,https://www.facebook.com/Health/photos/a.10150092140635668.283454.14482400667/10154195395735668/?type=3,2016-11-14 11:41:11,,2123,9,119,0,0,0,0,0,0
14482400667_10154195350855668,These paleo coconut pancakes are packed with protein to keep you feeling fuller longer!,Health,video,https://www.facebook.com/Health/videos/10154094387905668/,2016-11-14 11:11:07,,1357,57,0,0,0,0,0,0,0
