status_id,status_message,link_name,status_type,status_link,status_published,status_video_length,num_reactions,num_comments,num_shares,num_likes,num_loves,num_wows,num_hahas,num_sads,num_angrys
18468761129_10152906217551130,Here's the truth about these popular diet trends.,4 Health Lies You Need To STOP Believing,link,http://pubx.ch/1AVNYq3,2015-03-09 10:00:02,,2369,137,902,2369,0,0,0,0,0
18468761129_10152906341081130,Today's the day!,How To Talk About The Apple Watch,link,http://www.huffingtonpost.com/2015/03/08/apple-watch-tips_n_6826984.html?ncid=fcbklnkushpmg00000063,2015-03-09 09:41:09,,382,40,81,382,0,0,0,0,0
18468761129_10152906325966130,"""Every woman should see it. The government should revoke the ban immediately."" (via HuffPost India)",Agra Village Screens Banned Documentary On Delhi Gang Rape,link,http://www.huffingtonpost.in/2015/03/09/indias-daughter_n_6829110.html?ncid=fcbklnkushpmg00000063,2015-03-09 09:30:45,,622,32,82,622,0,0,0,0,0
18468761129_10152906310536130,"""When I turned around and saw Dean standing in front of me, we both broke down in tears.""",This Man Proposed To His Girlfriend Every Single Day For A Year,link,http://www.huffingtonpost.com/2015/03/08/365-day-proposal-video_n_6818552.html?ncid=fcbklnkushpmg00000063,2015-03-09 09:21:07,,7709,378,779,7709,0,0,0,0,0
18468761129_10152906141866130,I'm not worried about my baggage; I'm worried about yours.,"It's Not That I Can't Find A Man To Love Me, I Can't Find A Man I Love",link,http://pubx.ch/1AVENpy,2015-03-09 09:00:02,,19638,1244,5322,19638,0,0,0,0,0
18468761129_10152906234071130,We know the feeling.,Why Am I So Tired All The Time?,link,http://www.huffingtonpost.com/sharon-greenthal/tired-all-the-time_b_6765074.html?ncid=fcbklnkushpmg00000063,2015-03-09 08:41:09,,1724,115,553,1724,0,0,0,0,0
18468761129_10152906129826130,It's said that Benjamin Franklin first proposed a version of Daylight Saving Time as a way to save candles.,It's Time to Kill Daylight Saving Time,link,http://pubx.ch/1GxBJYW,2015-03-09 08:20:00,,16748,954,5687,16748,0,0,0,0,0
18468761129_10152906156736130,This is disgusting.,Oklahoma Frat Boys Caught Singing 'There Will Never Be A Ni**** In SAE',link,http://www.huffingtonpost.com/2015/03/08/frat-racist-sae-oklahoma_n_6828212.html?ncid=fcbklnkushpmg00000063,2015-03-09 08:00:14,,4110,2142,3136,4110,0,0,0,0,0
18468761129_10152906112041130,"""As much progress as we've made as a country, we absolutely still have more work to do.""","Giant X-Ray Screen Erases Gender, Age, Race To Prove 'We Are All Human'",link,http://www.huffingtonpost.com/2015/03/04/psa-love-has-no-labels-skeletons_n_6801038.html?ncid=fcbklnkushpmg00000063,2015-03-09 07:30:16,,3790,87,540,3790,0,0,0,0,0
18468761129_10152906003141130,5. Automatically see swaps that will save you money.,6 Google Flights Tricks That Beat Any Travel Agent,link,http://www.huffingtonpost.com/2015/03/05/google-flights-ticks-better-travel-agent_n_6783692.html?ncid=fcbklnkushpmg00000063,2015-03-09 06:30:12,,4485,288,4400,4485,0,0,0,0,0
18468761129_10152905937601130,These are awesome.,10 Funny Doormats That Completely Spoke Our Minds,link,http://www.huffingtonpost.com/2015/03/04/funny-doormats_n_2599345.html?ncid=fcbklnkushpmg00000063,2015-03-09 05:30:13,,3618,172,601,3618,0,0,0,0,0
18468761129_10152905875141130,"""He was very, very open and had made many friends.""",A Homeless Man Was Buried At A Vatican Cemetery Usually Reserved For Aristocrats,link,http://www.huffingtonpost.com/2015/02/27/vatican-homeless-man-funeral_n_6770680.html?ncid=fcbklnkushpmg00000063,2015-03-09 04:30:16,,1839,38,166,1839,0,0,0,0,0
18468761129_10152905824766130,They lie to you -- a lot.,6 Signs It May Be Time to Break Up With Your Friend,link,http://www.huffingtonpost.com/jennifer-twardowski/6-signs-it-may-be-time-to-break-up-with-your-friend_b_6503518.html?ncid=fcbklnkushpmg00000063,2015-03-09 03:30:12,,2070,119,586,2070,0,0,0,0,0
18468761129_10152905661666130,"Family and having a job are ""the two most important things I can think of.""",Granddad Walks 35 Miles To Work To Support Sick Wife And Grandson,link,http://www.huffingtonpost.com/2015/03/02/man-walks-35-miles-work-steve-simoff_n_6783726.html?ncid=fcbklnkushpmg00000063,2015-03-09 02:30:10,,3888,159,445,3888,0,0,0,0,0
18468761129_10152905605271130,"Nice try, dude.",Cops Find Weed In Sour Cream Container Marked 'Not Weed',link,http://www.huffingtonpost.com/2015/03/02/container-not-weed_n_6785016.html?ncid=fcbklnkushpmg00000063,2015-03-09 01:30:16,,2256,169,277,2256,0,0,0,0,0
18468761129_10152905545566130,There are some truly standout yoga YouTube channels you should look into.,9 Great Yoga YouTube Channels,link,http://www.huffingtonpost.com/kayla-matthews/9-great-yoga-youtube-channels_b_6737360.html?ncid=fcbklnkushpmg00000063,2015-03-09 00:30:13,,4818,257,4373,4818,0,0,0,0,0
18468761129_10152905473106130,"""As it turns out, not wanting kids will absolutely not make me 'less' of a woman.""",I Don't Want Children -- Ever,link,http://www.huffingtonpost.com/jessica-burnell/on-wanting-to-die-old-and-childless_b_6742664.html?ncid=fcbklnkushpmg00000063,2015-03-08 23:30:12,,9182,972,1035,9182,0,0,0,0,0
18468761129_10152905381121130,"Don't forget, everything in moderation.",3 To 5 Cups Of Coffee A Day May Lower Heart Attack Risk,link,http://www.huffingtonpost.com/2015/03/03/coffee-heart-attack-risk_n_6790776.html?ncid=fcbklnkushpmg00000063,2015-03-08 22:30:15,,2536,159,653,2536,0,0,0,0,0
18468761129_10152905339426130,Chicken hasn't looked this good in a loooong time.,32 Slow Cooker Chicken Recipes That'll Feed You For Days,link,http://www.huffingtonpost.com/2015/02/25/slow-cooker-chicken-recipes_n_6743988.html?ncid=fcbklnkushpmg00000063,2015-03-08 22:00:09,,3092,168,3047,3092,0,0,0,0,0
18468761129_10152905293421130,"""In one of the scrapbooks Flick and my other first friends made me, I wrote a note in the back page to myself: 'These are the best friends ever, you are too lucky to have them. Never take them for granted Always treat them with respect Love them for what they are -- themselves.'""",I Was The Maid Of Honor For The Girl I Bullied Mercilessly For Years,link,http://www.huffingtonpost.com/xojane-/i-was-the-maid-of-honor-for-the-girl-i-bullied-for-years_b_6732726.html?ncid=fcbklnkushpmg00000063,2015-03-08 21:30:14,,1161,27,112,1161,0,0,0,0,0
18468761129_10152905139501130,We need to go ASAP.,Book The Batcave Hotel Room For A Good 'Knight's' Sleep,link,http://www.huffingtonpost.com/2015/03/02/batman-hotel_n_4309715.html?ncid=fcbklnkushpmg00000063,2015-03-08 21:00:41,,5577,1266,3919,5577,0,0,0,0,0
18468761129_10152905094191130,"Yes, these places actually exist.",10 Of The Most Colorful Places On Earth,link,http://www.huffingtonpost.com/purewow/10-of-the-most-colorful-p_b_6746178.html?ncid=fcbklnkushpmg00000063,2015-03-08 20:30:27,,10548,149,2974,10548,0,0,0,0,0
18468761129_10152905048276130,Incredible.,Captivating Photos Give A Glimpse Into The Lives Of Military Personnel,link,http://www.huffingtonpost.com/2015/02/28/active-military-photos_n_6775428.html?ncid=fcbklnkushpmg00000063,2015-03-08 20:00:12,,3870,74,373,3870,0,0,0,0,0
18468761129_10152904995261130,"Meow, if only they had bingo.","A Retirement Home Exists For Aging Cats, And It Looks Purrfectly Cozy",link,http://www.huffingtonpost.com/2015/03/05/lincolnshire-trust-for-cats_n_6810360.html?ncid=fcbklnkushpmg00000063,2015-03-08 19:30:14,,6015,272,1286,6015,0,0,0,0,0
18468761129_10152904935271130,"My, what a sexy... lower spine you have!",Science Explains Why Men Like Women With Curvy Booties,link,http://www.huffingtonpost.com/2015/03/05/why-men-like-butts-science_n_6800172.html?ncid=fcbklnkushpmg00000063,2015-03-08 19:00:08,,1104,137,277,1104,0,0,0,0,0
18468761129_10152904881621130,"Well, this is awesome.","Honest Wine Labels Describe Which Drinks Pair Best With Divorce Papers, And Other Situations",link,http://www.huffingtonpost.com/2015/03/05/honest-wine-labels-drinks-pair-best-divorce-situations_n_6810434.html?ncid=fcbklnkushpmg00000063,2015-03-08 18:30:16,,4909,135,1337,4909,0,0,0,0,0
18468761129_10152904824646130,"""They have nothing to do with faith and everything to do with fanaticism.""",Queen Rania: Let's Drop The First 'I' In ISIS. There's Nothing Islamic About Them,link,http://www.huffingtonpost.com/2015/03/06/queen-rania-isis-islamic_n_6781160.html?ncid=fcbklnkushpmg00000063,2015-03-08 18:00:08,,6174,194,1113,6174,0,0,0,0,0
18468761129_10152904758456130,"""I just cannot take another shower today.""",6 Excuses Your Fitness Instructor Is Tired Of Hearing,link,http://www.huffingtonpost.com/2015/03/07/fitness-excuses_n_6771680.html?ncid=fcbklnkushpmg00000063,2015-03-08 17:30:14,,452,46,97,452,0,0,0,0,0
18468761129_10152904700796130,The film went viral in China... then disappeared.,Viral Anti-Pollution Film Disappears From China's Web,link,http://www.huffingtonpost.com/2015/03/07/under-the-dome-removed_n_6821940.html?ncid=fcbklnkushpmg00000063,2015-03-08 17:00:08,,591,48,144,591,0,0,0,0,0
18468761129_10152904636801130,"Apple's selling, but who's buying?",Apple Watch Faces Major Challenge In Fashion Industry,link,http://www.huffingtonpost.com/2015/03/08/apple-watch-fashion_n_6825782.html?ncid=fcbklnkushpmg00000063,2015-03-08 16:30:21,,399,92,53,399,0,0,0,0,0
18468761129_10152904575446130,"A fisherman found the car upside-down, and rescue workers performed a miracle.",Toddler Rescued From Car 14 Hours After Plunge Into Utah River,link,http://www.huffingtonpost.com/2015/03/08/toddler-rescued-from-car-after-utah-river-plunge_n_6826190.html?ncid=fcbklnkushpmg00000063,2015-03-08 16:00:09,,2321,64,277,2321,0,0,0,0,0
18468761129_10152904514031130,"""If being gay is a choice, prove it. Choose it. Choose to be gay yourself.""",Dan Savage To Ben Carson: 'Suck My D**k' To Prove Being Gay Is A Choice,link,http://www.huffingtonpost.com/2015/03/08/dan-savage-ben-carson_n_6825848.html?ncid=fcbklnkushpmg00000063,2015-03-08 15:30:17,,12571,1007,2119,12571,0,0,0,0,0
18468761129_10152904456696130,Apparently she's just been binging on House of Cards.,'SNL' Jokes Hillary Clinton's Private Emails Were Just 'Fun Woman Talk',link,http://www.huffingtonpost.com/2015/03/08/hillary-clinton-email-snl_n_6826258.html?ncid=fcbklnkushpmg00000063,2015-03-08 15:00:50,,685,45,72,685,0,0,0,0,0
18468761129_10152904403541130,"Bald is beautiful, right?","GQ Editor: Men, It's Okay To Go Bald",link,http://www.huffingtonpost.com/2015/03/06/embrase-baldness-john-wilde_n_6817850.html?ncid=fcbklnkushpmg00000063,2015-03-08 14:30:18,,5283,582,903,5283,0,0,0,0,0
18468761129_10152904347616130,This total solar eclipse may do more than just darken Europe's skies.,Upcoming Eclipse Sparks Worries In Europe,link,http://www.huffingtonpost.com/2015/03/07/solar-eclipse-2015-europe_n_6792732.html?ncid=fcbklnkushpmg00000063,2015-03-08 14:00:45,,2486,156,1359,2486,0,0,0,0,0
18468761129_10152904286541130,The new M.I.A. song sounds so M.I.A.,Listen To M.I.A.'s New Very M.I.A. Song,link,http://www.huffingtonpost.com/2015/03/07/mia-new-song_n_6823928.html?ncid=fcbklnkushpmg00000063,2015-03-08 13:30:10,,439,52,58,439,0,0,0,0,0
18468761129_10152904219026130,Talk about kingdom of isolation.,There Probably Won't Be A Proper Sequel To 'Frozen' For Some Time,link,http://www.huffingtonpost.com/2015/03/07/frozen-fever-sequel_n_6820700.html?ncid=fcbklnkushpmg00000063,2015-03-08 13:00:41,,586,92,69,586,0,0,0,0,0
18468761129_10152904115236130,It's about time we had a woman on a bill.,Here Are 7 Redesigns Of The $20 Bill That Honor Women,link,http://www.huffingtonpost.com/2015/03/07/women-on-20s_n_6816928.html?ncid=fcbklnkushpmg00000063,2015-03-08 12:30:24,,33662,1885,6446,33662,0,0,0,0,0
18468761129_10152904049751130,"""So, to the men out there who want to reassure me that they like curves, thank you for your concern, but I don't need your approval.""","Dear Men, Stop Telling Me 'Real Women Have Curves'",link,http://www.huffingtonpost.com/bustle/dear-men-my-eating-disorder-was-never-about-you-so-stop-telling-me-real-women-have-curves_b_6784248.html?ncid=fcbklnkushpmg00000063,2015-03-08 12:00:51,,5699,995,615,5699,0,0,0,0,0
18468761129_10152903958001130,Simply breathtaking.,"Yup, We Can't Believe These Were Taken On An iPhone Either",link,http://www.huffingtonpost.com/2015/03/06/iphone-photo_n_6810366.html?ncid=fcbklnkushpmg00000063,2015-03-08 11:30:30,,2047,65,372,2047,0,0,0,0,0
18468761129_10152903885871130,Heh.,Young Adam Levine Sported A Very Silly Goatee,link,http://www.huffingtonpost.com/2015/03/07/young-adam-levine-goatee_n_6823004.html?ncid=fcbklnkushpmg00000063,2015-03-08 11:00:11,,814,103,66,814,0,0,0,0,0
18468761129_10152903812491130,We can't stop looking at these photos.,Abandoned Homes Are Surprisingly Full Of Life (Or Remnants Of It),link,http://www.huffingtonpost.com/2015/03/06/abandoned-homes-photos_n_6801514.html?ncid=fcbklnkushpmg00000063,2015-03-08 10:30:25,,11271,321,3211,11271,0,0,0,0,0
18468761129_10152901883981130,It's International Women's Day and to celebrate HuffPost Women is taking over our Instagram.  Follow along at https://www.instagram.com/huffingtonpost,Timeline Photos,photo,https://www.facebook.com/HuffingtonPost/photos/a.443444786129.234228.18468761129/10152901883981130/?type=3,2015-03-08 10:00:03,,143550,910,32689,143550,0,0,0,0,0
18468761129_10152903675816130,"Accio, dreams come true.",The 'Harry Potter' Cast Had The Most Magical Reunion Ever,link,http://www.huffingtonpost.com/2015/03/07/harry-potter-reunion_n_6823666.html?ncid=fcbklnkushpmg00000063,2015-03-08 09:30:21,,12699,278,729,12699,0,0,0,0,0
18468761129_10152903563911130,Is it actually different from regular green tea?,"What's The Deal With Matcha, Anyway?",link,http://www.huffingtonpost.com/2015/03/04/matcha-what-is-matcha-latte-info_n_6803446.html?ncid=fcbklnkushpmg00000063,2015-03-08 08:30:20,,720,55,278,720,0,0,0,0,0
18468761129_10152903512161130,"""Over the course of a decade, Syracuse University did not control and monitor its athletics programs, and its head men's basketball coach failed to monitor his program.""",NCAA Comes Down Hard On Syracuse After Investigating Violations,link,http://www.huffingtonpost.com/2015/03/06/ncaa-syracuse-jim-boeheim-investigation-suspension_n_6817444.html?ncid=fcbklnkushpmg00000063,2015-03-08 08:00:38,,204,20,33,204,0,0,0,0,0
18468761129_10152903456696130,Well this seems fair.,"Instagram Ads Get Cool Interactive Feature, But Regular Users Don't",link,http://www.huffingtonpost.com/2015/03/05/instagram-carousel-ads_n_6808918.html?ncid=fcbklnkushpmg00000063,2015-03-08 07:30:15,,103,2,12,103,0,0,0,0,0
18468761129_10152903282701130,"""They say two become one and that really has happened.""",The Beautiful Way A Couple Married 56 Years Describe Love Without Using The Word 'Love',link,http://www.huffingtonpost.com/2015/03/05/hallmark-put-your-heart-to-paper_n_6810104.html?ncid=fcbklnkushpmg00000063,2015-03-08 06:30:14,,3139,89,616,3139,0,0,0,0,0
18468761129_10152903202466130,Love stories can be so creepy and so romantic at the same time.,Love Stories Are A Lot More Romantic When Old People Tell Them,link,http://www.huffingtonpost.com/2015/03/05/love-stories-old-vs-young-people_n_6810120.html?ncid=fcbklnkushpmg00000063,2015-03-08 05:30:12,,1307,13,145,1307,0,0,0,0,0
18468761129_10152903111116130,"""If you're going to make it last, you need time on your own. Marital bliss is possible if each partner is blissful without the other.""",11 Be-All-End-All Marriage Mistakes That Lead To Divorce,link,http://www.huffingtonpost.com/2015/03/05/marriage-mistakes-that-lead-to-divorce_n_6795674.html?ncid=fcbklnkushpmg00000063,2015-03-08 04:30:15,,6985,225,2883,6985,0,0,0,0,0
18468761129_10152903035441130,Trippy.,What Sunset Would Look Like If The Sun Were Swapped With Other Stars,link,http://www.huffingtonpost.com/2015/03/05/sun-replaced-stars-sunset_n_6802754.html?ncid=fcbklnkushpmg00000063,2015-03-08 03:30:10,,1390,36,251,1390,0,0,0,0,0
18468761129_10152902966321130,"""Alligator Sperm"" just sound like a bad idea from the start.","The Most Disgusting Cocktails Ever, In Photos",link,http://www.huffingtonpost.com/liquorcom/the-most-disgusting-cockt_b_6802086.html?ncid=fcbklnkushpmg00000063,2015-03-08 02:30:09,,564,127,401,564,0,0,0,0,0
18468761129_10152902888166130,This is incredible and terrifying at the same time.,It Wasn't Ammunition That Did This. It Was A Laser,link,http://www.huffingtonpost.com/2015/03/06/laser-weapon-system-lockheed-martin-disables-truck_n_6813956.html?ncid=fcbklnkushpmg00000063,2015-03-08 01:30:16,,1863,200,727,1863,0,0,0,0,0
18468761129_10152902849166130,It pays... $60K-a-year.,Need A Job? What About A Fabulous Career In Chick Sexing?,link,http://www.huffingtonpost.com/2015/03/07/chicken-sexing_n_6822324.html?ncid=fcbklnkushpmg00000063,2015-03-08 01:00:27,,2164,514,1101,2164,0,0,0,0,0
18468761129_10152902806761130,"""The accuracy is phenomenal. Because almost every time when it's nice weather and they launch five or six of these at a time, they almost invariably hit the front door.""",NIGHTMARE: Elderly Man's Home Egged For A Year,link,http://www.huffingtonpost.com/2015/03/06/home-egged-every-day-albert-clemens_n_6814876.html?ncid=fcbklnkushpmg00000063,2015-03-08 00:30:11,,1159,754,824,1159,0,0,0,0,0
18468761129_10152902708936130,"Archaeologists say they may have stumbled on the long-lost ""City of the Monkey God.""",Ancient Lost City Discovered In Honduras Rainforest,link,http://www.huffingtonpost.com/2015/03/03/lost-city-honduras-ciudad-blanca_n_6797194.html?ncid=fcbklnkushpmg00000063,2015-03-07 23:30:13,,7331,137,1408,7331,0,0,0,0,0
18468761129_10152902648211130,"Well, sh*t.",It's Even Snowing In Hawaii,link,http://www.huffingtonpost.com/2015/03/05/mauna-kea-snow_n_6809040.html?ncid=fcbklnkushpmg00000063,2015-03-07 23:00:08,,5602,298,2407,5602,0,0,0,0,0
18468761129_10152902612211130,Replace your late night ice cream for popcorn.,6 Food Swaps For Better Sleep,link,http://www.huffingtonpost.com/self/6-food-swaps-to-make-for-better-sleep_b_6746912.html?ncid=fcbklnkushpmg00000063,2015-03-07 22:40:09,,1224,50,549,1224,0,0,0,0,0
18468761129_10152902577906130,"You've heard of bitcoin, but what exactly is BitchCoin?",BitchCoin: The Artist-Made Currency That Just May Change How We Invest In Art,link,http://www.huffingtonpost.com/2015/03/06/bitchcoin-sarah-meyohas_n_6812432.html?ncid=fcbklnkushpmg00000063,2015-03-07 22:20:09,,207,22,43,207,0,0,0,0,0
18468761129_10152902537876130,"""It kept my brain clean.""",Ex-NFL Player: I Smoked Pot To Avoid Prescription Drug Addiction,link,http://www.huffingtonpost.com/2015/03/05/nate-jackson-marijuana_n_6807842.html?ncid=fcbklnkushpmg00000063,2015-03-07 22:00:30,,6578,182,813,6578,0,0,0,0,0
18468761129_10152902483501130,WHAT IS HAPPENING?!,Divers Meet Totally Trippy 'Unicorn Of The Sea',link,http://www.huffingtonpost.com/2015/03/05/pyrosome-philippines-video_n_6805644.html?ncid=fcbklnkushpmg00000063,2015-03-07 21:30:21,,5335,203,1883,5335,0,0,0,0,0
18468761129_10152902432091130,Silver is the new black.,6 Reasons Gray Hair Is White Hot Again,link,http://www.huffingtonpost.com/2015/03/04/gray-hair-hot-reasons_n_6745104.html?ncid=fcbklnkushpmg00000063,2015-03-07 21:00:09,,5494,449,2643,5494,0,0,0,0,0
18468761129_10152902357601130,Hold hands. Always.,5 Things Long-Lasting Couples Do Differently,link,http://www.huffingtonpost.com/2015/03/06/what-long-lasting-couples-do-differently_n_6808436.html?ncid=fcbklnkushpmg00000063,2015-03-07 20:30:13,,9974,573,3200,9974,0,0,0,0,0
18468761129_10152902299321130,"""We are raised to believe that when we are one half of a couple, we should derive all our happiness and pleasure from that single partner and only experience it together with that partner.""",This Polyamorous Principle Could Strengthen Your Marriage,link,http://www.huffingtonpost.com/gracie-x/compersion-a-polyamorous-principle-that-can-strengthen-any-relationship_b_6803868.html?ncid=fcbklnkushpmg00000063,2015-03-07 20:00:15,,2866,930,1057,2866,0,0,0,0,0
18468761129_10152902262846130,"This too, shall pass.",This Age May Just Be The Most Expensive Year Of Your Life,link,http://www.huffingtonpost.com/2015/03/06/50-most-expensive-age-_n_6816974.html?ncid=fcbklnkushpmg00000063,2015-03-07 19:40:08,,391,36,94,391,0,0,0,0,0
18468761129_10152902193146130,Aww!!,"This Dog Was Rescued From A Sewer Tunnel. Within Hours, He Was Transformed",link,http://www.huffingtonpost.com/2015/03/06/dog-rescued-sewer-tunnel-hope-for-paws_n_6814200.html?ncid=fcbklnkushpmg00000063,2015-03-07 19:00:08,,1059,24,117,1059,0,0,0,0,0
18468761129_10152902153376130,How far have we really come? #Selma50,Selma Anniversary: This Is How Much Black Life Has Really Changed In 50 Years,link,http://www.huffingtonpost.com/2015/03/07/progress-selma-march_n_6822608.html?ncid=fcbklnkushpmg00000063,2015-03-07 18:40:08,,4249,196,735,4249,0,0,0,0,0
18468761129_10152902071966130,"#Selma50

Photo: Bill Clark via Getty Images",Timeline Photos,photo,https://www.facebook.com/HuffingtonPost/photos/a.443444786129.234228.18468761129/10152902071966130/?type=3,2015-03-07 18:20:00,,7931,49,948,7931,0,0,0,0,0
18468761129_10152902016341130,"""If we want to honor this day, let that hundred go back to Washington and gather four hundred more, and together, pledge to make it their mission to restore that law this year."" #Selma50

â€” President Barack Obama on the Voting Rights Act",,video,https://www.facebook.com/HuffingtonPost/videos/10152902016341130/,2015-03-07 18:00:01,01:56,7144,162,1372,7144,0,0,0,0,0
18468761129_10152901986966130,"""Some of us were left bloody ... but we never became bitter. Our country will never, ever be the same after what happened on this bridge."" #Selma50",John Lewis At Selma Anniversary: 'There's Still Work Left To Be Done',link,http://www.huffingtonpost.com/2015/03/07/john-lewis-selma-march-anniversary_n_6823550.html?ncid=fcbklnkushpmg00000063,2015-03-07 17:21:08,,2508,72,280,2508,0,0,0,0,0
18468761129_10152901951096130,"""The government should not be able to decide what types of speech are forbidden â€“ even when the speech in question reflects viewpoints we all agree are repellent.""",An Unlikely Source Is Defending the Redskins' First Amendment Rights,link,http://www.huffingtonpost.com/2015/03/06/aclu-redskins-government-lawsuit_n_6820174.html?ncid=fcbklnkushpmg00000063,2015-03-07 17:00:36,,439,163,64,439,0,0,0,0,0
18468761129_10152901914086130,This is terrifying.,New Roller Coaster Is Taller Than The Statue Of Liberty And It Will Make You Cry,link,http://www.huffingtonpost.com/2015/03/05/carowinds-fury-rollercoaster-video_n_6809700.html?ncid=fcbklnkushpmg00000063,2015-03-07 16:40:07,,7642,1048,5747,7642,0,0,0,0,0
18468761129_10152901872941130,50 years ago today... #Selma50,John Lewis Shares Memories From Selma In This Incredible Series Of Tweets,link,http://www.huffingtonpost.com/2015/03/07/john-lewis-selma_n_6823268.html?ncid=fcbklnkushpmg00000063,2015-03-07 16:20:09,,2643,101,571,2643,0,0,0,0,0
18468761129_10152901839251130,Spoiler alert: They deal with a whole lot of crazy.,The Craziest Hotel Concierge Stories You'll Ever Hear,link,http://www.huffingtonpost.com/map-happy/the-craziest-hotel-concie_b_6745548.html?ncid=fcbklnkushpmg00000063,2015-03-07 16:00:34,,1381,130,525,1381,0,0,0,0,0
18468761129_10152901706956130,,Protests After Wisconsin Police Fatally Shoot Black 19-Year-Old,link,http://www.huffingtonpost.com/2015/03/07/wisconsin-police-shoot-black_n_6821524.html?ncid=fcbklnkushpmg00000063,2015-03-07 15:00:11,,796,256,251,796,0,0,0,0,0
18468761129_10152901654181130,"""I've learned that a lot about how we make decisions has to do with identity.""",Anti-Vaccine Haven Digs In As Measles Outbreak Hands Science Crusaders An Edge,link,http://www.huffingtonpost.com/2015/03/06/vaccines-exemption-measles_n_6812092.html?ncid=fcbklnkushpmg00000063,2015-03-07 14:30:12,,321,131,49,321,0,0,0,0,0
18468761129_10152901544761130,Life's ruff for these pups.,"So This Is What A $30,000 Luxury Doghouse Looks Like",link,http://www.huffingtonpost.com/2015/03/06/samsung-luxury-doghouse_n_6818976.html?ncid=fcbklnkushpmg00000063,2015-03-07 13:30:09,,890,172,378,890,0,0,0,0,0
18468761129_10152901046771130,"Your move, cat ladies.",Sweet Portraits Of Men With Felines Challenge 'Cat Lady' Stereotypes,link,http://www.today.com/pets/men-cats-photo-series-challenges-cat-lady-stereotypes-2D80534570?cid=par-huffingtonpost,2015-03-07 13:00:14,,2992,189,674,2992,0,0,0,0,0
18468761129_10152901434446130,"Given that the Internet basically created Kim Kardashian, it's no wonder she's mastered it.",Kim K Makes Time's List Of Most Influential People On The Internet,link,http://www.huffingtonpost.com/2015/03/06/kim-kardashian-most-influential-internet_n_6818940.html?ncid=fcbklnkushpmg00000063,2015-03-07 12:40:08,,540,690,101,540,0,0,0,0,0
18468761129_10152901398716130,"Over the decades, chants have changed and leaders have evolved -- but the same belief in the value of black life has fueled the mission of protesters fighting for racial equality.",These 19 Photos Of Black Activism Through The Years Will Stun You,link,http://www.huffingtonpost.com/2015/02/18/protest-photos-then-now_n_6704024.html?ncid=fcbklnkushpmg00000063,2015-03-07 12:20:11,,2839,82,567,2839,0,0,0,0,0
18468761129_10152901356486130,3. Eat a piece of dark chocolate.,7 Ways To Boost Your Happiness In Under A Minute,link,http://www.huffingtonpost.com/margaret-manning/boost-happiness-in-under-a-minute_b_6768298.html?ncid=fcbklnkushpmg00000063,2015-03-07 12:00:10,,1845,48,537,1845,0,0,0,0,0
18468761129_10152899573621130,This is what it's like to be in my mind for 3 minutes.,I Have OCD.,link,http://themighty.com/2015/02/i-have-ocd-this-is-what-its-like-to-be-in-my-mind-for-3-minutes2/,2015-03-07 12:00:01,,4435,296,2246,4435,0,0,0,0,0
