status_id,status_message,link_name,status_type,status_link,status_published,status_video_length,num_reactions,num_comments,num_shares,num_likes,num_loves,num_wows,num_hahas,num_sads,num_angrys
18468761129_10152921180041130,"""Having sex with Sam has changed my life. It's not just the sex that's changed me. It's the experience of loving the man I'm having sex with that has completely, irrevocably rocked my world.""",The Sex Partner Who Rocked My World In Middle Age,link,http://www.huffingtonpost.com/erica-jagger/sexual-partner-rocked-my-world_b_6797644.html?ncid=fcbklnkushpmg00000063,2015-03-15 12:00:51,,1559,125,145,1559,0,0,0,0,0
18468761129_10152921119491130,"""We mostly just do things inspired by the idea of it being fun. And this just sounded like a fun thing to do.""",This Badass Couple's Vegas Elopement Is The Epitome Of Cool,link,http://www.huffingtonpost.com/2015/03/12/vegas-elopement-is-so-badass_n_6850930.html?ncid=fcbklnkushpmg00000063,2015-03-15 11:30:12,,2381,205,235,2381,0,0,0,0,0
18468761129_10152921061671130,The opportunity of a lifetime.,"6 Dream Retirement Destinations In Europe, Now On Sale",link,http://www.huffingtonpost.com/kathleen-peddicord/dream-retirement-destinations-in-europe_b_6802546.html?ncid=fcbklnkushpmg00000063,2015-03-15 11:00:09,,858,36,269,858,0,0,0,0,0
18468761129_10152921003621130,A truly incredible story,Here's What Happened After This Dad Put His Two Gay Kids In Therapy For 7 Years,link,http://www.huffingtonpost.com/2015/03/14/dad-fights-gay-rights_n_6865368.html?ncid=fcbklnkushpmg00000063,2015-03-15 10:30:10,,2904,99,416,2904,0,0,0,0,0
18468761129_10152920947851130,"Beyond all the politics, here are some of the real issues at stake.",What You Need To Know About The Iran Nuclear Negotiations,link,http://www.huffingtonpost.com/2015/03/14/iran-nuclear-negotiations_n_6864584.html?ncid=fcbklnkushpmg00000063,2015-03-15 10:00:47,,280,66,64,280,0,0,0,0,0
18468761129_10152920892406130,"We may not be in control of what happens in life, but we are in control of how we react to it.",8 Ways To Bounce Back After Disappointment,link,http://www.huffingtonpost.com/2015/03/14/recover-disappointment-bounce-back_n_6847810.html?ncid=fcbklnkushpmg00000063,2015-03-15 09:30:22,,3600,60,1222,3600,0,0,0,0,0
18468761129_10152920786566130,Yikes!,Emma Roberts Makes You Terrified Of Bubble Gum,link,http://www.huffingtonpost.com/2015/03/14/emma-roberts-scream-queens-teaser_n_6870736.html?ncid=fcbklnkushpmg00000063,2015-03-15 08:30:19,,2195,50,93,2195,0,0,0,0,0
18468761129_10152920691501130,The ultimate roommate test.,This Roommate Test Can Tell You If Living Together Will Suck,link,http://www.huffingtonpost.com/2015/03/13/roommate-quiz-buyer-diggs-trulia_n_6864166.html?ncid=fcbklnkushpmg00000063,2015-03-15 07:30:14,,1189,288,705,1189,0,0,0,0,0
18468761129_10152920610356130,"GOLD, Jerry, GOLD!!!",Prepare To Binge! 'Seinfeld' Is Coming To Streaming,link,http://www.huffingtonpost.com/2015/03/14/seinfeld-streaming_n_6869564.html?ncid=fcbklnkushpmg00000063,2015-03-15 06:30:12,,24168,844,2993,24168,0,0,0,0,0
18468761129_10152920529371130,These kids read mean tweets about themselves to shed light on cyberbullying.,This Mean Tweets Video Won't Make You Laugh Like The Others,link,http://www.huffingtonpost.com/2015/03/13/kids-read-mean-tweets_n_6865456.html?ncid=fcbklnkushpmg00000063,2015-03-15 05:30:10,,3117,149,1606,3117,0,0,0,0,0
18468761129_10152920453391130,This is how the world's biggest Indiana Jones fans feel about a reboot,What The World's Biggest Indiana Jones Fans Think About The Reboot,link,http://www.huffingtonpost.com/2015/03/14/raiders-sxsw_n_6863112.html?ncid=fcbklnkushpmg00000063,2015-03-15 04:30:18,,499,37,74,499,0,0,0,0,0
18468761129_10152920383891130,"""Having spent quality time with her over the last couple of years, I can categorically state that she is in full possession of her mental faculties.""",Harper Lee's Agent: I'm 'Surprised' By Elder Abuse Allegations,link,http://www.huffingtonpost.com/2015/03/14/harper-lee-elder-abuse-al_n_6870424.html?ncid=fcbklnkushpmg00000063,2015-03-15 03:30:11,,745,32,104,745,0,0,0,0,0
18468761129_10152920293131130,This is an art that deserves a resurgence.,"Handwritten Letters From Frida Kahlo, Andy Warhol, Alexander Calder And More",link,http://www.huffingtonpost.com/2015/03/13/more-than-words_n_6842354.html?ncid=fcbklnkushpmg00000063,2015-03-15 02:30:09,,6613,90,1885,6613,0,0,0,0,0
18468761129_10152920227421130,He's not ruining anyone's childhood.,"Paul Feig Says 'Ghostbusters' Backlash Is 'Vile, Misogynistic Sh*t'",link,http://www.huffingtonpost.com/2015/03/14/ghostbusters-backlash-misogynistic_n_6869550.html?ncid=fcbklnkushpmg00000063,2015-03-15 01:30:13,,3806,468,335,3806,0,0,0,0,0
18468761129_10152920028066130,"""As much as I tried to keep my job out of the conversation in the getting-to-know-you phase of courtship, it's typical to ask what someone does for a living.""","I'm A Sex Worker, And Dating Is Awkward",link,http://www.huffingtonpost.com/xojane-/im-a-sex-worker-and-dating-is-awkward_b_6770650.html?ncid=fcbklnkushpmg00000063,2015-03-15 00:30:12,,2471,452,307,2471,0,0,0,0,0
18468761129_10152919922341130,"Even in this far away photo, the teens somehow look apathetic about the whole thing.",Teenagers Float Away On Lake Michigan Ice Raft,link,http://www.huffingtonpost.com/2015/03/13/teenagers-ice-raft-michigan_n_6863304.html?ncid=fcbklnkushpmg00000063,2015-03-14 23:30:11,,2934,225,510,2934,0,0,0,0,0
18468761129_10152919832651130,Because nutrition affects your brain function.,Can Dementia Be Prevented Through Nutrition?,link,http://www.huffingtonpost.com/amy-r-beaudreault/can-dementia-be-prevented-through-nutrition_b_6847822.html?ncid=fcbklnkushpmg00000063,2015-03-14 22:30:17,,4738,182,2783,4738,0,0,0,0,0
18468761129_10152919741136130,Words are overrated.,This Emoji Keyboard Will Make You Forget You Ever Used The Alphabet,link,http://www.huffingtonpost.com/2015/03/13/emoji-keyboard-yall_n_6863926.html?ncid=fcbklnkushpmg00000063,2015-03-14 21:30:12,,1785,179,394,1785,0,0,0,0,0
18468761129_10152919683956130,Take a lesson from a dude who ALWAYS looks good.,What Common Can Teach Men About Getting Dressed,link,http://www.huffingtonpost.com/2015/03/13/common-style-lessons-teach-men-getting-dressed_n_6855384.html?ncid=fcbklnkushpmg00000063,2015-03-14 21:00:08,,6572,213,328,6572,0,0,0,0,0
18468761129_10152919635241130,"""The mood in the house was very peaceful, very loving.""",Brittany Maynard's Husband Shares New Details Of Her 'Peaceful' Last Moments,link,http://www.huffingtonpost.com/2015/03/13/brittany-maynard-husband-oprah-dan-diaz_n_6863494.html?ncid=fcbklnkushpmg00000063,2015-03-14 20:30:11,,5450,213,389,5450,0,0,0,0,0
18468761129_10152919589136130,We're so in.,Italy's Epic Treehouse Apartments Fulfill Everyone's Childhood Dreams,link,http://www.huffingtonpost.com/2015/03/12/italy-treehouse-apartments_n_6856570.html?ncid=fcbklnkushpmg00000063,2015-03-14 20:00:09,,38162,921,11423,38162,0,0,0,0,0
18468761129_10152919539331130,Cake for breakfast anyone?,36 Towering Layer Cakes,link,http://www.huffingtonpost.com/2015/03/11/cake-recipes_n_1560758.html?ncid=fcbklnkushpmg00000063,2015-03-14 19:30:12,,1063,51,403,1063,0,0,0,0,0
18468761129_10152919489536130,Gorgeous.,These Stunning Photos Show The Unspeakable Beauty Of Earth,link,http://www.huffingtonpost.com/2015/03/12/incredible-nature-photos-breathtaking-images_n_6840154.html?ncid=fcbklnkushpmg00000063,2015-03-14 19:00:32,,7568,48,1931,7568,0,0,0,0,0
18468761129_10152919437066130,"And no, it's not our smartphones.",This Is What's Ruining The World's Sleep,link,http://www.huffingtonpost.com/2015/03/13/sleep-a-global-perspective-survey_n_6841032.html?ncid=fcbklnkushpmg00000063,2015-03-14 18:30:08,,874,81,345,874,0,0,0,0,0
18468761129_10152919385491130,Progress could be on the way from a pretty unlikely source: The world's biggest corporations.,One Small Hope For The Future Of Maternity Leave In The U.S.,link,http://www.huffingtonpost.com/2015/03/10/vodafone-maternity-leave-paid_n_6834676.html?ncid=fcbklnkushpmg00000063,2015-03-14 18:00:09,,833,17,116,833,0,0,0,0,0
18468761129_10152919331561130,"No humblebrags, please.",4 Things You Shouldn't Do On Facebook,link,http://www.huffingtonpost.com/sharon-greenthal/things-not-to-do-on-facebook_b_6788470.html?ncid=fcbklnkushpmg00000063,2015-03-14 17:30:12,,6816,298,2904,6816,0,0,0,0,0
18468761129_10152919282876130,"His good deeds have already attracted the attention of many community members, who have offered to donate money.",Anonymous 'Spider-Man' Feeds Homeless People At Night,link,http://www.huffingtonpost.com/2015/03/11/birmingham-spiderman-feeds-homeless_n_6831648.html?ncid=fcbklnkushpmg00000063,2015-03-14 17:00:36,,8951,96,1857,8951,0,0,0,0,0
18468761129_10152919226691130,Wow.,Ice Chunks Taller Than People Washed Up On The Shores Of Cape Cod,link,http://www.huffingtonpost.com/2015/03/12/ice-chunks-cape-cod_n_6855104.html?ncid=fcbklnkushpmg00000063,2015-03-14 16:30:14,,5950,210,1504,5950,0,0,0,0,0
18468761129_10152919179371130,How are these things real?!,These Baby Chameleons Will Provide Your Daily Dose Of Squee,link,http://www.huffingtonpost.com/2015/03/12/baby-chameleons-taronga-zoo_n_6855770.html?ncid=fcbklnkushpmg00000063,2015-03-14 16:00:09,,3067,94,680,3067,0,0,0,0,0
18468761129_10152919130811130,"Please celebrate responsibly, with at least one slice of pie.",Get Set For A Very Special Pi Day,link,http://www.huffingtonpost.com/2015/03/13/pi-day-2015_n_6857138.html?ncid=fcbklnkushpmg00000063,2015-03-14 15:30:13,,1673,39,253,1673,0,0,0,0,0
18468761129_10152919022936130,Netflix is a train that can't be stopped.,Netflix Continues To Crush Cable TV,link,http://www.huffingtonpost.com/2015/03/11/netflix-cable-tv_n_6846942.html?ncid=fcbklnkushpmg00000063,2015-03-14 14:30:18,,6389,268,672,6389,0,0,0,0,0
18468761129_10152918797976130,3.1415...,Timeline Photos,photo,https://www.facebook.com/HuffingtonPost/photos/a.443444786129.234228.18468761129/10152918797976130/?type=3,2015-03-14 14:00:07,,2516,25,135,2516,0,0,0,0,0
18468761129_10152918890841130,No. 2: He deleted a picture of me from his Instagram.,10 Unexpected Things That Hurt The Most In My Divorce,link,http://www.huffingtonpost.com/samantha-darby-sollenberger/10-unusual-things-that-devastated-me-about-my-divorce_b_6838598.html?ncid=fcbklnkushpmg00000063,2015-03-14 13:30:21,,1093,159,115,1093,0,0,0,0,0
18468761129_10152918845606130,"Happy birthday, Einstein!",The Scope,photo,https://www.facebook.com/TheScopeHP/photos/a.10150712708131083.449531.159156871082/10153079476381083/?type=3,2015-03-14 13:11:09,,11088,102,7,11088,0,0,0,0,0
18468761129_10152918823631130,"In one sentence, Madonna summed up why rape is so grossly underreported.",Madonna Didn't Report Her Rape For The Same Reason So Many Victims Stay Silent,link,http://www.huffingtonpost.com/2015/03/12/madonna-says-her-rape-wasnt-worth-reporting-humiliation_n_6856196.html?ncid=fcbklnkushpmg00000063,2015-03-14 13:00:09,,1460,82,429,1460,0,0,0,0,0
18468761129_10152918774446130,"Before you feel physically connected with your spouse, you need to feel emotionally connected, this expert says.",How Much Sex Happily Married Women Have Vs. Unhappily Married Women,link,http://www.huffingtonpost.com/2015/03/10/how-many-times-couples-have-sex-a-week_n_6840846.html?ncid=fcbklnkushpmg00000063,2015-03-14 12:30:10,,1254,86,273,1254,0,0,0,0,0
18468761129_10152918720761130,This seems so unfair.,Pit Bull Credited For Protecting Owner From Domestic Violence Is Getting Kicked Out Of Town,link,http://www.huffingtonpost.com/2015/03/11/pit-bull-protects-owner-from-domestic-abuse_n_6845864.html?ncid=fcbklnkushpmg00000063,2015-03-14 12:00:44,,1941,264,878,1941,0,0,0,0,0
18468761129_10152918655081130,"Who knew people in Illinois are competitive and less creative in their thinking, while residents of Vermont are incredibly introverted?",Where You Live Says A Lot More About You Than You'd Think,link,http://www.huffingtonpost.com/2015/03/10/state-by-personality-truity_n_6833614.html?ncid=fcbklnkushpmg00000063,2015-03-14 11:30:11,,759,108,327,759,0,0,0,0,0
18468761129_10152918599351130,"We understand, pooch.",Dog Totally Loses It After Owner Returns From 2 Years Abroad,link,http://www.huffingtonpost.com/2015/03/10/dog-owner-reunion-video_n_6840598.html?ncid=fcbklnkushpmg00000063,2015-03-14 11:00:09,,4715,125,411,4715,0,0,0,0,0
18468761129_10152918546911130,"Enjoy your bath, sweet Rudy.",Rudy The Dog Deserves Every Second Of His Luxurious Bath,link,http://www.huffingtonpost.com/2015/03/10/abused-dog-takes-bath_n_6838692.html?ncid=fcbklnkushpmg00000063,2015-03-14 10:30:09,,12567,229,768,12567,0,0,0,0,0
18468761129_10152918488536130,Incredible!,This Staggering Ballet Duet To Sam Smith's 'Stay With Me' Is Just Daaaaamn,link,http://www.huffingtonpost.com/2015/03/10/sam-smith-ballet-duet_n_6832542.html?ncid=fcbklnkushpmg00000063,2015-03-14 10:00:37,,6441,248,2607,6441,0,0,0,0,0
18468761129_10152918431356130,"Keep being awesome, Cici.","A Boy In Her Class Called Her 'Ugly,' And Her Response Is Perfect",link,http://www.huffingtonpost.com/2015/03/06/girl-responds-to-boy-who-called-her-ugly-video_n_6816840.html?ncid=fcbklnkushpmg00000063,2015-03-14 09:30:11,,8360,348,991,8360,0,0,0,0,0
18468761129_10152918337136130,"Sorry, McD's. This one is FAR superior.",How To Make Your Own Damn Shamrock Shake,link,http://www.huffingtonpost.com/2015/03/09/how-to-make-shamrock-shake_n_6793502.html?ncid=fcbklnkushpmg00000063,2015-03-14 08:30:20,,2540,162,1443,2540,0,0,0,0,0
18468761129_10152918235686130,Don't be the embarrassing one in the group.,6 Ways to Humiliate Yourself in Europe,link,http://www.huffingtonpost.com/smartertravel/6-ways-to-humiliate-yours_b_6799202.html?ncid=fcbklnkushpmg00000063,2015-03-14 07:30:17,,2732,363,1343,2732,0,0,0,0,0
18468761129_10152918029981130,Want a pancake in the shape of your face? No problem.,Want A Pancake Shaped Like A Seahorse? PancakeBot Will Print One For You,link,http://www.huffingtonpost.com/2015/03/13/pancakebot-food-printer_n_6857506.html?ncid=fcbklnkushpmg00000063,2015-03-14 04:30:21,,431,13,118,431,0,0,0,0,0
18468761129_10152917958386130,"""I know you. I was you... I am you. I got out. I stayed out. You can, too.""",To The Woman With The Bruises,link,http://www.huffingtonpost.com/melissa-charles/to-the-woman-with-the-bruises_b_6725300.html?ncid=fcbklnkushpmg00000063,2015-03-14 03:30:18,,5227,178,2370,5227,0,0,0,0,0
18468761129_10152915943391130,"""You might not have raped anyone, Mr. Sharma, but you are definitely cheering it on. And for that, I, India's Daughter, will not forgive you."" (via HuffPost India)",'India's Daughter' Blasts Delhi Gang Rape Lawyer For His Misogynistic Views,link,http://www.huffingtonpost.in/2015/03/13/delhi-gang-rape-_n_6861378.html?ncid=fcbklnkushpmg00000063,2015-03-14 02:30:01,,170,15,19,170,0,0,0,0,0
18468761129_10152917829446130,"No. 2. ""Wow, you look so pretty now.""",What You Should Never Ask Someone Who Has Lost Weight,link,http://www.huffingtonpost.com/jennifer-lilley/things-never-to-say-lost-weight_b_6818060.html?ncid=fcbklnkushpmg00000063,2015-03-14 01:30:15,,2293,215,541,2293,0,0,0,0,0
18468761129_10152917751171130,Tastes like chicken!,Kids Try Frog Legs For The First Time,link,http://www.huffingtonpost.com/2015/03/13/kids-frog-legs-react-video_n_6861674.html?ncid=fcbklnkushpmg00000063,2015-03-14 00:30:14,,502,80,106,502,0,0,0,0,0
18468761129_10152917711711130,"Nice try, Mr. Vice President.",Joe Biden Says He Does A Million Arm Curls A Day But We Call Bulls#!% On That,link,http://www.huffingtonpost.com/2015/03/13/joe-biden-arm-curls_n_6865908.html?ncid=fcbklnkushpmg00000063,2015-03-14 00:00:22,,323,115,15,323,0,0,0,0,0
18468761129_10152917672911130,We're happy to get stuck there.,The 5 Most Beautiful Train Stations Across America,link,http://www.huffingtonpost.com/thrillist/the-11-most-beautiful-train-stations-across-america_b_6839244.html?ncid=fcbklnkushpmg00000063,2015-03-13 23:30:15,,1670,34,302,1670,0,0,0,0,0
18468761129_10152917672851130,30 percent of Americans still feel the recession hasn't ended.,1 In 3 Feels Scammed By Big Banks,link,http://www.huffingtonpost.com/2015/03/13/bank-customers-are-mad-as-hell_n_6857990.html?ncid=fcbklnkushpmg00000063,2015-03-13 23:30:11,,3006,218,348,3006,0,0,0,0,0
18468761129_10152916665666130,"Good for you, but not so good for the environment.",There's a Downside to All That Greek Yogurt You're Eating | VICE News,link,https://news.vice.com/article/theres-a-downside-to-all-that-greek-yogurt-youre-eating,2015-03-13 23:00:02,,546,65,225,546,0,0,0,0,0
18468761129_10152917600556130,Just plane fun.,Pilot Traces Penis Outlines In Sky Over Florida,link,http://www.huffingtonpost.com/2015/03/13/pilot-flies-traces-penis-florida-sky_n_6864172.html?ncid=fcbklnkushpmg00000063,2015-03-13 22:40:08,,1224,134,298,1224,0,0,0,0,0
18468761129_10152917565891130,"""That's our job as artists, to turn the world upside down and make everyone feel bewildered and have to rethink everything.""","From 'Hell' And Back, Madonna Lives To Tell",link,http://www.huffingtonpost.com/2015/03/13/madonna-rebel-heart_n_6851648.html?ncid=fcbklnkushpmg00000063,2015-03-13 22:20:10,,226,27,26,226,0,0,0,0,0
18468761129_10152916666081130,"Yeah, moving to St. Louis.",An All-Ranch Dressing Restaurant Is Coming to St. Louis,link,http://www.eater.com/2015/3/13/8208185/all-ranch-dressing-restaurant-st-louis,2015-03-13 22:00:02,,1927,604,2133,1927,0,0,0,0,0
18468761129_10152917489866130,Are efforts to combat climate change working?,Carbon Emissions Stabilized In 2014,link,http://www.huffingtonpost.com/2015/03/13/carbon-emissions-stabilized_n_6865366.html?ncid=fcbklnkushpmg00000063,2015-03-13 21:40:10,,628,61,110,628,0,0,0,0,0
18468761129_10152917456131130,What a career!,Will Ferrell Ends Remarkable Dodgers Career With 0.00 ERA,link,http://www.huffingtonpost.com/2015/03/13/will-ferrell-pitch-dodgers-los-angeles_n_6863320.html?ncid=fcbklnkushpmg00000063,2015-03-13 21:20:09,,2105,26,142,2105,0,0,0,0,0
18468761129_10152916666861130,This Pi Day is kind of a big deal.,Why Pi Matters - The New Yorker,link,http://www.newyorker.com/tech/elements/pi-day-why-pi-matters,2015-03-13 21:00:03,,16745,315,8874,16745,0,0,0,0,0
18468761129_10152917359491130,"""You are so lovely, darling, that I often wonder how it is possible that you are mine. I'm really the luckiest guy in the world, you know. And you are the reason.""","70 Years Later, WWII Vet Reads Long-Lost Letter He Wrote To His Future Wife",link,http://www.huffingtonpost.com/2015/03/11/wwii-love-letter-veteran-bill-moore_n_6845030.html?ncid=fcbklnkushpmg00000063,2015-03-13 20:40:10,,19953,384,2881,19953,0,0,0,0,0
18468761129_10152917305321130,Cyberbullying needs to stop. Now.,This Mean Tweets Video Won't Make You Laugh Like The Others,link,http://www.huffingtonpost.com/2015/03/13/kids-read-mean-tweets_n_6865456.html?ncid=fcbklnkushpmg00000063,2015-03-13 20:20:10,,3475,260,1473,3475,0,0,0,0,0
18468761129_10152916703946130,"As of April 2014, he'd fulfilled more than 400 Make-A-Wish Foundation wishes â€” the most of any celebrity.",The Incredible Way John Cena Gave This Teen the Best Day of His Life,link,http://themighty.com/2015/03/the-incredible-way-john-cena-gave-this-teen-the-best-day-of-his-life/,2015-03-13 20:00:01,,290955,2688,9768,290955,0,0,0,0,0
18468761129_10152917223356130,"""I get out there and meet people face-to-face. When I spend time with them and get to know what their story is, they tell me no one has sat and talked to them in they can't remember how long.""","Cops, Social Workers Are Joining Forces To Help Homeless People Get Off The Streets",link,http://www.huffingtonpost.com/2015/03/13/social-workers-homeless-outreach_n_6863910.html?ncid=fcbklnkushpmg00000063,2015-03-13 19:40:09,,4733,57,711,4733,0,0,0,0,0
18468761129_10152917133956130,We really missed out.,Here's The Michelle Obama-Ellen DeGeneres Dance Party You Wish You Were Invited To,link,http://www.huffingtonpost.com/2015/03/13/michelle-obama-ellen-degeneres_n_6864408.html?ncid=fcbklnkushpmg00000063,2015-03-13 19:00:08,,3082,171,357,3082,0,0,0,0,0
18468761129_10152917089476130,<3,Terminally Ill Costco Employee Breaks Down As Customers Surprise Him With Vacation,link,http://www.huffingtonpost.com/2015/03/12/costco-employee-terminal-cancer-surprise_n_6847738.html?ncid=fcbklnkushpmg00000063,2015-03-13 18:40:08,,5730,82,569,5730,0,0,0,0,0
18468761129_10152917052356130,15 + 6 ... DOES NOT = 17.,Bride Walks Out Of Wedding After Groom Fails Her Math Test,link,http://www.huffingtonpost.com/2015/03/13/indian-bride-walks-out-groom-fails-math-test_n_6861552.html?ncid=fcbklnkushpmg00000063,2015-03-13 18:20:10,,4815,494,1484,4815,0,0,0,0,0
18468761129_10152916856486130,3.141592653...,"It's Going to Be a Very Special Pi Day on March 14, 2015, at 9:26:53",link,http://www.slate.com/articles/health_and_science/science/2015/03/pi_day_2015_ten_digits_represented_on_march_14_at_9_26_53.html?wpsrc=huffpo,2015-03-13 18:01:00,,22916,367,10579,22916,0,0,0,0,0
18468761129_10152916957116130,"4,321!",54-Year-Old Sets World Record For Most Pull-Ups,link,http://www.huffingtonpost.com/2015/03/13/pull-ups-world-record-_n_6865218.html?ncid=fcbklnkushpmg00000063,2015-03-13 17:40:10,,5033,393,1528,5033,0,0,0,0,0
18468761129_10152916916446130,Please accept our apologies in advance for melting your brain.,These 3D Gifs Will Turn Your Brain Inside Out,link,http://www.huffingtonpost.com/2015/03/12/split-depth-gif-animations_n_6851254.html?ncid=fcbklnkushpmg00000063,2015-03-13 17:20:13,,744,30,281,744,0,0,0,0,0
18468761129_10152916878341130,Baby's first barrel!,Baby Surfing First Wave Is The Epitome Of Pure Bliss,link,http://www.huffingtonpost.com/2015/03/11/baby-surfs-first-wave_n_6836086.html?ncid=fcbklnkushpmg00000063,2015-03-13 17:00:35,,34554,1675,6747,34554,0,0,0,0,0
18468761129_10152916836351130,"""It is very important because many trans people do not want to be public figures, they just want to live the lives they have fought for.""",Trans People Launch Campaign To Let The World Know #WeJustNeedToPee,link,http://www.huffingtonpost.com/2015/03/12/trans-bathroom-selfie-campaign_n_6855430.html?ncid=fcbklnkushpmg00000063,2015-03-13 16:40:14,,2958,303,366,2958,0,0,0,0,0
18468761129_10152916793506130,It will take 144 years before Wyoming women working full time and year-round make the same as their male counterparts.,Here's How Long It'll Take To Close The Gender Wage Gap In Each State,link,http://www.huffingtonpost.com/2015/03/13/gender-wage-gap-close_n_6863314.html?ncid=fcbklnkushpmg00000063,2015-03-13 16:20:10,,842,192,682,842,0,0,0,0,0
18468761129_10152916358486130,*mic drop*,10 Celebrities Who Had the Perfect Response to Fat Shaming,link,http://pubx.ch/1Myu0u5,2015-03-13 16:00:05,,6397,115,741,6397,0,0,0,0,0
18468761129_10152916721126130,"B*tch, she's Madonna.","From 'Hell' And Back, Madonna Lives To Tell",link,http://www.huffingtonpost.com/2015/03/13/madonna-rebel-heart_n_6851648.html?ncid=fcbklnkushpmg00000063,2015-03-13 15:40:11,,527,54,53,527,0,0,0,0,0
18468761129_10152916673996130,"2 years ago: Jorge Mario Bergoglio was elected as the successor of Pope Benedict XVI. He chose Francis as his papal name.

Happy Pope-iversary Pope Francis.",Timeline Photos,photo,https://www.facebook.com/HuffingtonPost/photos/a.443444786129.234228.18468761129/10152916673996130/?type=3,2015-03-13 15:32:52,,21065,499,3138,21065,0,0,0,0,0
18468761129_10152916675101130,SO rad.,This Badass Couple's Vegas Elopement Is The Epitome Of Cool,link,http://www.huffingtonpost.com/2015/03/12/vegas-elopement-is-so-badass_n_6850930.html?ncid=fcbklnkushpmg00000063,2015-03-13 15:20:10,,4421,397,428,4421,0,0,0,0,0
18468761129_10152916316636130,Save the music.,There's Scientific Proof That Musicians Have Better Brains,link,http://pubx.ch/1xkmhab,2015-03-13 15:00:05,,7624,323,3262,7624,0,0,0,0,0
18468761129_10152916595736130,"""The day after we separated was one of the worst days of my life. Waking up at a friend's house, and not seeing my love sleeping next to me was unbearable.""",The Day After My Wife and I Separated,link,http://www.huffingtonpost.com/kimanzi-constable/the-day-after-my-wife-and-i-separated_b_6777228.html?ncid=fcbklnkushpmg00000063,2015-03-13 14:40:08,,4899,222,1377,4899,0,0,0,0,0
18468761129_10152916559871130,Don't mess with Ronda.,Mike Tyson: 'Ronda Rousey Might Kick My A**',link,http://www.huffingtonpost.com/2015/03/12/mike-tyson-ronda-rousey_n_6859266.html?ncid=fcbklnkushpmg00000063,2015-03-13 14:20:10,,7975,333,944,7975,0,0,0,0,0
18468761129_10152916270751130,"Looking good, Dennis!",Dachshund on a diet: Obese pup loses 80 percent of body weight,link,http://pubx.ch/1MypmMD,2015-03-13 14:00:01,,11179,418,1004,11179,0,0,0,0,0
18468761129_10152916417116130,"Nice mall, eh?",This Canadian Mega-Mall Is Your New Vacation Spot,link,http://www.huffingtonpost.com/2015/03/06/west-edmonton-mall-travel_n_6816492.html?ncid=fcbklnkushpmg00000063,2015-03-13 13:40:08,,1819,181,544,1819,0,0,0,0,0
18468761129_10152916378871130,"The most anticlimactic ""Jeopardy!"" ever.",Bizarre 'Jeopardy' Finish Will Make You Do A 'Daily Double-Take',link,http://www.huffingtonpost.com/2015/03/13/one-contestant-final-jeopardy_n_6862896.html?ncid=fcbklnkushpmg00000063,2015-03-13 13:20:11,,1394,88,239,1394,0,0,0,0,0
18468761129_10152916345676130,So many feels.,Boy Gets His Very Own 'Iron Man' Bionic Arm -- From Tony Stark,link,http://www.huffingtonpost.com/2015/03/12/robert-downey-jr-iron-man-arm_n_6860990.html?ncid=fcbklnkushpmg00000063,2015-03-13 13:00:51,,7352,94,1149,7352,0,0,0,0,0
18468761129_10152916306791130,We want to go to there.,27 Dreamy Honeymoon Photos That Will Remind You How Badly You Need A Vacation,link,http://www.huffingtonpost.com/2015/03/12/awesome-honeymoon-photos_n_6849302.html?ncid=fcbklnkushpmg00000063,2015-03-13 12:40:09,,1407,53,205,1407,0,0,0,0,0
