status_id,status_message,link_name,status_type,status_link,status_published,status_video_length,num_reactions,num_comments,num_shares,num_likes,num_loves,num_wows,num_hahas,num_sads,num_angrys
18468761129_10152939955811130,"""She told him that she didn't want to stop, to which he reportedly responded: 'Good, then we're going to do this together.'""",'Angel' Police Officer Helps Struggling Runner Finish 10K Race,link,http://www.huffingtonpost.com/2015/03/23/policer-officer-helps-runner-10k-asia-ford_n_6921270.html?ncid=fcbklnkushpmg00000063,2015-03-23 09:40:11,,8050,142,869,8050,0,0,0,0,0
18468761129_10152939925506130,"Are you ready for this?  
 
Straight James Franco interviews Gay James Franco.",James Franco Gets Candid About His Sexuality In Strangest Interview Yet,link,http://www.huffingtonpost.com/2015/03/18/james-franco-gay-interview_n_6893970.html?ncid=fcbklnkushpmg00000063,2015-03-23 09:20:12,,3426,351,606,3426,0,0,0,0,0
18468761129_10152939749176130,A part of you seeks the pain this person gives you.,Why You Should Never Go Back To Someone Who's Hurt You,link,http://pubx.ch/1CQp0QC,2015-03-23 09:00:02,,20377,934,8180,20377,0,0,0,0,0
18468761129_10152939858801130,"""Governor LePage is full of the stuff that makes the grass grow green.""",Stephen King Demands Apology From Maine's Governor,link,http://www.huffingtonpost.com/2015/03/23/stephen-king-paul-lepage_n_6921396.html?ncid=fcbklnkushpmg00000063,2015-03-23 08:40:11,,2106,72,185,2106,0,0,0,0,0
18468761129_10152939830556130,"""We cannot have a system where committing a minor violation can end up putting you in -- and I'm going to use a legal term of art here -- the f**k barrel.""",John Oliver Wants To #ShutDownTheF**kBarrel,link,http://www.huffingtonpost.com/2015/03/23/john-oliver-fuck-barrel_n_6921650.html?ncid=fcbklnkushpmg00000063,2015-03-23 08:20:15,,2103,51,507,2103,0,0,0,0,0
18468761129_10152939745036130,Everything is not awesome.,The science of why stepping on Legos makes you want to die,link,http://pubx.ch/1FR3bPH,2015-03-23 08:00:00,,7393,333,4015,7393,0,0,0,0,0
18468761129_10152939755871130,Literally...,Know Someone You Think Deserves A Bag Of Dicks? Well... Now You Can Send Them One!,link,http://www.huffingtonpost.com/2015/03/19/dicks-by-mail-novelty-candy-_n_6903858.html?ncid=fcbklnkushpmg00000063,2015-03-23 07:30:19,,2812,580,1810,2812,0,0,0,0,0
18468761129_10152939678146130,You're NOT alone in feeling this way.,Why Loneliness Is A Growing Public Health Concern -- And What We Can Do About It,link,http://www.huffingtonpost.com/2015/03/21/science-loneliness_n_6864066.html?ncid=fcbklnkushpmg00000063,2015-03-23 06:30:17,,2208,169,1019,2208,0,0,0,0,0
18468761129_10152939607126130,"""You should be able to do your own things and do what you want.""",Kids Talk About What It Means To Be 'Manly',link,http://www.huffingtonpost.com/2015/03/19/kids-talk-about-what-it-means-to-be-manly_n_6905366.html?ncid=fcbklnkushpmg00000063,2015-03-23 05:30:13,,591,77,261,591,0,0,0,0,0
18468761129_10152939536911130,THESE TWO.,This Incredible Acrobatic Couple Is Getting Married 38 Times In 83 Days On 6 Continents,link,http://www.huffingtonpost.com/2015/03/20/acrobat-couple-married-worldwide-wedding-photos_n_6912226.html?ncid=fcbklnkushpmg00000063,2015-03-23 04:30:11,,3274,112,322,3274,0,0,0,0,0
18468761129_10152939367661130,So beautiful and moving!,A Dying Neurosurgeon's Exquisite Message To His Daughter,link,http://www.huffingtonpost.com/2015/03/20/paul-kalanithi-dying-neurosurgeons-exquisite-message-to-daughter_n_6905234.html?ncid=fcbklnkushpmg00000063,2015-03-23 03:30:17,,6036,97,1266,6036,0,0,0,0,0
18468761129_10152939282886130,"No one told you life was gonna be this way, Harry Potter.",'Harry Potter' Reimagined As 'Friends' Is The TV Show We Didn't Know We Needed,link,http://www.huffingtonpost.com/2015/03/20/harry-potter-friends-intro_n_6910834.html?ncid=fcbklnkushpmg00000063,2015-03-23 02:30:11,,3139,354,1558,3139,0,0,0,0,0
18468761129_10152939228691130,"""Solo travel not only pushes you out of your comfort zone, it also pushes you out of the zone of others' expectations.""",6 Reasons Every Woman Needs To Travel Alone,link,http://www.huffingtonpost.com/2015/03/21/7-reasons-every-woman-nee_n_6880384.html?ncid=fcbklnkushpmg00000063,2015-03-23 01:30:13,,26251,1355,8738,26251,0,0,0,0,0
18468761129_10152939170566130,"Everyone has their own way of doing things, but sometimes there's a more correct way.",7 Home Decor Trends You Might Be Doing Wrong,link,http://www.huffingtonpost.com/hometalk/7-more-home-decor-trends_b_6902076.html?ncid=fcbklnkushpmg00000063,2015-03-23 00:30:09,,356,16,73,356,0,0,0,0,0
18468761129_10152939135816130,"It's a bird! It's a plane! It's Morrissey, looking so very solemn.",And Here Are You Favorite Post-Punk Rock Stars As Marvel Superheroes,link,http://www.huffingtonpost.com/2015/03/20/butcher-billy_n_6912738.html?ncid=fcbklnkushpmg00000063,2015-03-23 00:00:10,,707,28,281,707,0,0,0,0,0
18468761129_10152939107616130,DEVELOPING...,Ted Cruz Announces He's Running For President In 2016,link,http://www.huffingtonpost.com/2015/03/23/ted-cruz-2016_n_6193388.html?ncid=fcbklnkushpmg00000063,2015-03-22 23:42:07,,698,1155,384,698,0,0,0,0,0
18468761129_10152939014506130,No. 4: Always use your vacation time.,7 Tips For A Happier Work Life,link,http://www.huffingtonpost.com/nancy-roman/how-to-love-your-job_b_6867968.html?ncid=fcbklnkushpmg00000063,2015-03-22 22:30:09,,2665,61,912,2665,0,0,0,0,0
18468761129_10152938925126130,All of it adds up.,The Other Factor That Might Be Keeping You From Losing Weight,link,http://www.huffingtonpost.com/2015/03/20/stress-and-weight-gain-ownshow_n_6912308.html?ncid=fcbklnkushpmg00000063,2015-03-22 21:30:20,,456,31,201,456,0,0,0,0,0
18468761129_10152938801271130,"Skip that, do this.","Instead of Going to India, Why Not Sri Lanka?",link,http://www.huffingtonpost.com/findery/instead-of-going-to-india_b_6904058.html?ncid=fcbklnkushpmg00000063,2015-03-22 20:30:11,,1471,144,244,1471,0,0,0,0,0
18468761129_10152938732961130,It isn't easy being clean.,7 Services That Will Basically Do Your Spring Cleaning For You,link,http://www.huffingtonpost.com/2015/03/20/spring-cleaning-services_n_6911260.html?ncid=fcbklnkushpmg00000063,2015-03-22 20:00:09,,234,6,85,234,0,0,0,0,0
18468761129_10152938677761130,"""When someone is talking to you, LISTEN.""",22 Things To Start Doing Now That Will Improve The Rest Of Your Life,link,http://www.huffingtonpost.com/2015/03/20/22-tips-life_n_6906880.html?ncid=fcbklnkushpmg00000063,2015-03-22 19:30:12,,5486,77,2908,5486,0,0,0,0,0
18468761129_10152938473211130,Cause we are so sick of Winter.,Florida's 7 Best Beaches,link,http://www.huffingtonpost.com/fodors/floridas-7-best-beaches_b_6894408.html?ncid=fcbklnkushpmg00000063,2015-03-22 19:00:09,,1273,108,416,1273,0,0,0,0,0
18468761129_10152938424651130,Everyone loves a bad boy.,What Sherlock Holmes Teaches Us About Ourselves,link,http://www.huffingtonpost.com/josh-cook/sherlock-holmes-archetype_b_6904120.html?ncid=fcbklnkushpmg00000063,2015-03-22 18:30:21,,1037,23,144,1037,0,0,0,0,0
18468761129_10152938378986130,"You go in for help, you leave feeling like a teenager.",Why It Sucks Going To The Bank As A Woman,link,http://www.huffingtonpost.com/sasha-bronner/why-it-sucks-going-to-the-bank-as-a-woman_b_6906972.html?ncid=fcbklnkushpmg00000063,2015-03-22 18:00:11,,1651,484,253,1651,0,0,0,0,0
18468761129_10152938333226130,3. Other people's stress.,17 Surprising Reasons You're Stressed Out,link,http://www.huffingtonpost.com/2015/03/21/surprising-stress-causes_n_6849250.html?ncid=fcbklnkushpmg00000063,2015-03-22 17:30:14,,878,33,462,878,0,0,0,0,0
18468761129_10152938286476130,Gross.,The 8 Germiest Places in Your Home,link,http://www.huffingtonpost.com/domino/8-germiest-places-in-your_b_6848338.html?ncid=fcbklnkushpmg00000063,2015-03-22 17:00:09,,252,10,134,252,0,0,0,0,0
18468761129_10152938232576130,"""The way we have to measure progress here is not, 'Is there ever going to be an incident of racism in the country?' It's, 'How does the majority of our country respond?'""",Obama Applauds 'Quick Reaction' Against Racist Fraternity Video,link,http://www.huffingtonpost.com/2015/03/21/obama-racist-frat-video_n_6911826.html?ncid=fcbklnkushpmg00000063,2015-03-22 16:30:14,,1593,60,90,1593,0,0,0,0,0
18468761129_10152938185881130,Even people who did not follow the diet rigorously lowered their risk by 35%.,The 'MIND Diet' Could Protect You From Alzheimer's And Age-Related Cognitive Decline,link,http://www.huffingtonpost.com/2015/03/21/diet-alzheimers-_n_6896760.html?ncid=fcbklnkushpmg00000063,2015-03-22 16:00:08,,2543,116,1938,2543,0,0,0,0,0
18468761129_10152938133986130,He's better in bed.,10 Reasons Why Women Should Date Men In Their 50s,link,http://www.huffingtonpost.com/john-w-anderson/reasons-women-should-be-dating-men-in-their-50s_b_6841616.html?ncid=fcbklnkushpmg00000063,2015-03-22 15:30:13,,2457,423,948,2457,0,0,0,0,0
18468761129_10152938079281130,Cheers! Kampai! L'Chaim!,Here Is The Most Popular Beer In Every Country,link,http://www.huffingtonpost.com/2015/03/21/beer-map_n_6916140.html?ncid=fcbklnkushpmg00000063,2015-03-22 15:00:36,,4935,901,3793,4935,0,0,0,0,0
18468761129_10152938022716130,"Best of luck with that, Mr. President!",Obama: I'm Hoping For A 'Post-Administration Glow' After I Leave Office And Can Get More Sleep,link,http://www.huffingtonpost.com/2015/03/21/obama-sleep_n_6911950.html?ncid=fcbklnkushpmg00000063,2015-03-22 14:30:21,,1695,182,64,1695,0,0,0,0,0
18468761129_10152937969201130,"""I'm a big advocate for body positivity, but I've never shown what my excess skin really looks like ... I've never done this before ever, and I'm really, really scared.""","After Losing 270 Pounds, Man Bravely Strips Down To Reveal Excess Skin",link,http://www.huffingtonpost.com/2015/03/21/matt-diaz-excess-skin-weight-loss_n_6915550.html?ncid=fcbklnkushpmg00000063,2015-03-22 14:00:40,,5596,613,313,5596,0,0,0,0,0
18468761129_10152937914481130,"Like the character, the name Waldo is disappearing, with only 5 boys taking the name last year in the U.S.",15 Once-Popular Baby Names On The Verge Of Extinction,link,http://www.huffingtonpost.com/2015/03/17/unpopular-baby-names-going-extinct_n_6859318.html?ncid=fcbklnkushpmg00000063,2015-03-22 13:30:18,,1405,307,499,1405,0,0,0,0,0
18468761129_10152937856476130,"""It could be a movie.""","Husband And Wife Discover They Crossed Paths As Kids, 16 Years Before Meeting",link,http://www.huffingtonpost.com/2015/03/20/couple-crossed-paths-before-they-met_n_6911308.html?ncid=fcbklnkushpmg00000063,2015-03-22 13:00:09,,5970,192,406,5970,0,0,0,0,0
18468761129_10152937788516130,None of the thousands of federal prisoners who have applied through the clemency program so far have had their sentences reduced by the president.,Obama Vows To Use Clemency Power 'More Aggressively',link,http://www.huffingtonpost.com/2015/03/21/obama-clemency-pardon_n_6911784.html?ncid=fcbklnkushpmg00000063,2015-03-22 12:30:28,,339,86,67,339,0,0,0,0,0
18468761129_10152937722351130,Whoa!,"500,000-Year-Old 'Swiss Army Knife' Discovered",link,http://www.huffingtonpost.com/2015/03/22/prehistoric-swiss-army-knife_n_6909050.html?ncid=fcbklnkushpmg00000063,2015-03-22 12:00:09,,2993,92,653,2993,0,0,0,0,0
18468761129_10152937666491130,The Fit Guy. Three words: Protein. Powder. Supplements.,The Definitive List of Men You'll Find At Whole Foods,link,http://www.huffingtonpost.com/literally-darling/the-definitive-list-of-men-youll-find-at-whole-foods_b_6699698.html?ncid=fcbklnkushpmg00000063,2015-03-22 11:30:34,,942,124,297,942,0,0,0,0,0
18468761129_10152937610821130,Here's who's helping the 748 million people still lack access to clean water.,These Brilliant Innovations Are Bringing Clean Water To People Worldwide,link,http://www.huffingtonpost.com/2015/03/22/clean-water-innovations_n_6909106.html?ncid=fcbklnkushpmg00000063,2015-03-22 11:01:07,,1801,20,323,1801,0,0,0,0,0
18468761129_10152937559776130,Tried and tested!,This Is How Long Travel-Sized Toothpaste Will Last You,link,http://www.huffingtonpost.com/map-happy/this-is-how-long-travelsi_b_6801206.html?ncid=fcbklnkushpmg00000063,2015-03-22 10:30:23,,193,37,28,193,0,0,0,0,0
18468761129_10152933690361130,"We've all been there, some more than others.",The Name on My Coffee Cup - The New Yorker,link,http://www.newyorker.com/culture/culture-desk/the-name-on-my-coffee-cup,2015-03-22 10:00:01,,2142,552,463,2142,0,0,0,0,0
18468761129_10152937455721130,This is a dream.,"For Just $10, You Can Snuggle These Seriously Impressive Puppies",link,http://www.huffingtonpost.com/arin-greenwood/puppy-hugging-southeastern-guide-dogs_b_6903800.html?ncid=fcbklnkushpmg00000063,2015-03-22 09:30:14,,1667,75,233,1667,0,0,0,0,0
18468761129_10152937360021130,Stellar news!,Is It Time To Take Green Sea Turtles Off Threatened Species List?,link,http://www.huffingtonpost.com/2015/03/20/threatened-status-sea-turtles_n_6913576.html?ncid=fcbklnkushpmg00000063,2015-03-22 08:30:17,,1524,30,115,1524,0,0,0,0,0
18468761129_10152937274321130,Are you ready?,Ted Cruz To Announce Presidential Run On Monday: Report,link,http://www.huffingtonpost.com/2015/03/22/ted-cruz-2016_n_6917824.html?ncid=fcbklnkushpmg00000063,2015-03-22 07:32:07,,887,1783,624,887,0,0,0,0,0
18468761129_10152937195231130,Your weekend TV marathon just got even better.,7 More Netflix Hacks To Make You A Binge-Watching Pro,link,http://www.huffingtonpost.com/2015/03/21/more-netflix-hacks-binge-watcher-needs_n_6914380.html?ncid=fcbklnkushpmg00000063,2015-03-22 06:30:09,,1510,108,869,1510,0,0,0,0,0
18468761129_10152937125151130,Go for the organic bacon.,Antibiotic Use In Meat Is Soaring,link,http://www.huffingtonpost.com/2015/03/21/antibiotics-meat_n_6916932.html?ncid=fcbklnkushpmg00000063,2015-03-22 05:30:14,,1717,167,1093,1717,0,0,0,0,0
18468761129_10152937053701130,Packs a punch.,Serena Williams Covers Vogue (Again) And We Couldn't Be Happier,link,http://www.huffingtonpost.com/2015/03/21/serena-williams-vogue-cover_n_6917192.html?ncid=fcbklnkushpmg00000063,2015-03-22 04:30:20,,3043,138,221,3043,0,0,0,0,0
18468761129_10152933688586130,An economic update of the Seven Kingdoms.,'Game of Thrones': The Iron Throne is a terrible investment,link,http://www.businessinsider.com/game-of-thrones-economics-2015-3,2015-03-22 03:30:00,,957,43,175,957,0,0,0,0,0
18468761129_10152936931436130,NIGHTMARE.,These Terrifying Carnivorous Fish Will Make You Think Twice About Murky Water,link,http://www.huffingtonpost.com/2015/03/19/meat-eating-carnivorous-fish-brazil-feed-video_n_6904428.html?ncid=fcbklnkushpmg00000063,2015-03-22 02:30:11,,712,94,404,712,0,0,0,0,0
18468761129_10152936878616130,Time for a stroll?,World's Most Dangerous Walkway Set To Reopen Next Week,link,http://www.huffingtonpost.com/2015/03/20/worlds-most-dangerous-walkway-caminito-del-rey_n_6894360.html?ncid=fcbklnkushpmg00000063,2015-03-22 01:30:11,,8605,501,4448,8605,0,0,0,0,0
18468761129_10152936825911130,Powerful.,Animals At 'Gunpoint' Posters Will Make You Rethink Your Next Purchase,link,http://www.huffingtonpost.com/2015/03/20/surfrider-animals-at-gunpoint_n_6899036.html?ncid=fcbklnkushpmg00000063,2015-03-22 00:30:10,,6417,150,2469,6417,0,0,0,0,0
18468761129_10152936749721130,"""In this madness, our work as surgeons is to save as many lives as we can. Sometimes we succeed, and sometimes we fail. It is as if we repair the damage that the war left.""","Syrian Surgeon, Supported By Doctors Without Borders, Performs His First C-Section While Under Siege",link,http://www.huffingtonpost.com/2015/03/19/syria-maternal-health_n_6903338.html?ncid=fcbklnkushpmg00000063,2015-03-21 23:30:13,,1283,26,124,1283,0,0,0,0,0
18468761129_10152936676701130,"March Sadness, epitomized.",Villanova Crying Piccolo Player Captures The Emotional Roller Coaster That Is March Madness,link,http://www.huffingtonpost.com/2015/03/21/villanova-crying-piccolo-player_n_6917558.html?ncid=fcbklnkushpmg00000063,2015-03-21 22:35:08,,2657,242,381,2657,0,0,0,0,0
18468761129_10152936669581130,Because happiness looks good on you.,34 Ways To Feel Happier Right Now,link,http://www.huffingtonpost.com/2015/03/20/how-to-feel-happier-yippee_n_6887702.html?ncid=fcbklnkushpmg00000063,2015-03-21 22:30:14,,1718,46,1097,1718,0,0,0,0,0
18468761129_10152936585306130,Mental illness doesn't discriminate against age or gender -- or even celebrity status.,9 Celebrity Quotes That Will Change The Way You View Mental Illness,link,http://www.huffingtonpost.com/2015/03/20/celeb-quotes-on-mental-illness_n_6850256.html?ncid=fcbklnkushpmg00000063,2015-03-21 21:30:18,,5381,132,1499,5381,0,0,0,0,0
18468761129_10152936543406130,"""It is unfortunate that this important information is being miscommunicated in the media.""",Concussion Experts Pick Apart The Myth That Cycling Is More Dangerous Than Football,link,http://www.huffingtonpost.com/2015/03/20/football-biking-bicycling-nfl_n_6909714.html?ncid=fcbklnkushpmg00000063,2015-03-21 21:00:09,,274,34,43,274,0,0,0,0,0
18468761129_10152936502896130,"This celeb's mobile home has no heat or air, but you'll still want to live there.",'Pretty Little Liars' Star Lives In A (Tricked-Out) Mobile Home,link,http://www.huffingtonpost.com/2015/03/20/nia-peeples-home-trailer-tour_n_6904818.html?ncid=fcbklnkushpmg00000063,2015-03-21 20:30:21,,1975,142,225,1975,0,0,0,0,0
18468761129_10152936457866130,There's never been a better time to get out and experience the world.,5 Reasons You Should Quit Your Job To Travel Now,link,http://www.huffingtonpost.com/clayton-b-cornell/5-reasons-you-should-quit-your-job-to-travel-now_b_6907720.html?ncid=fcbklnkushpmg00000063,2015-03-21 20:00:09,,5100,571,1751,5100,0,0,0,0,0
18468761129_10152936402271130,"No. 5: You're amazed at how easily your spouse meets new people, while you tend to keep to your smaller circle of close friends.",9 Signs You're In An Introvert-Extrovert Relationship,link,http://www.huffingtonpost.com/2015/03/19/signs-youre-in-an-introvert-extrovert-marriage_n_6849560.html?ncid=fcbklnkushpmg00000063,2015-03-21 19:30:19,,2521,218,958,2521,0,0,0,0,0
18468761129_10152936326996130,"""Anytime I start doubting my new curves or war wounds I look around the room and ask myself, how many other people in this room grew two people inside their body at once?""",The Meaningful Lesson This Mom Blogger Learned When Photos Of Her Body Went Viral,link,http://www.huffingtonpost.com/2015/03/19/joanna-venditti-postpartum-body_n_6894740.html?ncid=fcbklnkushpmg00000063,2015-03-21 19:00:10,,2652,101,138,2652,0,0,0,0,0
18468761129_10152936222571130,President Barack Obama says he looks forward to getting more sleep after leaving office.,,video,https://www.facebook.com/HuffingtonPost/videos/10152936222571130/,2015-03-21 18:30:00,03:21,1044,144,155,1044,0,0,0,0,0
18468761129_10152936194946130,"President Barack Obama tells HuffPost that student athletes ""need to be taken better care of.""",,video,https://www.facebook.com/HuffingtonPost/videos/10152936194946130/,2015-03-21 17:55:00,02:08,353,59,70,353,0,0,0,0,0
18468761129_10152936200526130,"President Barack Obama makes a sober assessment of nuclear talks with Iran: ""They have not yet made the kind of concessions that are I think going to be needed.""",,video,https://www.facebook.com/HuffingtonPost/videos/10152936200526130/,2015-03-21 17:38:25,02:47,733,87,130,733,0,0,0,0,0
18468761129_10152936164871130,President Barack Obama tells HuffPost that he dismisses Israeli Prime Minister Benjamin Netanyahu's backtrack on Palestinian statehood.,,video,https://www.facebook.com/HuffingtonPost/videos/10152936164871130/,2015-03-21 17:14:28,03:17,2558,349,1012,2558,0,0,0,0,0
18468761129_10152936115456130,"""An immediate step that the NCAA could take -- that some conferences have already taken -- is if you offer a scholarship to a kid coming into school, that scholarship sticks, no matter what. It doesn't matter whether they get cut, it doesn't matter whether they get hurt. You are now entering into a bargain and responsible for them.""",Obama Calls On NCAA To Rethink The Way It Protects And Punishes Athletes,link,http://www.huffingtonpost.com/2015/03/21/obama-ncaa-scholarships_n_6911804.html?ncid=fcbklnkushpmg00000063,2015-03-21 16:45:09,,1933,116,196,1933,0,0,0,0,0
18468761129_10152936079591130,"""We take him at his word when he said that [a two-state solution] wouldn't happen during his prime ministership, and so that's why we've got to evaluate what other options are available to make sure that we don't see a chaotic situation in the region.""",Obama Details His Disappointment With Netanyahu In First Post-Election Comments,link,http://www.huffingtonpost.com/2015/03/21/obama-iran-deal_n_6905634.html?ncid=fcbklnkushpmg00000063,2015-03-21 16:24:07,,989,138,109,989,0,0,0,0,0
18468761129_10152935935811130,"Hey, nutritionists get hangry too.",10 Nutritionists Reveal What They'd Order If They <em>Had</em> To Eat At McDonald's,link,http://www.huffingtonpost.com/2015/03/19/healthy-mcdonalds-what-to-order_n_6886068.html?ncid=fcbklnkushpmg00000063,2015-03-21 15:01:06,,423,106,89,423,0,0,0,0,0
18468761129_10152935887726130,"""I'd like to FaceTime with some pizza.""",The Funniest Tweets From Women This Week,link,http://www.huffingtonpost.com/2015/03/21/best-tweets-women-on-twitter_n_6884892.html?ncid=fcbklnkushpmg00000063,2015-03-21 14:31:07,,1750,39,143,1750,0,0,0,0,0
18468761129_10152935841586130,Coming later today: Our full interview with President Barack Obama.,,video,https://www.facebook.com/HuffingtonPost/videos/10152935841586130/,2015-03-21 14:17:00,00:10,486,62,44,486,0,0,0,0,0
18468761129_10152935829271130,You may have been doing toilet paper wrong this whole time.,This 124-Year-Old Patent Reveals The Right Way To Use Toilet Paper,link,http://www.huffingtonpost.com/2015/03/17/toilet-paper-actually-goes-over_n_6887724.html?ncid=fcbklnkushpmg00000063,2015-03-21 14:01:12,,3826,434,2840,3826,0,0,0,0,0
18468761129_10152935512636130,Here's when to catch the round of 32. #MarchMadness,Here Is The March Madness Weekend TV Schedule,link,http://www.huffingtonpost.com/2015/03/21/march-madness-schedule-saturday-sunday_n_6915486.html?ncid=fcbklnkushpmg00000063,2015-03-21 13:30:01,,81,2,7,81,0,0,0,0,0
18468761129_10152935687476130,"In honor of World Down Syndrome Day, we'd like to introduce you to Squishy, who is SO adorable!",This Little Girl With Down Syndrome Will Totally Steal Your Heart,link,http://www.huffingtonpost.com/2015/03/21/down-syndrome-baby-photos-interview_n_6912138.html?ncid=fcbklnkushpmg00000063,2015-03-21 13:00:50,,15310,251,1817,15310,0,0,0,0,0
18468761129_10152935636811130,Here's where you get some real bang for your buck.,The 10 Airlines With The Best Economy Class Seats,link,http://www.huffingtonpost.com/hoppercom/the-10-airlines-with-the-_b_6888280.html?ncid=fcbklnkushpmg00000063,2015-03-21 12:30:13,,1134,119,477,1134,0,0,0,0,0
18468761129_10152935584116130,Hooray for some real competition!,Cable Companies Should Be Seriously Terrified Of Apple Right Now,link,http://www.huffingtonpost.com/2015/03/17/apple-tv-service_n_6887956.html?ncid=fcbklnkushpmg00000063,2015-03-21 12:00:32,,9290,419,2370,9290,0,0,0,0,0
18468761129_10152935527171130,"""I wanted to show them as real people, humans.""",These Striking Portraits Of Porn Stars Shine A Different Light On XXX Actors,link,http://www.huffingtonpost.com/2015/03/16/porn-star-portraits-roger-kisby_n_6881234.html?ncid=fcbklnkushpmg00000063,2015-03-21 11:30:12,,1612,217,168,1612,0,0,0,0,0
18468761129_10152935472391130,So cool!,WATCH: Drone Captures Jaw-Dropping Footage Inside World's Largest Cave,link,http://www.huffingtonpost.com/2015/03/16/hang-son-doong-drone-worlds-largest-cave-vietnam_n_6882916.html?ncid=fcbklnkushpmg00000063,2015-03-21 11:00:09,,2629,83,817,2629,0,0,0,0,0
18468761129_10152935456506130,A sneak preview of what's to come in the rest of our exclusive interview with President Barack Obama. We'll have video later!,Timeline Photos,photo,https://www.facebook.com/HuffingtonPost/photos/a.443444786129.234228.18468761129/10152935456506130/?type=3,2015-03-21 10:51:41,,6098,150,267,6098,0,0,0,0,0
18468761129_10152935401811130,Now imagine if Carmen Sandiego had this!,How To Plan The Best Road Trip Ever,link,http://www.huffingtonpost.com/2015/03/15/plan-a-road-trip_n_6839764.html?ncid=fcbklnkushpmg00000063,2015-03-21 10:30:12,,3558,270,1417,3558,0,0,0,0,0
18468761129_10152935345321130,100 years in one minute.,Watch '100 Years Of Korean Beauty' Unfold In One Minute,link,http://www.huffingtonpost.com/2015/03/17/100-years-of-korean-beauty_n_6887726.html?ncid=fcbklnkushpmg00000063,2015-03-21 10:00:57,,2475,79,425,2475,0,0,0,0,0
18468761129_10152935293366130,Why our furry little friends are so good for us.,11 Reasons Your Crazy Cat Obsession Makes You Happier And Healthier,link,http://www.huffingtonpost.com/2015/03/15/how-cats-help-us_n_6809820.html?ncid=fcbklnkushpmg00000063,2015-03-21 09:30:21,,12577,984,7273,12577,0,0,0,0,0
18468761129_10152935142476130,It might mean you're a perfectionist!,"The Psychology Of Nail-Biting, Skin-Picking And Other Compulsive Behaviors",link,http://www.huffingtonpost.com/2015/03/13/nail-biting-nervous-habits_n_6854152.html?ncid=fcbklnkushpmg00000063,2015-03-21 08:30:22,,6183,741,4870,6183,0,0,0,0,0
18468761129_10152935033426130,"""This distrust of women's feelings is so ingrained, so commonplace that I'm not even sure we (men) realize it exists.""",Men Just Don't Trust Women -- And It's A Huge Problem,link,http://www.huffingtonpost.com/damon-young/men-just-dont-trust-women_b_6714280.html?ncid=fcbklnkushpmg00000063,2015-03-21 07:30:17,,4949,679,2545,4949,0,0,0,0,0
18468761129_10152934620461130,#4. Make a pleasant breakfast your daily ritual.,6 Ways To Find Lasting Happiness After 50,link,http://www.huffingtonpost.com/margaret-manning/find-lasting-happiness-after-50_b_6894794.html?ncid=fcbklnkushpmg00000063,2015-03-21 01:30:17,,621,30,216,621,0,0,0,0,0
