status_id,status_message,link_name,status_type,status_link,status_published,status_video_length,num_reactions,num_comments,num_shares,num_likes,num_loves,num_wows,num_hahas,num_sads,num_angrys
199098633470668_2289738817739962,It looks like the next iOS update will finally solve one of the most irritating problems when it comes to mobile phone photos.,iOS 9 Update To Solve The Most Annoying Thing About Your Mobile Phone Photos | The LAD Bible,link,http://www.theladbible.com/articles/ios-9-adds-separate-folders-for-selfies-and-screenshots,2015-07-09 06:10:54,,1885,584,154,1885,0,0,0,0,0
199098633470668_2289670617746782,When you think you've made it...,,video,https://www.facebook.com/LADbible/videos/2289670617746782/,2015-07-09 05:27:20,00:10,45724,8519,7687,45724,0,0,0,0,0
199098633470668_2289627604417750,"547 people have been killed by police in the US in the first 6 months of 2015, 503 of them by gunshot. New statistics reveal that Norway has the lowest level of gun use.",Police In Norway Only Fired Two Bullets Last Year And Not A Single Person Was Killed | The LAD Bible,link,http://www.theladbible.com/articles/police-in-norway-only-fired-two-bullets-last-year-and-noone-was-killed,2015-07-09 04:56:14,,18202,1067,1438,18202,0,0,0,0,0
199098633470668_2288805714499939,This lad attempted to grind down a risky rail and ended it in what looks like one of the most painful fails we've ever seen...,Skater Tries To Grind Down Risky Rail And Ends In Horrific Faceplant | The LAD Bible,link,http://www.theladbible.com/articles/this-has-to-be-one-of-the-worst-skateboarding-injuries-you-ll-see,2015-07-09 02:30:00,,2395,928,669,2395,0,0,0,0,0
199098633470668_2288756757838168,When your nan tries to set you up,Timeline Photos,photo,https://www.facebook.com/LADbible/photos/a.200542726659592.50788.199098633470668/2288756757838168/?type=3,2015-07-09 01:30:00,,66715,5097,863,66715,0,0,0,0,0
199098633470668_2288822397831604,"Since the legalisation of recreational marijuana, there are now more weed shops in this West Coast state than there are McDonald's or Starbucks.",State In America Has More Weed Shops Than McDonald's Or Starbucks | The LAD Bible,link,http://www.theladbible.com/articles/this-state-in-america-has-more-weed-shops-than-mcdonald-s-or-starbucks,2015-07-08 23:00:01,,6337,332,247,6337,0,0,0,0,0
199098633470668_2288735587840285,True story,Timeline Photos,photo,https://www.facebook.com/LADbible/photos/a.200542726659592.50788.199098633470668/2288735587840285/?type=3,2015-07-08 22:00:01,,61509,1229,4322,61509,0,0,0,0,0
199098633470668_2288768457836998,Comedy Central have announced that South Park WILL continue for at least another 3 seasons! Matt Stone and Trey Parker are definitely here to stay...,South Park Has Been Renewed Until 2019 By Comedy Central | The LAD Bible,link,http://www.theladbible.com/articles/south-park-has-been-renewed-for-three-more-seasons,2015-07-08 20:54:01,,7070,339,267,7070,0,0,0,0,0
199098633470668_2288851667828677,Awesome selfie!,Mobile Uploads,photo,https://www.facebook.com/LADbible/photos/a.619797954734065.1073741825.199098633470668/2288851667828677/?type=3,2015-07-08 20:05:14,,33018,315,223,33018,0,0,0,0,0
199098633470668_2288818237832020,Snapchat game strong...,Timeline Photos,photo,https://www.facebook.com/LADbible/photos/a.200542726659592.50788.199098633470668/2288818237832020/?type=3,2015-07-08 19:23:18,,41396,1879,464,41396,0,0,0,0,0
199098633470668_2288787834501727,Pornhub have revealed 18-34 year olds' favourite pornstar along with all the weird kind of stuff that they watch... Who knew Hentai was so popular.,Pornhub Study Reveals Viewing Habits Of 18-34 Year Olds | The LAD Bible,link,http://www.theladbible.com/articles/pornhub-study-reveals-viewing-habits-of-18-34-year-olds,2015-07-08 18:45:52,,2395,789,171,2395,0,0,0,0,0
199098633470668_2288744064506104,"Prepare for some serious nostalgia, lads. The Goosebumps movie is on it's way and the trailer has just landed.",The Goosebumps Movie Trailer Has Just Been Released | The LAD Bible,link,http://www.theladbible.com/articles/the-new-goosebumps-movie-has-an-official-poster-and-we-only-get-the-trailer-if-we-tweet-about-it,2015-07-08 18:06:04,,15502,3240,3346,15502,0,0,0,0,0
199098633470668_2288640487849795,"Charles Bronson is one of the most notorious criminals in the world, but you may not have known that he's raised £250,000 for charity whilst he has been behind bars.","Notorious Criminal Charles Bronson Has Helped Raise Over £250,000 For Charity From Behind Bars |...",link,http://www.theladbible.com/articles/notorious-criminal-charles-bronson-has-helped-raise-over-ps250-000-for-charity-from-behind-bars,2015-07-08 16:54:15,,9167,621,910,9167,0,0,0,0,0
199098633470668_2288607197853124,"Remember the dad who dressed up as Spiderman to cheer up his terminally ill son? Well he's back with an incredible short film in memory of his late son, Jayden. This is brilliant...",The Spider-Dad Created A Brilliant Short Film To Raise Money For Terminally Ill Children,link,http://www.theladbible.com/articles/the-amazing-spiderdad-is-back-and-needs-some-help,2015-07-08 16:34:56,,5227,153,803,5227,0,0,0,0,0
199098633470668_2288538424526668,That haircut...,,video,https://www.facebook.com/LADbible/videos/2288538424526668/,2015-07-08 15:59:35,00:26,37494,6060,4908,37494,0,0,0,0,0
199098633470668_2288488481198329,"A man with superhuman strength managed to pin two police officers to the floor before escaping, and it was all caught on camera...",Man With Superhuman Strength Pins Down Two Policemen And Isn't Arrested | The LAD Bible,link,http://www.theladbible.com/articles/man-with-superhuman-strength-overpowers-two-police-officers-and-escapes-in-shocking-video,2015-07-08 15:29:24,,7325,1859,1346,7325,0,0,0,0,0
199098633470668_2288420291205148,Greece...,Timeline Photos,photo,https://www.facebook.com/LADbible/photos/a.200542726659592.50788.199098633470668/2288420291205148/?type=3,2015-07-08 14:48:00,,165293,3878,9916,165293,0,0,0,0,0
199098633470668_2288374807876363,"Young Muslims in the US have got together and managed to raise a staggering $30,000 to help repair black churches destroyed by fire.","Young Muslims Raise $30,000 To Help Repair Black Churches Destroyed By Fire | The LAD Bible",link,http://www.theladbible.com/articles/young-muslims-raise-30-000-to-help-repair-black-churches-destroyed-by-fire,2015-07-08 14:16:17,,16452,410,1474,16452,0,0,0,0,0
199098633470668_2288331247880719,So true...,Timeline Photos,photo,https://www.facebook.com/LADbible/photos/a.200542726659592.50788.199098633470668/2288331247880719/?type=3,2015-07-08 13:47:36,,75756,1779,1507,75756,0,0,0,0,0
199098633470668_2288266971220480,"Today, a series of events has made Americans think the end of the world is upon us and we should all get our tin foil hats out, stock up on canned goods and head for the bunkers.",Americans Are Freaking Out Because They Think It's The End Of The World | The LAD Bible,link,http://www.theladbible.com/articles/wall-street-stopped-trading-united-airlines-flights-were-grounded-and-americans-think-the-apocalypse-is-near,2015-07-08 13:16:06,,4001,1102,416,4001,0,0,0,0,0
199098633470668_2288183351228842,American police vs English police,,video,https://www.facebook.com/LADbible/videos/2288183351228842/,2015-07-08 12:47:06,00:16,42211,1691,5094,42211,0,0,0,0,0
199098633470668_2288192541227923,,Timeline Photos,photo,https://www.facebook.com/LADbible/photos/a.200542726659592.50788.199098633470668/2288192541227923/?type=3,2015-07-08 12:38:29,,96873,6310,2297,96873,0,0,0,0,0
199098633470668_2288143104566200,"After a cougar tried to kill his dog during a fishing trip, this lad punched it square in the face...",Lad Punched Cougar In The Face To Save His Dog | The LAD Bible,link,http://www.theladbible.com/articles/this-lad-punched-a-cougar-in-the-face-because-he-didn-t-want-him-to-eat-his-pet-dog,2015-07-08 12:03:57,,8642,590,464,8642,0,0,0,0,0
199098633470668_2288062844574226,Just a group of sheep pretending that the floor is lava...,,video,https://www.facebook.com/LADbible/videos/2288062844574226/,2015-07-08 11:23:49,00:29,44282,6398,5876,44282,0,0,0,0,0
199098633470668_2288001124580398,This footage of a man having a rat pulled from his bellybutton during an exorcism is the weirdest thing you'll see today.,Watch This Man Have A Rat Pulled From His Stomach During An Exorcism | The LAD Bible,link,http://www.theladbible.com/articles/watch-this-man-have-a-rat-pulled-from-his-stomach-during-an-exorcism,2015-07-08 10:57:19,,3316,5160,1770,3316,0,0,0,0,0
199098633470668_2287923701254807,Last week Russell Brand said he would go to Syria if he could fly first class - these two soldiers who have just come back from fighting ISIS have called him out.,,video,https://www.facebook.com/LADbible/videos/2287923701254807/,2015-07-08 10:08:00,00:49,44273,1938,11172,44273,0,0,0,0,0
199098633470668_2287879947925849,The salaries of the cast from The Simpsons has been revealed and it's ridiculous... so much Doh!,Here's What The Simpsons Cast Are Being Paid For The Next Two Seasons | The LAD Bible,link,http://www.theladbible.com/articles/the-cast-of-the-simpsons-are-still-making-an-absurd-amount-of-money,2015-07-08 09:34:51,,1928,230,115,1928,0,0,0,0,0
199098633470668_2287831997930644,When you can't afford the train...,Timeline Photos,photo,https://www.facebook.com/LADbible/photos/a.200542726659592.50788.199098633470668/2287831997930644/?type=3,2015-07-08 09:06:56,,123846,7901,11491,123846,0,0,0,0,0
199098633470668_2287774277936416,"This lad dropped a shovel and it sounds exactly like ""Smells Like Teen Spirit"".",,video,https://www.facebook.com/LADbible/videos/2287774277936416/,2015-07-08 08:31:59,00:10,78650,25836,29011,78650,0,0,0,0,0
199098633470668_2287746507939193,"""My coworker took a nap on his break...""",Timeline Photos,photo,https://www.facebook.com/LADbible/photos/a.200542726659592.50788.199098633470668/2287746507939193/?type=3,2015-07-08 08:10:28,,24181,1857,1212,24181,0,0,0,0,0
199098633470668_2287714671275710,45 ISIS militants have been killed after breaking their Ramadan fast and eating a meal laced with poison. Karma?,45 ISIS Extremists Die After Eating Poisoned Meal In Iraq | The LAD Bible,link,http://www.theladbible.com/articles/45-isis-fighters-are-killed-after-breaking-their-fast-with-a-poisoned-meal,2015-07-08 07:46:22,,46992,3014,3783,46992,0,0,0,0,0
199098633470668_2287695304610980,"Students, brace yourselves... This round of budget cuts looks like it's going to hit you the worst.",Maintenance Grants Set To Be Scrapped In Today's Budget Cuts | The LAD Bible,link,http://www.theladbible.com/articles/maintenance-grants-for-students-from-low-income-families-will-be-turned-into-loans,2015-07-08 07:30:00,,3324,773,799,3324,0,0,0,0,0
199098633470668_2287640201283157,One policeman made this little lad's day after he gave him a 'parking ticket' for his tricycle...,"Little Lad Recieves 'Parking Ticket' For His Tricycle, His Reaction Is Priceless | The LAD Bible",link,http://www.theladbible.com/articles/three-year-old-in-a-tricycle-gets-pulled-over-by-a-cop,2015-07-08 06:40:28,,8403,268,612,8403,0,0,0,0,0
199098633470668_2287563477957496,"Wait for the drop...

Via: Mashd N Kutcher",,video,https://www.facebook.com/LADbible/videos/2287563477957496/,2015-07-08 05:40:01,00:17,25420,6620,5482,25420,0,0,0,0,0
199098633470668_2287533761293801,"Piers Morgan hosted a Q&A on Twitter yesterday, and of course it back fired hilariously... He was asking for trouble here.",Piers Morgan's Q&A Backfiring Is Exactly Why We Love The Internet | The LAD Bible,link,http://www.theladbible.com/articles/piers-morgan-did-a-q-a-on-twitter-today-and-it-didn-t-go-to-plan,2015-07-08 05:05:36,,2487,260,573,2487,0,0,0,0,0
199098633470668_2287482347965609,"""Chris, you're GQ's man of the year. Can you show us some poses?""",Timeline Photos,photo,https://www.facebook.com/LADbible/photos/a.200542726659592.50788.199098633470668/2287482347965609/?type=3,2015-07-08 04:16:12,,42868,1559,679,42868,0,0,0,0,0
199098633470668_2287387404641770,"One lad is putting up these hilarious posters asking for someone to be his best friend, tag team partner, or to help him break someone out of prison. These are brilliant!",Irish Man Puts Up Hilarious Posters Looking For A 'Best Friend' | The LAD Bible,link,http://www.theladbible.com/articles/irish-man-puts-up-posters-looking-for-best-friend-and-help-with-a-prison-escape,2015-07-08 02:33:13,,2677,220,390,2677,0,0,0,0,0
199098633470668_2287027091344468,"Every apprentice...

Credit: On The Tools",,video,https://www.facebook.com/LADbible/videos/2287027091344468/,2015-07-08 01:45:00,02:22,26421,5256,6574,26421,0,0,0,0,0
199098633470668_2286669538046890,"This little lad is Camden Eubank, he suffers from Apraxia and finds it difficult to interact in social situations, which means he has a tough time making friends. Like any lad who's about to turn 10, Camden wanted a big party, and the power of social media made this an incredible reality.",Internet Comes Together To Make Ten-Year-Old Apraxia Sufferer's Birthday One He'll Never Forget,link,http://www.theladbible.com/articles/internet-comes-together-to-make-ten-year-old-apraxia-sufferer-s-birthday-one-he-ll-never-forget,2015-07-08 01:12:01,,1772,41,64,1772,0,0,0,0,0
199098633470668_2287023081344869,How to drive in GTA,,video,https://www.facebook.com/LADbible/videos/2287023081344869/,2015-07-08 00:00:00,00:12,30270,4152,2279,30270,0,0,0,0,0
199098633470668_2287049174675593,Introducing one of the best bosses in the world... This lad pays for his staff to go on holiday every year just to keep their morale up.,Boss Pays For His Staff To Go On Holiday Every Year To Keep Morale Up | The LAD Bible,link,http://www.theladbible.com/articles/the-ceo-of-a-us-based-tech-company-buys-each-of-his-employees-a-holiday-every-year-to-keep-their-morale-up,2015-07-07 23:08:00,,40448,2949,6819,40448,0,0,0,0,0
199098633470668_2286501844730326,This incredible house built into a cliff face overlooking the sea looks like something a supervillain would live in... But who's going to clean the windows?,This Awesome Cliff House Is A Criminal Lair Waiting To Happen | The LAD Bible,link,http://www.theladbible.com/articles/staggeringly-cool-prototype-cliff-house-is-a-criminal-lair-waiting-to-happen,2015-07-07 22:03:00,,10997,841,771,10997,0,0,0,0,0
199098633470668_2287004961346681,When you can't afford a selfie stick...,Timeline Photos,photo,https://www.facebook.com/LADbible/photos/a.200542726659592.50788.199098633470668/2287004961346681/?type=3,2015-07-07 21:01:01,,14780,564,399,14780,0,0,0,0,0
199098633470668_2286519568061887,These lads have invented a new type of beer pong cup that means no more flat and dirty beer... Why has nobody thought of this sooner?,Lads Invent New Type Of Beer Pong Cup And It's A Definite Game-Changer | The LAD Bible,link,http://www.theladbible.com/articles/clever-invention-will-make-dirty-beer-pong-a-thing-of-the-past,2015-07-07 19:56:00,,8384,4176,1807,8384,0,0,0,0,0
199098633470668_2287075391339638,True story...,Timeline Photos,photo,https://www.facebook.com/LADbible/photos/a.200542726659592.50788.199098633470668/2287075391339638/?type=3,2015-07-07 19:25:00,,18271,240,765,18271,0,0,0,0,0
199098633470668_2287084068005437,"Once again Johnny Depp is proving he's one of the good guys in Hollywood. He left the set of the new Pirates of the Caribbean film in order to see some children in a local hospital, while dressed as Captain Jack Sparrow.",Johnny Depp Visits Kids In Hospital Dressed As Captain Jack Sparrow | The LAD Bible,link,http://www.theladbible.com/articles/johnny-depp-rocks-up-to-children-s-hospital-dressed-as-jack-sparrow-and-makes-their-day,2015-07-07 18:55:07,,26353,484,1473,26353,0,0,0,0,0
199098633470668_2287031441344033,"This guy with a camera is hellbent on making a police officer look like an idiot. Unfortunately for him, he came across a true professional and immediately regretted it.",Guy Tries To Play Smart With A Police Officer And Ends Up Looking Stupid | The LAD Bible,link,http://www.theladbible.com/articles/extremely-professional-police-officer,2015-07-07 18:06:35,,15255,1700,3028,15255,0,0,0,0,0
199098633470668_2286978998015944,Lad's holidays just got a lot cheaper. Ryanair's 30th birthday announcement has made a lot of people happy...,Ryanair Have Announced Ridiculously Cheap Flights For Their 30th Birthday | The LAD Bible,link,http://www.theladbible.com/articles/ryanair-selling-crazily-cheap-flights-to-celebrate-its-30th-anniversary,2015-07-07 17:27:52,,3682,3314,1078,3682,0,0,0,0,0
199098633470668_2286930284687482,What a time to be alive.,Timeline Photos,photo,https://www.facebook.com/LADbible/photos/a.200542726659592.50788.199098633470668/2286930284687482/?type=3,2015-07-07 16:57:41,,14638,841,535,14638,0,0,0,0,0
199098633470668_2286848174695693,He knew it was coming...,Timeline Photos,photo,https://www.facebook.com/LADbible/photos/a.200542726659592.50788.199098633470668/2286848174695693/?type=3,2015-07-07 16:26:06,,67219,7355,2293,67219,0,0,0,0,0
199098633470668_2286792078034636,"After saying he would leave The Simpsons, the voice of Mr. Burns, Principal Skinner, Ned Flanders and many more will be returning to the show.",Harry Shearer Will Return To The Simpsons | The LAD Bible,link,http://www.theladbible.com/articles/voice-of-mr-burns-harry-shearer-is-not-leaving-the-simpsons-after-all,2015-07-07 15:47:33,,3316,214,112,3316,0,0,0,0,0
199098633470668_2286741768039667,"Stop everything, Pizza Hut and KFC decided to create some pizza-flavoured chicken wings and it looks like one of the best combos since Kenan & Kel.",KFC And Pizza Hut Just Created Pizza-Flavoured Chicken Wings | The LAD Bible,link,http://www.theladbible.com/articles/the-kfc-pizza-crossover-exists-and-it-looks-amazing,2015-07-07 15:17:59,,20535,5965,3796,20535,0,0,0,0,0
199098633470668_2286621144718396,"From filming himself playing games to brokering massive video deals, PewDiePie got himself sorted in 2014. He also made a load of money in the process...",YouTuber PewDiePie Earned A Ridiculous Amount Of Money In 2014 | The LAD Bible,link,http://www.theladbible.com/articles/youtuber-pewdiepie-earned-a-lot-more-money-than-anyone-else-did-in-2014,2015-07-07 14:10:58,,6718,1713,419,6718,0,0,0,0,0
199098633470668_2286563248057519,After getting ridiculously drunk this woman scratched and bit her boyfriend because he wouldn't have sex with her.,Drunk Woman Viciously Attacks Her Boyfriend Because He Refused Her Sex | The LAD Bible,link,http://www.theladbible.com/articles/drunk-woman-viciously-attacks-her-boyfriend-because-he-refused-her-sex,2015-07-07 13:31:48,,4155,5383,1038,4155,0,0,0,0,0
199098633470668_2286518844728626,Everyone's going to be trying this...,,video,https://www.facebook.com/LADbible/videos/2286518844728626/,2015-07-07 13:10:26,00:10,25470,1440,1531,25470,0,0,0,0,0
199098633470668_2286468111400366,Fake scratch card prank,,video,https://www.facebook.com/LADbible/videos/2286468111400366/,2015-07-07 12:33:27,02:10,14419,1553,1705,14419,0,0,0,0,0
199098633470668_2286407594739751,Meet the Canadian ex-model who quit her job to go and fight on the front line against ISIS.,This Canadian Model Quit Her Job So She Could Go And Fight ISIS | The LAD Bible,link,http://www.theladbible.com/articles/a-canadian-model-went-to-fight-isis-and-has-spoken-about-some-of-the-things-she-saw,2015-07-07 11:51:21,,6821,333,195,6821,0,0,0,0,0
199098633470668_2286298274750683,"Kim Jong-Un has made some outrageous claims during his time in power, but this could be our favourite. Next he'll be telling us he lives next door to 2Pac.",Kim Jong-Un Claims He's Found A Unicorn Lair And We Definitely Believe Him... | The LAD Bible,link,http://www.theladbible.com/articles/kim-jong-un-claims-north-korea-have-discovered-a-unicorn-lair-underneath-a-temple-and-we-completely-believe-him,2015-07-07 10:28:34,,13146,2487,2155,13146,0,0,0,0,0
199098633470668_2286260091421168,"One woman live tweeted what sounds like one of the worst first dates ever. How can one man be so cringey? If you ever want to reach a second, avoid everything this guy did...",Woman Live Tweets What Could Possibly Be The Worst Date Of All Time | The LAD Bible,link,http://www.theladbible.com/articles/a-woman-live-tweeted-an-absolutely-terrible-first-date,2015-07-07 09:57:48,,10156,894,728,10156,0,0,0,0,0
199098633470668_2286202721426905,There's always that one kid on sports day...,Timeline Photos,photo,https://www.facebook.com/LADbible/photos/a.200542726659592.50788.199098633470668/2286202721426905/?type=3,2015-07-07 09:15:37,,35167,2631,1029,35167,0,0,0,0,0
199098633470668_2286120738101770,"Micah was diagnosed with Down's Syndrome when he was 3 months old, but that hasn't stopped him landing a big modelling contract.",Little Lad With Down's Syndrome Lands Modelling Contract | The LAD Bible,link,http://www.theladbible.com/articles/11-month-old-son-suffering-with-down-syndrome-scores-modeling-contract-with-the-same-agency-as-his-mum,2015-07-07 08:43:17,,8701,165,218,8701,0,0,0,0,0
199098633470668_2286040568109787,"""Life is about wearing hats and looking fabulous""
Credit: Wayne gormley",,video,https://www.facebook.com/LADbible/videos/2286040568109787/,2015-07-07 07:59:55,00:24,92761,82680,92421,92761,0,0,0,0,0
199098633470668_2286016961445481,"This guy found out that the easiest way to annoy a judge is to drop a massive fart in the middle of court.
(Via: The LAD Bible Oz)","Lad Drops A Huge Fart In Court, Judge Loses It | The LAD Bible",link,http://www.theladbible.com/articles/guy-drops-an-epic-fart-in-court,2015-07-07 07:35:43,,6088,1624,868,6088,0,0,0,0,0
199098633470668_2285965501450627,Have you ever been so tired you confused a calculator cover for a mobile.,,video,https://www.facebook.com/LADbible/videos/2285965501450627/,2015-07-07 07:03:49,00:48,43820,4126,2770,43820,0,0,0,0,0
199098633470668_2285921398121704,"We all remember Yanet Garcia, the Mexican weather girl. Well, she continues to gain admirers and it's clear to see why...",The Internet's Favorite Weatherwoman Had A Massive Weekend | The LAD Bible,link,http://www.theladbible.com/articles/the-internet-s-favourite-weatherwoman-had-a-huge-weekend-on-reddit,2015-07-07 06:31:26,,10439,733,343,10439,0,0,0,0,0
199098633470668_2285889131458264,When the police have a sense of humour...,,video,https://www.facebook.com/LADbible/videos/2285889131458264/,2015-07-07 05:57:57,00:11,44542,1306,2780,44542,0,0,0,0,0
199098633470668_2285862134794297,June sounds like a lucky lady...,Timeline Photos,photo,https://www.facebook.com/LADbible/photos/a.200542726659592.50788.199098633470668/2285862134794297/?type=3,2015-07-07 05:24:04,,26863,1314,1998,26863,0,0,0,0,0
199098633470668_2285843414796169,This dad decided to give his son a brutal punishment after he found out he was bullying other kids...,Dad Makes His Bully Son Fight A Professional Boxer To Teach Him A Lesson | The LAD Bible,link,http://www.theladbible.com/articles/dad-makes-his-son-fight-a-pro-boxer-to-teach-him-a-lesson-for-being-a-bully,2015-07-07 05:03:08,,17547,792,2145,17547,0,0,0,0,0
199098633470668_2285809178132926,Floyd Mayweather is no longer the WBO Welterweight Champion of the World after being stripped of the belt that he won off Manny Pacquiao.,Floyd Mayweather Officially Stripped Of WBO Welterweight Belt He Won From Pacquiao | The LAD Bible,link,http://www.theladbible.com/articles/floyd-mayweather-has-officially-been-stripped-of-his-wbo-welterweight-belt-he-won-from-manny-pacquiao,2015-07-07 04:20:06,,12936,1889,2295,12936,0,0,0,0,0
199098633470668_2285762454804265,10 years ago today 52 people lost their lives in the 7/7 bombings in London. We will never forget. RIP.,Timeline Photos,photo,https://www.facebook.com/LADbible/photos/a.200542726659592.50788.199098633470668/2285762454804265/?type=3,2015-07-07 03:29:18,,70261,665,9223,70261,0,0,0,0,0
199098633470668_2285728214807689,"This man reportedly shouted ""f*ck that alligator"" and jumped straight into alligator infested water...","Man Dies After Swearing At Alligators And Then Jumping In Their Water
 | The LAD Bible",link,http://www.theladbible.com/articles/man-mocks-an-alligator-before-getting-killed-by-it-shortly-after,2015-07-07 02:37:14,,2173,484,304,2173,0,0,0,0,0
199098633470668_2285288578184986,"Gill Hicks was the last living person to be rescued from the underground stations on this tragic day ten years ago, and had to have both of her legs amputated. If it wasn't for PC Andy Maxwell she may not have made it.",A 7/7 Survivor Broke Down In Tears After The Policeman Who Saved Her Life Came To Visit Her,link,http://www.theladbible.com/articles/a-7-7-survivor-was-reunited-with-the-officer-who-saved-her-life-exactly-ten-years-ago,2015-07-07 01:15:00,,18150,156,902,18150,0,0,0,0,0
199098633470668_2285277561519421,"""We told the new starter he had to bump start the circular saw""",,video,https://www.facebook.com/LADbible/videos/2285277561519421/,2015-07-07 00:15:00,01:13,28543,4886,7913,28543,0,0,0,0,0
199098633470668_2285148851532292,"When it comes to animals we always think of dogs as loyal, but this Bullmastiff had no problem landing his mate in the doghouse... Nobody likes a snitch.",Dog Makes a Massive Mess And His Canine Mate Rats Him Out | The LAD Bible,link,http://www.theladbible.com/articles/dog-makes-a-massive-mess-and-his-canine-mate-rats-him-out,2015-07-06 23:14:00,,8770,1884,1462,8770,0,0,0,0,0
199098633470668_2285112814869229,"Last week America challenged Japan to a giant robot battle, and of course Japan have accepted, and they're determined to win. Think Transformers meets Robot Wars and you're on the right lines... Awesome!",Japan And USA To Battle In Epic Giant Robot Duel | The LAD Bible,link,http://www.theladbible.com/articles/japan-have-responded-to-usa-s-request-for-a-robot-duel,2015-07-06 21:55:00,,4547,323,558,4547,0,0,0,0,0
