status_id,status_message,link_name,status_type,status_link,status_published,status_video_length,num_reactions,num_comments,num_shares,num_likes,num_loves,num_wows,num_hahas,num_sads,num_angrys
199098633470668_2304136342966876,"Less than a week after telling a cameraman to 'take the f*cking picture', Prince Philip is at it again...",Prince Philip Asks A Community Centre Group Of Women: 'Who Do You Sponge Off?' | The LAD Bible,link,http://www.theladbible.com/articles/prince-philip-is-causing-mischief-again,2015-07-16 11:43:09,,5250,1116,811,5250,0,0,0,0,0
199098633470668_2304066156307228,She just doesn't get it...,,video,https://www.facebook.com/LADbible/videos/2304066156307228/,2015-07-16 11:03:36,03:30,57815,18354,29558,57815,0,0,0,0,0
199098633470668_2304021832978327,Damon Albarn confirms Gorillaz will be returning and are set to start recording a new album in September.,Gorillaz Will Start Recording New Album In September | The LAD Bible,link,http://www.theladbible.com/articles/damon-albarn-confirms-that-a-new-gorillaz-album-is-in-the-works,2015-07-16 10:25:18,,25205,1602,3429,25205,0,0,0,0,0
199098633470668_2303978282982682,This exam question has gone viral because it's messing with so many students' heads. What would you do?,Professor Sets The Cruelest Exam Question Ever | The LAD Bible,link,http://www.theladbible.com/articles/professor-sets-the-cruelest-exam-question,2015-07-16 09:51:04,,7067,854,594,7067,0,0,0,0,0
199098633470668_2303934892987021,"""Fortunately, he's still not as big of a c*nt as you are. Imagine that, being a bigger c*nt than our kid.""",WATCH: Noel Gallagher Absolutely Ruins A Heckler Who Brings Up Liam During A Gig | The LAD Bible,link,http://www.theladbible.com/articles/noel-gallagher-destroys-heckler-who-asks-him-where-s-liam-at-a-gig,2015-07-16 09:19:38,,5792,812,984,5792,0,0,0,0,0
199098633470668_2303818142998696,"Extreme fishing, this is quality!",,video,https://www.facebook.com/LADbible/videos/2303818142998696/,2015-07-16 08:04:18,01:12,49613,7574,15067,49613,0,0,0,0,0
199098633470668_2303755199671657,Savage...,Timeline Photos,photo,https://www.facebook.com/LADbible/photos/a.200542726659592.50788.199098633470668/2303755199671657/?type=3,2015-07-16 07:29:47,,58553,2447,1535,58553,0,0,0,0,0
199098633470668_2303728003007710,A jet pilot flew extremely low over a beach at 700mph and caused absolute chaos on the beach below.,Jet Pilot's Low Flight Causes Mayhem For Sunbathers | The LAD Bible,link,http://www.theladbible.com/articles/jet-pilot-flies-at-700mph-over-a-beach-to-shock-sunbathers-and-send-tents-flying,2015-07-16 07:11:19,,14575,1670,2394,14575,0,0,0,0,0
199098633470668_2303643026349541,"The world's heaviest sleeper...

Via The LAD Bible Oz",,video,https://www.facebook.com/LADbible/videos/2303643026349541/,2015-07-16 06:30:00,00:25,59371,18354,12107,59371,0,0,0,0,0
199098633470668_2303595089687668,When your Nando's ends up being a little bit too cheeky.,Timeline Photos,photo,https://www.facebook.com/LADbible/photos/a.200542726659592.50788.199098633470668/2303595089687668/?type=3,2015-07-16 05:56:32,,25817,3803,889,25817,0,0,0,0,0
199098633470668_2303571696356674,"People have been falling for an iPhone scam, and it's costing them quite a bit of money... Make sure you don't fall into the trap!",Here's How Not To Fall For The iPhone Scam That Is Tricking A LOT Of People | The LAD Bible,link,http://www.theladbible.com/articles/scam-artists-are-targeting-apple-users-so-here-s-how-to-not-fall-for-it,2015-07-16 05:38:49,,3092,1624,4691,3092,0,0,0,0,0
199098633470668_2303514653029045,After pushing an off duty fireman during a holdup in a shop this guy felt the full force of justice when the fireman wipes him out.,Armed Robber Pushes Fireman During Holdup And Gets Instant Karma | The LAD Bible,link,http://www.theladbible.com/articles/armed-robber-pushes-fireman-during-holdup-and-gets-instant-karma,2015-07-16 05:01:29,,8433,320,641,8433,0,0,0,0,0
199098633470668_2303462106367633,Happy birthday Will Ferrell!,Timeline Photos,photo,https://www.facebook.com/LADbible/photos/a.200542726659592.50788.199098633470668/2303462106367633/?type=3,2015-07-16 04:40:09,,128874,2138,4980,128874,0,0,0,0,0
199098633470668_2303401519707025,This guy's got skills!,,video,https://www.facebook.com/LADbible/videos/2303401519707025/,2015-07-16 04:04:44,01:42,125714,29884,77803,125714,0,0,0,0,0
199098633470668_2303332106380633,"""I wonder how Floyd feels being beat by a woman for once."" Ronda Rousey couldn't resist taunting Floyd Mayweather after beating him to an award!",Ronda Rousey Takes Dig At Mayweather's Domestic Violence Charges | The LAD Bible,link,http://www.theladbible.com/articles/ronda-rousey-takes-dig-at-mayweather-s-domestic-violence-charges,2015-07-16 02:31:35,,5341,206,294,5341,0,0,0,0,0
199098633470668_2302959093084601,"Some nutter has mixed together archery, paintball and dodgeball, and it looks awesome! Introducing, Archery Tag...",Archery Tag Could Be The Most Fun Thing We've Ever Seen | The LAD Bible,link,http://www.theladbible.com/articles/forget-paintball-this-is-archery-tag,2015-07-16 01:00:00,,5327,1304,1581,5327,0,0,0,0,0
199098633470668_2302915253088985,Here's the real image of Pluto that NASA didn't want you to see...,Timeline Photos,photo,https://www.facebook.com/LADbible/photos/a.200542726659592.50788.199098633470668/2302915253088985/?type=3,2015-07-16 00:00:01,,48619,1354,2423,48619,0,0,0,0,0
199098633470668_2302955516418292,"I bet you never thought you'd see Rod Stewart, A$AP Rocky and James Corden singing together in a car. Well now you can...","Rod Stewart, A$AP Rocky And James Corden Doing Karaoke In A Car | The LAD Bible",link,http://www.theladbible.com/articles/james-corden-rod-stewart-and-a-ap-rocky-car-karaoke,2015-07-15 23:00:01,,10153,1134,5798,10153,0,0,0,0,0
199098633470668_2302910149756162,"Ten years ago, Lamborghini rocked up at the Geneva Motor Show in a car that no-one had ever seen before, and now it could be yours!",This One-Of-A-Kind Lamborghini Concept S Is Going Up For Auction In New York | The LAD Bible,link,http://www.theladbible.com/articles/a-one-of-a-kind-lamborghini-concept-s-is-going-up-for-auction-in-new-york,2015-07-15 22:00:00,,1733,144,77,1733,0,0,0,0,0
199098633470668_2302980569749120,This cow rescue reminds me of Jurassic Park.,Timeline Photos,photo,https://www.facebook.com/LADbible/photos/a.200542726659592.50788.199098633470668/2302980569749120/?type=3,2015-07-15 21:00:01,,50908,1055,1016,50908,0,0,0,0,0
199098633470668_2302901113090399,Eminem wrote a heartfelt letter to the late Tupac Shakur's mother and it's brilliant. He even included a drawing of his idol!,Read The Sentimental Letter That Eminem Wrote To Tupac's Mother | The LAD Bible,link,http://www.theladbible.com/articles/eminem-penned-a-letter-to-2pac-s-mother,2015-07-15 20:00:00,,5057,264,295,5057,0,0,0,0,0
199098633470668_2302889179758259,Was Morgan Freeman ever a kid or just born 60?,Timeline Photos,photo,https://www.facebook.com/LADbible/photos/a.200542726659592.50788.199098633470668/2302889179758259/?type=3,2015-07-15 19:00:01,,64350,1350,1034,64350,0,0,0,0,0
199098633470668_2302939096419934,This guy claims he's found a way of getting girls' numbers on Tinder simply by using emojis... How is it working so well?!,This Lad Set Himself The Challenge Of Getting Numbers On Tinder By Only Using Emojis | The LAD Bible,link,http://www.theladbible.com/articles/a-lad-had-set-himself-the-challenge-to-get-numbers-on-tinder-by-only-using-emojis,2015-07-15 18:19:49,,2031,802,92,2031,0,0,0,0,0
199098633470668_2302876316426212,Something is very wrong with that monitor...,Timeline Photos,photo,https://www.facebook.com/LADbible/photos/a.200542726659592.50788.199098633470668/2302876316426212/?type=3,2015-07-15 17:35:57,,23919,1017,349,23919,0,0,0,0,0
199098633470668_2302819839765193,This drunk guy managed to get himself stuck in some railings and it's hilarious...,,video,https://www.facebook.com/LADbible/videos/2302819839765193/,2015-07-15 17:07:03,01:58,40702,11758,14267,40702,0,0,0,0,0
199098633470668_2302778606435983,The guys from Prison Break have announced that they're in talks about a limited run series!,Prison Break Stars Confirm That They Could Make TV Comeback | The LAD Bible,link,http://www.theladbible.com/articles/prison-break-stars-confirm-that-talks-are-ongoing-about-the-possibility-of-a-new-series,2015-07-15 16:42:55,,22261,6710,3435,22261,0,0,0,0,0
199098633470668_2302703776443466,"This is the truly inspirational story of an ex London gang member who turned his life around after his brother got shot in a barber shop. Chris Preddie is one of the youngest people to receive an OBE, and we need to help his cause.",,video,https://www.facebook.com/LADbible/videos/2302703776443466/,2015-07-15 15:49:21,04:55,13260,404,6653,13260,0,0,0,0,0
199098633470668_2302666393113871,"This woman ordered an extra beer for her brother who died whilst serving in Iraq, and the restaurant responded perfectly...",Woman Orders Beer For Fallen Soldier Brother And Is Shown Ultimate Respect By Restaurant | The...,link,http://www.theladbible.com/articles/american-woman-orders-an-additional-beer-in-a-restaurant-for-her-brother-who-died-on-duty-in-iraq-and-the-restaurant-s-response-made-her-day,2015-07-15 15:15:53,,11076,206,778,11076,0,0,0,0,0
199098633470668_2302591656454678,So true!,Timeline Photos,photo,https://www.facebook.com/LADbible/photos/a.200542726659592.50788.199098633470668/2302591656454678/?type=3,2015-07-15 14:30:21,,78743,1549,3564,78743,0,0,0,0,0
199098633470668_2302558559791321,"People kept asking Steve-O for some footage that was filmed for Jackass that they weren't allowed to show, and it took them years to convince him to release this clip...",Steve-O Posts Previously Unseen Jackass Footage That Was Too Much For TV | The LAD Bible,link,http://www.theladbible.com/articles/steve-o-posts-previously-unseen-jackass-footage-involving-a-bb-gun-and-his-nipple-to-facebook,2015-07-15 14:02:21,,10817,1402,1751,10817,0,0,0,0,0
199098633470668_2302511433129367,"Pranking his mum after she got out of the shower... 

Credit: Jack Williams",,video,https://www.facebook.com/LADbible/videos/2302511433129367/,2015-07-15 13:33:21,01:22,25626,2493,3072,25626,0,0,0,0,0
199098633470668_2302461596467684,This woman has a message for any lads out there who think they're 'too big' for condoms...,Woman Sets out To Prove There's No Such Thing As Being 'Too Big' For A Condom | The LAD Bible,link,http://www.theladbible.com/articles/twitter-is-loving-this-woman-s-message-to-lads-who-say-they-re-too-big-for-a-condom,2015-07-15 13:01:00,,3425,1042,151,3425,0,0,0,0,0
199098633470668_2302404113140099,"We've all been there, lads...",Timeline Photos,photo,https://www.facebook.com/LADbible/photos/a.200542726659592.50788.199098633470668/2302404113140099/?type=3,2015-07-15 12:30:43,,95477,7783,3277,95477,0,0,0,0,0
199098633470668_2302365666477277,The living legend that is Leonardo DiCaprio has once again demonstrated what a great guy he is after donating $15 million to environmental causes.,Leonardo DiCaprio Has Just Donated $15 Million To Environmental Causes | The LAD Bible,link,http://www.theladbible.com/articles/leonardo-dicaprio-is-once-again-being-an-absolute-legend-by-saving-the-planet,2015-07-15 12:02:18,,21370,461,673,21370,0,0,0,0,0
199098633470668_2302308049816372,This is how controllers get smashed...,,video,https://www.facebook.com/LADbible/videos/2302308049816372/,2015-07-15 11:31:30,00:25,38559,9318,4470,38559,0,0,0,0,0
199098633470668_2302234706490373,"This woman had so many implants in her bum that when she went to exercise they actually ended up exploding... No, seriously!",Woman's Bum Explodes During Exercise Because Of Too Many Implants | The LAD Bible,link,http://www.theladbible.com/articles/a-lady-s-bum-implants-exploded-while-she-was-exercising,2015-07-15 10:38:09,,3899,1660,526,3899,0,0,0,0,0
199098633470668_2302190833161427,True story!,Timeline Photos,photo,https://www.facebook.com/LADbible/photos/a.200542726659592.50788.199098633470668/2302190833161427/?type=3,2015-07-15 10:10:54,,88783,5004,4030,88783,0,0,0,0,0
199098633470668_2302178006496043,"Ahh, Tinder...",Timeline Photos,photo,https://www.facebook.com/LADbible/photos/a.200542726659592.50788.199098633470668/2302178006496043/?type=3,2015-07-15 10:01:46,,33044,1680,535,33044,0,0,0,0,0
199098633470668_2302114583169052,"A terminally ill woman, who removed herself from the organ donor list so she could be well enough to enjoy her final months, has fulfilled her number one bucket list wish. Well played, Ed Sheeran.",Ed Sheeran Helps Terminally Ill Girl Tick Off Ultimate Bucket List Wish | The LAD Bible,link,http://www.theladbible.com/articles/ed-sheeran-makes-terminally-ill-girl-s-dreams-come-true,2015-07-15 09:14:17,,20537,421,725,20537,0,0,0,0,0
199098633470668_2302062876507556,"Kenan and Kel was hands down one of the best TV shows around, and now Kel wants a reunion.",It Looks Like A Kenan And Kel Reunion Could Be On The Cards! | The LAD Bible,link,http://www.theladbible.com/articles/is-there-going-to-be-a-kenan-kel-reunion,2015-07-15 08:40:47,,15772,1597,2747,15772,0,0,0,0,0
199098633470668_2301918839855293,Cyclists could soon be made to carry a license like other road users. Good idea?,Cyclists Could Soon Be Made To Carry A 'Cycling License' | The LAD Bible,link,http://www.theladbible.com/articles/cyclists-could-soon-be-made-to-carry-licenses-like-other-road-users,2015-07-15 07:13:48,,26635,4335,2856,26635,0,0,0,0,0
199098633470668_2301845966529247,Kids today will never know the struggle...,Timeline Photos,photo,https://www.facebook.com/LADbible/photos/a.200542726659592.50788.199098633470668/2301845966529247/?type=3,2015-07-15 06:34:09,,55630,1628,1156,55630,0,0,0,0,0
199098633470668_2301807713199739,"This little lad from Byker in Newcastle is the first ever Geordie to get into Eton, despite coming from a difficult background.",Little Lad From Tough Newcastle Estate Wins Place At Eton | The LAD Bible,link,http://www.theladbible.com/articles/real-life-byker-grove-boy-from-rough-newcastle-estate-wins-a-place-at-eton,2015-07-15 06:13:21,,17893,529,441,17893,0,0,0,0,0
199098633470668_2301740129873164,"Wait for the drop...

Credit: Skanktank",,video,https://www.facebook.com/LADbible/videos/2301740129873164/,2015-07-15 05:36:56,00:10,17084,3778,2992,17084,0,0,0,0,0
199098633470668_2301704289876748,"After posting a Facebook status attacking Islam, one EDL member ended up getting into an argument with his 12-year-old niece. Who do you think won?",EDL Member Argues With 12-Year-Old Niece And The Outcome Goes Viral | The LAD Bible,link,http://www.theladbible.com/articles/edl-member-gets-schooled-by-his-12-year-old-niece-on-facebook,2015-07-15 05:17:17,,2797,338,232,2797,0,0,0,0,0
199098633470668_2301572706556573,Awesome dance moves and T in the Park... This is what festivals are all about!,,video,https://www.facebook.com/LADbible/videos/2301572706556573/,2015-07-15 04:14:14,03:57,102103,15469,29559,102103,0,0,0,0,0
199098633470668_2301404906573353,"When you were younger, it's very likely that you were collecting Pokemon cards. But did you know how much they are worth today? Some of you could be sitting on a lot of money...",Time To Dig Out Your Old Pokemon Cards Because They're Worth A Lot Of Money Now | The LAD Bible,link,http://www.theladbible.com/articles/how-much-are-some-of-your-pokemon-cards-worth-now,2015-07-15 02:32:43,,14179,18849,9525,14179,0,0,0,0,0
199098633470668_2300949873285523,The lifting prank...,,video,https://www.facebook.com/LADbible/videos/2300949873285523/,2015-07-15 01:45:00,00:42,26901,4070,8734,26901,0,0,0,0,0
199098633470668_2300887016625142,Someone has invented an alarm clock that sounds like it's emerged from the depths of hell. But it's guaranteed to get you out of bed. Evil genius...,This Evil Alarm Clock Runs Away From You So That You Definitely Get Up Out Of Bed | The LAD Bible,link,http://www.theladbible.com/articles/evil-alarm-clock-for-sale-and-people-are-buying-it,2015-07-15 01:02:01,,8282,1708,1448,8282,0,0,0,0,0
199098633470668_2300950803285430,Never marry a tennis player...,Timeline Photos,photo,https://www.facebook.com/LADbible/photos/a.200542726659592.50788.199098633470668/2300950803285430/?type=3,2015-07-15 00:03:01,,35955,1401,1247,35955,0,0,0,0,0
199098633470668_2300870316626812,"After discovering a baby great white shark washed up on the beach, one group of tourists helped get him back to where he belongs.",Tourists Help Save A Great White Shark That Washed Up On a Beach | The LAD Bible,link,http://www.theladbible.com/articles/tourists-help-save-a-great-white-shark-that-washed-up-on-a-beach,2015-07-14 23:12:01,,4772,243,185,4772,0,0,0,0,0
199098633470668_2300910553289455,These see-through pods that sit 400ft above Peru's Sacred Valley are perfect for any adrenaline junkie. Just check out that view...,Could You Spend The Night In One Of These 400ft High See-Through Pods? | The LAD Bible,link,http://www.theladbible.com/articles/if-you-like-views-there-s-a-hotel-in-peru-that-you-need-to-visit,2015-07-14 22:05:00,,9315,1248,818,9315,0,0,0,0,0
199098633470668_2301038856609958,Never forget...,Timeline Photos,photo,https://www.facebook.com/LADbible/photos/a.200542726659592.50788.199098633470668/2301038856609958/?type=3,2015-07-14 20:59:00,,37276,1210,495,37276,0,0,0,0,0
199098633470668_2300880646625779,"Undoubtedly one of the greatest wrestlers of all time, The Undertaker is looking fighting fit in recent pictures. Has he still got a good few years left in him?",The Undertaker Is Back To His Old Self In Latest Photos | The LAD Bible,link,http://www.theladbible.com/articles/the-undertaker-is-back-to-his-old-self-after-worrying-pictures-circulated,2015-07-14 19:59:00,,2466,364,119,2466,0,0,0,0,0
199098633470668_2300894066624437,Pretty much...,Timeline Photos,photo,https://www.facebook.com/LADbible/photos/a.200542726659592.50788.199098633470668/2300894066624437/?type=3,2015-07-14 18:53:34,,52113,575,2043,52113,0,0,0,0,0
199098633470668_2300851743295336,"We all know that The Rock is a pretty tough guy, and he may have proven it further after breaking his finger and recording a quick video of it.",The Rock Breaks His Finger But Can't Resist A Video Before Getting It Fixed | The LAD Bible,link,http://www.theladbible.com/articles/the-rock-proves-he-s-definitely-not-human-with-this-epic-broken-finger-video,2015-07-14 18:20:58,,6902,904,970,6902,0,0,0,0,0
199098633470668_2300762439970933,"""No one is going to believe me... """,Timeline Photos,photo,https://www.facebook.com/LADbible/photos/a.200542726659592.50788.199098633470668/2300762439970933/?type=3,2015-07-14 17:39:37,,42212,3257,784,42212,0,0,0,0,0
199098633470668_2300679393312571,"Grime artist JME is taking an interesting approach to promoting his latest album. He's trading vinyl copies for Pokemon cards... No, seriously.",JME Will Swap You A Vinyl Copy Of His Album For A Shiny Pokemon Card | The LAD Bible,link,http://www.theladbible.com/articles/jme-will-swap-you-a-vinyl-copy-of-his-album-for-a-shiny-pokemon-card,2015-07-14 17:00:54,,7827,1356,635,7827,0,0,0,0,0
199098633470668_2300564973324013,True story...,Timeline Photos,photo,https://www.facebook.com/LADbible/photos/a.200542726659592.50788.199098633470668/2300564973324013/?type=3,2015-07-14 16:27:27,,61673,3301,5597,61673,0,0,0,0,0
199098633470668_2300485599998617,"The Snapchat story is a great feature of the app, it gives a view into many parts of the world through the eyes of the public, and their coverage of Ramadan prayers from Mecca is the best use of it yet. Simply incredible.",Snapchat Are Giving A Totally Unbiased View Into What Mecca Is Really Like | The LAD Bible,link,http://www.theladbible.com/articles/snapchat-are-giving-a-totally-unbiased-view-into-what-mecca-is-really-like,2015-07-14 16:00:58,,8791,438,610,8791,0,0,0,0,0
199098633470668_2300388580008319,You've got to love the 'dad dance'...,,video,https://www.facebook.com/LADbible/videos/2300388580008319/,2015-07-14 15:33:56,00:40,95017,33134,34517,95017,0,0,0,0,0
199098633470668_2300337963346714,"Not only is The Simpsons the longest running cartoon ever, but it has a habit of predicting the future... Some of these are just freaky!",10 Times The Simpsons Predicted The Future | The LAD Bible,link,http://www.theladbible.com/articles/10-times-the-simpsons-predicted-the-future,2015-07-14 15:03:30,,6410,440,580,6410,0,0,0,0,0
199098633470668_2300290913351419,Shaq thinks Irish people are pirates...,Timeline Photos,photo,https://www.facebook.com/LADbible/photos/a.200542726659592.50788.199098633470668/2300290913351419/?type=3,2015-07-14 14:36:03,,11015,536,305,11015,0,0,0,0,0
199098633470668_2300232090023968,This driver got out of his car to punch a motorcyclist in the face and instantly regretted it... He won't be doing that again!,Guy With Immense Road Rage Confronts Motorcyclist But Ends Up Wishing He Hadn't | The LAD Bible,link,http://www.theladbible.com/articles/guy-with-immense-road-rage-tries-to-pull-a-biker-off-his-motorcycle-but-ends-up-wishing-he-hadn-t,2015-07-14 14:01:56,,32124,4978,7486,32124,0,0,0,0,0
199098633470668_2300143883366122,He's back...,,video,https://www.facebook.com/LADbible/videos/2300143883366122/,2015-07-14 13:21:26,01:02,26406,8679,5691,26406,0,0,0,0,0
199098633470668_2300100236703820,"""The urinal at a bar I went to the other night had headrests... genius!""",Timeline Photos,photo,https://www.facebook.com/LADbible/photos/a.200542726659592.50788.199098633470668/2300100236703820/?type=3,2015-07-14 12:59:21,,39556,1950,2718,39556,0,0,0,0,0
199098633470668_2300045280042649,"This pretty much confirms THE biggest fan theory in Game of Thrones... Attention, spoilers ahead!",Game Of Thrones Filming Location Pretty Much Confirms Huge Fan Theory | The LAD Bible,link,http://www.theladbible.com/articles/the-latest-game-of-thrones-fan-theory-about-jon-snow-is-actually-quite-convincing,2015-07-14 12:29:09,,18396,14455,5537,18396,0,0,0,0,0
199098633470668_2299990430048134,"Sinead O'Connor has posted a brilliant explicit rant after revealing Kim Kardashian picture makes the cover of Rolling Stone, and she doesn't hold back!",Sinead O'Connor Calls For Rolling Stone Boycot After Kim Kardashian Makes Cover | The LAD Bible,link,http://www.theladbible.com/articles/kim-kardashian-is-on-the-front-cover-of-rolling-stone-magazine-and-people-are-not-happy,2015-07-14 11:55:54,,7160,601,563,7160,0,0,0,0,0
199098633470668_2299890676724776,When Joe Charman met Anto Sharp Vines...,,video,https://www.facebook.com/LADbible/videos/2299890676724776/,2015-07-14 10:59:11,00:07,73615,19764,26250,73615,0,0,0,0,0
199098633470668_2299861143394396,"Recess is one of the best programmes from our childhood, but have you ever wondered what the people behind the characters look like?",Here's What The Recess Cast Look Like And What They're Up To Now | The LAD Bible,link,http://www.theladbible.com/articles/ever-wondered-who-the-people-behind-the-recess-characters-are,2015-07-14 10:37:17,,3218,491,194,3218,0,0,0,0,0
199098633470668_2299759450071232,"After a shocking video of a girl bullying two other girls went viral, the bully is now going to get exactly what she deserves...",Police Say Teenage Bully Filmed Forcing Girls To Their Knees In Humiliating Video Will Be Arrested,link,http://www.theladbible.com/articles/teenagers-who-forced-girl-on-her-knees-in-shocking-bullying-video-will-be-arrested,2015-07-14 09:32:37,,12596,1267,1523,12596,0,0,0,0,0
199098633470668_2299688346745009,WWE at T in the Park!,,video,https://www.facebook.com/LADbible/videos/2299688346745009/,2015-07-14 08:46:53,03:16,28139,8889,5207,28139,0,0,0,0,0
199098633470668_2299642556749588,"A video has been released of Tom Cruise doing one of his own stunts in the new Mission Impossible, and he's got some serious balls. This would be terrifying.",Watch Tom Cruise Hang From The Side Of A Jet In Awesome Mission Impossible Stunt | The LAD Bible,link,http://www.theladbible.com/articles/the-new-mission-impossible-plane-stunt-was-performed-by-tom-cruise-himself-and-it-took-eight-tries-to-get-right,2015-07-14 08:11:49,,7239,871,907,7239,0,0,0,0,0
199098633470668_2299576766756167,So true...,Timeline Photos,photo,https://www.facebook.com/LADbible/photos/a.200542726659592.50788.199098633470668/2299576766756167/?type=3,2015-07-14 07:31:14,,123436,3568,10339,123436,0,0,0,0,0
199098633470668_2299536816760162,"How to speak Australian...

Credit: Rhys Keir and Hi Josh",,video,https://www.facebook.com/LADbible/videos/2299536816760162/,2015-07-14 07:11:40,02:59,23364,8551,8022,23364,0,0,0,0,0
199098633470668_2299511573429353,"After David Cameron tried to relax the rules on fox hunting, the vote has been pulled in the face of embarrassing defeat.",Government Forced To Pull Fox Hunting Vote In Face Of Embarrassing Defeat | The LAD Bible,link,http://www.theladbible.com/articles/david-cameron-left-red-faced-after-nicola-sturgeon-uses-her-power-to-stop-fox-hunting-vote,2015-07-14 06:49:03,,8205,533,841,8205,0,0,0,0,0
199098633470668_2299443173436193,For the hood.,Timeline Photos,photo,https://www.facebook.com/LADbible/photos/a.200542726659592.50788.199098633470668/2299443173436193/?type=3,2015-07-14 05:59:32,,30475,818,784,30475,0,0,0,0,0
199098633470668_2299421453438365,"Apple Pay launches today, which means the way we pay for things will be changing forever. Here's what you need to know...",Everything You Need To Know About Apple Pay | The LAD Bible,link,http://www.theladbible.com/articles/apply-pay-what-is-it,2015-07-14 05:42:32,,1552,505,244,1552,0,0,0,0,0
