status_id,status_message,link_name,status_type,status_link,status_published,status_video_length,num_reactions,num_comments,num_shares,num_likes,num_loves,num_wows,num_hahas,num_sads,num_angrys
21317493981_10153800109383982,You'll never be lost in the middle of Rome again.,Finally! Google Announces Offline Maps Access,link,http://cntrvlr.co/m8uCDHk,2015-11-12 08:30:17,,163,2,29,163,0,0,0,0,0
21317493981_10153799946618982,"Resembling something more like the statue guarding Braavos in Game of Thrones, the new Colossus of Rhodes will dwarf its predecessor, standing 500 feet tall.",The Titan of Braavos in Real Life? Project Aims to Resurrect an Ancient Wonder of the World,link,http://cntrvlr.co/UVvB4NT,2015-11-12 07:00:37,,85,1,20,85,0,0,0,0,0
21317493981_10153799894758982,There's a reason Denmark gets voted the happiest country in the world. Via Refinery29,Discovering What Makes Scandinavians So Happy,link,http://cntrvlr.co/kUhaJ9F,2015-11-12 06:00:39,,838,39,155,838,0,0,0,0,0
21317493981_10153799815333982,"Tim Tams, anyone?",The 7 Best Souvenirs to Bring Back From Australia,link,http://cntrvlr.co/oMKZh6Y,2015-11-12 04:00:25,,1404,224,335,1404,0,0,0,0,0
21317493981_10153799772428982,Make a trip to the kingdom of cold this winter—you won't regret it.,9 Unbelievable Ice Caves (They're Not All In Iceland),link,http://cntrvlr.co/dB6HCeh,2015-11-12 03:00:13,,597,10,106,597,0,0,0,0,0
21317493981_10153799715898982,The best city in the world is also home to some seriously beautiful hotels: http://cntrvlr.co/Q4gyZWl,Timeline Photos,photo,https://www.facebook.com/CondeNastTraveler/photos/a.174408898981.149256.21317493981/10153799715898982/?type=3,2015-11-12 02:00:18,,476,11,49,476,0,0,0,0,0
21317493981_10153799661753982,"Here's where Greeks are traveling—and where they suggest you go, too.",The 8 Most Stunning Cities in Greece—As Told By Greeks,link,http://cntrvlr.co/SpooTIC,2015-11-12 01:00:19,,382,17,132,382,0,0,0,0,0
21317493981_10153799599778982,Walk down the street in Nicaragua and you'll see every color of the rainbow.,A Guide to Nicaragua's Rainbow-Colored Cities,link,http://cntrvlr.co/lIWrf5M,2015-11-12 00:00:31,,218,6,31,218,0,0,0,0,0
21317493981_10153799507863982,"""Unless it's 5 in the morning, I'm wearing red lipstick to the airport."" - Linda Rodin",Model Linda Rodin's Guide to Packing Light,link,http://cntrvlr.co/6azhRBN,2015-11-11 23:00:36,,177,7,40,177,0,0,0,0,0
21317493981_10153799458823982,Completely Instagram-worthy.,8 Colorful Hotels to Brighten Up Your Next Vacation,link,http://cntrvlr.co/u6UQi6S,2015-11-11 22:10:04,,251,0,25,251,0,0,0,0,0
21317493981_10153799408243982,Your trip to the City of Light will be even more magical if you stay at one of these reader-approved hotels.,20 Best Hotels in Paris: Readers' Choice Awards 2015,link,http://cntrvlr.co/7tAa6PJ,2015-11-11 21:35:04,,601,20,173,601,0,0,0,0,0
21317493981_10153799335668982,Because we prefer to see the world through multi-colored glasses.,The World's Most Spectacular Stained Glass,link,http://cntrvlr.co/0dUbgV7,2015-11-11 21:00:40,,878,10,158,878,0,0,0,0,0
21317493981_10153799261338982,"These cabins are far, far from Little House on the Prairie.",9 of the Most Luxurious Airbnb Cabins Around the World,link,http://cntrvlr.co/AN1aNOu,2015-11-11 20:00:39,,228,8,38,228,0,0,0,0,0
21317493981_10153799185888982,"Rule #1: It's your time, and you can spend it any way you want.",7 Things to Know Before Traveling Solo,link,http://cntrvlr.co/H86xkwf,2015-11-11 19:00:34,,819,36,174,819,0,0,0,0,0
21317493981_10153799022843982,Paris could learn a thing or two from this Estonian town:,How a Town in Estonia Solved the 'Love Locks' Problem,link,http://cntrvlr.co/TwpfbrX,2015-11-11 17:05:03,,200,2,15,200,0,0,0,0,0
21317493981_10153798952363982,"Have a spare $10.6 million in your pocket? Head to Atherton, California.",The 10 Most Expensive Zip Codes in the U.S. (and How You Can Spend the Night There),link,http://cntrvlr.co/qO3wWKz,2015-11-11 16:15:09,,188,5,36,188,0,0,0,0,0
21317493981_10153798891808982,"You'll now be able to rent out that gorgeous townhouse in New York City's West Village, thanks to this new app. Via WIRED",This New Startup Is Like an Airbnb for Event Spaces,link,http://cntrvlr.co/kPBpm3g,2015-11-11 15:30:18,,51,3,7,51,0,0,0,0,0
21317493981_10153798831033982,The 100-foot-tall bronze statue of the Greek sun god Helios was among the tallest structures in the world when it was built in 280 B.C.—and it's now going to be resurrected.,The Titan of Braavos in Real Life? Project Aims to Resurrect an Ancient Wonder of the World,link,http://cntrvlr.co/8sooI1q,2015-11-11 15:00:36,,504,10,85,504,0,0,0,0,0
21317493981_10153798789693982,"Say what you want about Donald Trump, but our readers really, really love his hotels.",The 8 Best Trump Hotels in the World: Readers' Choice Awards 2015,link,http://cntrvlr.co/E7unwB4,2015-11-11 14:30:12,,396,22,63,396,0,0,0,0,0
21317493981_10153798754033982,"Rome's taxpayers aren't paying for renovations to the city's most famous and important sites— Fendi, Bulgari, and Tod's are.",How Fendi Is Saving the Trevi Fountain,link,http://cntrvlr.co/NdcHg23,2015-11-11 14:00:21,,2076,45,318,2076,0,0,0,0,0
21317493981_10153798711368982,"From ""rear-seat kickers"" to ""aromatic passengers,"" these are the worst of the worst when it comes to your airplane seat mates.",These Are Officially the Most Annoying Airplane Passengers,link,http://cntrvlr.co/y8q73st,2015-11-11 13:30:12,,217,22,39,217,0,0,0,0,0
21317493981_10153798676448982,"If it's the big-city hustle and bustle you're after in a vacation, these places are for you.",The 15 Best Big Cities in the U.S.,link,http://cntrvlr.co/RGEcrM4,2015-11-11 13:00:27,,195,3,34,195,0,0,0,0,0
21317493981_10153798581873982,You'll never get lost again.,Finally! Google Announces Offline Maps Access,link,http://cntrvlr.co/zZhxMSD,2015-11-11 12:15:08,,663,28,139,663,0,0,0,0,0
21317493981_10153798520818982,"More than 100,000 travelers will be affected by Lufthansa's flight attendants strike this week. 

Are you one of them? Let us know in the comments!",Lufthansa Flight Attendants Strike to Drag Into the Week,link,http://cntrvlr.co/WFJoqJ4,2015-11-11 11:30:14,,42,9,22,42,0,0,0,0,0
21317493981_10153798445178982,Today we remember all who have dedicated their lives to serving their country.,10 American Monuments You Need to See in Your Lifetime,link,http://cntrvlr.co/TFQ2xu3,2015-11-11 11:00:10,,481,13,68,481,0,0,0,0,0
21317493981_10153798379868982,"Paris is beautiful no matter when you go, but autumn may be our favorite.",13 Reasons You Need to Go to Paris This Fall,link,http://cntrvlr.co/71oq4Ye,2015-11-11 10:13:32,,455,12,71,455,0,0,0,0,0
21317493981_10153798316258982,Life's too short to wait at a baggage carousel.,9 Pro Packing Tips Every Traveler Needs to Know,link,http://cntrvlr.co/AvG2S2w,2015-11-11 09:38:09,,556,20,208,556,0,0,0,0,0
21317493981_10153798248168982,Beach hopping all over Florida will never be easier.,This New Florida Train Will Take You From Miami to Orlando in 3 Hours,link,http://cntrvlr.co/MJBuikM,2015-11-11 08:30:04,,261,5,58,261,0,0,0,0,0
21317493981_10153798153538982,Coolest scarves ever.,These Scarves Will Make You Want to Travel the World,link,http://cntrvlr.co/ewgK3zs,2015-11-11 07:00:30,,274,3,35,274,0,0,0,0,0
21317493981_10153798002723982,Your guide to the best of the culinary heart of America:,10 Most Unmissable Restaurants in the American South,link,http://cntrvlr.co/VHAplbQ,2015-11-11 05:00:22,,125,4,17,125,0,0,0,0,0
21317493981_10153797868163982,5 things smart travelers should do this November: http://cntrvlr.co/zxBqEvT,Timeline Photos,photo,https://www.facebook.com/CondeNastTraveler/photos/a.174408898981.149256.21317493981/10153797868163982/?type=3,2015-11-11 04:00:27,,987,10,82,987,0,0,0,0,0
21317493981_10153797789358982,Hotel pools don't get any better than this.,The World's Most Luxurious Hotel Pools,link,http://cntrvlr.co/NLCpXSp,2015-11-11 03:00:25,,863,14,142,863,0,0,0,0,0
21317493981_10153797727828982,Consider this your guide to what NOT to do in London.,10 Tourist Traps to Avoid in London,link,http://cntrvlr.co/zvDkv8h,2015-11-11 02:00:32,,331,16,91,331,0,0,0,0,0
21317493981_10153797683383982,"Art lovers, you don't want to miss this.",Jump on This Epic Photo Sale While You Can!,link,http://cntrvlr.co/gW9WuCm,2015-11-11 01:00:15,,60,1,8,60,0,0,0,0,0
21317493981_10153797623353982,Say hello to the new Lake Como: http://cntrvlr.co/vTAXYAY,Timeline Photos,photo,https://www.facebook.com/CondeNastTraveler/photos/a.174408898981.149256.21317493981/10153797623353982/?type=3,2015-11-11 00:00:29,,481,9,20,481,0,0,0,0,0
21317493981_10153797575033982,Oh la la!,What to Pack for a Romantic Weekend Getaway,link,http://cntrvlr.co/Tua9zfh,2015-11-10 23:00:38,,165,0,20,165,0,0,0,0,0
21317493981_10153797523043982,"Haven't booked your Thanksgiving ticket home yet? There's still time, but avoid this day:",This Will Be the Worst Day to Travel This Thanksgiving,link,http://cntrvlr.co/HS6f87g,2015-11-10 22:10:07,,36,3,6,36,0,0,0,0,0
21317493981_10153797476743982,Don't know where to go next? Consider one of these cities—they're the best in Europe.,The 10 Best Cities in Europe,link,http://cntrvlr.co/bMfgKWp,2015-11-10 21:35:07,,395,13,98,395,0,0,0,0,0
21317493981_10153797431413982,"Palawan, you've done it again.",The 20 Best Islands in the World,link,http://cntrvlr.co/5mlq3qT,2015-11-10 21:00:41,,515,11,143,515,0,0,0,0,0
21317493981_10153797362078982,"You can travel like 007, too.",10 Greatest James Bond Movie Locations You Can Visit Today,link,http://cntrvlr.co/G4tM3eH,2015-11-10 20:00:35,,1006,12,208,1006,0,0,0,0,0
21317493981_10153797287438982,All your Italian countryside dreams are coming true. Via Architectural Digest,7 Gorgeous Italian Villas for Sale,link,http://cntrvlr.co/YAFICZn,2015-11-10 19:00:19,,121,5,27,121,0,0,0,0,0
21317493981_10153797175743982,"For every tourist hotspot, there's an off-the-beaten-path gem hiding in its shadow, waiting to be discovered.",8 'Dark Horse' Destinations To Visit in 2015,link,http://cntrvlr.co/CpwKYdo,2015-11-10 18:00:24,,399,6,65,399,0,0,0,0,0
21317493981_10153797038278982,Wishing all of our readers a happy Diwali today!,10 Colorful Photos of Diwali Around the World,link,http://cntrvlr.co/qGx7kc1,2015-11-10 16:30:11,,705,8,180,705,0,0,0,0,0
21317493981_10153796975298982,Mexico City's Zócalo is now home to one of the greatest 007 opening scenes in history.,Here's Where They Filmed That Crazy Opening Scene From the New James Bond Movie,link,http://cntrvlr.co/xXGHQ7X,2015-11-10 15:55:07,,1126,41,207,1126,0,0,0,0,0
21317493981_10153796899748982,These pets officially have it made.,7 Pets of Instagram Who Travel Better Than We Do,link,http://cntrvlr.co/1ph0RNQ,2015-11-10 15:10:06,,2089,56,224,2089,0,0,0,0,0
21317493981_10153796849178982,We took a ride on JetBlue's inaugural trip out of country for its Mint class—and it was awesome.,Three Meals in Four Hours: The Luxe Life of JetBlue's Mint Class,link,http://cntrvlr.co/GGfmRbL,2015-11-10 14:35:18,,572,18,111,572,0,0,0,0,0
21317493981_10153796767163982,The flight attendants—not the pilots—are walking out this time.,Lufthansa Flight Attendants Strike to Drag Into Tuesday,link,http://cntrvlr.co/RiPmdis,2015-11-10 13:30:11,,116,5,14,116,0,0,0,0,0
21317493981_10153796728228982,Remember the jellyfish scene from Finding Nemo? That's pretty much what this lake is like:,The Most Dangerous Trips in the World,link,http://cntrvlr.co/MwxILRj,2015-11-10 13:00:25,,230,4,40,230,0,0,0,0,0
21317493981_10153796672853982,"These creepy ""UFO Clouds"" are taking over South Africa right now:",What's Up With Those 'UFO Clouds' Spotted Over Cape Town?,link,http://cntrvlr.co/m85iSEU,2015-11-10 12:15:06,,376,20,72,376,0,0,0,0,0
21317493981_10153796603553982,A new Orlando-to-Miami express train is in the works—so you can beach hop all over Florida.,This New Florida Train Will Take You From Miami to Orlando in 3 Hours,link,http://cntrvlr.co/2MrX3NV,2015-11-10 11:42:38,,966,44,273,966,0,0,0,0,0
21317493981_10153796536093982,Want to see some of the world's most beautiful scenery? Just board a train.,9 Most Scenic Train Rides Around the World,link,http://cntrvlr.co/KvrIGwW,2015-11-10 11:05:49,,1140,34,361,1140,0,0,0,0,0
21317493981_10153796478208982,The gift shops at these museums may be worth the visit alone.,16 Of The World's Greatest Fashion Museums,link,http://cntrvlr.co/OB0QGxY,2015-11-10 10:27:52,,219,11,58,219,0,0,0,0,0
21317493981_10153796420963982,"If you've made it through 2015 without paying for a carry-on bag or a soda on a domestic flight, consider yourself warned: that's about to change.",Why U.S. Budget Airlines Fall Behind the Rest of the World's,link,http://cntrvlr.co/8bURX8Q,2015-11-10 09:49:24,,37,1,12,37,0,0,0,0,0
21317493981_10153796327643982,W Hotels just hit the jackpot in Sin City.,W Hotels to Try Their Luck in Las Vegas,link,http://cntrvlr.co/j5TIpRr,2015-11-10 08:30:24,,209,3,27,209,0,0,0,0,0
21317493981_10153796243528982,"The vote was one of the biggest, so far, for Catalonia's independence.",Catalonia Approves Plan to Secede From Spain By 2017,link,http://cntrvlr.co/ohSaqun,2015-11-10 07:00:23,,69,5,20,69,0,0,0,0,0
21317493981_10153796169598982,This is how we want to wake up every morning. http://cntrvlr.co/aVbDgZL,Timeline Photos,photo,https://www.facebook.com/CondeNastTraveler/photos/a.174408898981.149256.21317493981/10153796169598982/?type=3,2015-11-10 06:00:32,,855,18,42,855,0,0,0,0,0
21317493981_10153796125743982,Is this place on your list? http://cntrvlr.co/MgYcGqL,11 Photos That Prove Peru is Much More Than Machu Picchu,link,http://cntrvlr.co/MgYcGqL,2015-11-10 05:25:06,,416,20,90,416,0,0,0,0,0
21317493981_10153796073063982,Italy's best locavore dishes are just a flight away http://cntrvlr.co/hvc3ZYC,The 12 Best Street Foods in Italy,link,http://cntrvlr.co/hvc3ZYC,2015-11-10 04:28:08,,961,44,298,961,0,0,0,0,0
21317493981_10153796033058982,A NSFW place!? http://cntrvlr.co/9YQ3nsI,This Town in the Philippines is Controversial,link,http://cntrvlr.co/9YQ3nsI,2015-11-10 04:22:06,,90,2,6,90,0,0,0,0,0
21317493981_10153795954723982,You're going to fall hard for these can't-miss destinations... http://cntrvlr.co/cvu6Osv,The 10 Best European Cities to Visit in Autumn,link,http://cntrvlr.co/cvu6Osv,2015-11-10 03:23:09,,138,4,22,138,0,0,0,0,0
21317493981_10153795854668982,It doesn't get much more serene than this place. http://cntrvlr.co/NWuB8YC,Timeline Photos,photo,https://www.facebook.com/CondeNastTraveler/photos/a.174408898981.149256.21317493981/10153795854668982/?type=3,2015-11-10 02:00:11,,1679,44,145,1679,0,0,0,0,0
21317493981_10153795793688982,Start planning your next vacation now.,The 10 Most Beautiful Beaches in the World,link,http://cntrvlr.co/EwgOrXl,2015-11-10 01:00:11,,1142,47,276,1142,0,0,0,0,0
21317493981_10153795712213982,Consider this the case for spending Thanksgiving away from home this year: http://cntrvlr.co/u9yYqRG,Timeline Photos,photo,https://www.facebook.com/CondeNastTraveler/photos/a.174408898981.149256.21317493981/10153795712213982/?type=3,2015-11-10 00:00:29,,449,5,20,449,0,0,0,0,0
21317493981_10153795600048982,Everyone has to do it someday.,The Best and Worst Airport to Sleep In (If You Must),link,http://cntrvlr.co/SHP2xw5,2015-11-09 23:00:21,,209,5,46,209,0,0,0,0,0
21317493981_10153795548048982,Like a boss.,How to Pack Your Carry-On Luggage Like a Boss,link,http://cntrvlr.co/Zvd6oto,2015-11-09 22:10:08,,271,7,94,271,0,0,0,0,0
21317493981_10153795504723982,Epic.,"10 Travel Gear Fails: They're So Bad, They're Genius",link,http://cntrvlr.co/IOd6nEU,2015-11-09 21:31:04,,115,7,27,115,0,0,0,0,0
21317493981_10153795472223982,In need of some vacation inspiration? This should help.,The 100 Best Hotels in the World,link,http://cntrvlr.co/W2w9IuS,2015-11-09 21:00:26,,239,5,61,239,0,0,0,0,0
21317493981_10153795390443982,Numbers aren't just for zip codes anymore.,This Australian Town Changed Its Name to a Number,link,http://cntrvlr.co/Ma2gMuf,2015-11-09 20:00:35,,161,2,10,161,0,0,0,0,0
21317493981_10153795273303982,"Richard Branson's in-flight cocktail of choice? A ""Virgin Mary,"" of course.",Virgin America Flights to Cuba? Richard Branson and VA's CEO Answer Our Latest Questions,link,http://cntrvlr.co/XCLwKyu,2015-11-09 19:00:32,,118,1,10,118,0,0,0,0,0
21317493981_10153795000588982,Condé Nast Traveler contributing style editor Sofía Sanchez de Betak takes us on a helicopter tour of Iceland (and meets an adorable Arctic fox pup!),Take a Helicopter Tour of Iceland with Sofía Sanchez de Betak,video,https://www.facebook.com/CondeNastTraveler/videos/10153795000588982/,2015-11-09 18:30:00,01:14,252,14,73,252,0,0,0,0,0
21317493981_10153795164603982,Simply beautiful. Via WIRED,"In Russia, Palaces and Metro Stations Are Hard to Tell Apart",link,http://cntrvlr.co/RjoEPpr,2015-11-09 17:46:15,,925,20,140,925,0,0,0,0,0
21317493981_10153795007363982,Good news: a new study says drinking three glasses of champagne a week can prevent memory loss and dementia.,"Can A Diet Of Champagne, Chocolate, and Spicy Food Keep You Alive Forever? Science Says Maybe!",link,http://cntrvlr.co/jjvn7vC,2015-11-09 16:00:09,,4520,539,4002,4520,0,0,0,0,0
21317493981_10153794872738982,"Philadelphia now joins Paris, Jerusalem, and St. Petersburg as a UNESCO World Heritage City.",Philadelphia Named First UNESCO World Heritage City in U.S.,link,http://cntrvlr.co/uJE1qub,2015-11-09 15:09:53,,2165,84,473,2165,0,0,0,0,0
21317493981_10153794814218982,"To many, it's a move that seems a long time coming.",Catalonia Approves Plan to Secede From Spain By 2017,link,http://cntrvlr.co/oSBtdkd,2015-11-09 14:25:06,,443,36,152,443,0,0,0,0,0
21317493981_10153794782828982,A dish is more of an experience than just a meal–it's an entry point into a culture.,12 of the World's Most Incredible Noodle Dishes—From Ramen to Saimin,link,http://cntrvlr.co/npVh8w7,2015-11-09 13:59:52,,476,15,100,476,0,0,0,0,0
21317493981_10153794723143982,And it turns out the best time to hit the road is Thanksgiving Day itself.,Waze Predicts the Worst Day to Travel This Thanksgiving,link,http://cntrvlr.co/qqf7nQf,2015-11-09 13:04:11,,120,8,20,120,0,0,0,0,0
21317493981_10153794646613982,What's better than Thanksgiving dinner? That's easy—one you didn't have to fuss over.,10 Hotel Thanksgiving Dinners Worth Leaving Home For,link,http://cntrvlr.co/1kDHmpu,2015-11-09 12:15:09,,161,7,15,161,0,0,0,0,0
21317493981_10153794593508982,Note to tall travelers: Aeroméxico might be your new best friend.,A Tall Traveler's Guide to the Airlines With the Most Legroom,link,http://cntrvlr.co/wUHCYFD,2015-11-09 11:35:08,,179,4,39,179,0,0,0,0,0
21317493981_10153794543958982,America has a budget airline problem.,Why U.S. Budget Airlines Fall Behind the Rest of the World's,link,http://cntrvlr.co/SbJ2trx,2015-11-09 10:56:33,,135,10,14,135,0,0,0,0,0
21317493981_10153794487858982,This isn't your average cabin in the woods.,9 of the Most Luxurious Airbnb Cabins Around the World,link,http://cntrvlr.co/sHJemBk,2015-11-09 10:09:03,,532,16,78,532,0,0,0,0,0
21317493981_10153794403473982,"Enough with the ""obli-cation."" How about a proper, legitimate vacation?",12 Reasons to Spend Thanksgiving Away From Home This Year,link,http://cntrvlr.co/NjBhnQM,2015-11-09 09:25:46,,229,7,20,229,0,0,0,0,0
21317493981_10153794340688982,"Summer may be long gone, but that doesn't mean the good vibes must end.",Beyond Burning Man: The 5 Best Festivals to Hit This Winter,link,http://cntrvlr.co/ntncrIb,2015-11-09 08:40:05,,304,12,90,304,0,0,0,0,0
21317493981_10153794268323982,Get ready for all the behind-the-scenes airline photos you could ever want:,The Best Airlines on Snapchat,link,http://cntrvlr.co/bdzuUFB,2015-11-09 07:30:09,,94,5,7,94,0,0,0,0,0
21317493981_10153794243078982,Good morning from Honolulu. http://cntrvlr.co/N7QlUdH,Timeline Photos,photo,https://www.facebook.com/CondeNastTraveler/photos/a.174408898981.149256.21317493981/10153794243078982/?type=3,2015-11-09 07:00:21,,1424,26,70,1424,0,0,0,0,0
21317493981_10153794203278982,Why you should definitely judge an airline by its seats http://cntrvlr.co/Zwv4x8d,Timeline Photos,photo,https://www.facebook.com/CondeNastTraveler/photos/a.174408898981.149256.21317493981/10153794203278982/?type=3,2015-11-09 06:30:06,,212,6,22,212,0,0,0,0,0
21317493981_10153794180208982,Plan your next trip with the help of the Readers' Choice Awards issue. Subscribe now for $6!,Get Your Readers' Choice Awards Issue Now!,link,http://cntrvlr.co/2odtUI3,2015-11-09 06:00:14,,4,0,0,4,0,0,0,0,0
21317493981_10153794071213982,Heading to Las Vegas soon? Here's what to do: http://cntrvlr.co/k3TdvWV,Timeline Photos,photo,https://www.facebook.com/CondeNastTraveler/photos/a.174408898981.149256.21317493981/10153794071213982/?type=3,2015-11-09 04:00:14,,485,15,95,485,0,0,0,0,0
21317493981_10153793983148982,We're dreaming of sailing away to... http://cntrvlr.co/MJZoKHN,Timeline Photos,photo,https://www.facebook.com/CondeNastTraveler/photos/a.174408898981.149256.21317493981/10153793983148982/?type=3,2015-11-09 03:00:20,,1488,11,105,1488,0,0,0,0,0
21317493981_10153793831738982,What you need to know about Restival (and other under-the-radar festivals this winter): http://cntrvlr.co/K0j57AL,Timeline Photos,photo,https://www.facebook.com/CondeNastTraveler/photos/a.174408898981.149256.21317493981/10153793831738982/?type=3,2015-11-09 02:00:06,,373,5,40,373,0,0,0,0,0
21317493981_10153793733178982,"It's never too late. 

15 places to go for your end of the year resolutions: http://cntrvlr.co/CkQtSmK",Timeline Photos,photo,https://www.facebook.com/CondeNastTraveler/photos/a.174408898981.149256.21317493981/10153793733178982/?type=3,2015-11-09 00:00:15,,478,1,43,478,0,0,0,0,0
21317493981_10153793705833982,Could you recognize these places from space? http://cntrvlr.co/TNxChP4,Timeline Photos,photo,https://www.facebook.com/CondeNastTraveler/photos/a.174408898981.149256.21317493981/10153793705833982/?type=3,2015-11-08 23:30:18,,116,4,8,116,0,0,0,0,0
21317493981_10153793642688982,Let your phone ride shotgun.,8 Fantastic Apps to Download Before Your Next Road Trip,link,http://cntrvlr.co/Q0bbPUz,2015-11-08 22:59:05,,95,3,45,95,0,0,0,0,0
21317493981_10153793610073982,For your Sunday night blues: http://cntrvlr.co/ePYb1s7,Timeline Photos,photo,https://www.facebook.com/CondeNastTraveler/photos/a.174408898981.149256.21317493981/10153793610073982/?type=3,2015-11-08 22:30:16,,464,3,48,464,0,0,0,0,0
21317493981_10153793520733982,"""My life is my art and traveling shapes who I am. It improves me; it challenges me and it leaves me eager for more. I am thankful that I have created a life for myself where experiences and views like these are always a priority."" - Felicia Ceraso

Share a photo in the comments below and tell us why you're thankful for travel.",Timeline Photos,photo,https://www.facebook.com/CondeNastTraveler/photos/a.174408898981.149256.21317493981/10153793520733982/?type=3,2015-11-08 22:00:38,,772,43,84,772,0,0,0,0,0
21317493981_10153793482843982,Now's the time to book a beach vacation in Belize.,5 Things Smart Travelers Should Do This November,link,http://cntrvlr.co/TvXrRqU,2015-11-08 21:32:07,,80,2,11,80,0,0,0,0,0
21317493981_10153793436463982,Bon voyage!,The One Bag You Need For Every Type of Vacation,link,http://cntrvlr.co/w6JCQ9b,2015-11-08 21:00:28,,118,3,17,118,0,0,0,0,0
21317493981_10153793348888982,These buildings leave us in awe every. single. time.,10 Architectural Wonders Around the World,link,http://cntrvlr.co/Gm5eZzQ,2015-11-08 20:00:41,,768,15,176,768,0,0,0,0,0
21317493981_10153793264308982,Talk about breathtaking.,The 10 Most Unbelievable Temples in the World,link,http://cntrvlr.co/VRsW4sV,2015-11-08 19:00:37,,565,14,131,565,0,0,0,0,0
21317493981_10153793186518982,The world's greatest home of custom suiting is no longer a boys' club:,Get a Bespoke Savile Row Suit (Without the Flight to London),link,http://cntrvlr.co/pZT54BF,2015-11-08 18:00:43,,272,2,20,272,0,0,0,0,0
21317493981_10153793043568982,Are you ready for your daily dose of wanderlust? http://cntrvlr.co/yLyEecc,Timeline Photos,photo,https://www.facebook.com/CondeNastTraveler/photos/a.174408898981.149256.21317493981/10153793043568982/?type=3,2015-11-08 16:33:03,,210,3,38,210,0,0,0,0,0
21317493981_10153792932288982,And what you should know:,Some Major Passport Changes Are Coming Your Way,link,http://cntrvlr.co/NAMxGg9,2015-11-08 15:30:19,,399,12,211,399,0,0,0,0,0
21317493981_10153792835973982,"They're so good, you won't ever fly the same.",Singapore Airlines' Premium Economy Makes a 16-Hour Flight Seem Reasonable,link,http://cntrvlr.co/hAlFg96,2015-11-08 14:32:03,,776,32,147,776,0,0,0,0,0
21317493981_10153792784128982,Which one is next on your list?,10 Best Cities in Europe: Readers' Choice Awards 2015,link,http://cntrvlr.co/q2NO19W,2015-11-08 14:00:43,,624,23,147,624,0,0,0,0,0
21317493981_10153792730348982,Garance Dore sets the record straight.,The 5 Biggest Differences Between French and American Women,link,http://cntrvlr.co/IXtijzO,2015-11-08 13:30:23,,493,36,96,493,0,0,0,0,0
21317493981_10153792675858982,The first Delta plane was not for the faint of heart.,8 Vintage Photos From the Early Days of Flight,link,http://cntrvlr.co/iaKnKRM,2015-11-08 13:00:55,,152,4,39,152,0,0,0,0,0
21317493981_10153792615078982,Take it from us: visiting Europe in the autumn means less tourists and lower prices.,The 10 Best European Cities to Visit in Autumn,link,http://cntrvlr.co/BwwkH9F,2015-11-08 12:23:08,,771,13,157,771,0,0,0,0,0
21317493981_10153792543713982,"Here's where Greeks are traveling—and where they suggest you go, too.",The 8 Most Stunning Cities in Greece,link,http://cntrvlr.co/3jhQPOA,2015-11-08 11:39:06,,612,11,148,612,0,0,0,0,0
