status_id,status_message,link_name,status_type,status_link,status_published,status_video_length,num_reactions,num_comments,num_shares,num_likes,num_loves,num_wows,num_hahas,num_sads,num_angrys
21317493981_10154058920898982,Call it an official trend.,Santorini to Start Turning (Some) Tourists Away,link,http://cntrvlr.co/Fv0CHEo,2016-03-11 09:00:58,,120,6,25,0,0,0,0,0,0
21317493981_10154058438703982,Good morning from Bermuda. http://cntrvlr.co/ouK76R9,Timeline Photos,photo,https://www.facebook.com/CondeNastTraveler/photos/a.174408898981.149256.21317493981/10154058438703982/?type=3,2016-03-11 07:00:07,,3492,46,288,0,0,0,0,0,0
21317493981_10154056564778982,We can hear the waves crashing now. Have you been to one of the world's top 10 perfect sandy beaches? http://cntrvlr.co/HWA7xZb,Timeline Photos,photo,https://www.facebook.com/CondeNastTraveler/photos/a.174408898981.149256.21317493981/10154056564778982/?type=3,2016-03-10 22:10:03,,668,7,79,0,0,0,0,0,0
21317493981_10154056478253982,"The one (or two, or three) must-haves we'd never board a flight without.",8 Items Every Fashion Lover Always Packs,link,http://cntrvlr.co/IiVLDfu,2016-03-10 21:34:07,,62,2,7,0,0,0,0,0,0
21317493981_10154056204118982,Goodnight. http://cntrvlr.co/1PaOjWb,Timeline Photos,photo,https://www.facebook.com/CondeNastTraveler/photos/a.174408898981.149256.21317493981/10154056204118982/?type=3,2016-03-10 21:09:08,,3367,41,144,0,0,0,0,0,0
21317493981_10154055728628982,Keep on living on. http://cntrvlr.co/jM0n22G,Timeline Photos,photo,https://www.facebook.com/CondeNastTraveler/photos/a.174408898981.149256.21317493981/10154055728628982/?type=3,2016-03-10 20:03:05,,104,4,48,0,0,0,0,0,0
21317493981_10154055307823982,The weekend is so close yet so far. (Here's some inspiration): http://cntrvlr.co/IpKi5zQ,Timeline Photos,photo,https://www.facebook.com/CondeNastTraveler/photos/a.174408898981.149256.21317493981/10154055307823982/?type=3,2016-03-10 19:00:27,,511,2,24,0,0,0,0,0,0
21317493981_10154051356098982,Finally: travel-sized beauty products we actually want to use—even when we're not traveling. http://cntrvlr.co/VhTT8A1,The Travel-Size Makeup You're About to Be Obsessed With,video,https://www.facebook.com/CondeNastTraveler/videos/10154051356098982/,2016-03-10 18:00:00,00:53,61,4,4,0,0,0,0,0,0
21317493981_10154054897253982,Why everyone is saying Austin is still the coolest town:,Travelogue Podcast: How to Navigate Austin and SXSW Like a Local,link,http://cntrvlr.co/nKfeLmI,2016-03-10 17:00:36,,166,13,39,0,0,0,0,0,0
21317493981_10154054805588982,Sit tight: Airplanes are about to get even cozier.,Airlines Add an Extra Seat to Each Row,link,http://cntrvlr.co/8L6sGws,2016-03-10 16:00:49,,148,28,39,0,0,0,0,0,0
21317493981_10154054694013982,"For the third year in a row, this island city takes the ""prize.""",The World's Most Expensive City Is...,link,http://cntrvlr.co/deQut1x,2016-03-10 15:43:27,,1033,76,246,0,0,0,0,0,0
21317493981_10154054630238982,How technology is actually deteriorating your memory. http://cntrvlr.co/xEUvEHb,"Travel Journals > Travel Photographs, Says Science",link,http://cntrvlr.co/xEUvEHb,2016-03-10 15:06:04,,105,2,37,0,0,0,0,0,0
21317493981_10154054454903982,Time to shed the winter layers. http://cntrvlr.co/QgDyIA0,Timeline Photos,photo,https://www.facebook.com/CondeNastTraveler/photos/a.174408898981.149256.21317493981/10154054454903982/?type=3,2016-03-10 14:25:06,,461,4,8,0,0,0,0,0,0
21317493981_10154054403058982,Tell a friend. http://cntrvlr.co/hI0RYlH,10 Best Places for Bachelor and Bachelorette Parties,link,http://cntrvlr.co/uUh5Cuz,2016-03-10 14:02:08,,133,28,33,0,0,0,0,0,0
21317493981_10154054238928982,After a passenger noticed something moving inside a bag: http://cntrvlr.co/LEi7CCS,Woman Smuggles Child Onto Air France Flight in Her Carry-On,link,http://cntrvlr.co/LEi7CCS,2016-03-10 13:23:06,,110,28,41,0,0,0,0,0,0
21317493981_10154054162113982,You're welcome. http://cntrvlr.co/sWkn6mM,This Airline Has the Cheapest Fares 70 Percent of the Time,link,http://cntrvlr.co/sWkn6mM,2016-03-10 12:36:03,,249,24,53,0,0,0,0,0,0
21317493981_10154054124113982,Why you should upgrade this on your list now: http://cntrvlr.co/Rt0dK2l,Will Angkor Wat Be the Next Site to Cap Visitor Numbers?,link,http://cntrvlr.co/Rt0dK2l,2016-03-10 12:13:08,,142,24,23,0,0,0,0,0,0
21317493981_10154053893758982,Magical. http://cntrvlr.co/IBRB49r,Alaska Airlines Reroutes Flight So Passengers Can See Solar Eclipse,link,http://cntrvlr.co/IBRB49r,2016-03-10 11:15:10,,2778,40,291,0,0,0,0,0,0
21317493981_10154053805508982,There's nothing better to do on a beautiful day http://cntrvlr.co/Gv59mK1,The 10 Most Famous Streets in the World,link,http://cntrvlr.co/Gv59mK1,2016-03-10 10:39:04,,233,15,108,0,0,0,0,0,0
21317493981_10154053728223982,We've got you covered. http://cntrvlr.co/YsN08GQ,Flight Canceled? These Travel Apps Will Deal with the Hassle,link,http://cntrvlr.co/YsN08GQ,2016-03-10 10:04:03,,20,0,11,0,0,0,0,0,0
21317493981_10154053684608982,,This is the Most Visited Place in London,link,http://cntrvlr.co/eHgA1q9,2016-03-10 09:37:05,,292,6,54,0,0,0,0,0,0
21317493981_10154053552668982,🇮🇹 🇮🇹 🇮🇹,The 20 Most Beautiful Places in Italy,link,http://cntrvlr.co/H5ftGOG,2016-03-10 09:00:42,,754,35,394,0,0,0,0,0,0
21317493981_10154053479973982,"Passports come in red, green, blue or black—here's what your color says about you:",What Your Passport Color Says About You,link,http://cntrvlr.co/wvqFzQ7,2016-03-10 08:15:07,,192,10,46,0,0,0,0,0,0
21317493981_10154053307138982,Going to Austin for SXSW? Here's what to do while you're there:,20 Best Things To Do In Austin,link,http://cntrvlr.co/vDd4woQ,2016-03-10 07:12:08,,49,8,8,0,0,0,0,0,0
21317493981_10154051605503982,Via Atlas Obscura,The 19th Century 'Show Caves' That Became America's First Tourist Traps,link,http://www.atlasobscura.com/articles/show-caves-arent-telling?utm_source=facebook.com&utm_medium=cnt,2016-03-09 23:40:01,,67,1,8,0,0,0,0,0,0
21317493981_10154052203643982,11 things you need to know about taking better photos with your iPhone: http://cntrvlr.co/WcgUQhQ,Timeline Photos,photo,https://www.facebook.com/CondeNastTraveler/photos/a.174408898981.149256.21317493981/10154052203643982/?type=3,2016-03-09 22:30:10,,293,10,52,0,0,0,0,0,0
21317493981_10154052058753982,Islands are generally pretty gorgeous. They are islands after all. But these are the best of the best:,The 12 Most Scenic Islands in the World,link,http://cntrvlr.co/bHbpqK3,2016-03-09 21:45:08,,646,22,150,0,0,0,0,0,0
21317493981_10154051997648982,Paris' iconic Seine River actually begins 180 miles upstream from Paris...in a tiny Burgundy village.,Why There's a Part of Paris in Burgundy,link,http://cntrvlr.co/f1LzICC,2016-03-09 21:00:22,,23,1,3,0,0,0,0,0,0
21317493981_10154051949673982,The one place you need to visit in each of the 50 states: http://cntrvlr.co/dZfmaeG,Timeline Photos,photo,https://www.facebook.com/CondeNastTraveler/photos/a.174408898981.149256.21317493981/10154051949673982/?type=3,2016-03-09 20:30:12,,488,8,72,0,0,0,0,0,0
21317493981_10154051905918982,,An Art Lover's Guide to Los Angeles,link,http://cntrvlr.co/qrRre3c,2016-03-09 20:00:53,,135,0,24,0,0,0,0,0,0
21317493981_10154051770503982,Tell us about some of your favorite spots in Los Angeles for a chance to be featured by @[Condé Nast Traveler]. You could be our next travel expert!,Los Angeles Notes,link,http://cntrvlr.co/TU9Rcbw,2016-03-09 19:30:40,,26,2,1,0,0,0,0,0,0
21317493981_10154051728718982,,Where to Get the Best Soup Dumplings in Hong Kong,link,http://cntrvlr.co/Ig2Y22V,2016-03-09 19:01:00,,47,1,6,0,0,0,0,0,0
21317493981_10154051671328982,"It's possible to avoid all those pesky fees (and yes, there are a lot of them).",How to Beat Spirit at its Own Game and Minimize Airline Fees,link,http://cntrvlr.co/LgKMYUY,2016-03-09 18:30:29,,145,20,55,0,0,0,0,0,0
21317493981_10154051619428982,Finally: a camera bag we actually want to carry around.,Our Favorite Camera Bag Doesn't Look Like One,link,http://cntrvlr.co/mEyZ3rh,2016-03-09 18:01:02,,31,3,3,0,0,0,0,0,0
21317493981_10154051570193982,These are the world's top beaches for swimming and snorkeling—so grab your gear and go. http://cntrvlr.co/gcXymRO,Timeline Photos,photo,https://www.facebook.com/CondeNastTraveler/photos/a.174408898981.149256.21317493981/10154051570193982/?type=3,2016-03-09 17:30:29,,1462,45,176,0,0,0,0,0,0
21317493981_10154051416618982,Tip no. 1: Don't wait any longer.,How to Rent a Summer Home (When You Forgot to Rent a Summer Home),link,http://cntrvlr.co/VC379oz,2016-03-09 16:54:04,,43,1,8,0,0,0,0,0,0
21317493981_10154051355128982,"We're celebrating amazing hotel breakfasts all day on Condé Nast Traveler's Instagram. Have a place you want to recommend? Follow us at CNTraveler and let us know! http://cntrvlr.co/tTBT6t1

Photo by Julia Kramer of Bon Appétit Magazine",Timeline Photos,photo,https://www.facebook.com/CondeNastTraveler/photos/a.174408898981.149256.21317493981/10154051355128982/?type=3,2016-03-09 16:24:05,,51,4,6,0,0,0,0,0,0
21317493981_10154051318828982,Flight cancellations don't have to spell disaster anymore.,Flight Canceled? These Travel Apps Will Deal with the Hassle,link,http://cntrvlr.co/QHV2gok,2016-03-09 16:00:27,,9,0,4,0,0,0,0,0,0
21317493981_10154050710418982,"Digital deputy editor Laura Dannen Redman caught a ride through Old Havana in a classic Cuban taxi: a bright orange '51 Chevy, handed down to the driver from his grandfather.","Take a Ride Through Havana, Cuba",video,https://www.facebook.com/CondeNastTraveler/videos/10154050710418982/,2016-03-09 15:37:00,00:38,312,18,58,0,0,0,0,0,0
21317493981_10154051234883982,"Yes, it's totally possible to have two passports.",Travel Often? You Can Get a Second Passport,link,http://cntrvlr.co/ENRa0uP,2016-03-09 15:10:07,,26,2,3,0,0,0,0,0,0
21317493981_10154051179063982,"Is Machu Picchu on your bucket list? How about drinking a Pisco Sour cocktail and eating the best ceviche in the world? Well, we have good news.",Flight Deal of the Day: U.S. to Peru for Under $450 Round Trip,link,http://cntrvlr.co/6bMcrVm,2016-03-09 14:40:07,,1349,189,273,0,0,0,0,0,0
21317493981_10154051133118982,These resorts take pampering to a whole new level.,The 10 Best Adults-Only All-Inclusive Resorts,link,http://cntrvlr.co/9juNKrz,2016-03-09 14:10:09,,39,3,12,0,0,0,0,0,0
21317493981_10154051081533982,"""It's going to continue to be a challenge, but if it's there, they will find it eventually.""",How Much Longer Will the MH370 Search Continue?,link,http://cntrvlr.co/k3MUsoF,2016-03-09 13:41:30,,8,0,0,0,0,0,0,0,0
21317493981_10154051012908982,Why ski down the Alps when you can free-fall slide down them?,Switzerland's Mountain Coaster Lets You Slide Down the Alps,link,http://cntrvlr.co/kGhQQRI,2016-03-09 13:10:05,,73,14,28,0,0,0,0,0,0
21317493981_10154050958588982,Greece's Santorini is the latest place to limit tourists in the face of overcrowding and complaints from locals.,Santorini to Start Turning (Some) Tourists Away,link,http://cntrvlr.co/r7Fb6D7,2016-03-09 12:32:03,,32,2,5,0,0,0,0,0,0
21317493981_10154050907433982,Australia is now using drones to look for sharks in public swimming areas:,How Australia Is Using Drones to Prevent Shark Attacks,link,http://cntrvlr.co/8B6ttPQ,2016-03-09 11:59:46,,42,1,9,0,0,0,0,0,0
21317493981_10154050839248982,,The 10 Friendliest (and Unfriendliest) Cities in the World,link,http://cntrvlr.co/TvH7Tvf,2016-03-09 11:23:47,,321,13,95,0,0,0,0,0,0
21317493981_10154050667078982,Let's face it: we're in love with Florence.,"23 Beautiful Photos of Florence, Your Favorite City in the World",link,http://cntrvlr.co/Tn8M9sE,2016-03-09 10:42:08,,837,27,212,0,0,0,0,0,0
21317493981_10154050607403982,The 10 best places to live in the U.S. http://cntrvlr.co/dRMtyf3,Timeline Photos,photo,https://www.facebook.com/CondeNastTraveler/photos/a.174408898981.149256.21317493981/10154050607403982/?type=3,2016-03-09 10:11:03,,899,24,95,0,0,0,0,0,0
21317493981_10154050475423982,Great news if you haven't decided when or where to go on vacation.,Google Travel Does Everything For You Except Pack,link,http://cntrvlr.co/rEdXRT6,2016-03-09 09:42:41,,41,4,6,0,0,0,0,0,0
21317493981_10154050422513982,Now you know.,How to Get Free Global Entry,link,http://cntrvlr.co/jGHFZZn,2016-03-09 09:00:45,,15,0,11,0,0,0,0,0,0
21317493981_10154050354458982,Congress is fighting for your right to more legroom.,6 Ways Flying Could Change This Year,link,http://cntrvlr.co/XleU6FF,2016-03-09 08:08:04,,36,2,4,0,0,0,0,0,0
21317493981_10154050278048982,You can't beat this deal to Paris.,Flight Deal of the Day: U.S. to Paris for Under $450 Round-Trip,link,http://cntrvlr.co/3qJyuWy,2016-03-09 07:08:06,,29,1,5,0,0,0,0,0,0
21317493981_10154049714748982,Marie Antoinette meets Maria from West Side Story.,Explore a Massive Labyrinth Made of 'Cake' in Los Angeles,link,http://cntrvlr.co/nwxNe9R,2016-03-08 23:45:06,,139,19,20,0,0,0,0,0,0
21317493981_10154049662263982,That 12-hour flight has nothing on these products.,8 In-Flight Beauty Treatments to Feel Good on a Long Flight,link,http://cntrvlr.co/DszlSDJ,2016-03-08 23:00:57,,133,1,31,0,0,0,0,0,0
21317493981_10154049595623982,"Each Sunday at the Feria de Mataderos, a fair on the outskirts of Buenos Aires, you can find the locals here:",Behind the Scenes of Argentina's Legendary Cowboy Competition,link,http://cntrvlr.co/JgHkoFX,2016-03-08 22:10:05,,53,1,7,0,0,0,0,0,0
21317493981_10154049550513982,You don't have to be royalty to live like a king.,10 Incredible Presidential Suites and Villas Around the World,link,http://cntrvlr.co/MsroIgE,2016-03-08 21:34:09,,200,1,28,0,0,0,0,0,0
21317493981_10154048989208982,"Everything you need to have a great flight is in here, trust us. http://cntrvlr.co/4RZEAmG",The Right Way to Pack a Carry-On Bag,video,https://www.facebook.com/CondeNastTraveler/videos/10154048989208982/,2016-03-08 21:00:01,00:37,236,7,67,0,0,0,0,0,0
21317493981_10154049323393982,Start preparing now.,The 10 Best Places in the World to Retire,link,http://cntrvlr.co/NRwBai1,2016-03-08 20:00:50,,163,6,59,0,0,0,0,0,0
21317493981_10154048898308982,It's like time-traveling on your way to breakfast.,This Mexican Mansion-Turned-Hotel is Every Art Deco Fan's Dream,link,http://www.cntraveler.com/stories/2016-03-08/how-to-look-art-deco-chic-at-guadalajaras-casa-fayette-hotel?mbid=social_facebook,2016-03-08 19:00:01,,155,3,11,0,0,0,0,0,0
21317493981_10154049010803982,You can ditch any old notions you may have of the Renaissance capital as a frozen-in-amber monument to Italy's oldest monuments.,20 Best Things To Do in Florence,link,http://cntrvlr.co/mBXsP6V,2016-03-08 18:00:36,,445,33,117,0,0,0,0,0,0
21317493981_10154048975818982,"For 20 years, Guy Trebay has found both peace and adventure in the southern Indian state of Tamil Nadu. In our March issue, photographer Felix Odell captures the vibrance, grandeur, and beauty of the temple towns that have become regular stops on Trebay's travels through the region. http://cntrvlr.co/fSDFyj4",Condé Nast Traveler's cover photo,photo,https://www.facebook.com/CondeNastTraveler/photos/a.10150745501978982.459461.21317493981/10154048975818982/?type=3,2016-03-08 17:42:03,,263,2,12,0,0,0,0,0,0
21317493981_10154048905318982,"If you are looking for a change, you've come to the right place.",The 10 Best Places to Live in the U.S.,link,http://cntrvlr.co/ys9Osci,2016-03-08 17:00:48,,124,1,34,0,0,0,0,0,0
21317493981_10154048833128982,Time to relax.,The 20 Best Spas in the World,link,http://cntrvlr.co/eD8ANOY,2016-03-08 16:10:07,,283,7,71,0,0,0,0,0,0
21317493981_10154048801508982,,Elizabeth Gilbert,photo,https://www.facebook.com/GilbertLiz/photos/a.356148997800555.79726.227291194019670/976518979096884/?type=3,2016-03-08 15:55:48,,602,8,0,0,0,0,0,0,0
21317493981_10154048775198982,Where are you going next? http://cntrvlr.co/067tiIu (Quote by Ibn Battuta),Timeline Photos,photo,https://www.facebook.com/CondeNastTraveler/photos/a.174408898981.149256.21317493981/10154048775198982/?type=3,2016-03-08 15:40:10,,5383,138,2000,0,0,0,0,0,0
21317493981_10154048686088982,☀️ ☀️ ☀️,11 Photos of the Most Beautiful Island in the World,link,http://cntrvlr.co/kemWcex,2016-03-08 15:10:08,,798,41,182,0,0,0,0,0,0
21317493981_10154048633708982,"Looking for the perfect place to say ""I do?"" We've got the answer.",The Most Beautiful Wedding Venues in the U.S.,link,http://cntrvlr.co/JSiKEER,2016-03-08 14:40:04,,357,25,65,0,0,0,0,0,0
21317493981_10154048593093982,Why be in the back of the plane when you can be in the front?,JetBlue Is Accepting Applicants for Its Pilot Training Program,link,http://cntrvlr.co/kfjEMiW,2016-03-08 14:10:05,,315,53,134,0,0,0,0,0,0
21317493981_10154048546783982,Passports come in four different colors—here's how your country got theirs:,What Your Passport Color Says About You,link,http://cntrvlr.co/rX16RUS,2016-03-08 13:40:08,,849,74,303,0,0,0,0,0,0
21317493981_10154048490773982,An early morning pain au chocolat in Paris this fall? We say oui.,Deal of the Day: U.S. to Paris for Under $450 Round-Trip,link,http://cntrvlr.co/E7Pn9dX,2016-03-08 13:05:18,,1923,191,376,0,0,0,0,0,0
21317493981_10154048436903982,Forget the snow globes and refrigerator magnets.,Why the Best Maldives Souvenir Is One You Can't Bring Home,link,http://cntrvlr.co/7WCuWRo,2016-03-08 12:33:03,,261,9,25,0,0,0,0,0,0
21317493981_10154048390363982,Flying could become a lot more enjoyable in 2016.,Congress Fights for Your Right to More Legroom on Planes,link,http://cntrvlr.co/K5aPFzG,2016-03-08 12:03:03,,402,26,49,0,0,0,0,0,0
21317493981_10154048328733982,The 50 most beautiful cities in the world: http://cntrvlr.co/ZGAsDiF,Timeline Photos,photo,https://www.facebook.com/CondeNastTraveler/photos/a.174408898981.149256.21317493981/10154048328733982/?type=3,2016-03-08 11:20:05,,899,23,96,0,0,0,0,0,0
21317493981_10154048257548982,"These days, anyone with a smartphone can take photos that look straight out of a magazine spread. Wondering where to start? Download these apps.",11 iPhone Photography Apps (and Tips) You Need to Know,link,http://cntrvlr.co/hqEM4TX,2016-03-08 10:40:06,,327,17,133,0,0,0,0,0,0
21317493981_10154048163808982,Happy almost-March Madness!,The 20 Most Beautiful College Campuses in America,link,http://cntrvlr.co/2wCQvXv,2016-03-08 09:50:10,,79,3,16,0,0,0,0,0,0
21317493981_10154048093413982,"Air India Flight 173 took off on Sunday from Delhi to San Francisco, with an all-female crew, making it the longest flight staffed entirely by women in history.",The Longest Flight Run Entirely By Women Heads Home Today,link,http://cntrvlr.co/ifrx7XK,2016-03-08 09:00:26,,9678,187,2185,0,0,0,0,0,0
21317493981_10154048006308982,"If visiting Yellowstone, Yosemite, or any of the country's other national parks isn't on your bucket list, go ahead and edit it.",How to Plan the Perfect National Parks Trip,link,http://cntrvlr.co/1QidVBx,2016-03-08 08:20:02,,521,30,147,0,0,0,0,0,0
21317493981_10154047916963982,"Due to record rainfall this year, a rare ""super bloom"" has covered Death Valley with beautiful flowers: http://cntrvlr.co/ZcjzJcF",Timeline Photos,photo,https://www.facebook.com/CondeNastTraveler/photos/a.174408898981.149256.21317493981/10154047916963982/?type=3,2016-03-08 07:00:18,,922,10,66,0,0,0,0,0,0
21317493981_10154047343163982,"Iceland and Greenland are stunningly beautiful from any angle, especially when seen from above. Via WIRED","The Breathtaking, Disorienting Terrain of Greenland and Iceland",link,http://cntrvlr.co/FHZ7mK8,2016-03-07 23:40:06,,250,15,24,0,0,0,0,0,0
21317493981_10154047288028982,The 20 most beautiful places in all of Italy: http://cntrvlr.co/w8cxjoG,Timeline Photos,photo,https://www.facebook.com/CondeNastTraveler/photos/a.174408898981.149256.21317493981/10154047288028982/?type=3,2016-03-07 23:00:50,,2751,108,445,0,0,0,0,0,0
21317493981_10154047181218982,"If it's serenity and solitude you're after, head to one of Hawaii's many secret, off-the-beaten-path beaches.",10 of Hawaii's Best Hidden Beaches,link,http://cntrvlr.co/BFNpXc8,2016-03-07 22:00:08,,416,20,108,0,0,0,0,0,0
21317493981_10154047085023982,"Whether they have over-the-top American charm (we're looking at you, Woodstock, Vermont) or proximity to some of the loveliest landscapes on earth (hello, Big Sur), these towns are worth a stopover.",The 17 Most Beautiful Towns in America,link,http://cntrvlr.co/bEvoF2S,2016-03-07 21:00:51,,238,1,72,0,0,0,0,0,0
21317493981_10154047014393982,It doesn't get much more secluded than this.,The 12 Most Beautiful Places to Spend the Night,link,http://cntrvlr.co/XrEbMof,2016-03-07 20:00:22,,562,10,127,0,0,0,0,0,0
21317493981_10154046929418982,"Globetrotter Jonathan Yevin carries his life in his cargo pockets, taking ""leave your baggage at home"" to a new level.",Why This Man Travels Without Luggage,link,http://cntrvlr.co/THP6jRX,2016-03-07 19:00:22,,285,21,73,0,0,0,0,0,0
21317493981_10154046849453982,Pok Pok chef Andy Ricker taught us how to order Thai food like a local:,The One Thing Visitors to Thailand Should Know About Ordering Food,link,http://cntrvlr.co/nYyXVyd,2016-03-07 18:11:06,,249,33,57,0,0,0,0,0,0
21317493981_10154046764703982,Tell us about some of your favorite spots in New York City for a chance to be featured by Condé Nast Traveler. You could be our next travel expert! http://cntrvlr.co/W2efBpG,How to See New York City Like a Local,video,https://www.facebook.com/CondeNastTraveler/videos/10154046764703982/,2016-03-07 17:35:00,01:03,105,5,53,0,0,0,0,0,0
21317493981_10154046731643982,We found the perfect beachy weekend trip to take from Paris this summer:,This Is the Cape Cod of France,link,http://cntrvlr.co/bLfBhxp,2016-03-07 16:56:05,,234,5,43,0,0,0,0,0,0
21317493981_10154046684908982,Your afternoon pick-me-up.,The Best Travel Quotes We've Ever Heard,link,http://cntrvlr.co/uGkZVei,2016-03-07 16:25:52,,180,7,27,0,0,0,0,0,0
21317493981_10154046624268982,"For some peace and quiet and escape in India, locals head here.",The Temple Towns in South India You Need to See,link,http://cntrvlr.co/hCXWAXr,2016-03-07 15:45:08,,226,7,42,0,0,0,0,0,0
21317493981_10154046570073982,"The numbers are in, and all ten of the most visited sites in the United Kingdom last year were in its capital.",The 10 Most-Visited Spots in London,link,http://cntrvlr.co/Scu8Pfu,2016-03-07 15:10:08,,275,16,54,0,0,0,0,0,0
21317493981_10154046526168982,The classic smoking slipper is back.,The Parisian Shoes Every Man Should Own,link,http://cntrvlr.co/QHY2c9Y,2016-03-07 14:41:54,,213,25,32,0,0,0,0,0,0
21317493981_10154046473183982,How many have you seen up close?,The Most Beautiful UNESCO World Heritage Sites,link,http://cntrvlr.co/gk4SjcK,2016-03-07 14:01:08,,435,11,85,0,0,0,0,0,0
21317493981_10154046443133982,A trip to Cambodia challenged this Condé Nast Traveler editor to look beyond a country's dark past—and appreciate its present.,Visiting Phnom Penh: How I Finally Relaxed In a City That Scared Me,link,http://cntrvlr.co/7qjhd4S,2016-03-07 13:39:04,,345,19,89,0,0,0,0,0,0
21317493981_10154046389513982,"Travelers, take note: A Global Entry fee credit may be included in your credit card perks.",How to Get Free Global Entry,link,http://cntrvlr.co/Gn4aYgB,2016-03-07 13:01:24,,207,13,58,0,0,0,0,0,0
21317493981_10154046344518982,Get your passport pic... by taking a selfie.,This App Makes It Way Easier For You to Renew Your Passport,link,http://cntrvlr.co/Ef6Qu5S,2016-03-07 12:30:11,,117,5,34,0,0,0,0,0,0
21317493981_10154046298883982,"Thanks to unusually high rainfall this year, the normally arid Death Valley is suddenly awash in bright yellow, pink, and purple blooms:",Death Valley's Rare 'Super Bloom' Covers Desert With Beautiful Flowers,link,http://cntrvlr.co/ghMS3Fk,2016-03-07 11:56:57,,448,8,42,0,0,0,0,0,0
21317493981_10154046251033982,"Goodbye, Downton Abbey.",7 Things You Never Knew About 'Downton Abbey',link,http://cntrvlr.co/nRHVPcq,2016-03-07 11:28:06,,341,12,61,0,0,0,0,0,0
21317493981_10154046195068982,Who knew?,The World's Largest Desert Island Is Not Where You'd Expect,link,http://cntrvlr.co/SBQyrEC,2016-03-07 10:54:28,,82,2,3,0,0,0,0,0,0
21317493981_10154046127203982,"If you're not ready to say goodbye to Downton Abbey yet (we aren't either), these vacation spots are for you:",10 English Manor Hotels That Fulfill Your 'Downton Abbey' Dreams,link,http://cntrvlr.co/2ubcHLj,2016-03-07 10:16:07,,306,20,79,0,0,0,0,0,0
21317493981_10154046085953982,Happy Monday! Wish you (and we) were here. http://cntrvlr.co/AkB91yn,Timeline Photos,photo,https://www.facebook.com/CondeNastTraveler/photos/a.174408898981.149256.21317493981/10154046085953982/?type=3,2016-03-07 09:48:48,,1879,22,84,0,0,0,0,0,0
21317493981_10154045927918982,Having two U.S. passports is more common than you think.,Travel Often? You Can Get a Second Passport,link,http://cntrvlr.co/eaP8gwO,2016-03-07 08:16:06,,382,17,137,0,0,0,0,0,0
21317493981_10154045841643982,Direct flights from the U.S. to Cuba could begin as early as August.,U.S. Flights to Cuba May Resume as Early as This Summer,link,http://cntrvlr.co/E7mO58W,2016-03-07 07:06:05,,287,12,36,0,0,0,0,0,0
21317493981_10154045010458982,"Wedding season is almost here—and with it, more chances to take a non-cookie-cutter honeymoon.",8 Honeymoon Destinations None of Your Friends Have Thought Of,link,http://cntrvlr.co/tSLVNsU,2016-03-06 23:00:07,,129,13,39,0,0,0,0,0,0
21317493981_10154044942698982,Some U.S. cities are just better places to live than others.,The 10 Best Places to Live in the U.S.,link,http://cntrvlr.co/8XCzaR0,2016-03-06 22:10:09,,294,18,80,0,0,0,0,0,0
21317493981_10154044881838982,There's truly nowhere in the world with nicer people.,The 10 Friendliest Cities in Canada,link,http://cntrvlr.co/UaTS5QJ,2016-03-06 21:34:07,,273,13,52,0,0,0,0,0,0
