status_id,status_message,link_name,status_type,status_link,status_published,status_video_length,num_reactions,num_comments,num_shares,num_likes,num_loves,num_wows,num_hahas,num_sads,num_angrys
21317493981_10154072469173982,"Trust us, it's a trip of a lifetime.",How to Plan the Perfect National Parks Trip,link,http://cntrvlr.co/5xXRWix,2016-03-15 14:29:04,,240,13,62,0,0,0,0,0,0
21317493981_10154072417113982,Pretty spectacular. via Atlas Obscura,The Hidden Patterns of America's Wildest Landscapes,link,http://cntrvlr.co/wCJGqso,2016-03-15 14:04:06,,73,0,3,0,0,0,0,0,0
21317493981_10154072342523982,Now is the time to book before tourists take over.,The White House Just Made It Even Easier to Visit Cuba,link,http://cntrvlr.co/YGUFyec,2016-03-15 13:30:05,,1850,121,405,0,0,0,0,0,0
21317493981_10154072282823982,How many have you visited already?,The 6 Best New Restaurants in the U.S. Are...,link,http://cntrvlr.co/BmbPtUu,2016-03-15 13:00:07,,90,3,18,0,0,0,0,0,0
21317493981_10154072151578982,It should be on the top of your list.,Why It's Okay to Love Las Vegas,link,http://cntrvlr.co/o2k2Kka,2016-03-15 12:02:03,,269,18,42,0,0,0,0,0,0
21317493981_10154072065058982,Your city could be next. http://cntrvlr.co/A98FIIJ,Pigeons With Backpacks Are Monitoring London's Air Quality,link,http://cntrvlr.co/A98FIIJ,2016-03-15 11:14:06,,191,7,39,0,0,0,0,0,0
21317493981_10154071973883982,Pretty brilliant if you ask us.,A New Service That Frees Travelers From Luggage,link,http://cntrvlr.co/zn0d4MR,2016-03-15 10:31:07,,149,9,33,0,0,0,0,0,0
21317493981_10154071925493982,It's so big you might need a GPS to find your way around.,The Largest Cruise Ship in the World Sets Sail,link,http://cntrvlr.co/cv349G8,2016-03-15 10:04:02,,365,19,97,0,0,0,0,0,0
21317493981_10154071835698982,Whether you're backpacking or looking for a spa retreat:,The Best Sites Like Airbnb: Top 4 Competitors,link,http://cntrvlr.co/dgpH2uS,2016-03-15 09:30:19,,99,2,14,0,0,0,0,0,0
21317493981_10154071777853982,"Why you might be losing your hard earned points, as we speak:",Don't Want to Lose Your Airline Miles? Fly Now,link,http://cntrvlr.co/P8Aubu4,2016-03-15 09:02:06,,86,2,7,0,0,0,0,0,0
21317493981_10154071708383982,"For the third consecutive year, guess which island city tops the list?",The World's Most Expensive City Is...,link,http://cntrvlr.co/oELxYL4,2016-03-15 08:28:06,,354,22,89,0,0,0,0,0,0
21317493981_10154071670243982,Because we know all too well the horrors of jet lag.,11 Tips for Sleeping Well on a Plane,link,http://cntrvlr.co/nDAH4XT,2016-03-15 08:01:06,,179,17,85,0,0,0,0,0,0
21317493981_10154071563998982,"Just one of the most beautiful train rides in the world, no big deal.",Travel Deal of the Day: 30 Percent Off Swiss Train Passes,link,http://cntrvlr.co/oJgo2Sa,2016-03-15 07:02:06,,640,29,83,0,0,0,0,0,0
21317493981_10154071457983982,"Good morning from Havana, Cuba. http://cntrvlr.co/SnRe0Oe",Timeline Photos,photo,https://www.facebook.com/CondeNastTraveler/photos/a.174408898981.149256.21317493981/10154071457983982/?type=3,2016-03-15 06:00:30,,3338,70,142,0,0,0,0,0,0
21317493981_10154071410268982,"Imagine traveling from L.A. to San Francisco at the speed of sound, seated comfortably in a capsule that looks something like a pill for giants.",A 30-Minute Train From Los Angeles to San Francisco Is Coming,link,http://cntrvlr.co/dbJA9oL,2016-03-15 05:29:07,,397,20,50,0,0,0,0,0,0
21317493981_10154070809218982,It's true.,How Cozy: Airlines Add an Extra Seat to Each Row,link,http://cntrvlr.co/oyVIyGM,2016-03-15 00:04:04,,81,5,13,0,0,0,0,0,0
21317493981_10154070731443982,"Rule #4: You might have to skip out on the gifts.

Via BRIDES",10 Things to Know Before Planning a Destination Wedding,link,http://cntrvlr.co/DVfhrDZ,2016-03-14 23:24:46,,117,7,19,0,0,0,0,0,0
21317493981_10154070681788982,Goodnight from Toronto: http://cntrvlr.co/5HC7WTx,Timeline Photos,photo,https://www.facebook.com/CondeNastTraveler/photos/a.174408898981.149256.21317493981/10154070681788982/?type=3,2016-03-14 22:59:04,,2342,43,163,0,0,0,0,0,0
21317493981_10154070571973982,"They may be spooky, but they're equally beautiful.",The 11 Most Stunning Abandoned Places on Earth,link,http://cntrvlr.co/pbEQl5r,2016-03-14 22:00:53,,428,14,88,0,0,0,0,0,0
21317493981_10154070472768982,The California hyperloop concept is finally getting out of the station.,"Hyperloop CEO at SXSW: ""Our Goal Is to Make Travel Suck Less""",link,http://cntrvlr.co/E0tKFh7,2016-03-14 21:15:05,,241,6,38,0,0,0,0,0,0
21317493981_10154070390173982,"They say that everyone's a little bit Irish on St. Patrick's Day, but where does your city stack up?",The Most Irish Cities in America,link,http://cntrvlr.co/u8fjldC,2016-03-14 20:35:07,,143,7,34,0,0,0,0,0,0
21317493981_10154070318358982,These views of the Northern Lights from space are unbelievable. http://cntrvlr.co/0ewQaMu,Timeline Photos,photo,https://www.facebook.com/CondeNastTraveler/photos/a.174408898981.149256.21317493981/10154070318358982/?type=3,2016-03-14 20:00:34,,2048,46,255,0,0,0,0,0,0
21317493981_10154070202833982,Explore the most beautiful places in Italy: http://cntrvlr.co/fpZ2pSz,Timeline Photos,photo,https://www.facebook.com/CondeNastTraveler/photos/a.174408898981.149256.21317493981/10154070202833982/?type=3,2016-03-14 19:00:21,,1173,19,126,0,0,0,0,0,0
21317493981_10154070085303982,What's for dinner?,10 Vegetarian Dishes That Will Make You Swear Off Meat,link,http://cntrvlr.co/eQxvlW5,2016-03-14 18:00:32,,515,59,152,0,0,0,0,0,0
21317493981_10154069938218982,Celebrate St. Paddy's Day authentically with more than just a pint of Guinness.,St. Patrick's Day: The Best Irish Pubs to Celebrate in the U.S.,link,http://cntrvlr.co/mpKqtfu,2016-03-14 17:00:04,,146,5,25,0,0,0,0,0,0
21317493981_10154069797213982,Visit this dream destination for half the price.,Flight Deal of the Day: U.S. to Fiji for Under $700 Round-Trip,link,http://cntrvlr.co/00ZZbYm,2016-03-14 16:00:43,,1015,102,363,0,0,0,0,0,0
21317493981_10154069685573982,Drop the selfie stick and pick up a pen.,Science Says Travel Journals Are Better Than Photographs,link,http://cntrvlr.co/tTqgl6q,2016-03-14 15:24:04,,478,39,114,0,0,0,0,0,0
21317493981_10154069603813982,How the weekend's attacks may affect your travels:,Turkey and Ivory Coast Attacks: The Travel Safety Alerts You Need to Know,link,http://cntrvlr.co/qqY1TOT,2016-03-14 14:30:06,,112,10,36,0,0,0,0,0,0
21317493981_10154069491933982,"The series finale has aired, but there are still ways celebrate Downton Abbey this year.",15 Fashion Exhibits You Need to See in 2016,link,http://cntrvlr.co/hrlPHBz,2016-03-14 14:00:40,,191,5,32,0,0,0,0,0,0
21317493981_10154069425808982,"Because it's in Paris, of course.",Incroyable! The World's Most Popular McDonald's Is in Paris,link,http://cntrvlr.co/xokpILC,2016-03-14 13:30:18,,171,14,47,0,0,0,0,0,0
21317493981_10154069358703982,"""Just getting me to the airport and out of the country was an accomplishment.""",Anthony Bourdain on the Most Dangerous Places He's Been,link,http://cntrvlr.co/Pyc9mO9,2016-03-14 13:00:47,,1651,35,237,0,0,0,0,0,0
21317493981_10154069298273982,"Sign us up for ""yappy hour.""",The 10 Best Pet-Friendly Luxury Hotels in the U.S.,link,http://cntrvlr.co/DbtYXBD,2016-03-14 12:30:23,,107,5,8,0,0,0,0,0,0
21317493981_10154069246583982,The secret? It's all about the folding.,The Wrinkle-Proof Method for Packing a Suit,link,http://cntrvlr.co/QEEOf6j,2016-03-14 12:00:10,,97,6,43,0,0,0,0,0,0
21317493981_10154069213358982,The town even renamed its newspaper: The Daily Planet.,Superman's Metropolis Is Actually in the Midwest,link,http://cntrvlr.co/8CT6EES,2016-03-14 11:40:05,,77,2,7,0,0,0,0,0,0
21317493981_10154069147638982,"No one is going to tell you not to visit the Palace of Versailles, but...","Make Fontainebleau, Not Versailles, Your Paris Day Trip",link,http://cntrvlr.co/kGDN6Z0,2016-03-14 11:15:05,,137,5,19,0,0,0,0,0,0
21317493981_10154069077618982,Wanted: athletic individual good with a ninja star and able to perform a solid backward handspring.,Japan Looking for Full-Time 'Ninjas' to Boost Tourism,link,http://cntrvlr.co/zGhCOc6,2016-03-14 10:30:05,,1036,132,295,0,0,0,0,0,0
21317493981_10154069030713982,These top 4 competitors give Airbnb a run for its money.,The Best Sites Like Airbnb,link,http://cntrvlr.co/CrTDnSb,2016-03-14 10:00:29,,484,25,95,0,0,0,0,0,0
21317493981_10154068970653982,Happy Pi Day!,The 12 Best Pies in the U.S.,link,http://cntrvlr.co/XBXM6d6,2016-03-14 09:30:30,,201,5,34,0,0,0,0,0,0
21317493981_10154068897908982,We're already packing our bags.,Travel Deal of the Day: Stay in a Royal Hawaiian Suite for 15 Percent Off,link,http://cntrvlr.co/42Unpvc,2016-03-14 09:00:25,,108,1,4,0,0,0,0,0,0
21317493981_10154068847138982,"""Going on vacation with your colleagues is one thing, but seeing them naked is entirely another.""",How to Go on Vacation With Your Coworkers,link,http://cntrvlr.co/kM2Q5Gd,2016-03-14 08:30:03,,70,4,4,0,0,0,0,0,0
21317493981_10154068795128982,Good morning from one of the most beautiful museums in the world! http://cntrvlr.co/6p5bICU,Timeline Photos,photo,https://www.facebook.com/CondeNastTraveler/photos/a.174408898981.149256.21317493981/10154068795128982/?type=3,2016-03-14 08:00:18,,261,8,44,0,0,0,0,0,0
21317493981_10154068617698982,Don't panic just yet.,10 Things You Need to Know About Turbulence,link,http://cntrvlr.co/ebmADXV,2016-03-14 07:00:02,,134,2,49,0,0,0,0,0,0
21317493981_10154068534978982,Avoid the hassle of waiting in line:,How to Get Free Global Entry,link,http://cntrvlr.co/LFeqVfS,2016-03-14 06:03:26,,91,2,35,0,0,0,0,0,0
21317493981_10154068477813982,30 places to visit at least once before you turn 30: http://cntrvlr.co/W2vGUG6,Timeline Photos,photo,https://www.facebook.com/CondeNastTraveler/photos/a.174408898981.149256.21317493981/10154068477813982/?type=3,2016-03-14 05:22:23,,893,32,91,0,0,0,0,0,0
21317493981_10154068333568982,The best things in life exist on secret islands. Or something like that.,7 Under-the-Radar Caribbean Islands Where You Won't Find Any Tourists,link,http://cntrvlr.co/yWUEhOM,2016-03-14 04:02:02,,183,12,58,0,0,0,0,0,0
21317493981_10154068286203982,Where we're dreaming of tonight. Can you guess which popular wine comes from this region?,The 20 Most Beautiful Places in Italy,link,http://cntrvlr.co/BfPbMyN,2016-03-14 03:25:08,,1058,57,259,0,0,0,0,0,0
21317493981_10154068179343982,"The 40 Best Resorts in Mexico. Or in other words, 40 reasons why you should do something good for yourself. http://cntrvlr.co/8jEGiPz",Timeline Photos,photo,https://www.facebook.com/CondeNastTraveler/photos/a.174408898981.149256.21317493981/10154068179343982/?type=3,2016-03-14 02:14:05,,832,32,94,0,0,0,0,0,0
21317493981_10154068069603982,Paris is on top of our list of most romantic places in the world to propose. But you've probably never imagined that these places were just as amazing: http://cntrvlr.co/xJ2C4z4,Timeline Photos,photo,https://www.facebook.com/CondeNastTraveler/photos/a.174408898981.149256.21317493981/10154068069603982/?type=3,2016-03-14 01:13:05,,703,5,67,0,0,0,0,0,0
21317493981_10154067983558982,You'll really want to remember these.,Is Airbnb Safe? Seven Tips To Always Keep In Mind.,link,http://cntrvlr.co/CcNDS8I,2016-03-14 00:15:06,,83,3,28,0,0,0,0,0,0
21317493981_10154067800628982,The side of Texas you've never seen. http://cntrvlr.co/LQGWeCV,Timeline Photos,photo,https://www.facebook.com/CondeNastTraveler/photos/a.174408898981.149256.21317493981/10154067800628982/?type=3,2016-03-13 22:30:10,,877,8,42,0,0,0,0,0,0
21317493981_10154067575098982,"""When people ask you why you're moving, just say, 'Because I can.""",My Life as an Expat: Why I Left New York and Moved to Nairobi,link,http://cntrvlr.co/wykC5PB,2016-03-13 21:03:04,,773,22,96,0,0,0,0,0,0
21317493981_10154067476223982,Don't mind if we do. Most incredible outdoor hotel suites where you can sleep under the stars. http://cntrvlr.co/mZtZ0Hd,Timeline Photos,photo,https://www.facebook.com/CondeNastTraveler/photos/a.174408898981.149256.21317493981/10154067476223982/?type=3,2016-03-13 20:09:05,,893,15,89,0,0,0,0,0,0
21317493981_10154067350948982,For every type of traveler. Which one are you?,The 10 Most Romantic Places in the World to Propose,link,http://cntrvlr.co/RApiXs2,2016-03-13 19:00:46,,141,8,29,0,0,0,0,0,0
21317493981_10154067208098982,Where we wish we were eating dinner tonight http://cntrvlr.co/jKTL3H9,Timeline Photos,photo,https://www.facebook.com/CondeNastTraveler/photos/a.174408898981.149256.21317493981/10154067208098982/?type=3,2016-03-13 18:05:06,,1898,51,231,0,0,0,0,0,0
21317493981_10154067068943982,Important.,What to Do When Your Checked Bag Is Damaged,link,http://cntrvlr.co/z34XMMJ,2016-03-13 17:05:08,,207,17,120,0,0,0,0,0,0
21317493981_10154066918288982,You'll never forgive yourself if you don't just do it.,The One Trip Everyone in Their 20s Should Take,link,http://cntrvlr.co/mXNZ1HB,2016-03-13 16:06:05,,1295,60,211,0,0,0,0,0,0
21317493981_10154066803563982,Our best kept secrets. http://cntrvlr.co/9K1dnmz,"Why The Best Pizza's Not in Italy, and Other Unexpected Food Finds",link,http://cntrvlr.co/9K1dnmz,2016-03-13 15:14:08,,225,8,25,0,0,0,0,0,0
21317493981_10154066648803982,"Even if you're not there, it's happy hour somewhere.",The Six Best Bars on Austin's Cocktail Row,link,http://cntrvlr.co/n2JLeSO,2016-03-13 14:02:07,,18,0,1,0,0,0,0,0,0
21317493981_10154066587418982,Thank us later.,7 Ways To Beat Spirit at its Own Game and Minimize Airline Fees,link,http://cntrvlr.co/jmQ3p4s,2016-03-13 13:33:06,,122,20,37,0,0,0,0,0,0
21317493981_10154066509438982,What you need in your life right now.,The 20 Best Islands in the World,link,http://cntrvlr.co/YFMA8Wm,2016-03-13 13:02:05,,565,20,129,0,0,0,0,0,0
21317493981_10154066477933982,How to take your Instagram game to the next level: http://cntrvlr.co/FLBbl6E,Timeline Photos,photo,https://www.facebook.com/CondeNastTraveler/photos/a.174408898981.149256.21317493981/10154066477933982/?type=3,2016-03-13 12:51:06,,462,4,16,0,0,0,0,0,0
21317493981_10154066388073982,If you dare. http://cntrvlr.co/lIrJ8T6,Weird Food: The Most Dangerous Foods You Can Eat,link,http://cntrvlr.co/lIrJ8T6,2016-03-13 12:08:05,,41,0,18,0,0,0,0,0,0
21317493981_10154066256493982,And guess which airline is providing free smoothies on Fridays. http://cntrvlr.co/MmwcTmn,Spring Break Travel Will Hit an All-Time High This Year,link,http://cntrvlr.co/MmwcTmn,2016-03-13 11:04:07,,105,2,14,0,0,0,0,0,0
21317493981_10154066187718982,If you could be stuck on one of these islands which one would you choose? http://cntrvlr.co/QXqAocf,12 Most Beautiful Beaches in Italy,link,http://cntrvlr.co/QXqAocf,2016-03-13 10:31:06,,320,22,85,0,0,0,0,0,0
21317493981_10154066124478982,"Globetrotter Jonathan Yevin carries his life in his cargo pockets, taking ""leave your baggage at home"" to a new level.",Why This Man Travels Without Luggage,link,http://cntrvlr.co/cttzqJ6,2016-03-13 10:00:54,,107,6,31,0,0,0,0,0,0
21317493981_10154066057798982,Why you should go to Brazil this year. http://cntrvlr.co/ewCp3hU,Timeline Photos,photo,https://www.facebook.com/CondeNastTraveler/photos/a.174408898981.149256.21317493981/10154066057798982/?type=3,2016-03-13 09:30:07,,380,23,21,0,0,0,0,0,0
21317493981_10154065964623982,Where we're hanging out today. What are your plans? http://cntrvlr.co/1hJxzzB,Timeline Photos,photo,https://www.facebook.com/CondeNastTraveler/photos/a.174408898981.149256.21317493981/10154065964623982/?type=3,2016-03-13 09:01:00,,2132,38,153,0,0,0,0,0,0
21317493981_10154065885148982,"For some peace and quiet in India, head to these temple towns: http://cntrvlr.co/UeKnm2W

Photograph by Felix Odell",Timeline Photos,photo,https://www.facebook.com/CondeNastTraveler/photos/a.174408898981.149256.21317493981/10154065885148982/?type=3,2016-03-13 08:30:08,,440,7,17,0,0,0,0,0,0
21317493981_10154065817983982,Good morning from The Maldives. http://cntrvlr.co/nS0VBdn,Timeline Photos,photo,https://www.facebook.com/CondeNastTraveler/photos/a.174408898981.149256.21317493981/10154065817983982/?type=3,2016-03-13 08:05:07,,4614,90,350,0,0,0,0,0,0
21317493981_10154065700148982,What you need to know:,Congress Fights for Your Right to More Legroom on Planes,link,http://cntrvlr.co/GFl22Ki,2016-03-13 07:03:07,,41,2,6,0,0,0,0,0,0
21317493981_10154065600248982,It's never too early to plan. http://cntrvlr.co/P6UIzB6,The 10 Best Places in the World to Retire,link,http://cntrvlr.co/P6UIzB6,2016-03-13 06:00:15,,117,9,35,0,0,0,0,0,0
21317493981_10154064799303982,It's no wonder our top island is also one of the most beautiful places in the world. http://cntrvlr.co/h0VhthY,Timeline Photos,photo,https://www.facebook.com/CondeNastTraveler/photos/a.174408898981.149256.21317493981/10154064799303982/?type=3,2016-03-12 22:00:33,,1851,17,126,0,0,0,0,0,0
21317493981_10154064747463982,We found the perfect beachy weekend trip to take from Paris this summer:,This Is the Cape Cod of France,link,http://cntrvlr.co/vVJa12W,2016-03-12 21:35:06,,231,10,39,0,0,0,0,0,0
21317493981_10154064680878982,Your map for the ultimate Texas road trip:,The Most Beautiful Places in Texas,link,http://cntrvlr.co/8Uffe9H,2016-03-12 21:00:06,,420,40,135,0,0,0,0,0,0
21317493981_10154064556453982,It was a last resort... Until it worked.,How Twitter Saved My Around-the-World Trip,link,http://cntrvlr.co/nekf6xq,2016-03-12 20:00:26,,83,2,14,0,0,0,0,0,0
21317493981_10154064417778982,What are your favorite hotels in the world?,Gold List 2016: Our Favorite Hotels in the World,link,http://cntrvlr.co/FMRfyDO,2016-03-12 19:00:47,,486,16,107,0,0,0,0,0,0
21317493981_10154064259898982,708 million passengers were screened last year.,These Airports Have the Worst TSA Wait Times in the U.S.,link,http://cntrvlr.co/LAK8JHZ,2016-03-12 18:00:54,,72,29,21,0,0,0,0,0,0
21317493981_10154064163198982,Land bright-eyed and refreshed—even after an intercontinental flight.,8 In-Flight Beauty Treatments to Feel Good on a Long Flight,link,http://cntrvlr.co/Onw5QEs,2016-03-12 17:00:47,,89,1,10,0,0,0,0,0,0
21317493981_10154064084678982,Long live Paris!,"25 Things You Absolutely, Positively Have to Do in Paris",link,http://cntrvlr.co/R39McHq,2016-03-12 16:15:06,,830,41,298,0,0,0,0,0,0
21317493981_10154064006518982,The good news: There's still time to book.,5 Things Every First-Time Summer Home Renter Should Know,link,http://cntrvlr.co/PHb1OCf,2016-03-12 15:30:05,,29,1,3,0,0,0,0,0,0
21317493981_10154063953068982,This cocktail's flavor is feisty enough to get us through these last dregs of winter.,Global Cocktail of the Week: A Spicy Margarita from Nicaragua's Coast,link,http://cntrvlr.co/zSJ5BpJ,2016-03-12 15:00:42,,202,8,51,0,0,0,0,0,0
21317493981_10154063891738982,"Try this ""hundred-million-dollar yacht on land.""",10 Incredible Presidential Suites and Villas Around the World,link,http://cntrvlr.co/p96lWNi,2016-03-12 14:29:06,,110,1,8,0,0,0,0,0,0
21317493981_10154063842273982,Never buy another boring souvenir again.,6 Things You Need to Know About Souvenir Shopping,link,http://cntrvlr.co/RJGKxyK,2016-03-12 14:00:31,,146,3,24,0,0,0,0,0,0
21317493981_10154063794088982,And we want every single piece of it.,Warm's New Clothing Line is Santa Cruz By Way of Paris,link,http://cntrvlr.co/Na2b4T1,2016-03-12 13:30:16,,68,0,7,0,0,0,0,0,0
21317493981_10154063729158982,File this away for your next trip to the Big Apple.,The Best Hotels in New York City: Readers' Choice Awards 2015,link,http://cntrvlr.co/or3QNqo,2016-03-12 13:00:25,,133,2,37,0,0,0,0,0,0
21317493981_10154063684973982,2016 the time to explore one of the greatest U.S. treasures.,How to Plan the Perfect National Parks Trip,link,http://cntrvlr.co/zjTI2l1,2016-03-12 12:40:04,,396,8,61,0,0,0,0,0,0
21317493981_10154063629913982,The best beaches are ones for doing absolutely nothing at all.,10 Most Relaxing Beaches in the World,link,http://cntrvlr.co/CpbBfDj,2016-03-12 12:15:06,,457,7,84,0,0,0,0,0,0
21317493981_10154063544148982,Our ultimate airline frustration:,Everything You Need To Know About Lost Luggage,link,http://cntrvlr.co/7EQORU8,2016-03-12 11:30:22,,40,1,18,0,0,0,0,0,0
21317493981_10154063478253982,"Have twice the fun, without the crowds, at these 5 spring break alternatives. http://cntrvlr.co/fRUOnR8",Timeline Photos,photo,https://www.facebook.com/CondeNastTraveler/photos/a.174408898981.149256.21317493981/10154063478253982/?type=3,2016-03-12 11:00:48,,440,2,22,0,0,0,0,0,0
21317493981_10154063410338982,Hint: It's good news for cardholders who travel internationally.,How JetBlue Is Stepping Up Its Credit Card Game,link,http://cntrvlr.co/sFwvjfn,2016-03-12 10:30:08,,112,3,18,0,0,0,0,0,0
21317493981_10154063346193982,Footage from the skies will hopefully curb the number of shark attacks.,How Australia Is Using Drones to Prevent Shark Attacks,link,http://cntrvlr.co/Q0Dnlqy,2016-03-12 10:00:22,,81,1,21,0,0,0,0,0,0
21317493981_10154063294598982,Good news for germaphobes:,This Self-Cleaning Airplane Bathroom Is the Lavatory of the Future,link,http://cntrvlr.co/JtoW2JL,2016-03-12 09:30:21,,187,8,29,0,0,0,0,0,0
21317493981_10154063241373982,"Say ""I do"" on a white sand beach, in a rustic barn, or on a scenic city rooftop.",The Most Beautiful Wedding Venues in the U.S.,link,http://cntrvlr.co/Zeo0nzs,2016-03-12 09:00:21,,211,9,39,0,0,0,0,0,0
21317493981_10154063136943982,"The newly crowned cruise ship can hold more than 6,000 passengers.",The Largest Cruise Ship in the World Just Set Sail for the First Time,link,http://cntrvlr.co/DrBYDtY,2016-03-12 08:00:42,,1536,129,424,0,0,0,0,0,0
21317493981_10154063040893982,Finally: a camera bag we actually want to carry around.,Our Favorite Camera Bag Doesn't Look Like One,link,http://cntrvlr.co/Ba0vww6,2016-03-12 07:00:30,,54,3,8,0,0,0,0,0,0
21317493981_10154061755373982,Visit Mexico's Caribbean coast—without ever leaving your kitchen.,Taste of Tulum: An Avocado Soup from the Hartwood Kitchen,link,http://cntrvlr.co/YxeS21y,2016-03-11 22:10:11,,54,6,8,0,0,0,0,0,0
21317493981_10154061681438982,Remember: it's not a hotel.,Is Airbnb Safe? Six Tips for First-Time Renters,link,http://cntrvlr.co/f10KNMn,2016-03-11 21:35:06,,160,15,48,0,0,0,0,0,0
21317493981_10154061534503982,"Gone to the beach, be back never. http://cntrvlr.co/1dqo8hF",The 10 Most Beautiful Islands in the Caribbean,link,http://cntrvlr.co/1dqo8hF,2016-03-11 21:00:10,,378,17,88,0,0,0,0,0,0
21317493981_10154061355648982,Rough it (without really roughing it).,The One Trip Everyone In Their 30s Should Take,link,http://cntrvlr.co/NGzGbPU,2016-03-11 20:00:35,,844,27,183,0,0,0,0,0,0
21317493981_10154061016953982,"An Indian palace, Swedish treehouse, and English castle all made the list.",The World's Most Beautiful Houses You Can Visit,link,http://cntrvlr.co/e4Xqlv3,2016-03-11 19:00:18,,269,6,52,0,0,0,0,0,0
21317493981_10154060647073982,Our out of office reply. http://cntrvlr.co/kKeDwGH,Timeline Photos,photo,https://www.facebook.com/CondeNastTraveler/photos/a.174408898981.149256.21317493981/10154060647073982/?type=3,2016-03-11 17:00:30,,2087,18,91,0,0,0,0,0,0
21317493981_10154060397928982,Pok Pok chef Andy Ricker taught us how to order Thai food like a local:,The One Thing Visitors to Thailand Should Know About Ordering Food,link,http://cntrvlr.co/J0tlS6J,2016-03-11 16:15:09,,114,13,25,0,0,0,0,0,0
21317493981_10154060232353982,You'll never want to leave. http://cntrvlr.co/cILjcXJ,The 40 Best Resorts in Mexico: Readers' Choice Awards 2015,link,http://cntrvlr.co/cILjcXJ,2016-03-11 15:38:04,,91,4,22,0,0,0,0,0,0
21317493981_10154060092668982,Time to get out of town. http://cntrvlr.co/RrKxa1M,14 Most Insanely Beautiful Coastlines in the World,link,http://cntrvlr.co/RrKxa1M,2016-03-11 15:01:56,,870,18,160,0,0,0,0,0,0
21317493981_10154059982168982,"Out of 268,820 square miles, these are the most spectacular sites in the Lone Star State. http://cntrvlr.co/85WcoY3",Timeline Photos,photo,https://www.facebook.com/CondeNastTraveler/photos/a.174408898981.149256.21317493981/10154059982168982/?type=3,2016-03-11 14:43:08,,1439,31,154,0,0,0,0,0,0
21317493981_10154059777048982,We'd like to interrupt your afternoon meeting with important news. http://cntrvlr.co/cQDzFqk,Is Cape Town the New Global Gin Capital?,link,http://cntrvlr.co/cQDzFqk,2016-03-11 13:33:05,,212,35,41,0,0,0,0,0,0
21317493981_10154059721118982,When a normal airline flight goes wrong: http://cntrvlr.co/zhHXdi5,Fight Breaks Out on Spirit Airlines,link,http://cntrvlr.co/zhHXdi5,2016-03-11 13:00:11,,84,28,13,0,0,0,0,0,0
21317493981_10154059605978982,London is calling. Book while you can: http://cntrvlr.co/jKKFRvx,Flight Deal of the Day: U.S. to London for $355 Round-Trip,link,http://cntrvlr.co/jKKFRvx,2016-03-11 12:38:05,,63,1,13,0,0,0,0,0,0
21317493981_10154059548393982,"Spring Break, anyone? http://cntrvlr.co/SrOGHt5",Travel Deal of the Day,link,http://cntrvlr.co/SrOGHt5,2016-03-11 12:15:16,,146,2,8,0,0,0,0,0,0
21317493981_10154059483713982,Be the ultimate traveler.,Travel Often? You Can Get a Second Passport,link,http://cntrvlr.co/LtdnGNt,2016-03-11 11:34:05,,196,8,41,0,0,0,0,0,0
21317493981_10154059429738982,"""The world eats because of women, but women rarely work as restaurant chefs or owners. I want them to get a bigger slice of the pie."" -Mazi Mas founder Niki Kopcke http://cntrvlr.co/bFfWGF1",London's Best New Restaurant Brings on Refugees as Chefs,link,http://cntrvlr.co/bFfWGF1,2016-03-11 11:02:04,,276,8,31,0,0,0,0,0,0
21317493981_10154046757453982,Heading to Austin this week for SXSW? Here's what you can't miss in Texas' capital city. http://cntrvlr.co/IIFVA1E,How to Spend the Weekend in Austin,video,https://www.facebook.com/CondeNastTraveler/videos/10154046757453982/,2016-03-11 10:00:00,01:37,194,15,49,0,0,0,0,0,0
21317493981_10154059078923982,Rep your city.,The 10 Best Places to Live in the U.S.,link,http://cntrvlr.co/s2OEcsW,2016-03-11 09:30:14,,31,1,9,0,0,0,0,0,0
