status_id,status_message,link_name,status_type,status_link,status_published,status_video_length,num_reactions,num_comments,num_shares,num_likes,num_loves,num_wows,num_hahas,num_sads,num_angrys
21317493981_10153832440878982,Now you know.,So You've Got a Truffle? Cool. Here's How to Keep It Fresh,link,http://cntrvlr.co/aac7UA1,2015-11-29 22:10:07,,121,7,11,121,0,0,0,0,0
21317493981_10153832399933982,And why you should visit Moscow in the winter:,10 Travel Secrets From the World's Best Concierges,link,http://cntrvlr.co/9KKH4ug,2015-11-29 21:35:06,,658,12,141,658,0,0,0,0,0
21317493981_10153832359888982,These hotels are way more than just a roof over your head.,The 12 Most Beautiful Places to Spend the Night,link,http://cntrvlr.co/dI43Ku3,2015-11-29 21:00:42,,857,15,206,857,0,0,0,0,0
21317493981_10153832276243982,Ditch your dreams of a White Christmas this year.,10 Places Where You'll Never Be Cold This Holiday Season,link,http://cntrvlr.co/m3sQqS3,2015-11-29 20:00:33,,442,5,79,442,0,0,0,0,0
21317493981_10153832178928982,All the candy you could ever want.,10 Candy Shops Where You Get the Willy Wonka Experience,link,http://cntrvlr.co/rFXxo7n,2015-11-29 19:00:32,,286,13,76,286,0,0,0,0,0
21317493981_10153832078873982,"New Yorkers, you won't be surprised by who topped the list this year.",The 10 Worst Airports in America,link,http://cntrvlr.co/mcv5omd,2015-11-29 18:00:42,,114,16,44,114,0,0,0,0,0
21317493981_10153832002633982,Need some travel inspiration? These are the 50 most beautiful places in the world: http://cntrvlr.co/T8FdXC5,Timeline Photos,photo,https://www.facebook.com/CondeNastTraveler/photos/a.174408898981.149256.21317493981/10153832002633982/?type=3,2015-11-29 17:20:04,,1320,26,187,1320,0,0,0,0,0
21317493981_10153831909483982,2016 seems like the perfect time to cross these items off your bucket list.,50 Things to Do in the U.S. At Least Once in Your Life,link,http://cntrvlr.co/ADANoWm,2015-11-29 16:30:15,,482,17,175,482,0,0,0,0,0
21317493981_10153831821028982,A cup of tea isn't merely a drink: It's the history of the world itself.,This is What Tea Time Looks Like Around the World,link,http://cntrvlr.co/O0rLf4S,2015-11-29 15:30:21,,699,14,240,699,0,0,0,0,0
21317493981_10153831778378982,"For fans of Miyazaki's breathtaking and compelling films, this park is literally a dream come true.",Hayao Miyazaki's Theme Park Is Just As Magical As You'd Expect,link,http://cntrvlr.co/GLjmIJR,2015-11-29 15:00:20,,557,53,247,557,0,0,0,0,0
21317493981_10153831740893982,Walt Disney would surely approve of these places.,20 Real-World Places That Are Straight Out of Fairy Tales,link,http://cntrvlr.co/Sn6cXcs,2015-11-29 14:30:19,,585,12,226,585,0,0,0,0,0
21317493981_10153831704713982,Forget about stuffy galleries full of paintings from 500 years ago:,16 of the World's Greatest Fashion Museums,link,http://cntrvlr.co/XIAYYl6,2015-11-29 14:00:41,,893,39,318,893,0,0,0,0,0
21317493981_10153831664483982,Coolest airplane ever?,What It's Like on Hawaiian Airlines' Oakland Raiders Plane,link,http://cntrvlr.co/yODuLhN,2015-11-29 13:30:23,,242,12,23,242,0,0,0,0,0
21317493981_10153831628208982,It's officially the most wonderful time of the year.,The 15 Best Holiday Markets Around the World,link,http://cntrvlr.co/avwg9tv,2015-11-29 13:00:32,,262,3,113,262,0,0,0,0,0
21317493981_10153831566388982,"Say goodbye to cramped gate areas, overpriced junk food, and endless schleps through drab terminals.",4 Kid-Friendly Airports to Help You Get Through Holiday Travel Hell,link,http://cntrvlr.co/oesEBeH,2015-11-29 12:10:09,,81,2,8,81,0,0,0,0,0
21317493981_10153831504653982,"Bookstores aren't just literary gathering spots—they're often beautiful, fascinating destinations in their own right.",12 Beautiful Bookstores That Are Worth Traveling For,link,http://cntrvlr.co/BTqz6zU,2015-11-29 11:30:24,,2314,129,928,2314,0,0,0,0,0
21317493981_10153831465618982,These hotels are doing more than just reusing bath towels and conserving shower water.,5 Luxury Travel Hotels That Give Back,link,http://cntrvlr.co/o3BjvwN,2015-11-29 11:00:42,,244,3,40,244,0,0,0,0,0
21317493981_10153831374893982,"No one loves a long flight, but it's a great time to finish that book you've been trying to make time to read.",28 Great Books for Long Flights,link,http://cntrvlr.co/XJ6AoOx,2015-11-29 10:00:42,,78,2,19,78,0,0,0,0,0
21317493981_10153831324763982,Not all frequent flier miles are created equally.,9 Ways to Make the Most of Your Frequent Flier Miles,link,http://cntrvlr.co/0gn0bH8,2015-11-29 09:20:11,,155,5,37,155,0,0,0,0,0
21317493981_10153831270293982,"If paradise exists, you can probably find it here.",Monastero Santa Rosa: A Blissful Retreat on the Amalfi Coast,link,http://cntrvlr.co/D2A8rYR,2015-11-29 08:30:14,,1652,52,287,1652,0,0,0,0,0
21317493981_10153831161843982,"Airports are a happy place for approximately nobody. Luckily, it's possible to make them just a little better:",6 Totally Legit Airport Spas You Need to Know,link,http://cntrvlr.co/al3hopQ,2015-11-29 07:00:37,,236,4,44,236,0,0,0,0,0
21317493981_10153830771123982,Beirut's art scene is officially having a moment.,A Tale of Two Beirut Museums: A Contemporary Art Scene Is Born,link,http://cntrvlr.co/bSpMiXV,2015-11-29 00:30:08,,155,2,12,155,0,0,0,0,0
21317493981_10153830686213982,The journey is part of the fun. Via BRIDES,12 Most Romantic Destination Wedding Locations in the World,link,http://cntrvlr.co/rOz4AXT,2015-11-28 23:00:17,,413,12,91,413,0,0,0,0,0
21317493981_10153830625873982,What better way to refuel after the holidays?,8 Hotels Every Wine Lover Should Visit,link,http://cntrvlr.co/EFvt4Mt,2015-11-28 22:10:07,,246,5,56,246,0,0,0,0,0
21317493981_10153830570033982,It really is completely blue.,Morocco's Best-Kept Secret Is This All-Blue Village,link,http://cntrvlr.co/xGjJptB,2015-11-28 21:35:08,,4471,139,816,4471,0,0,0,0,0
21317493981_10153830532973982,The world has never looked so colorful.,15 Beautiful Drone Photos That Leave Us Speechless,link,http://cntrvlr.co/8blksCa,2015-11-28 21:00:43,,387,7,85,387,0,0,0,0,0
21317493981_10153830415743982,Don't make these rookie mistakes.,9 Mistakes Not to Make When Booking a Cruise,link,http://cntrvlr.co/TS6fJa2,2015-11-28 20:00:47,,283,11,76,283,0,0,0,0,0
21317493981_10153830347103982,How did yours compare?,The Most Spectacular Thanksgiving Feasts on Instagram,link,http://cntrvlr.co/bDi31Z9,2015-11-28 19:00:28,,118,0,8,118,0,0,0,0,0
21317493981_10153830260138982,You know you want to book a trip.,The 40 Best Resorts in Mexico: Readers' Choice Awards 2015,link,http://cntrvlr.co/8fmrYFG,2015-11-28 18:00:33,,643,38,267,643,0,0,0,0,0
21317493981_10153830130393982,Dubai may soon be renamed the City of Love.,Dubai's Next Resort? A Heart-Shaped Island,link,http://cntrvlr.co/wakWCJb,2015-11-28 16:30:24,,499,26,109,499,0,0,0,0,0
21317493981_10153830048213982,Can't make it to the Downton Abbey hotel? We've got you covered.,10 English Manor Hotels That Will Fulfill All Your Jane Austen Dreams,link,http://cntrvlr.co/xqaK5Ct,2015-11-28 15:30:21,,178,7,50,178,0,0,0,0,0
21317493981_10153829964373982,"David Ebershoff traveled to Denmark to uncover the story of transgender pioneer Lili Elbe for his first novel, The Danish Girl, then returned years later when its film adaptation was made.",Exploring Copenhagen Through the Eyes of 'The Danish Girl',link,http://cntrvlr.co/fezMuPB,2015-11-28 14:30:07,,216,5,29,216,0,0,0,0,0
21317493981_10153829878198982,The Big Apple is calling your name.,10 Reasons to Visit New York City During the Holidays,link,http://cntrvlr.co/xdbf91I,2015-11-28 13:30:27,,312,25,76,312,0,0,0,0,0
21317493981_10153829841898982,"Say hello to the ""Venice of the Netherlands.""",The Instagram-Famous European Town You've Never Heard Of,link,http://cntrvlr.co/8BkbDlP,2015-11-28 13:00:57,,2250,54,321,2250,0,0,0,0,0
21317493981_10153829781603982,Transparent and The Man in the High Castle are coming to JetBlue.,"You Can (Finally!) Stream Amazon Prime's ""The Man In The High Castle"" on JetBlue",link,http://cntrvlr.co/HzLwDb8,2015-11-28 12:15:05,,21,0,2,21,0,0,0,0,0
21317493981_10153829699058982,There's only one gift to ask for this year.,The Easiest (and Cheapest) Way to Travel with Wine,link,http://cntrvlr.co/Vumfx6J,2015-11-28 11:30:18,,1273,142,945,1273,0,0,0,0,0
21317493981_10153829632783982,We know where you're going this winter.,7 Under-the-Radar Caribbean Islands Where You Won't Find Any Tourists,link,http://cntrvlr.co/GbrlmqP,2015-11-28 11:00:50,,888,32,203,888,0,0,0,0,0
21317493981_10153829585688982,The best way to see Paris this weekend is through the rebooted Paris Photo fair: http://cntrvlr.co/l9iMaie,Timeline Photos,photo,https://www.facebook.com/CondeNastTraveler/photos/a.174408898981.149256.21317493981/10153829585688982/?type=3,2015-11-28 10:30:16,,172,1,18,172,0,0,0,0,0
21317493981_10153829528698982,Talk about stunning.,The Most Beautiful UNESCO World Heritage Sites,link,http://cntrvlr.co/bJhgOlU,2015-11-28 10:00:46,,1612,16,346,1612,0,0,0,0,0
21317493981_10153829453583982,Yet another reason not to mess with the IRS:,You Could Soon Lose Your Passport If You Owe the IRS,link,http://cntrvlr.co/XWvdftB,2015-11-28 09:20:06,,186,33,128,186,0,0,0,0,0
21317493981_10153829372333982,Headed to NYC this holiday season? Don't just stick to Rockefeller Center and Central Park:,One World Trade and Beyond: 14 Best Things To Do In Lower Manhattan,link,http://cntrvlr.co/7Aunhhk,2015-11-28 08:30:15,,438,22,108,438,0,0,0,0,0
21317493981_10153829277798982,17 hours of Star Wars sounds pretty great to us.,"'Star Wars' Fans Can Watch a 17-Hour, 7-Movie Marathon At This Theater",link,http://cntrvlr.co/FwI8TJ9,2015-11-28 07:00:23,,322,18,71,322,0,0,0,0,0
21317493981_10153828691243982,"Have $25,000 to spare? You can live like Hemingway.",Get a Once-in-a-Lifetime Look at Ernest Hemingway's Key West Home,link,http://cntrvlr.co/KPMmirs,2015-11-27 23:00:35,,390,12,60,390,0,0,0,0,0
21317493981_10153828623568982,It's hard to believe that something this beautiful actually exists.,"6 Incredible Photos of the Northern Lights in Yellowknife, Canada",link,http://cntrvlr.co/LjI2rZq,2015-11-27 22:10:09,,1136,18,172,1136,0,0,0,0,0
21317493981_10153828589803982,Your tastebuds—and your check book—won't ever forget it.,The Most Expensive Restaurants in the World,link,http://cntrvlr.co/v25FJzF,2015-11-27 21:35:09,,706,8,158,706,0,0,0,0,0
21317493981_10153828556778982,"If escaping civilization is your goal on vacation, these places are for you.",The 15 Most Remote Travel Destinations in the World,link,http://cntrvlr.co/AskGfSe,2015-11-27 21:00:48,,1128,27,238,1128,0,0,0,0,0
21317493981_10153828498688982,We know exactly what you need after a holiday week.,9 Of Instagram's Best #DrinksAroundTheWorld,link,http://cntrvlr.co/Hq2VEh9,2015-11-27 20:00:43,,230,1,28,230,0,0,0,0,0
21317493981_10153828440858982,"Travel season is upon us, and we've got the perfect bag for you.",The Perfect Piece of Luggage for Every Single Trip You Take,link,http://cntrvlr.co/DYwxCYW,2015-11-27 19:00:42,,22,0,5,22,0,0,0,0,0
21317493981_10153828347043982,We've found the perfect Black Friday cocktail for you.,Try This Sweet and Spicy Cocktail from The Midnight Rambler in Dallas,link,http://cntrvlr.co/6YPnH0G,2015-11-27 18:00:55,,31,0,4,31,0,0,0,0,0
21317493981_10153828286223982,"Next time you head to the airport, make sure you have the right gear. Via WIRED",16 Travel-Friendly Gifts to Make Flying Less Miserable,link,http://cntrvlr.co/21MmxWA,2015-11-27 17:15:07,,25,1,7,25,0,0,0,0,0
21317493981_10153828234618982,Already seen the Met and the MoMa? Pay a visit to one of NYC's smaller—but equally amazing—museums.,10 Best Small Museums in New York City,link,http://cntrvlr.co/0xvhKvp,2015-11-27 16:30:31,,69,2,28,69,0,0,0,0,0
21317493981_10153828166023982,In need of some post-turkey movie inspiration? Here's what to watch:,50 Best Travel Movies of the Past 50 Years,link,http://cntrvlr.co/KMz5KYT,2015-11-27 15:30:18,,788,16,225,788,0,0,0,0,0
21317493981_10153828091163982,"Pinpointing every breathtaking place on the planet could take a lifetime, but these places are at the top of our list.",The 50 Most Beautiful Places in the World,link,http://cntrvlr.co/uWcE32K,2015-11-27 14:30:22,,2188,34,615,2188,0,0,0,0,0
21317493981_10153827939168982,No Instagram filters needed.,14 Of The Most Unforgettable National Parks In The World,link,http://cntrvlr.co/d7XHsFM,2015-11-27 14:01:01,,865,12,169,865,0,0,0,0,0
21317493981_10153827845258982,The best way to see Paris this weekend:,"Delayed By Attacks, 'Paris Photo' Reboots — All Over Town",link,http://cntrvlr.co/9xNLc0m,2015-11-27 13:30:06,,134,1,10,134,0,0,0,0,0
21317493981_10153827804813982,Treat yourself this holiday season.,Deal of the Day: Fly to South America For as Low as $499 Round Trip,link,http://cntrvlr.co/mUIBZcB,2015-11-27 13:00:08,,231,9,34,231,0,0,0,0,0
21317493981_10153822360883982,"Stuck at the airport? Airline run out of food? Weather hitches? We want to hear from you.

Share your worst Thanksgiving travel stories this week—and you could be featured on Condé Nast Traveler!",,status,,2015-11-27 13:00:02,,6,0,1,6,0,0,0,0,0
21317493981_10153827745423982,It's actually not crazy to head north when the temperature drops.,16 Reasons to Visit Canada in the Middle of Winter,link,http://cntrvlr.co/evje4oH,2015-11-27 12:16:06,,763,46,178,763,0,0,0,0,0
21317493981_10153827656998982,Need some shopping inspiration today?,The 10 Best Sneaker Brands In The World,link,http://cntrvlr.co/O7JwbJh,2015-11-27 11:30:26,,52,3,3,52,0,0,0,0,0
21317493981_10153827536493982,Start adding these items to your Cyber Monday shopping list.,11 Winter-Ready Pieces Every Traveler Needs,link,http://cntrvlr.co/HOQkwYw,2015-11-27 10:30:18,,95,2,12,95,0,0,0,0,0
21317493981_10153827489328982,For all your Black Friday needs.,The Best Shopping Cities in the World,link,http://cntrvlr.co/8m1mm2V,2015-11-27 10:00:20,,107,3,33,107,0,0,0,0,0
21317493981_10153827345233982,Be warned: this season's hottest gift is not travel-friendly.,Why the Hottest Gift This Christmas Is Already Banned From Flying,link,http://cntrvlr.co/ZYuVo72,2015-11-27 09:20:06,,413,29,106,413,0,0,0,0,0
21317493981_10153827199313982,Minecraft-themed Lego sets for the win.,This App Will Tell You What to Buy Your Kids This Christmas,link,http://cntrvlr.co/Xg0NcpJ,2015-11-27 08:30:19,,24,1,3,24,0,0,0,0,0
21317493981_10153827025773982,"Instead of shopping today, why not visit a national park?",California and Minnesota State Parks Will be Free on Black Friday,link,http://cntrvlr.co/UfUzvNG,2015-11-27 07:00:46,,154,1,30,154,0,0,0,0,0
21317493981_10153826976998982,Black Friday sale! Get a year of travel inspiration for just $6. Subscribe now!,Give the Gift of Conde Nast Traveler This Year,link,http://cntrvlr.co/l70wSJ7,2015-11-27 06:00:32,,17,0,1,17,0,0,0,0,0
21317493981_10153826580773982,"Yes, you can even go to Italy!","Gluten-Free Travel Is a Thing (And Yes, You Can Still Visit Europe)",link,http://cntrvlr.co/LJbGT4M,2015-11-26 23:00:31,,389,37,82,389,0,0,0,0,0
21317493981_10153826526138982,Book a post-Thanksgiving trip. You know you want to.,13 Photos of the Most Beautiful Island in the World,link,http://cntrvlr.co/u3TY0Qb,2015-11-26 22:10:09,,1531,58,364,1531,0,0,0,0,0
21317493981_10153826488183982,We're thankful for a world as beautiful as this.,The 20 Most Colorful Cities In The World,link,http://cntrvlr.co/G2DI3Yj,2015-11-26 21:36:08,,1179,27,172,1179,0,0,0,0,0
21317493981_10153826444803982,Want to raise globally minded children? Read them these books.,25 Children's Books That Will Teach Your Kids About the World,link,http://cntrvlr.co/NEnb2Do,2015-11-26 21:00:40,,1165,46,633,1165,0,0,0,0,0
21317493981_10153826361358982,'Tis the season for holiday travel.,Don't Miss: Our Favorite Black Friday and Cyber Monday Travel Deals,link,http://cntrvlr.co/nve78Wd,2015-11-26 19:50:06,,63,0,10,63,0,0,0,0,0
21317493981_10153826303858982,Had enough of turkey today? This is for you.,10 Places Every Seafood Lover Should Visit,link,http://cntrvlr.co/x9SMxCG,2015-11-26 19:00:40,,92,2,20,92,0,0,0,0,0
21317493981_10153826258953982,"There's one constant around the world, and that's that no celebration is complete without food.",6 Surprising Food Capitals Around the World,link,http://cntrvlr.co/OlpYLNi,2015-11-26 18:30:09,,81,0,23,81,0,0,0,0,0
21317493981_10153826136113982,"""Empathy is born of exposure—a reaching out, not a turning in. It starts in those moments of discovery we only get by going somewhere that can surprise us.""","Why You Should Go to Paris (And Beirut, And Belgium.) Now More Than Ever",link,http://cntrvlr.co/kdoJkP7,2015-11-26 17:46:37,,1611,63,336,1611,0,0,0,0,0
21317493981_10153826037118982,Try these quick digestion exercises before you settle in for your post-turkey nap:,3 Post-Thanksgiving Dinner Exercises to Do Tonight,link,http://cntrvlr.co/5Lbsxfd,2015-11-26 16:30:23,,373,25,103,373,0,0,0,0,0
21317493981_10153825954993982,Any of these books makes for perfect non-political Thanksgiving table chat.,7 Books To Read While You Travel This Holiday Season,link,http://cntrvlr.co/scVp0T6,2015-11-26 15:30:21,,159,4,41,159,0,0,0,0,0
21317493981_10153825873783982,Are you spending the holiday in any of these cities?,The 10 Most Popular Cities for Thanksgiving,link,http://cntrvlr.co/ZsfBQSY,2015-11-26 14:30:23,,67,1,17,67,0,0,0,0,0
21317493981_10153825831743982,We're thankful for anyone who gives us a smile when we're traveling—and you'll find plenty of those people in these cities.,The 10 Friendliest Cities in the World,link,http://cntrvlr.co/vsM4UYz,2015-11-26 14:01:06,,408,8,122,408,0,0,0,0,0
21317493981_10153825733983982,Just in time for your post-turkey stupor.,10 Holiday Travel Movies That Reveal The Awful Truth—Thanksgiving Edition,link,http://cntrvlr.co/C5mquEx,2015-11-26 13:01:08,,76,1,5,76,0,0,0,0,0
21317493981_10153825662698982,So you're not stuck watching Spongebob reruns with the nieces and nephews.,9 Things to Binge-Watch After Binge-Eating This Thanksgiving,link,http://cntrvlr.co/ryolR5m,2015-11-26 12:15:06,,100,1,11,100,0,0,0,0,0
21317493981_10153825564643982,"Happy Thanksgiving to all our readers! What are you most thankful for today? On our list: family, food, and places that look like this http://cntrvlr.co/9tuBxiL",Timeline Photos,photo,https://www.facebook.com/CondeNastTraveler/photos/a.174408898981.149256.21317493981/10153825564643982/?type=3,2015-11-26 11:00:48,,3083,44,203,3083,0,0,0,0,0
21317493981_10153825484153982,"Thanksgiving isn't just an American thing, you know.",8 Countries Around the World That Also Celebrate Thanksgiving,link,http://cntrvlr.co/z2Tl03J,2015-11-26 10:00:52,,192,4,45,192,0,0,0,0,0
21317493981_10153825473398982,Watch live from the #MacysParade! http://cntrvlr.co/LKtWuKi,Timeline Photos,photo,https://www.facebook.com/CondeNastTraveler/photos/a.174408898981.149256.21317493981/10153825473398982/?type=3,2015-11-26 09:50:03,,429,5,58,429,0,0,0,0,0
21317493981_10153825436513982,We're live at the annual Macy's Thanksgiving Day Parade! Watch now: http://cntrvlr.co/YqGXf6i,Timeline Photos,photo,https://www.facebook.com/CondeNastTraveler/photos/a.174408898981.149256.21317493981/10153825436513982/?type=3,2015-11-26 09:30:14,,63,2,11,63,0,0,0,0,0
21317493981_10153825361333982,"The right way to ask for more pie, and other holiday quandaries, courtesy of Delia Ephron and Epicurious.",How Well Do You Know Thanksgiving Manners? Take This Quiz to Find Out,link,http://cntrvlr.co/wfcT13R,2015-11-26 08:30:15,,49,0,14,49,0,0,0,0,0
21317493981_10153825355873982,See the Macy's Parade in all its glory—from 1925 until now.,14 Vintage Photos of the Macy's Thanksgiving Day Parade,link,http://cntrvlr.co/LuIAfd9,2015-11-26 08:25:05,,554,5,160,554,0,0,0,0,0
21317493981_10153825260073982,"""Once I started flying on holidays, I couldn't look back.""",Why We Love Traveling on Thanksgiving and Christmas Day,link,http://cntrvlr.co/osqvJ09,2015-11-26 07:00:42,,341,13,49,341,0,0,0,0,0
21317493981_10153824986183982,"#TBT A look back at the Macy's Thanksgiving Day Parade throughout the years: http://cntrvlr.co/7JrQksj

We'll be live streaming the parade on today on Periscope at 9:30 AM ET. http://cntrvlr.co/ZnfpaDs",Timeline Photos,photo,https://www.facebook.com/CondeNastTraveler/photos/a.174408898981.149256.21317493981/10153824986183982/?type=3,2015-11-26 02:48:03,,275,5,41,275,0,0,0,0,0
21317493981_10153824772978982,Is your favorite on the list?,The 30 Best Cities in the World: Readers' Choice Awards 2015,link,http://cntrvlr.co/1SiXer7,2015-11-25 23:00:38,,230,12,96,230,0,0,0,0,0
21317493981_10153824719803982,"Spa resorts, ski resorts, mountain lodges—take your pick from the best of the best.",The 25 Best Resorts in the U.S.,link,http://cntrvlr.co/MmyD4ax,2015-11-25 22:10:07,,190,2,36,190,0,0,0,0,0
21317493981_10153824692463982,Our very first Periscope and what we've been up to lately: http://cntrvlr.co/PUgNhN8,Catch A Bird's-Eye View of the Macy's Thanksgiving Day Parade via Periscope,link,http://cntrvlr.co/PUgNhN8,2015-11-25 21:39:07,,407,5,54,407,0,0,0,0,0
21317493981_10153824687963982,Vienna is calling your name.,Read This Before You Visit Vienna,link,http://cntrvlr.co/VZX8xXa,2015-11-25 21:35:05,,380,18,43,380,0,0,0,0,0
21317493981_10153824632363982,Just don't forget to pack your long underwear.,The Coolest Ice Hotels in the World,link,http://cntrvlr.co/2fCoz8v,2015-11-25 21:00:48,,139,3,57,139,0,0,0,0,0
21317493981_10153824612838982,"A look back at the Macy's Thanksgiving Day Parade throughout the years: http://cntrvlr.co/yTvTAIy

We'll be live streaming the parade on Periscope at 9:30 AM ET. Follow us on Periscope to watch: http://cntrvlr.co/a68vSzS",Timeline Photos,photo,https://www.facebook.com/CondeNastTraveler/photos/a.174408898981.149256.21317493981/10153824612838982/?type=3,2015-11-25 20:38:01,,117,1,4,117,0,0,0,0,0
21317493981_10153824579118982,Get your iPhones ready.,7 Most Beautiful Places to Take Photos in New York City,link,http://cntrvlr.co/XIEFIPJ,2015-11-25 20:00:56,,1303,82,280,1303,0,0,0,0,0
21317493981_10153824522628982,Which wine goes best with turkey and pumpkin pie? We asked the experts.,These Are The Wines You Should Bring to Thanksgiving Dinner,link,http://cntrvlr.co/rNBvtlu,2015-11-25 19:00:56,,102,4,43,102,0,0,0,0,0
21317493981_10153824439218982,Still stuck on what to make tomorrow? These chefs have you covered.,17 Delicious Thanksgiving Recipes From Celebrity Chefs,link,http://cntrvlr.co/5l2qnFa,2015-11-25 18:01:07,,17,0,5,17,0,0,0,0,0
21317493981_10153824423178982,"How to start Thanksgiving off the right way:

1. Set your alarm
2. Grab a coffee
3. Watch the Macy's Thanksgiving Parade with friends and family
4. See if you can spot Mariah Carey and Santa
5. Tell us what you loved most

Join us live at 930 AM ET on Periscope!: http://cntrvlr.co/NScEEIX",Timeline Photos,photo,https://www.facebook.com/CondeNastTraveler/photos/a.174408898981.149256.21317493981/10153824423178982/?type=3,2015-11-25 17:45:16,,283,10,38,283,0,0,0,0,0
21317493981_10153824318583982,This really is the world's best Thanksgiving turkey recipe. Via Epicurious,"The Most Outrageous, Obsessive, Over-the-Top Thanksgiving Turkey",link,http://cntrvlr.co/JZscRsf,2015-11-25 17:00:57,,75,7,12,75,0,0,0,0,0
21317493981_10153824284818982,The holiday travel season doesn't have to be painful.,7 Ways to Make Holiday Travel With Kids Way Easier,link,http://cntrvlr.co/NakCnBz,2015-11-25 16:30:26,,67,2,11,67,0,0,0,0,0
21317493981_10153824206763982,Don't come back from Thanksgiving break with a cold.,16 Tips For Staying Healthy While Traveling,link,http://cntrvlr.co/VyHIGDx,2015-11-25 15:30:32,,55,2,20,55,0,0,0,0,0
21317493981_10153824134268982,"It might be cold here, but summer's just getting started in Australia.",The 13 Most Beautiful Islands in Australia,link,http://cntrvlr.co/1LTpjE5,2015-11-25 14:30:23,,971,31,160,971,0,0,0,0,0
21317493981_10153824100418982,Don't feel guilty if you're spending Thanksgiving away from home this year. We get it.,The Case for Spending Thanksgiving Away from Home,link,http://cntrvlr.co/WfXjKhM,2015-11-25 14:01:18,,201,5,9,201,0,0,0,0,0
21317493981_10153824063038982,Don't want to cook tomorrow? We don't blame you. And these hotels are here to help:,10 Hotel Thanksgiving Dinners Worth Leaving Home For,link,http://cntrvlr.co/SzaBjvM,2015-11-25 13:30:30,,88,0,8,88,0,0,0,0,0
21317493981_10153824021813982,Just in time for that inevitable Thanksgiving gravy stain on your favorite shirt.,4 Foolproof Ways to Keep Your Clothes Clean On the Road,link,http://cntrvlr.co/6eE1Uj2,2015-11-25 13:00:58,,65,0,12,65,0,0,0,0,0
21317493981_10153823966693982,"The skies will be busy, that doesn't mean you have to suffer through your trip.",Thanksgiving 2015 Will Be Airlines' Busiest Since the Great Recession,link,http://cntrvlr.co/Jc3rMfT,2015-11-25 12:15:13,,27,3,4,27,0,0,0,0,0
21317493981_10153823903468982,What's better than watching the Thanksgiving Day Parade? Watching it from the comfort of a hotel room or rented apartment.,Where to Watch the Macy's Thanksgiving Day Parade in NYC,link,http://cntrvlr.co/TW3V9CD,2015-11-25 11:30:35,,231,6,23,231,0,0,0,0,0
21317493981_10153823864013982,"Indianapolis, you've done it again.",The 10 Best Airports in America,link,http://cntrvlr.co/cswvCyn,2015-11-25 11:00:50,,55,4,18,55,0,0,0,0,0
21317493981_10153823763548982,Heading to NYC this week? We've planned your itinerary for you.,"25 Things You Absolutely, Positively Have to Do in New York City",link,http://cntrvlr.co/ZP0vFdQ,2015-11-25 10:00:49,,252,21,64,252,0,0,0,0,0
21317493981_10153823688123982,Know your rights before you fly.,"Bumped Due to Overbooking? Airlines Owe You Money, Not Vouchers",link,http://cntrvlr.co/J4zRzuw,2015-11-25 09:20:05,,687,26,426,687,0,0,0,0,0
