status_id,status_message,link_name,status_type,status_link,status_published,status_video_length,num_reactions,num_comments,num_shares,num_likes,num_loves,num_wows,num_hahas,num_sads,num_angrys
21898300328_10155297203530329,"""I do not worry that a President Trump will nuke another country. I worry he will make so many Americans feel afraid in their own country.""",People Are Already Mourning The US Because The Election Is So Close,link,http://bzfd.it/2ejZgps,2016-11-08 23:41:00,,40615,1144,3863,0,0,0,0,0,0
21898300328_10155297207565329,😔 😔 😔,,video,https://www.facebook.com/BuzzFeed/videos/10155297207565329/,2016-11-08 23:28:13,00:10,105437,6926,40040,0,0,0,0,0,0
21898300328_10155297160955329,PANIC PANIC PANIC.,Canada's Immigration Website Has Actually Crashed On Election Night,link,http://bzfd.it/2eTdiL4,2016-11-08 23:26:00,,116507,5377,46831,0,0,0,0,0,0
21898300328_10155297060945329,Is it November 9th yet?????,24 Photos That Are Literally You Right Now,link,http://bzfd.it/2eT7CRf,2016-11-08 23:06:00,,2092,131,395,0,0,0,0,0,0
21898300328_10155297112700329,ugh,,video,https://www.facebook.com/BuzzFeed/videos/10155297112700329/,2016-11-08 23:01:42,00:11,113090,75124,220599,0,0,0,0,0,0
21898300328_10155297044735329,"Not tonight, Canada.",Did Canada Just Subtweet The United States In The Middle Of The Election?,link,http://bzfd.it/2eT5NUr,2016-11-08 22:49:00,,48743,1009,4812,0,0,0,0,0,0
21898300328_10155295984795329,Because America needs more dog representation in this election.,13 Good Dogs Who Went To The Polls Today,link,http://bzfd.it/2eSVfEB,2016-11-08 22:31:00,,890,57,83,0,0,0,0,0,0
21898300328_10155296963470329,,,video,https://www.facebook.com/BuzzFeed/videos/10155296963470329/,2016-11-08 22:24:00,00:17,9669,675,1091,0,0,0,0,0,0
21898300328_10155296992965329,,Timeline Photos,photo,https://www.facebook.com/BuzzFeed/photos/a.90324480328.112010.21898300328/10155296992965329/?type=3,2016-11-08 22:22:29,,40871,1119,6844,0,0,0,0,0,0
21898300328_10155296547180329,"Oh my god, alternate with water guys, PLEASE.",Everyone In America Is Going To Be Very Hungover Tomorrow,link,http://bzfd.it/2ejQKqn,2016-11-08 22:15:00,,87228,2155,13833,0,0,0,0,0,0
21898300328_10155296835925329,"""Chances of me having a heart attack in the next couple hours: too close to call.""",People Are Losing Their Damn Minds Over How Close The Race Is,link,http://bzfd.it/2ejVBIr,2016-11-08 21:59:01,,11930,404,1465,0,0,0,0,0,0
21898300328_10155296644375329,"President Obama has a special #Election2016 message for you: ""No matter what happens, the sun will rise in the morning""",,video,https://www.facebook.com/BuzzFeed/videos/10155296644375329/,2016-11-08 21:51:00,01:53,207836,9800,121777,0,0,0,0,0,0
21898300328_10155296780890329,"It might be a promoted tweet, but it's still not the best idea.",People Are Saying This Verizon Ad Was Probably Not The Best Thing To Tweet On Election Day,link,http://bzfd.it/2ejTVhM,2016-11-08 21:43:00,,4880,196,291,0,0,0,0,0,0
21898300328_10155296366835329,"Finally, some peace.",18 Pictures That With Soothe Your Brain,link,http://bzfd.it/2eT2CMk,2016-11-08 21:31:00,,902,105,158,0,0,0,0,0,0
21898300328_10155296760805329,Updated in real time.,Here's Our Map Showing Which States Clinton And Trump Won,link,http://bzfd.it/2eTas8J,2016-11-08 21:24:06,,3403,587,537,0,0,0,0,0,0
21898300328_10155296634275329,"""I voted for my family, the undocumented, the voiceless.""",24 Reasons Why Latinos Are Voting In This Election,link,http://bzfd.it/2ejOaAN,2016-11-08 21:11:00,,2614,43,170,0,0,0,0,0,0
21898300328_10155296697570329,,,video,https://www.facebook.com/BuzzFeed/videos/10155296697570329/,2016-11-08 21:08:02,00:10,14707,1131,3252,0,0,0,0,0,0
21898300328_10155296648230329,Just to add a little more surrealism to the end of the election.,These Mariachis Are Playing Outside The Trump Tower In New York As Results Roll In,link,http://bzfd.it/2ejSpfC,2016-11-08 21:02:26,,7462,135,488,0,0,0,0,0,0
21898300328_10155296655240329,,Cocoa Butter,video,https://www.facebook.com/BuzzFeedCocoaButter/videos/909903202474352/,2016-11-08 20:55:32,,17660,693,1,0,0,0,0,0,0
21898300328_10155296644560329,KEY RACE ALERT! ???,16 Tweets About How Wolf Blitzer Is Driving America Crazy,link,http://bzfd.it/2ejQ4BE,2016-11-08 20:51:25,,2910,294,634,0,0,0,0,0,0
21898300328_10155296575160329,"""FLORIDA WHY ARE YOU LIKE THIS.""",People Are Taking Out All Their Election Night Anxiety And Anger On Florida And It's Hilarious,link,http://bzfd.it/2ejOnnD,2016-11-08 20:36:46,,33513,3323,6732,0,0,0,0,0,0
21898300328_10155296591490329,,,video,https://www.facebook.com/BuzzFeed/videos/10155296591490329/,2016-11-08 20:36:28,00:10,17879,689,2626,0,0,0,0,0,0
21898300328_10155296569245329,too close!,Timeline Photos,photo,https://www.facebook.com/BuzzFeed/photos/a.90324480328.112010.21898300328/10155296569245329/?type=3,2016-11-08 20:28:14,,7587,342,689,0,0,0,0,0,0
21898300328_10155296264990329,"""My birthday is going to ruin America.""",People Whose Birthday Is Election Day Are Pretty Pissed About The Whole Thing,link,http://bzfd.it/2eSXNCG,2016-11-08 20:21:00,,1802,561,468,0,0,0,0,0,0
21898300328_10155296508545329,,,video,https://www.facebook.com/BuzzFeed/videos/10155296508545329/,2016-11-08 20:20:00,00:14,24323,2923,9111,0,0,0,0,0,0
21898300328_10155296492990329,,,video,https://www.facebook.com/BuzzFeed/videos/10155296492990329/,2016-11-08 20:15:00,00:06,11446,552,3356,0,0,0,0,0,0
21898300328_10155296473015329,Democracy everywhere.,14 Of The Weirdest Places To Vote,link,http://bzfd.it/2ejSccm,2016-11-08 20:11:00,,613,46,97,0,0,0,0,0,0
21898300328_10155296486010329,,,video,https://www.facebook.com/BuzzFeed/videos/10155296486010329/,2016-11-08 20:00:58,00:16,414970,39011,562388,0,0,0,0,0,0
21898300328_10155296437860329,,,video,https://www.facebook.com/BuzzFeed/videos/10155296437860329/,2016-11-08 19:52:00,00:12,8406,358,1727,0,0,0,0,0,0
21898300328_10155296131765329,"""You have a little chapstick fetish, dontch'ya?""",Fox Anchors Were So Bored On Election Day They Spent A Minute Talking About Chapstick,link,http://bzfd.it/2eT0Ef6,2016-11-08 19:46:00,,661,44,42,0,0,0,0,0,0
21898300328_10155296364690329,In Memoriam,,video,https://www.facebook.com/BuzzFeed/videos/10155296364690329/,2016-11-08 19:34:08,,50163,3885,5873,0,0,0,0,0,0
21898300328_10155296229900329,"""I just want to be taken back to my real planet already.""","People Are Crying, Vomiting, And Anxious AF Leading Up To Election Night",link,http://bzfd.it/2eT35OB,2016-11-08 19:21:00,,1290,54,114,0,0,0,0,0,0
21898300328_10155295979015329,"""This election makes me envy the quiet dignity with which the dinosaurs went extinct by meteor.""","27 Election Tweets That Will Make You Laugh, Then Cry",link,http://bzfd.it/2eSO3sj,2016-11-08 19:01:00,,15336,308,1752,0,0,0,0,0,0
21898300328_10155296206605329,,,video,https://www.facebook.com/BuzzFeed/videos/10155296206605329/,2016-11-08 18:50:00,00:16,126381,21552,230106,0,0,0,0,0,0
21898300328_10155296224565329,"On Election Day, calories don't count.",People Are Stress-Eating The Most Delicious Treats Before The Election,link,http://bzfd.it/2eT1LeP,2016-11-08 18:43:08,,1365,93,97,0,0,0,0,0,0
21898300328_10155295953260329,She's with her. And herself.,Rihanna Just Wore A Shirt Of Herself Wearing A Hillary Clinton Shirt,link,http://bzfd.it/2eSQ5bV,2016-11-08 18:31:00,,22063,368,443,0,0,0,0,0,0
21898300328_10155296102605329,"""That cake's seen some shit.""",Someone Sent Donald Trump A Giant Cake Of His Head And People Lost Their Minds,link,http://bzfd.it/2eSXrMu,2016-11-08 18:16:00,,968,46,36,0,0,0,0,0,0
21898300328_10155296134825329,,,video,https://www.facebook.com/BuzzFeed/videos/10155296134825329/,2016-11-08 18:15:49,00:07,25357,4000,5835,0,0,0,0,0,0
21898300328_10155296107885329,We're live right now from BuzzFeed HQ! Watch the #Election2016 results come in!,Buzzfeed Presents: Live Coverage Of The U.S. Election Results,link,https://twitter.com/i/live/790686278350102528,2016-11-08 18:04:13,,85,10,22,0,0,0,0,0,0
21898300328_10155295604155329,Ivanka Trump's poise and polish artfully mask just how closely her ideologies align with her father's.,Don't Cry For Ivanka — Fear Her,link,http://bzfd.it/2ejx32f,2016-11-08 17:31:01,,3589,338,328,0,0,0,0,0,0
21898300328_10155295571725329,Who needs polls when you have goats and turtles?,13 Psychic Animals Who Have Predicted The Next US President,link,http://bzfd.it/2ejultk,2016-11-08 16:46:01,,473,46,35,0,0,0,0,0,0
21898300328_10155295529560329,"""We're nullifying each other's vote.""",This Elderly Couple's Fight Over Who They're Voting For Is The Cutest,link,http://bzfd.it/2ejr7WO,2016-11-08 16:01:01,,3014,216,237,0,0,0,0,0,0
21898300328_10155295419315329,,BuzzFeed News,video,https://www.facebook.com/BuzzFeedNews/videos/1294129087274773/,2016-11-08 15:36:00,,5955,151,0,0,0,0,0,0,0
21898300328_10155295418165329,"As Melania Trump voted, Donald Trump took a quick glance over — just to make sure?",Trump Peeked At Melania's Ballot And People Think It's Hilarious,link,http://bzfd.it/2ejmrjB,2016-11-08 15:21:01,,23590,1069,1422,0,0,0,0,0,0
21898300328_10155295285310329,"No big deal, guys, it's a chocolate bar.",Toblerone Has Changed Its Design And People Have Lost Their Damn Minds,link,http://bzfd.it/2ejfIGp,2016-11-08 14:46:00,,3302,964,770,0,0,0,0,0,0
21898300328_10155295335760329,,SOML,video,https://www.facebook.com/SOML/videos/989655127845568/,2016-11-08 14:31:58,,34289,545,1,0,0,0,0,0,0
21898300328_10155295143280329,There were some cheers sprinkled in too.,People Booed Donald Trump When He Arrived At This Polling Place,link,http://bzfd.it/2ej6cmQ,2016-11-08 14:07:43,,14896,388,341,0,0,0,0,0,0
21898300328_10155295131600329,"What would you say to the next president? 

Tell us in emojis & see your answer at buzzfeed.com",,video,https://www.facebook.com/BuzzFeed/videos/10155295131600329/,2016-11-08 13:50:06,00:13,142,167,18,0,0,0,0,0,0
21898300328_10155294991465329,Me as a mom.,People Can't Get Over This Teen's Mom Who Closed Their Living Room For A Month,link,http://bzfd.it/2ej3MEA,2016-11-08 13:27:28,,12877,1484,1926,0,0,0,0,0,0
21898300328_10155294866955329,"Watch this and relax. You need this today. 

Watch BuzzFeed's live election coverage tonight at 6pm ET at election.twitter.com #Election2016",,video,https://www.facebook.com/BuzzFeed/videos/10155294866955329/,2016-11-08 12:55:50,59:23,10237,1059,3681,0,0,0,0,0,0
21898300328_10155294396610329,Just breathe.,28 Pictures That Will Help You Get Over Your Intense Election Anxiety,link,http://bzfd.it/2eiurS5,2016-11-08 12:31:01,,5242,825,2130,0,0,0,0,0,0
21898300328_10155294719610329,Anthony died 14 years before women were given the right to vote and people are stopping by her grave today to let her know they got to vote for a female president.,"People Are Lining Up At Susan B. Anthony's Grave To Show Her Their ""I Voted"" Stickers",link,http://bzfd.it/2eiLWla,2016-11-08 12:16:00,,44616,466,3371,0,0,0,0,0,0
21898300328_10155294395655329,There's got to be a few. (But please vote.),19 Things That Are Worse Than Not Voting In The Election,link,http://bzfd.it/2eiAHJm,2016-11-08 11:46:01,,3167,414,675,0,0,0,0,0,0
21898300328_10155294566330329,Eric Trump violated New York election law by posting a photo of his filled-out ballot.,Eric Trump Illegally Posted A Photo Of His Marked Ballot,link,http://bzfd.it/2eS0moB,2016-11-08 11:21:03,,64405,6464,18098,0,0,0,0,0,0
21898300328_10155294394665329,Feeling stressed? Look at these cute animals.,A Zoo Is Streaming Red Pandas All Day To Help You Escape The Election,link,http://bzfd.it/2eisV2g,2016-11-08 11:01:01,,23105,2696,10254,0,0,0,0,0,0
21898300328_10155291627010329,"""You are hella attractive. Don't wait until college to realize that.""",41 Pieces Of Beauty Advice You'll Wish Someone Told You In High School,link,http://bzfd.it/2ePjwLP,2016-11-08 10:16:01,,2668,163,670,0,0,0,0,0,0
21898300328_10155291873565329,"""I work out — just kidding I chase toddlers.""","17 Shirts That Every Funny-Ass Mom Needs, Okay?",link,http://bzfd.it/2ePqjFo,2016-11-08 09:31:00,,1085,517,383,0,0,0,0,0,0
21898300328_10155291844055329,Cheap mermaids = best mermaids.,18 Inexpensive Gifts For The Everyday Mermaid,link,http://bzfd.it/2ePrgxq,2016-11-08 08:46:01,,1180,522,325,0,0,0,0,0,0
21898300328_10155291621320329,"After all, it's the universal symbol of hospitality. Wealth, too!",29 Gifts For People Who Love Pineapples,link,http://bzfd.it/2ePhxHr,2016-11-08 08:01:08,,1780,2290,669,0,0,0,0,0,0
21898300328_10155291858785329,A lot of people dressed like things you'd find at your grandparents' house.,14 Things That People Looked Like At The MTV EMAs,link,http://bzfd.it/2ePqQqM,2016-11-08 07:01:01,,615,75,17,0,0,0,0,0,0
21898300328_10155291863745329,"That's one way to get one over on your ex, I guess.",This Celeb Tore Up Her Wedding Dress And Covered It In Fake Blood For Halloween After Her Divorce,link,http://bzfd.it/2ePq510,2016-11-08 06:01:01,,980,125,24,0,0,0,0,0,0
21898300328_10155291866530329,The revelation comes just days after a Chinese monkey predicted a Trump win. WHO ARE WE TO TRUST?,"This ""Psychic"" Scottish Goat Has Predicted Hillary Clinton Will Win The Election",link,http://bzfd.it/2ePlEDt,2016-11-08 05:01:01,,13435,1145,2758,0,0,0,0,0,0
21898300328_10155291882640329,Could ANYTHING make you go through this dumpster fire year again? (via BuzzFeed Quiz),This Is The Hardest Election Quiz You'll Ever Take,link,http://bzfd.it/2ePrBAm,2016-11-08 04:01:00,,492,131,70,0,0,0,0,0,0
21898300328_10155292057395329,For when you need a laugh or just want to cry fewer sad tears and more happy tears.,31 Tiny Pick-Me-Ups For When You Just Can't Deal Anymore,link,http://bzfd.it/2egtrOm,2016-11-08 03:03:00,,1665,160,473,0,0,0,0,0,0
21898300328_10155291877255329,,BuzzFeed Parents,video,https://www.facebook.com/BuzzFeedParents/videos/525597324305147/,2016-11-08 02:05:29,,4410,4099,1,0,0,0,0,0,0
21898300328_10155292005400329,From Britney to Gaga and Eminem to Soulja Boy.,How Normal Are Your 2000s Music Opinions?,link,http://bzfd.it/2ePtfSs,2016-11-08 01:01:00,,669,89,31,0,0,0,0,0,0
21898300328_10155291824525329,"""Harry learned he could talk to snakes and his first reaction was to make small talk.""",21 Funny Harry Potter Tumblr Posts To Make You Feel Better,link,http://bzfd.it/2ePosAq,2016-11-08 00:01:00,,13851,1875,3208,0,0,0,0,0,0
21898300328_10155291812910329,"""Sometimes, you might get the wrong corpse.""",22 Stories From Funeral Home Employees,link,http://bzfd.it/2ePjOCx,2016-11-07 23:16:00,,780,177,141,0,0,0,0,0,0
21898300328_10155291834630329,"""Well I lie when I'm nervous... and I invented oatmeal.""",21 Hilarious Tweets About First Dates,link,http://bzfd.it/2ePqTTy,2016-11-07 22:31:00,,987,121,81,0,0,0,0,0,0
21898300328_10155291636370329,"""While my friend and I were out ice fishing, his dog broke out of his house and got herself a job.""",23 Tumblr Posts About Dogs That You Won't Get Through Without Smiling,link,http://bzfd.it/2ePg1F7,2016-11-07 21:46:00,,20165,3060,6716,0,0,0,0,0,0
21898300328_10155291624370329,"You'd never reuse dirty underwear, but you'd pay for new ones instead of doing laundry.",18 Things You'll Get If You're A Lazy Girl But Not Full-On Gross,link,http://bzfd.it/2ePfV0q,2016-11-07 21:06:49,,2703,350,423,0,0,0,0,0,0
21898300328_10155291916455329,These are (mostly) the final national polls for the polling outlets before Tuesday.,Here's What The Polls Say Before Election Day,link,http://bzfd.it/2ePtuwZ,2016-11-07 19:31:00,,4564,459,357,0,0,0,0,0,0
21898300328_10155291853590329,Have you packed? (via BuzzFeed Quiz),Are You Really Ready For Election Day?,link,http://bzfd.it/2ePqaBN,2016-11-07 18:46:19,,881,155,156,0,0,0,0,0,0
21898300328_10155291946935329,"""I am beautiful and black. I am smart. I am funny. I am vibrant.""",People Love What This Mom Did For Her Daughter After She Was Bullied For Her Skin Color,link,http://bzfd.it/2ePw6Le,2016-11-07 18:01:55,,8127,159,572,0,0,0,0,0,0
21898300328_10155291569405329,,BuzzFeed News,video,https://www.facebook.com/BuzzFeedNews/videos/1296517200369295/,2016-11-07 17:32:14,,5474,110,0,0,0,0,0,0,0
21898300328_10155291642250329,YES J.K. 👏 👑,"The Daily Mail Used ""Openly Gay"" As A Slur And JK Rowling Had The Best Response",link,http://bzfd.it/2ePgmb0,2016-11-07 17:03:12,,3934,50,184,0,0,0,0,0,0
21898300328_10155291614215329,"Looking good, pups!",18 Dogs Who Are More Photogenic Than You,link,http://bzfd.it/2ebpmuR,2016-11-07 16:16:01,,1584,236,270,0,0,0,0,0,0
21898300328_10155291456840329,"You know, just in case...",Could You Pass The Canadian Citizenship Test?,link,http://bzfd.it/2eP7AcU,2016-11-07 15:31:01,,4871,1617,1277,0,0,0,0,0,0
21898300328_10155291462855329,"Who Will Win: Dog Or Cat?

Vote ""Like"" For Dog. Vote ""Heart"" For Cat.",,video,https://www.facebook.com/BuzzFeed/videos/10155291462855329/,2016-11-07 14:50:55,,2244770,151006,48566,0,0,0,0,0,0
21898300328_10155291445665329,"""It's like giving up weed for a job interview and then losing that job to a crackhead.""","26 Times ""SNL"" Made This Election Slightly More Bearable",link,http://bzfd.it/2eP7y4Q,2016-11-07 14:42:17,,18927,448,2880,0,0,0,0,0,0
21898300328_10155291164165329,We're almost there! Just hold on a little longer!,BuzzFeed News,video,https://www.facebook.com/BuzzFeedNews/videos/1297813543572994/,2016-11-07 13:23:16,,10297,651,0,0,0,0,0,0,0
21898300328_10155287711765329,GOOD. LUCK.,Can You Pass The United States Citizenship Test?,link,http://bzfd.it/2eMFcIE,2016-11-07 13:16:58,,1659,736,914,0,0,0,0,0,0
21898300328_10155290994975329,Where else would you find a tiny mouse eating a tiny pancake?,19 Pictures That Prove Not Everything On Twitter Is Fucking Terrible,link,http://bzfd.it/2efN2hu,2016-11-07 12:36:02,,7897,810,1106,0,0,0,0,0,0
21898300328_10155290835920329,"""Always gonna be you.""",This Girl's Dad Sent Her Mom Flowers After Their Divorce Finalized And Everyone's Sobbing,link,http://bzfd.it/2eOGJ0O,2016-11-07 11:47:32,,18282,941,1945,0,0,0,0,0,0
21898300328_10155290616360329,I am shook.,16 Of The Best Celebrity Conspiracy Theories On The Internet,link,http://bzfd.it/2eOCBh9,2016-11-07 10:55:53,,3518,1058,834,0,0,0,0,0,0
21898300328_10155288000470329,Love is prickly sometimes.,34 Insanely Adorable Gifts For People Who Love Hedgehogs,link,http://bzfd.it/2eMLmsa,2016-11-07 10:16:01,,3237,1803,1540,0,0,0,0,0,0
21898300328_10155287300395329,Your hands can now be permanently Instagram-ready.,17 Tips To Help You Achieve A Rihanna-Worthy Manicure,link,http://bzfd.it/2edpTMT,2016-11-07 09:31:00,,975,90,116,0,0,0,0,0,0
21898300328_10155287009075329,Lovely underneath it all.,17 Underwear Sets That Are So Ridiculously Pretty,link,http://bzfd.it/2edk6GX,2016-11-07 08:46:00,,1752,339,182,0,0,0,0,0,0
21898300328_10155287375465329,*sips coffee* *buys everything*,39 Amazing Gifts For People Who Love Coffee,link,http://bzfd.it/2edrRg9,2016-11-07 08:01:00,,4047,762,1222,0,0,0,0,0,0
21898300328_10155287292705329,Don't let anyone tell you that you don't deserve fancy-ass jars.,22 Underrated Ways To Make Your Home So Much Better,link,http://bzfd.it/2edqeyZ,2016-11-07 07:01:01,,1290,91,216,0,0,0,0,0,0
21898300328_10155287588530329,Taking pictures in the voting booth is actually illegal in 18 states.,Here's Everything You Need To Know About Voting Booth Selfies,link,http://bzfd.it/2eMBwGw,2016-11-07 06:01:00,,501,79,189,0,0,0,0,0,0
21898300328_10155287996295329,Small ways to feel a little better.,7 Self-Care Tips To Try Out This Week,link,http://bzfd.it/2eMKBPD,2016-11-07 05:01:00,,1683,83,383,0,0,0,0,0,0
21898300328_10155287607960329,Eye bet we can!,Can We Guess Your Eye And Hair Color With This Food Test?,link,http://bzfd.it/2eMCLpu,2016-11-07 04:01:00,,1211,704,73,0,0,0,0,0,0
21898300328_10155287408455329,"""The Beast is so ugly I don't deserve this it's my favorite movie."" // Beauty and the Beast","People Are Seriously Pissed With How ""Ugly"" Beast Is In The New ""Beauty And The Beast""",link,http://bzfd.it/2edwIxM,2016-11-07 03:01:00,,4413,1232,924,0,0,0,0,0,0
21898300328_10155286771285329,,BuzzFeed Community,photo,https://www.facebook.com/BuzzfeedCommunity/photos/a.444892428931250.1073741828.431011700319323/1222644791156006/?type=3,2016-11-07 02:01:00,,10446,1400,1,0,0,0,0,0,0
21898300328_10155287411290329,Boo! Spooked ya. (That one doesn't count.),23 Two-Sentence Horror Stories That Will Scare The Hell Out Of You,link,http://bzfd.it/2edt7zT,2016-11-07 01:01:00,,1261,273,326,0,0,0,0,0,0
21898300328_10155286938840329,"""If you want to appease me, compliment my brain!"" // Grey's Anatomy","21 Reasons Why ""Grey's Anatomy"" Desperately Needs Cristina Yang Back",link,http://bzfd.it/2edgbu1,2016-11-07 00:01:00,,23604,2170,2388,0,0,0,0,0,0
21898300328_10155286755980329,"Um, so how many timelines are there exactly? // Westworld","The 7 Best, Craziest ""Westworld"" Fan Theories Thus Far",link,http://bzfd.it/2eHZ9jA,2016-11-06 23:16:00,,1607,907,367,0,0,0,0,0,0
21898300328_10155287337605329,"""He was showing his 90-year-old grandmother pictures on his phone and she ended up seeing his semi-chub toilet dick pic.""",15 Times People Were Totally Betrayed By Their Phones,link,http://bzfd.it/2edrfXP,2016-11-06 22:31:00,,748,56,60,0,0,0,0,0,0
21898300328_10155287320910329,Why were Lily Potter's eyes brown? Why?!,"23 Awkward Movie Mistakes That'll Make You Say, ""Wow, Really?""",link,http://bzfd.it/2edpz0G,2016-11-06 21:46:01,,3019,199,304,0,0,0,0,0,0
21898300328_10155287100225329,Bookmark this for your future children.,25 Things Kids Today Won't Believe Ever Happened,link,http://bzfd.it/2ediNry,2016-11-06 21:01:00,,11561,626,4406,0,0,0,0,0,0
21898300328_10155287295470329,"""Bring me Schrödinger's head!""",23 Times Cats Were The Absolute Best Part Of Tumblr,link,http://bzfd.it/2edhqJA,2016-11-06 20:16:01,,11771,1367,2908,0,0,0,0,0,0
21898300328_10155287414730329,"Why, Internet, why.",21 Yahoo Questions That Will Make You Laugh,link,http://bzfd.it/2eduaQm,2016-11-06 19:31:01,,4355,658,855,0,0,0,0,0,0
21898300328_10155287302715329,L is for the student loans I have.,What Does Your College Major Say About Your Love Life?,link,http://bzfd.it/2edgFQP,2016-11-06 18:46:00,,402,54,15,0,0,0,0,0,0
21898300328_10155287395780329,I'm not crying. You are.,36 Rescue Dog Transformations That Will Restore Your Faith In Humanity,link,http://bzfd.it/2eduZbL,2016-11-06 18:01:00,,9861,745,1919,0,0,0,0,0,0
21898300328_10155287071675329,The steaks have never been higher. // Chopped,27 Times Chopped Was Honestly Just Weird And Funny,link,http://bzfd.it/2edlkC0,2016-11-06 17:16:00,,2018,564,564,0,0,0,0,0,0
21898300328_10155287559160329,*waits forever*,,video,https://www.facebook.com/BuzzFeed/videos/10155287559160329/,2016-11-06 16:41:00,00:31,24646,3493,3935,0,0,0,0,0,0
21898300328_10155287342855329,Nobody tell them.,21 Adorable Creatures Who Have No Clue That 2016 Is A Giant Trash Fire,link,http://bzfd.it/2edw2bD,2016-11-06 16:16:01,,12663,843,2455,0,0,0,0,0,0
21898300328_10155287674505329,James Comey on Sunday told members of Congress they had not found anything in the new emails to change their finding from July that Hillary Clinton not be charged.,FBI Review Turned Out To Be Nothing: Director Says No Charges For Clinton,link,http://bzfd.it/2eMDKWx,2016-11-06 15:46:55,,32181,1174,6465,0,0,0,0,0,0
21898300328_10155287325030329,Make America fact check again.,Do You Know More About America Than Donald Trump?,link,http://bzfd.it/2edq3np,2016-11-06 15:31:00,,4859,540,943,0,0,0,0,0,0
21898300328_10155286980115329,"Incase you forgot, our world is an inspiringly beautiful place.","15 Nature Photos That Will Make You Say ""Damn""",link,http://bzfd.it/2ed9dVT,2016-11-06 14:46:00,,2009,56,286,0,0,0,0,0,0
21898300328_10155286759170329,All hands on deck.,Can We Guess If You're Left Or Right-Handed?,link,http://bzfd.it/2eM3Jxj,2016-11-06 14:01:00,,1235,431,63,0,0,0,0,0,0
21898300328_10155287055945329,"""Call me now."" —Miss Cleo",19 Sounds That Will Transport You Back To 1999,link,http://bzfd.it/2ediwVJ,2016-11-06 13:01:01,,3877,228,782,0,0,0,0,0,0
21898300328_10155286933590329,It doesn't take going after someone as prominent as Donald Trump to face retaliation for alleging sexual assault. Women who've dealt with the backlash talk to BuzzFeed News.,Why Don't Sexual Assault Victims Report? Ask These College Women,link,http://bzfd.it/2edhSaD,2016-11-06 12:16:00,,2408,89,662,0,0,0,0,0,0
21898300328_10155286889070329,This is basically art.,17 Deeply Satisfying Before And After Cleaning Pictures,link,http://bzfd.it/2eM2XjL,2016-11-06 11:31:42,,4419,366,413,0,0,0,0,0,0
21898300328_10155283991145329,Putting the pun in Rapunzel.,21 Gifts For People Who Just Really Fucking Love Puns,link,http://bzfd.it/2ebI7yl,2016-11-06 09:46:02,,2528,781,749,0,0,0,0,0,0
21898300328_10155282918255329,,BuzzFeed Rewind,video,https://www.facebook.com/buzzfeedrewind/videos/1089796874472921/,2016-11-06 09:21:00,,34377,5024,6,0,0,0,0,0,0
21898300328_10155283684645329,"Take notes, other makeup companies.",The New Face Of CoverGirl Wears A Hijab And It's A Really Big Deal,link,http://bzfd.it/2ebsIhw,2016-11-06 09:01:00,,38527,652,1604,0,0,0,0,0,0
21898300328_10155283081200329,After a lifetime of nail-biting elections — and 511 days of this unbearable one — it's hard to feel anything but deep anxiety.,Waiting For This Election To End Might Kill Me,link,http://bzfd.it/2eJJLDm,2016-11-06 08:16:01,,1512,67,97,0,0,0,0,0,0
21898300328_10155283641540329,"My lipstick stayed on through a teeth cleaning, so yea.",7 Beauty Products I Tried That Actually Work,link,http://bzfd.it/2ebt1Zy,2016-11-06 07:31:00,,5491,222,527,0,0,0,0,0,0
21898300328_10155282989115329,Your kitchen will never be the same.,22 Awesome And Inexpensive Products For People Who Love To Bake,link,http://bzfd.it/2eJGkNf,2016-11-06 06:46:01,,2057,585,498,0,0,0,0,0,0
