status_id,status_message,link_name,status_type,status_link,status_published,status_video_length,num_reactions,num_comments,num_shares,num_likes,num_loves,num_wows,num_hahas,num_sads,num_angrys
228735667216_10152701864667217,A local man in Malaysia has been found guilty of murdering two British medical students.,Britons' Borneo murder guilty verdict,link,http://bbc.in/1OSErL2,2015-03-30 21:36:40,,2209,82,114,2209,0,0,0,0,0
228735667216_10152701177602217,"How would you react if you heard the wrong national anthem being played? http://bbc.in/19BH03u

El Salvador's footballers were left baffled when they heard the unfamiliar notes of the Isle of Man's anthem before their friendly match against Argentina.",Manx anthem played by mistake at Argentina v El Salvador game,link,http://bbc.in/19BH03u,2015-03-30 15:22:22,,2216,150,282,2216,0,0,0,0,0
228735667216_10152701050232217,"Who can shear a sheep and who can solve a Rubik's cube in one hand?

Find out some little-known facts about seven political leaders, ahead of the UK's #GE2015.",UK's election campaign begins,link,http://bbc.in/1HfufqS,2015-03-30 14:00:42,,3121,279,228,3121,0,0,0,0,0
228735667216_10152700886282217,"Can the UK become the ""most digital nation on the planet""? 

Internet pioneer Martha Lane Fox wants the country to aim for just that. See her #DimblebyLecture tonight at 22:45 on BBC One","30/03/2015, The Richard Dimbleby Lecture - BBC One",link,http://bbc.in/1CpCzmH,2015-03-30 12:47:19,,298,109,55,298,0,0,0,0,0
228735667216_10152700499237217,"As the UK's #GE2015 campaign begins, a fox makes a bid for Downing Street. 

Apparently it was after a duck, and not the keys to No.10 http://bbc.in/1ysJ4Ba",,video,https://www.facebook.com/bbcnews/videos/10152700499237217/,2015-03-30 12:00:01,00:33,8129,584,1833,8129,0,0,0,0,0
228735667216_10152700632142217,Reality TV star reported to police for race hate,"Katie Hopkins accused of ""causing trouble"" on Twitter",link,http://bbc.in/19Alg7Z,2015-03-30 10:58:06,,3365,790,192,3365,0,0,0,0,0
228735667216_10152700526667217,Instagram removed it twice. But then it backed down.,How a woman got Instagram to reinstate a photo showing her clothes & bed after her period,link,http://bbc.in/19oSeZi,2015-03-30 10:12:36,,6843,988,413,6843,0,0,0,0,0
228735667216_10152700458292217,Excited? Concerned? Confused? Which 3 words sum up how you feel about the #GE2015 campaign?,The Today Programme,photo,https://www.facebook.com/thetodayprogramme/photos/a.10151289170033895.488229.371509533894/10153126558743895/?type=3,2015-03-30 09:27:51,,1029,268,1,1029,0,0,0,0,0
228735667216_10152700323557217,Around the world fuel-free? You may need to adjust your journey time http://bbc.in/19zQCvC #BBCGoFigure,Solar Impulse plane leaves Myanmar for China,link,http://bbc.in/19zQCvC,2015-03-30 07:58:32,,1437,53,84,1437,0,0,0,0,0
228735667216_10152700297412217,"""Bizarre"" laws created by council bans",Lucky charms banned from sale and other unusual proposals,link,http://bbc.in/1Mn3GXn,2015-03-30 07:42:09,,2137,106,78,2137,0,0,0,0,0
228735667216_10152700233427217,Get expert answers to your #GE2015 questions,BBC Radio 5 live,photo,https://www.facebook.com/bbc5live/posts/10153229600556108,2015-03-30 06:58:31,,881,65,1,881,0,0,0,0,0
228735667216_10152700196792217,Aerial footage as PM visits Buckingham Palace to inform the Queen that Parliament is dissolved ahead of #GE2015 http://bbc.in/1NwBEFO,,video,https://www.facebook.com/bbcnews/videos/10152700196792217/,2015-03-30 06:29:41,00:39,12221,734,2383,12221,0,0,0,0,0
228735667216_10152700173267217,"Parliament has been dissolved ahead of the #GE2015. But what does this actually mean? Find with #BBCElection on Instagram 
https://instagram.com/p/02QxiLhztR/?taken-by=bbcelection","BBC Election on Instagram: ""30 MAR: What does it mean to ""dissolve Parliament?"" #Parliament...",video,https://instagram.com/p/02QxiLhztR/?taken-by=bbcelection,2015-03-30 06:08:36,,1441,76,110,1441,0,0,0,0,0
228735667216_10152700029112217,"A father describes Minecraft as ""Lego on steroids"". Should parents be worried?",Another world...,link,http://bbc.in/1xs3I9n,2015-03-30 05:11:44,,8189,880,1239,8189,0,0,0,0,0
228735667216_10152700001692217,Rollercoaster rescue after dozens stranded http://bbc.in/1NtkjvH,,video,https://www.facebook.com/bbcnews/videos/10152700001692217/,2015-03-30 04:39:34,00:33,2983,190,536,2983,0,0,0,0,0
228735667216_10152699952367217,"What if there is no majority after the #GE2015? Majorities & coalitions explained, with politicians on stilts: http://bbc.in/1CBMBCp",,video,https://www.facebook.com/bbcnews/videos/10152699952367217/,2015-03-30 03:51:24,00:27,1326,121,127,1326,0,0,0,0,0
228735667216_10152699928407217,"As the #GE2015 campaign gets under way, where do the parties stand on key policies?",Party-by-party: Policy-by-policy,link,http://bbc.in/1HezUND,2015-03-30 02:59:52,,1052,62,137,1052,0,0,0,0,0
228735667216_10152699751792217,'Rule of two' - Australia implements new cockpit rules following last week's #Germanwings crash,Australia orders new cockpit rules,link,http://bbc.in/1IIHHo1,2015-03-29 23:53:06,,6720,209,330,6720,0,0,0,0,0
228735667216_10152699466332217,We have a question for India's men: What does your wife do?,A question for Indian men: What does your wife do?,link,http://bbc.in/1F83gx2,2015-03-29 23:00:01,,6351,860,584,6351,0,0,0,0,0
228735667216_10152699286582217,Next stop: China,Solar Impulse plane leaves Myanmar for China,link,http://bbc.in/1xN8vCV,2015-03-29 19:26:14,,6805,93,371,6805,0,0,0,0,0
228735667216_10152698715972217,Fill these boots. Welsh rugby captain Sam Warburton helps player find size 21 boots,Rugby player Carl Griffiths gets size 21 boots after search,link,http://bbc.in/1GEc3ZQ,2015-03-29 14:34:19,,3573,241,419,3573,0,0,0,0,0
228735667216_10152698058422217,Thousands of Tunisians rally against terrorism after #BardoMuseum attack,,video,https://www.facebook.com/bbcnews/videos/10152698058422217/,2015-03-29 13:30:00,00:30,24009,571,3951,24009,0,0,0,0,0
228735667216_10152698403237217,"Leading light? Graphene light bulb set for shops.

Professor Colin Bailey outlines the significance of the creation of a new light bulb from a ''wonder material'' called graphene.",Graphene light bulb made of 'wonder material' - BBC News,video,https://www.youtube.com/watch?v=ZoXHmceBPcI,2015-03-29 11:54:08,,2106,75,293,2106,0,0,0,0,0
228735667216_10152698256532217,Memorial to murdered soldier Lee Rigby is unveiled by his widow Rebecca & four-year-old son Jack,Lee Rigby memorial goes on display in Middleton,link,http://bbc.in/1Hdr0jy,2015-03-29 10:52:30,,7283,132,421,7283,0,0,0,0,0
228735667216_10152698152387217,"Game of Thrones fans: This one's for you.
(SPOILER WARNING: Multiple plot details revealed below)",Game of Thrones: Finding fact within the fantasy,link,http://www.bbc.com/news/uk-england-tyne-31732494,2015-03-29 09:48:46,,4948,162,316,4948,0,0,0,0,0
228735667216_10152698002767217,"""All I want is a Slushie.""",4-year-old girl sneaks out at 3am & catches bus to shops,link,http://bbc.in/1Ek5UCw,2015-03-29 08:20:33,,13503,835,3423,13503,0,0,0,0,0
228735667216_10152697879512217,"NHS to introduce Meningitis B vaccine ""this year"" after deal with GlaxoSmithKline",Meningitis B vaccine deal agreed - Jeremy Hunt,link,http://bbc.in/1GD0fa3,2015-03-29 06:47:39,,9168,309,986,9168,0,0,0,0,0
228735667216_10152697790252217,"Australia win the cricket World Cup for the fifth time, beating New Zealand by 7 wickets in Melbourne #CWC15",Australia crush NZ to win World Cup,link,http://bbc.in/1EkcOHO,2015-03-29 05:24:13,,7667,203,570,7667,0,0,0,0,0
228735667216_10152697679242217,"Despite torrential rain, thousands lined the streets of Singapore to say goodbye to Lee Kuan Yew
http://bbc.in/1IH9Hs5",Photos from BBC News's post,photo,https://www.facebook.com/bbcnews/photos/a.10150618575207217.382392.228735667216/10152697678007217/?type=3,2015-03-29 04:05:29,,88100,1529,11065,88100,0,0,0,0,0
228735667216_10152697568122217,BBC director general Lord Hall receives threatening email after dropping presenter Jeremy #Clarkson from #TopGear,'Death threats' made against BBC's Tony Hall investigated,link,http://bbc.in/19uIkVI,2015-03-29 02:13:48,,3177,713,293,3177,0,0,0,0,0
228735667216_10152697216592217,#Singapore bids farewell to founder Lee Kuan Yew,Lee Kuan Yew: Singapore set for funeral procession,link,http://www.bbc.com/news/world-asia-32102686,2015-03-28 20:32:11,,6142,154,284,6142,0,0,0,0,0
228735667216_10152696500962217,This egg will be easy to find come Easter,UK chocolatier creates seven-foot tall Easter egg,link,http://bbc.in/1xJ5Vhb,2015-03-28 12:55:32,,13035,548,2374,13035,0,0,0,0,0
228735667216_10152696385347217,"""This should never happen again"" - Father's plea to airlines after losing son, Paul Bramley, in #Germanwings crash
http://bbc.in/1NoCsL6",,video,https://www.facebook.com/bbcnews/videos/10152696385347217/,2015-03-28 12:15:00,00:21,3308,261,216,3308,0,0,0,0,0
228735667216_10152696125602217,"Teaser trailer for the new James Bond movie Spectre released.
Full trailer & interviews courtesy of Sony Pictures, here:
http://bbc.in/19sD30N",,video,https://www.facebook.com/bbcnews/videos/10152696125602217/,2015-03-28 10:45:00,00:15,4081,208,690,4081,0,0,0,0,0
228735667216_10152696097787217,,Nigeria votes in tight Jonathan-Buhari contest,link,http://www.bbc.co.uk/news/world-africa-32095283,2015-03-28 09:39:52,,1744,88,53,1744,0,0,0,0,0
228735667216_10152695935187217,"Lufthansa, parent company of #Germanwings, takes out full-page advertisements in all Germany's national newspapers today:

""In deepest sympathy.
The unfathomable loss of 150 lives fills us with deepest sadness. Our sincere condolences, our thoughts and prayers, go out to all the relatives and friends of our passengers and colleagues. We thank the many thousands of helpers from France, Spain, Germany and the countless other countries for their help and support. In the name of all employees of Lufthansa group"". 

Carsten Spohr (CEO Lufthansa) & Thomas Winkelmann (Germanwings)
http://bbc.in/1HUwwey",Timeline Photos,photo,https://www.facebook.com/bbcnews/photos/a.10150618575207217.382392.228735667216/10152695935187217/?type=3,2015-03-28 07:57:06,,4694,318,461,4694,0,0,0,0,0
228735667216_10152695702067217,"""I'm so grateful to have my life back"" Amanda Knox speaking after her conviction for the murder of UK student Meredith Kercher was quashed by Italy's top appeals court
http://bbc.in/1NnwKcq",,video,https://www.facebook.com/bbcnews/videos/10152695702067217/,2015-03-28 05:35:00,00:26,3709,991,503,3709,0,0,0,0,0
228735667216_10152695686142217,"""Donkey Kong...it's so hard!"" Today's six year olds review 80s arcade computer classics
http://bbc.in/1BRqZwK",,video,https://www.facebook.com/bbcnews/videos/10152695686142217/,2015-03-28 04:20:00,00:30,5348,225,919,5348,0,0,0,0,0
228735667216_10152694834012217,BREAKING NEWS: Italian court acquits Amanda Knox and Raffaele Sollecito over murder of Meredith Kercher in 2007 http://bbc.in/1ChDPIv,Italy court clears Knox and Sollecito,link,http://bbc.in/1ChDPIv,2015-03-27 16:57:25,,4055,556,493,4055,0,0,0,0,0
228735667216_10152694429652217,Texan who won auction to shoot endangered black rhino in Namibia has been given a permit to import the carcass to the US.,US gives Texan rhino hunter an import permit,link,http://bbc.in/1ODSmoh,2015-03-27 12:44:23,,4624,2677,1701,4624,0,0,0,0,0
228735667216_10152694297782217,"Could you handle living in space for a year? http://bbc.in/1IE7EFp

US astronaut Scott Kelly and Russian cosmonaut Mikhail Kornienko are about to give it a try.",Kelly and Kornienko set for one year in space,link,http://bbc.in/1IE7EFp,2015-03-27 11:26:42,,2989,207,160,2989,0,0,0,0,0
228735667216_10152694185807217,How long is too long?,Children spend six hours or more a day on screens,link,http://bbc.in/1F14cTZ,2015-03-27 10:14:02,,5335,431,919,5335,0,0,0,0,0
228735667216_10152694034517217,Six people missing after fire destroys New York City building,Six people missing after fire razes New York City building,link,http://bbc.in/1OCODXY,2015-03-27 08:23:58,,5137,121,280,5137,0,0,0,0,0
228735667216_10152693991747217,"Is China's ""magic bunny"" the cutest endangered animal you've never heard of?  #BBCGoFigure",China's Ili Pika: The 'magic bunny' goes viral,link,http://bbc.in/1F0HziD,2015-03-27 07:51:00,,6528,198,750,6528,0,0,0,0,0
228735667216_10152693881682217,Top Gear producer 'won't press charges',Top Gear producer 'won't press charges' against Jeremy Clarkson,link,http://bbc.in/1xEIIN7,2015-03-27 06:27:53,,4366,810,219,4366,0,0,0,0,0
228735667216_10152693787982217,Are you sitting comfortably? Then it may be time to think again...,Office workers 'too sedentary',link,http://bbc.in/1xjWSmg,2015-03-27 05:20:42,,2777,122,400,2777,0,0,0,0,0
228735667216_10152693692567217,Ed Miliband v David Cameron - what the voters thought.,The Today Programme,video,https://www.facebook.com/thetodayprogramme/videos/10153119605308895/,2015-03-27 03:51:40,,1092,147,1,1092,0,0,0,0,0
228735667216_10152693641312217,"We found out last night what David Cameron & Ed Miliband think of each other: http://bit.ly/1OC4CWk

And for a 90 second catch-up on the first of the #GE2015 leaders' TV programmes, visit http://bbc.in/1xjKJha","BBC Election on Instagram: ""26 Mar: #GE2015 - What Cameron and Miliband think of each other....",video,https://instagram.com/p/0th36Whzsh/?taken-by=bbcelection,2015-03-27 02:49:09,,1337,100,45,1337,0,0,0,0,0
228735667216_10152693579402217,Diarrhoea is killing poor children in #India,,video,https://www.facebook.com/bbcnews/videos/10152693579402217/,2015-03-27 02:00:00,01:31,5026,625,1187,5026,0,0,0,0,0
228735667216_10152693322207217,Mandatory metadata retention becomes the law in #Australia,Australia passes controversial new metadata law,link,http://bbc.in/1Gx4fJb,2015-03-26 21:36:18,,2051,107,223,2051,0,0,0,0,0
228735667216_10152693172482217,PIKA,China's Ili Pika: The 'magic bunny' goes viral,link,http://www.bbc.com/news/blogs-china-blog-32079630,2015-03-26 19:49:48,,11822,310,1276,11822,0,0,0,0,0
228735667216_10152692936422217,Who came out on top in the UK's first #GE2015 special? Read what David Cameron and Ed Miliband had to say:  http://bbc.in/1xj0t4d,Timeline Photos,photo,https://www.facebook.com/bbcnews/photos/a.10150618575207217.382392.228735667216/10152692936422217/?type=3,2015-03-26 17:45:50,,1754,606,116,1754,0,0,0,0,0
228735667216_10152692855967217,"Video taken by the New York Fire Department shows extent of building collapse in Manhattan
http://bbc.in/1FN7T2p",,video,https://www.facebook.com/bbcnews/videos/10152692855967217/,2015-03-26 16:59:47,00:20,4965,195,1267,4965,0,0,0,0,0
228735667216_10152692764167217,What would you ask them? #GE2015,Cameron and Miliband facing TV grilling,link,http://bbc.in/1xCFYzR,2015-03-26 15:57:43,,1650,556,93,1650,0,0,0,0,0
228735667216_10152692682617217,"Emergency services are on the scene of a large fire and partial building collapse in New York City's East Village.

FDNY tells the BBC that four people are critically injured and have been sent to area hospitals, 12 others are being treated for injuries.

Photo Courtesy of Scott Westerfeld",New York City building collapses after explosion in Manhattan,link,http://bbc.in/1GviSg8,2015-03-26 15:15:45,,5162,405,1945,5162,0,0,0,0,0
228735667216_10152692517102217,Flash floods in one of the driest regions in the world - Chile's Atacama desert - have left two people dead and 24 missing http://bbc.in/1CegwPF,Photos from BBC News's post,photo,https://www.facebook.com/bbcnews/photos/a.10150618575207217.382392.228735667216/10152692516492217/?type=3,2015-03-26 13:51:29,,4083,127,520,4083,0,0,0,0,0
228735667216_10152692414102217,"Europe's first non-beating heart transplant has ""remarkable"" results","Man ""immensely grateful"" after pioneering operation",link,http://bbc.in/1OAOhkT,2015-03-26 12:54:44,,9863,162,1664,9863,0,0,0,0,0
228735667216_10152692313257217,"Do loan shops, tanning salons or fast-food outlets make your High Street unhealthy?","Britain's ""unhealthiest High Streets"" revealed",link,http://bbc.in/1OAO3dw,2015-03-26 11:57:09,,2431,188,135,2431,0,0,0,0,0
228735667216_10152692233192217,Saving Gaza's only grand piano,BBC Stories,video,https://www.facebook.com/BBCStories/videos/10153078481245659/,2015-03-26 11:06:08,,4139,200,6,4139,0,0,0,0,0
228735667216_10152692106257217,"Ahead of tonight's TV grilling of David Cameron and Ed Miliband, visit our #GE2015 website http://bit.ly/1BrSjTo  

To get you in the election mood, BBC Timeliner has shared some of the finest moments of the swingometer, a feature of election night broadcasts since 1959 http://bit.ly/1xBpKHg",,video,https://www.facebook.com/bbcnews/videos/10152692106257217/,2015-03-26 10:20:00,00:14,722,52,39,722,0,0,0,0,0
228735667216_10152692076692217,Why are people so mean to each other online? http://bbc.in/1ycizA1 #GoFigure,Timeline Photos,photo,https://www.facebook.com/bbcnews/photos/a.10150618575207217.382392.228735667216/10152692076692217/?type=3,2015-03-26 09:24:32,,1448,256,171,1448,0,0,0,0,0
228735667216_10152691990527217,"#Germanwings ""shaken"" by ""upsetting"" finding that co-pilot Andreas Lubitz caused crash http://bbc.in/1OAx0s2",Germanwings crash latest updates,link,http://bbc.in/1OAx0s2,2015-03-26 08:34:28,,4929,670,1902,4929,0,0,0,0,0
228735667216_10152691910052217,"#Germanwings co-pilot's intention ""was to destroy this plane"" - French prosecutor http://bbc.in/1HM4Wwx",,video,https://www.facebook.com/bbcnews/videos/10152691910052217/,2015-03-26 07:49:47,00:13,2918,390,989,2918,0,0,0,0,0
228735667216_10152691837332217,"#Germanwings plane ""crashed deliberately"", French officials say","Co-pilot was ""alive until impact"" of plane hitting the ground",link,http://bbc.in/1EXocXJ,2015-03-26 07:02:24,,9853,1294,4635,9853,0,0,0,0,0
228735667216_10152691783277217,How are serial killers caught?,The officer in charge of the Fred and Rose West case reveals all,link,http://bbc.in/1xBmjjQ,2015-03-26 06:27:34,,2889,90,224,2889,0,0,0,0,0
228735667216_10152691703817217,What do a 3D-printing prosthetic lab and a phone charging table have in common?,They have both been nominated Design of the Year. Find out what else is in the running...,link,http://bbc.in/1xBeJ8T,2015-03-26 05:41:45,,3080,42,272,3080,0,0,0,0,0
228735667216_10152691656007217,Return of the King,City prepares to rebury Richard III,link,http://bbc.in/1NbB14k,2015-03-26 04:53:39,,5366,187,293,5366,0,0,0,0,0
228735667216_10152691601657217,"Jeremy Clarkson return ""not ruled out""",Senior BBC figure says the presenter may one day return to the broadcaster,link,http://bbc.in/1ybfsbA,2015-03-26 04:04:03,,4571,776,326,4571,0,0,0,0,0
228735667216_10152691550467217,"""You can hear he is trying to smash the door down.""",Germanwings plane crash: Pilot 'locked out of cockpit',link,http://bbc.in/1NbnwSn,2015-03-26 03:13:20,,6446,550,1695,6446,0,0,0,0,0
228735667216_10152691501802217,On the trail of British jihadists,Tracking jihadists: The Britons in Syria and Iraq,link,http://bbc.in/1EWGpo8,2015-03-26 02:29:43,,2572,657,234,2572,0,0,0,0,0
228735667216_10152691357527217,Relatives and loved ones of those on board Germanwings Flight 4U 9525 will soon visit the crash site.,Germanwings plane crash: Victims' families to visit site,link,http://www.bbc.com/news/world-europe-32062278,2015-03-26 02:00:00,,1680,78,57,1680,0,0,0,0,0
228735667216_10152691261682217,#Australia v #India semi-final: Live!,Follow India vs Australia in the Cricket World Cup,link,http://www.bbc.co.uk/sport/live/cricket/31429009,2015-03-25 22:33:27,,2311,97,54,2311,0,0,0,0,0
228735667216_10152691143617217,"Watch out, Katniss Everdeen.",Indian two-year-old sets national archery record,link,http://www.bbc.com/news/world-asia-india-32046302,2015-03-25 21:18:26,,38641,806,4421,38641,0,0,0,0,0
228735667216_10152690595967217,"How much would you let your car control your journey?

New car will ""read"" road signs and adjust speed http://bbc.in/1EUJBAN

""Teen-proof"" car comes with parent spy option http://bbc.in/1xzymyb",Car claiming to be 'teen-proof' comes with parents spy option,link,http://bbc.in/1xzymyb,2015-03-25 15:24:23,,2994,245,237,2994,0,0,0,0,0
228735667216_10152690438177217,When sport and politics collide,Lord Coe on whether it's ever a good idea to mix the two,link,http://bbc.in/1xyU9Ws,2015-03-25 13:54:51,,1581,61,12,1581,0,0,0,0,0
228735667216_10152690337612217,"Can Hillary Clinton shatter the ""highest"" glass ceiling?",Will the former First Lady become first female US president?,link,http://bbc.in/1ETAMah,2015-03-25 12:57:35,,11675,1648,528,11675,0,0,0,0,0
228735667216_10152690208642217,"""I'd like to apologise to the fans if I've let anyone down,"" Zayn Malik says as he quits One Direction",Zayn Malik is leaving One Direction and group continues as four-piece,link,http://bbc.in/1IvicGG,2015-03-25 11:47:33,,36404,2608,4423,36404,0,0,0,0,0
228735667216_10152690129992217,"""Extraordinary"" people who lost their lives in the #Germanwings crash",We explain who the Alps plane crash victims were,link,http://bbc.in/1GlOULF,2015-03-25 10:59:39,,5944,313,777,5944,0,0,0,0,0
228735667216_10152690033477217,Where in Britain would you be happiest?,Take the test,link,http://bbc.in/1xyjZKu,2015-03-25 10:02:41,,2987,521,671,2987,0,0,0,0,0
228735667216_10152689917622217,Jeremy Clarkson won't be returning to Top Gear:,Jeremy Clarkson to leave Top Gear,link,http://bbc.in/1xyw3LC,2015-03-25 09:02:32,,11791,5108,4593,11791,0,0,0,0,0
228735667216_10152689857322217,What's the best pregnancy food myth you've been told?,Here are a few we've heard...,link,http://bbc.in/1CXRW9i,2015-03-25 08:22:04,,3415,217,413,3415,0,0,0,0,0
228735667216_10152689803492217,Life sauce? Are we making the most of our blood? http://bbc.in/1Gkxv5Z #BBCGoFigure,Michael Mosley: Why I consumed my own blood,link,http://bbc.in/1Gkxv5Z,2015-03-25 07:41:42,,2396,103,231,2396,0,0,0,0,0
228735667216_10152689741247217,The seconds when gunmen opened fire,Tourist captured video of the panic when the Bardo Museum attack began,link,http://bbc.in/1xy92IM,2015-03-25 06:51:56,,2917,150,237,2917,0,0,0,0,0
228735667216_10152689699337217,Footballer in disguise: the moment Thierry Henry surprised pupils,Arsenal striker wears wig and glasses,link,http://bbc.in/1ESbI3m,2015-03-25 06:13:37,,4281,191,301,4281,0,0,0,0,0
228735667216_10152689645052217,"""Enormous progress made"" on gender diversity in Britain's top companies. But does more need to be done?",FTSE 100 firms appoint more women to their boards,link,http://bbc.in/1Iu2trp,2015-03-25 05:32:23,,2380,131,105,2380,0,0,0,0,0
228735667216_10152689606477217,Thankfully passengers had disembarked before this happened to a bus in Brazil http://bbc.in/1CoQnPw (video via TV Globo Internacional),,video,https://www.facebook.com/bbcnews/videos/10152689606477217/,2015-03-25 04:54:58,00:20,38837,2041,36256,38837,0,0,0,0,0
228735667216_10152689562862217,"""The worst thing imaginable"" - mayor of German town on news that 16 teenagers from a local school were on board #Germanwings flight that crashed in the Alps http://bbc.in/1xxNADM",Exchange students on flight,link,http://bbc.in/1xxNADM,2015-03-25 04:05:18,,4046,391,322,4046,0,0,0,0,0
228735667216_10152689341932217,Italy's highest court will soon rule on the Meredith Kercher murder verdict,Top Italian court to rule on Meredith Kercher murder verdict,link,http://bbc.in/1HACy0g,2015-03-25 02:00:01,,1657,124,76,1657,0,0,0,0,0
228735667216_10152689147237217,The body of Singapore's Lee Kuan Yew will now lie in state,Lee Kuan Yew's body moved to Singapore parliament for mourning,link,http://bbc.in/1GRJXIo,2015-03-24 21:39:42,,3306,90,90,3306,0,0,0,0,0
228735667216_10152688737252217,Not so happy clappers,Students swap clapping for jazz hands at NUS event,link,http://bbc.in/1EP7XMb,2015-03-24 17:01:50,,1742,321,211,1742,0,0,0,0,0
228735667216_10152688497307217,"One of these four is illegal. Will the US Supreme Court (#SCOTUS) overrule? 

BBC's James Morgan explores the weird world of US licence plates.",Should America ban 'offensive' licence plates?,link,http://www.bbc.co.uk/news/magazine-32023016,2015-03-24 14:45:33,,1770,330,149,1770,0,0,0,0,0
228735667216_10152688369532217,"Aerial video shows the site where #Germanwings flight 4U9525 crashed. Rescue teams now begin the recovery operation
http://bbc.in/1HyQHuN",,video,https://www.facebook.com/bbcnews/videos/10152688369532217/,2015-03-24 13:22:39,00:23,8180,547,1819,8180,0,0,0,0,0
228735667216_10152688148597217,"Here's what we know so far on the #Germanwings crash in the Alps: http://bbc.in/19MVn5Z

And you can follow the latest updates here: http://bbc.in/19gWLMQ

Or via our Twitter list: bbc.in/1DTDzTd",German Airbus crash: What we know,link,http://www.bbc.co.uk/news/world-europe-32035121,2015-03-24 11:26:41,,5855,537,1302,5855,0,0,0,0,0
228735667216_10152688035202217,Scientists in Australia discover evidence of a 400km-wide asteroid impact area http://bbc.in/1xuT7La #BBCGoFigure,Timeline Photos,photo,https://www.facebook.com/bbcnews/photos/a.10150618575207217.382392.228735667216/10152688035202217/?type=3,2015-03-24 10:15:27,,2967,107,222,2967,0,0,0,0,0
228735667216_10152687955257217,A tiny tracker designed to monitor bee behaviour is being tested by ecologists at Kew Gardens,Bee behaviour mapped by tiny trackers,link,http://bbc.in/1Iq4FjH,2015-03-24 09:21:21,,7186,226,951,7186,0,0,0,0,0
228735667216_10152687703127217,A #Germanwings #Airbus A320 has crashed in the French Alps near Digne. 142 passengers and six crew members said to be on board.,Airliner crashes in French Alps - BBC News,link,http://bbc.in/1EE6t50,2015-03-24 06:27:30,,12232,1344,5853,12232,0,0,0,0,0
