status_id,status_message,link_name,status_type,status_link,status_published,status_video_length,num_reactions,num_comments,num_shares,num_likes,num_loves,num_wows,num_hahas,num_sads,num_angrys
25427813597_10153756088023598,Good news for Northern Ireland ahead of UEFA EURO 2016...,OFFICIAL: O'Neill signs new Northern Ireland contract,link,http://bit.ly/1poce6e,2016-03-16 10:56:52,,1304,9,4,1299,3,1,0,0,1
25427813597_10153756053713598,If Liverpool FC want to sign Mattia Perin they're going to have to break the bank...,Genoa chief wants 'big offer' for Liverpool target Perin,link,http://bit.ly/254k4CX,2016-03-16 10:40:54,,1897,25,8,1891,3,2,0,1,0
25427813597_10153756028293598,"Melissa Reddy appeared on LFCTV's Press Box to discuss all things Liverpool FC, including their upcoming clash with Manchester United...",Melissa Reddy,video,https://www.facebook.com/MelissaReddyGoal/videos/846852758776568/,2016-03-16 10:26:14,,183,7,0,181,2,0,0,0,0
25427813597_10153756010983598,"After FC Barcelona released Neymar for the Olympics, Brazil must forget about winning the Copa America...",Going for Gold: Brazil & Neymar can forget about Copa,link,http://bit.ly/22klUki,2016-03-16 10:21:13,,7612,26,18,7569,22,14,1,5,1
25427813597_10153755987368598,Could Anthony Martial be let go by Manchester United after just one season?,RUMOURS: Man Utd to use Martial in striker swap deal,link,http://bit.ly/1pu24Sm,2016-03-16 10:09:00,,5212,379,20,5052,6,1,39,9,105
25427813597_10153755950838598,Zlatan Ibrahimovic's love affair with the Eiffel Tower rumbles on...,Ibrahimovic sends love letter to the Eiffel Tower,link,http://bit.ly/1R30pd6,2016-03-16 09:55:36,,4397,28,21,4334,8,2,52,0,1
25427813597_10153755910568598,Julian Green needs to leave FC Bayern Munich!,On American Soccer: It is time for Julian Green to stop chasing his Bayern dream - Goal.com,link,http://www.goal.com/en-us/news/66/united-states/2016/03/16/21371182/on-american-soccer-it-is-time-for-julian-green-to-stop?ICID=HP_HN_1,2016-03-16 09:38:44,,1744,23,2,1742,2,0,0,0,0
25427813597_10153755899833598,One of FC Barcelona's stars is celebrating signing a new contract...,OFFICIAL: New contract for Barcelona star,link,http://bit.ly/1XuXkWS,2016-03-16 09:34:48,,25207,54,81,25015,143,30,14,2,3
25427813597_10153755842908598,What's next for Claudio Ranieri once his Leicester City Football Club adventure ends?,Ranieri reveals plans for life after Leicester,link,http://bit.ly/1nOdiiN,2016-03-16 09:17:41,,1706,18,2,1699,4,2,1,0,0
25427813597_10153755803713598,Now THAT'S what you call skill!,Goal Italia,video,https://www.facebook.com/Goal.Italia/videos/10154736037211808/,2016-03-16 09:01:46,,1153,54,0,1030,25,95,3,0,0
25427813597_10153755788668598,"AT LAST! 

Some positive injury news for Van Gaal & Manchester United!",Boost for Man Utd as TWO return to training,link,http://www.goal.com/en/news/166/europa-league/2016/03/16/21372482/united-duo-hand-van-gaal-fitness-boost?utm_source=facebook.com&utm_medium=referral&utm_campaign=enfb,2016-03-16 08:54:33,,2799,22,2,2788,5,3,1,1,1
25427813597_10153755753748598,"Happy birthday Theo Walcott! 🎂🎁🎉

Can Arsenal give him the perfect present by beating FC Barcelona?",Timeline Photos,photo,https://www.facebook.com/goal/photos/a.112071118597.98899.25427813597/10153755753748598/?type=3,2016-03-16 08:38:52,,13315,419,98,13199,43,15,54,2,2
25427813597_10153755737113598,"There are TWO teams Aguero wants to avoid in the Champions League quarters...

(by Sam Lee)",Aguero on Man City's Champions League chances,link,http://www.goal.com/en/news/1716/champions-league/2016/03/16/21372822/aguero-keen-to-avoid-messi-guardiola-in-champions-league?utm_source=facebook.com&utm_medium=referral&utm_campaign=enfb,2016-03-16 08:26:39,,4459,82,11,4440,10,1,8,0,0
25427813597_10153755718068598,He's BACK!,BREAKING: Redknapp lands new job,link,http://www.goal.com/en/news/1586/championship/2016/03/16/21373212/redknapp-takes-up-advisory-role-at-derby-county?utm_source=facebook.com&utm_medium=referral&utm_campaign=enfb,2016-03-16 08:13:20,,1714,24,2,1709,1,0,4,0,0
25427813597_10153755698998598,"What do FC Barcelona, Karim Benzema and a rampaging cow have in common?

They all star in today's Social Snap!",Goal Social Snap,video,https://www.facebook.com/goal/videos/10153755698998598/,2016-03-16 08:05:41,01:16,1888,31,46,1828,45,12,3,0,0
25427813597_10153755690698598,"Roberto Firmino's never seen anything like the Anfield atmosphere vs Manchester United!

(by Melissa Reddy)",EXCLUSIVE: Firmino hails Liverpool fans,link,http://www.goal.com/en/news/166/europa-league/2016/03/16/21372112/firmino-how-supporters-gave-liverpool-the-edge-over-united?utm_source=facebook.com&utm_medium=referral&utm_campaign=enfb,2016-03-16 07:56:37,,3510,15,8,3500,6,0,3,0,1
25427813597_10153755660733598,How many goals will Leo Messi help himself to against Arsenal?,Goal Kings: Lionel Messi,video,https://www.facebook.com/goal/videos/10153755660733598/,2016-03-16 07:41:06,01:22,1556,57,97,1518,24,11,2,0,1
25427813597_10153755639378598,😍😍😍 Paul Labile Pogba 😍😍😍,adidas unveil stunning signature Pogba boots,link,http://www.goal.com/en/news/13712/extra-time/2016/03/16/21371262/adidas-unveil-stunning-signature-pogba-boots?ICID=HP_BN_1,2016-03-16 07:32:04,,14346,155,152,14069,152,115,4,1,5
25427813597_10153755628808598,Newcastle United players can't quite believe Rafael Benitez is their new manager,'We were surprised to see him come to Newcastle!',link,http://www.goal.com/en/news/13822/news/2016/03/16/21371522/sissoko-confident-benitez-can-save-newcastle?utm_source=facebook.com&utm_medium=referral&utm_campaign=enfb,2016-03-16 07:25:23,,3077,24,6,3057,5,0,13,2,0
25427813597_10153755622363598,A huge injury update for Manchester City FC! (By Sam Lee),Otamendi on injury after limping off against Dynamo Kiev,link,http://www.goal.com/en/news/1862/premier-league/2016/03/16/21371422/otamendi-confident-of-manchester-derby-return?utm_source=facebook.com&utm_medium=referral&utm_campaign=enfb,2016-03-16 07:20:27,,1934,15,4,1924,1,4,3,1,1
25427813597_10153755594258598,"The UEFA Champions League Goal Kings series, presented by Nissan, continues. Next up we take a look at Leo Messi bit.ly/1RNLjrz",UCL Goal Kings: Lionel Messi,video,https://www.facebook.com/goal/videos/10153755594258598/,2016-03-16 07:05:58,01:22,281,12,21,276,4,1,0,0,0
25427813597_10153755596893598,Neymar Jr. has given a VERY definitive statement on his future at FC Barcelona!,Neymar on speculation over his Barcelona future,link,http://www.goal.com/en/news/722/la-liga/2016/03/16/21370562/i-dont-see-myself-leaving-neymar-feels-at-home-in-barcelona?utm_source=facebook.com&utm_medium=referral&utm_campaign=enfb,2016-03-16 07:05:29,,7171,30,33,7120,46,1,3,0,1
25427813597_10153755554113598,It looks like Mourinho's Manchester United dream is OVER!,LVG begins planning for THIRD season at Man Utd,link,http://www.goal.com/en/news/1862/premier-league/2016/03/16/21369722/van-gaal-woodward-begin-planning-for-third-season-at-man-utd?utm_source=facebook.com&utm_medium=referral&utm_campaign=enfb,2016-03-16 06:35:15,,2886,177,45,2789,9,3,38,6,41
25427813597_10153755553963598,Fifa have lodged an appeal to reclaim the funds that were lost to corrupt officials,Fifa to reclaim funds from corrupt officials,link,http://www.goal.com/en/news/745/fifa/2016/03/16/21369732/fifa-to-reclaim-funds-from-corrupt-officials?utm_source=facebook.com&utm_medium=referral&utm_campaign=enfb,2016-03-16 06:35:06,,638,10,4,637,1,0,0,0,0
25427813597_10153755545118598,"Neymar Jr. runs the rule over some amateur football freestylers!

From Panasonic Neymar Jr..",Crazy Skills Award being reviewed by Neymar Jr!,video,https://youtu.be/1WLaIoA8f6s,2016-03-16 06:31:22,,551,5,6,551,0,0,0,0,0
25427813597_10153755537583598,Sergiy Rebrov has a BIG regret after FC Dynamo Kyiv were knocked out of the UEFA Champions League,Rebrov on Manchester City tie regrets,link,http://www.goal.com/en/news/1716/champions-league/2016/03/16/21369242/rebrov-kiev-proved-worthy-of-knockout-spot?utm_source=facebook.com&utm_medium=referral&utm_campaign=enfb,2016-03-16 06:27:01,,711,3,0,710,0,0,1,0,0
25427813597_10153755521963598,Could domestic failure spur Real Madrid C.F. on to win the UEFA Champions League?,Former Barca starlet on Undecima chances,link,http://www.goal.com/en/news/596/exclusive/2016/03/16/21318832/real-madrid-have-nothing-else-but-the-champions-league?utm_source=facebook.com&utm_medium=referral&utm_campaign=enfb,2016-03-16 06:19:22,,2650,30,3,2637,4,4,3,2,0
25427813597_10153755505658598,Antonio Conte has been backed to shine at Chelsea Football Club by a man who would know!,'Italian coaches are very good ... I'm sure he'll do well.',link,http://www.goal.com/en/news/13822/news/2016/03/16/21368242/conte-would-succeed-at-chelsea-says-allegri?utm_source=facebook.com&utm_medium=referral&utm_campaign=enfb,2016-03-16 06:08:48,,1329,18,3,1323,3,0,2,0,1
25427813597_10153755497868598,One former Arsenal striker is not very optimistic about tonight's UEFA Champions League clash with FC Barcelona...,EXCLUSIVE: 'Arsenal couldn't beat Barca with 16 men!',link,http://www.goal.com/en/news/1716/champions-league/2016/03/16/21348372/arsenal-couldnt-beat-barcelona-even-with-16-men?utm_source=facebook.com&utm_medium=referral&utm_campaign=enfb,2016-03-16 06:02:59,,10903,147,119,10752,56,6,82,3,4
25427813597_10153755485998598,One former PSG star has had a HUGE dig at the French league...!,'You have two big games... it wasn't motivating',link,http://www.goal.com/en/news/13822/news/2016/03/16/21367072/i-didnt-like-playing-in-ligue-1-says-ex-psg-forward-lavezzi?utm_source=facebook.com&utm_medium=referral&utm_campaign=enfb,2016-03-16 05:52:09,,3474,19,5,3459,8,2,5,0,0
25427813597_10153755485918598,Thomas Müller talks exclusively on Pep Guardiola's time at FC Bayern München and winning the UEFA Champions League,"Muller on Guardiola, Bayern & Man City",link,http://www.goal.com/en/news/1716/champions-league/2016/03/16/21367442/muller-guardiola-wont-have-failed-if-we-dont-win-the?utm_source=facebook.com&utm_medium=referral&utm_campaign=enfb,2016-03-16 05:52:02,,1483,5,8,1480,3,0,0,0,0
25427813597_10153755470748598,Prandelli believes Juventus possess the weapons to stun FC Bayern München... can they do it?!,EXCLUSIVE: Juventus CAN cause Bayern upset,link,http://www.goal.com/en/news/1716/champions-league/2016/03/16/21322092/prandelli-juventus-have-the-weapons-to-break-down-bayerns?utm_source=facebook.com&utm_medium=referral&utm_campaign=enfb,2016-03-16 05:40:04,,4534,34,2,4518,5,5,6,0,0
25427813597_10153755453698598,One Manchester City FC great has made a VERY bold claim about Pep Guardiola... and it involves Leo Messi!,Is a reunion possible at Man City?,link,http://www.goal.com/en/news/13822/news/2016/03/16/21365902/goater-guardiola-can-lure-messi-to-manchester-city?utm_source=facebook.com&utm_medium=referral&utm_campaign=enfb,2016-03-16 05:31:04,,10740,62,27,10672,32,3,28,2,3
25427813597_10153755421453598,"FC Bayern München must do all they can to ensure David Alaba doesn't follow Pep Guardiola to Manchester City FC

(By Peter M Staunton)",Bayern must keep world's best Alaba,link,http://www.goal.com/en/news/14302/comment/2016/03/16/21342612/bayern-must-do-all-they-can-to-ensure-alaba-doesnt-follow-pep-to-?utm_source=facebook.com&utm_medium=referral&utm_campaign=enfb,2016-03-16 05:17:17,,4741,37,11,4722,8,5,4,0,2
25427813597_10153755389508598,"Even his former players want Wenger out now...

But is THIS the only way he will stop managing Arsenal?!",Arsenal legend has PLAN to move Wenger on,link,http://www.goal.com/en/news/1862/premier-league/2016/03/16/21365572/petit-urges-wenger-to-stand-down-at-the-end-of-the-season?utm_source=facebook.com&utm_medium=referral&utm_campaign=enfb,2016-03-16 04:56:28,,1207,65,5,1204,1,2,0,0,0
25427813597_10153755371138598,"Can Arsenal REALLY make the impossible possible?

Check out New Balance Football!",EXCLUSIVE: Ramsey hoping for miracle v Barca,link,http://www.goal.com/en/news/1716/champions-league/2016/03/16/21366322/ramsey-hopes-arsenal-can-produce-champions-league-miracle?utm_source=facebook.com&utm_medium=referral&utm_campaign=enfb,2016-03-16 04:42:05,,2207,124,16,2181,2,1,19,4,0
25427813597_10153755304298598,ATTACK! ATTACK! ATTACK!,Fowler tells Liverpool stars: Beat them at Old Trafford!,link,http://www.goal.com/en/news/13822/news/2016/03/16/21365002/fowler-liverpool-should-head-to-old-trafford-looking-to-win?utm_source=facebook.com&utm_medium=referral&utm_campaign=enfb,2016-03-16 04:19:58,,3221,36,16,3207,7,0,6,0,1
25427813597_10153755282788598,"Why NO ONE will fancy taking on this Atlético de Madrid side in the quarters...

(by Ben Hayward)",COMMENT: Atleti will be a match for anyone,link,http://www.goal.com/en/news/1716/champions-league/2016/03/16/21355232/atletico-arent-perfect-but-neither-madrid-nor-barca-will?utm_source=facebook.com&utm_medium=referral&utm_campaign=enfb,2016-03-16 03:58:59,,2039,55,5,2030,4,2,2,0,1
25427813597_10153754794583598,Arsenal have been urged to sign one of Manchester City FC's star players this summer,Arsenal urged to sign Manchester City star,link,http://www.goal.com/en/news/11/transfer-zone/2016/03/16/21363052/arsenal-urged-to-sign-yaya-toure-from-manchester-city-this?utm_source=facebook.com&utm_medium=referral&utm_campaign=enfb,2016-03-16 03:40:00,,1375,28,3,1374,1,0,0,0,0
25427813597_10153755239123598,Pellegrini says Man City are ready for ANYONE in the Champions League quarters (except FC Barcelona...!),Pellegrini upbeat over Man City chances,link,http://www.goal.com/en/news/13822/news/2016/03/16/21364572/pellegrini-pleased-by-city-steel-in-kiev-stalemate?utm_source=facebook.com&utm_medium=referral&utm_campaign=enfb,2016-03-16 03:26:31,,2219,111,50,2184,3,2,28,1,1
25427813597_10153754704768598,Sergio Romero has rejected a move away from Manchester United,RUMOURS: Romero rejects Manchester United exit,link,http://www.goal.com/en/news/14222/transfer-talk/2016/03/15/21359512/rumours-manchester-uniteds-sergio-romero-says-no-to-river?utm_source=facebook.com&utm_medium=referral&utm_campaign=enfb,2016-03-16 03:20:00,,4931,21,9,4916,9,1,4,1,0
25427813597_10153755218793598,Thomas Müller on THAT Guardiola meeting with Manchester City FC...,EXCLUSIVE: Pep met with Man City? Who cares!,link,http://www.goal.com/en/news/596/exclusive/2016/03/16/21364452/muller-guardiola-met-with-man-city-thats-not-an-issue?utm_source=facebook.com&utm_medium=referral&utm_campaign=enfb,2016-03-16 03:11:39,,4603,19,9,4585,12,1,5,0,0
25427813597_10153754634588598,Liverpool FC's £32.5 million flop has been offered a way out of Anfield...,RUMOURS: Benteke offered Liverpool escape route,link,http://www.goal.com/en/news/14222/transfer-talk/2016/03/16/21361392/rumours-benteke-offered-liverpool-escape-route-by-west-ham?utm_source=facebook.com&utm_medium=referral&utm_campaign=enfb,2016-03-16 03:00:01,,2503,39,4,2482,4,2,1,11,3
25427813597_10153754625358598,Manchester United have identified their first-choice replacement for David De Gea if he joins Real Madrid C.F.,RUMOURS: Manchester United pick top replacement for De Gea,link,http://www.goal.com/en/news/11/transfer-zone/2016/03/16/21360652/rumours-manchester-united-line-up-ter-stegen?utm_source=facebook.com&utm_medium=referral&utm_campaign=enfb,2016-03-16 02:40:01,,6875,82,15,6839,6,1,10,14,5
25427813597_10153754617823598,Mesut Özil is now secretly nutmegging his own Arsenal team-mates!,VIDEO: Ozil secretly nutmegs Arsenal team-mate,link,http://www.goal.com/en/news/780/fa-cup/2016/03/16/21361462/video-ozil-secretly-nutmegs-flamini?utm_source=facebook.com&utm_medium=referral&utm_campaign=enfb,2016-03-16 02:20:00,,2398,29,10,2383,4,3,7,1,0
25427813597_10153754584608598,FC Bayern München have told Paul Pogba that they will RUIN his birthday!,Bayern Munich vow to ruin Pogba's birthday,link,http://www.goal.com/en/news/1716/champions-league/2016/03/15/21359682/bayern-munich-vow-to-ruin-pogbas-birthday?utm_source=facebook.com&utm_medium=referral&utm_campaign=enfb,2016-03-16 02:00:00,,656,23,7,648,1,1,4,1,1
25427813597_10153754514713598,Wenger bites back at the haters and Man City earn Champions League progression at great cost...,Goal's European Headline Review,link,http://www.goal.com/en/news/7180/galleries/2016/03/16/21360842/kompany-injured-again-wengers-latest-strop-goals-european,2016-03-16 01:30:00,,885,11,0,882,1,0,2,0,0
25427813597_10153754584138598,Manchester United have launched a £24m bid for a Serie A TIM star!,RUMOURS: Man Utd ready £24m Serie A bid,link,http://www.goal.com/en/news/14222/transfer-talk/2016/03/15/21352532/rumours-man-utd-ready-florenzi-bid?utm_source=facebook.com&utm_medium=referral&utm_campaign=enfb,2016-03-16 01:00:00,,1906,25,9,1898,2,2,0,0,4
25427813597_10153754592508598,FC Bayern München promise to RUIN Paul Labile Pogba's birthday with cheeky Twitter reply!,Bayern Munich vow to ruin Paul Pogba's birthday!,link,http://www.goal.com/en/news/1716/champions-league/2016/03/15/21359682/bayern-munich-vow-to-ruin-pogbas-birthday?utm_source=facebook.com&utm_medium=referral&utm_campaign=enfb,2016-03-16 00:01:00,,2119,23,13,2107,3,0,8,1,0
25427813597_10153754572213598,For shame Arsenal! There are now TWENTY THREE teams to have reached the Champions League quarters since the Gunners!,The 23 teams to reach the Champions League quarter-finals since Arsenal in 2010,link,http://www.goal.com/en/news/1716/champions-league/2016/03/15/21358312/manchester-city-the-23-teams-who-have-reached-the-champions?utm_source=facebook.com&utm_medium=referral&utm_campaign=enfb,2016-03-15 23:01:00,,1241,27,16,1237,1,1,2,0,0
25427813597_10153754549508598,Oh dear. PSV fans were caught mocking beggars in Madrid...,Footage reveals PSV fans mocking beggars in Madrid,link,http://www.goal.com/en/news/1686/eredivisie/2016/03/15/21355602/psv-fans-mock-beggars-in-madrid?utm_source=facebook.com&utm_medium=referral&utm_campaign=enfb,2016-03-15 22:01:00,,1084,27,4,1064,1,1,4,1,13
25427813597_10153754454118598,Reports in Germany claim talks over a European Super League are at an advanced stage... but here's what Uefa have said!,Uefa respond to European Super League claims!,link,http://www.goal.com/en/news/1716/champions-league/2016/03/15/21346852/no-concrete-european-super-league-proposals-uefa-claims?utm_source=facebook.com&utm_medium=referral&utm_campaign=enfb,2016-03-15 21:01:01,,2111,13,12,2099,7,0,3,1,1
25427813597_10153754487553598,Jurgen Klopp says he is 'desperate' to play one of Liverpool FC's hottest properties!,"'He's 19, an outstanding talent, everyone loves him!'",link,http://www.goal.com/en/news/11/transfer-zone/2016/03/15/21354552/allan-wows-klopp-as-he-waits-on-permit?utm_source=facebook.com&utm_medium=referral&utm_campaign=enfb,2016-03-15 20:15:00,,3380,15,8,3365,10,1,4,0,0
25427813597_10153754501048598,Dream come true for three young fans that got to train wtih Leo Messi & Neymar Jr.!,VIDEO: Barca training invaded by three young fans!,link,http://www.goal.com/en/news/13712/extra-time/2016/03/15/21358572/barcelona-training-invaded-by-three-young-fans?utm_source=facebook.com&utm_medium=referral&utm_campaign=enfb,2016-03-15 19:38:53,,6518,24,38,6450,49,6,11,1,1
25427813597_10153754435733598,INJURED: Pellegrini has revealed how long Vincent Kompany will be sidelined for...,Pellegrini reveals grim Kompany injury news,link,http://www.goal.com/en/news/1862/premier-league/2016/03/15/21358992/city-captain-kompany-out-for-at-least-a-month-with-fresh?utm_source=facebook.com&utm_medium=referral&utm_campaign=enfb,2016-03-15 18:55:39,,1823,11,6,1816,1,0,2,4,0
25427813597_10153754413388598,No goals for Atlético de Madrid or PSV in 120 minutes... so surely a defender is picking up our man-of-the-match right?,PLAYER RATINGS: Atletico Madrid 0 - 0 PSV,link,http://www.goal.com/en/match/atlético-madrid-vs-psv/2176183/ratings?utm_source=facebook.com&utm_medium=referral&utm_campaign=enfb,2016-03-15 18:47:18,,1847,22,5,1846,1,0,0,0,0
25427813597_10153754375988598,,Goal.com's cover photo,photo,https://www.facebook.com/goal/photos/a.10150710367773598.402680.25427813597/10153754375988598/?type=3,2016-03-15 18:28:10,,10859,32,16,10785,51,10,9,1,3
25427813597_10153754341073598,Atlético de Madrid survived a dramatic penalty shootout to sink PSV,REPORT: Atletico Madrid see off PSV via dramatic shootout,link,http://www.goal.com/en/match/atlético-madrid-vs-psv/2176183/report,2016-03-15 18:09:09,,2983,24,18,2974,4,0,3,2,0
25427813597_10153754289868598,"Arsene Wenger has made a HUGE statement

And not too many Arsenal fans will agree with his verdict",Wenger makes HUGE statement about his Arsenal reign,link,http://www.goal.com/en/news/1716/champions-league/2016/03/15/21356212/wenger-i-built-up-arsenal-with-no-money-or-help?utm_source=facebook.com&utm_medium=referral&utm_campaign=enfb,2016-03-15 17:50:26,,1544,116,15,1517,15,2,5,1,4
25427813597_10153754204583598,Manchester City FC have made history - but it's come at a price (via Sam Lee),Manchester City make history - but at a heavy price,link,http://www.goal.com/en/news/1716/champions-league/2016/03/15/21356802/man-city-make-history-but-kompany-woe-spells-trouble?utm_source=facebook.com&utm_medium=referral&utm_campaign=enfb,2016-03-15 17:24:29,,5095,39,11,5067,12,2,1,12,1
25427813597_10153754173313598,Sam Lee delivers his full-time thoughts as Manchester City FC booked their place in the UEFA Champions League quarter-finals...,Sam Lee,video,https://www.facebook.com/SammyGoalMCFC/videos/1064437110296771/,2016-03-15 17:09:50,,190,4,0,189,0,0,0,1,0
25427813597_10153754168353598,Terrible night for Vincent Kompany but how did the team get on his absence?,PLAYER RATINGS: Man City 0 - 0 Dynamo Kyiv,link,http://www.goal.com/en/match/manchester-city-vs-dynamo-kyiv/2176185/ratings?utm_source=facebook.com&utm_medium=referral&utm_campaign=enfb,2016-03-15 17:08:03,,1617,23,6,1610,2,1,3,1,0
25427813597_10153754112878598,That didn't quite go to plan for Manchester City FC but at least they're in the hat!,MATCH REPORT: Manchester City vs Dynamo Kyiv,link,http://www.goal.com/en/match/manchester-city-vs-dynamo-kyiv/2176185/report?utm_source=facebook.com&utm_medium=referral&utm_campaign=enfb,2016-03-15 16:45:55,,1925,27,4,1920,1,0,0,4,0
25427813597_10153754074028598,"No goals at Manchester City FC, no goals at Atlético de Madrid!

Maybe if we all pile into this live scores page, the floodgates will open... 😉😉😉",LIVE SCORES: Champions League last 16,link,http://www.goal.com/en/fixtures?utm_source=facebook.com&utm_medium=referral&utm_campaign=enfb,2016-03-15 16:21:13,,1510,29,6,1503,2,1,2,2,0
25427813597_10153754041508598,One Chelsea Football Club star is in the frame to feature at The Olympic Games this summer...,EXCLUSIVE: Chelsea star in line to receive Olympics call-up,link,http://www.goal.com/en/news/468/international-football/2016/03/15/21353222/willian-in-line-to-receive-brazil-olympics-call-up?utm_source=facebook.com&utm_medium=referral&utm_campaign=enfb,2016-03-15 16:01:16,,3621,31,12,3607,10,1,3,0,0
25427813597_10153753997783598,FC Barcelona have given the go-ahead for Neymar Jr. to represent Brazil at this summer's Olympic Games,EXCLUSIVE: Neymar cleared to represent Brazil at Olympics,link,http://www.goal.com/en/news/468/international-football/2016/03/15/21352602/neymar-cleared-to-represent-brazil-at-olympics?utm_source=facebook.com&utm_medium=referral&utm_campaign=enfb,2016-03-15 15:40:30,,24206,41,118,24075,95,28,8,0,0
25427813597_10153753869803598,One FC Bayern München star insists he has NO plans to join Guardiola at Manchester City FC,Bayern Munich star rules out joining Guardiola at Manchester City,link,http://www.goal.com/en/news/11/transfer-zone/2016/03/15/21352432/bayern-munich-star-rules-out-joining-guardiola-at-manchester?utm_source=facebook.com&utm_medium=referral&utm_campaign=enfb,2016-03-15 15:15:00,,2585,14,5,2568,4,2,9,2,0
25427813597_10153753911603598,It's another injury blow for the Manchester City FC captain...,Kompany suffers injury in Champions League clash,link,http://www.goal.com/en/news/1716/champions-league/2016/03/15/21353232/breaking-news-kompany-suffers-injury-against-dynamo-kyiv?utm_source=facebook.com&utm_medium=referral&utm_campaign=enfb,2016-03-15 15:13:00,,1828,28,4,1811,0,1,3,12,1
25427813597_10153753798648598,AS Roma's president has revealed Francesco Totti's ideal move this summer...,Roma chief reveals Totti's preferred club,link,http://www.goal.com/en/news/11/transfer-zone/2016/03/15/21350882/totti-wants-to-play-for-an-mls-team-in-miami?utm_source=facebook.com&utm_medium=referral&utm_campaign=enfb,2016-03-15 15:00:01,,3012,21,12,3000,4,4,1,1,2
25427813597_10153753879273598,Easy night ahead for Manchester City FC? Follow their progress against Dynamo Kyiv below:,LIVE COMMENTARY: Man City vs Dynamo Kyiv,link,http://www.goal.com/en/match/manchester-city-vs-dynamo-kyiv/2176185?utm_source=facebook.com&utm_medium=referral&utm_campaign=enfb,2016-03-15 14:45:02,,1037,9,3,1036,0,0,1,0,0
25427813597_10153753871408598,Can PSV get a result at Atlético de Madrid after a goalless first leg? Follow the latest LIVE:,LIVE COMMENTARY: Atletico Madrid vs PSV,link,http://www.goal.com/en/match/atlético-madrid-vs-psv/2176183?utm_source=facebook.com&utm_medium=referral&utm_campaign=enfb,2016-03-15 14:41:09,,1442,19,5,1439,1,0,2,0,0
25427813597_10153753808708598,"For all the best stats, insight and analysis, drop by our UEFA Champions League live blog!",LIVE BLOG: Champions League last 16!,link,http://www.goal.com/en/live-update/3792/live-matchday-blog?utm_source=facebook.com&utm_medium=referral&utm_campaign=enfb,2016-03-15 14:30:00,,1847,12,5,1843,3,0,1,0,0
