status_id,status_message,link_name,status_type,status_link,status_published,status_video_length,num_reactions,num_comments,num_shares,num_likes,num_loves,num_wows,num_hahas,num_sads,num_angrys
25427813597_10153727657898598,We will be joining Christian Karembeu in Amsterdam to watch the UEFA Champions League match between Real Madrid C.F. and AS Roma over at Heineken. Have a question for the former World Cup winner? Fire it our way at https://twitter.com/heineken using the hashtag #ChampionTheMatch,,video,https://www.facebook.com/goal/videos/10153727657898598/,2016-03-08 11:45:37,00:14,388,10,6,387,0,1,0,0,0
25427813597_10153727637313598,Chelsea Football Club have just suffered a HUGE blow to their UEFA Champions League chances,Chelsea suffer injury setback ahead of PSG clash,link,http://www.goal.com/en/news/1716/champions-league/2016/03/08/21119012/terry-confirms-hes-out-of-chelseas-crunch-clash-with-psg?utm_source=facebook.com&utm_medium=referral&utm_campaign=enfb,2016-03-08 11:33:43,,2778,47,13,2762,4,3,7,2,0
25427813597_10153727631263598,"Adam Johnson's sister, Faye Johnson, has supported the abuse of her brother's victim on her Facebook page. Full story here...",Adam Johnson's sister supports vile abuse against brother's victim,link,http://bit.ly/1pds8ko,2016-03-08 11:30:14,,1973,63,11,1945,2,1,0,9,16
25427813597_10153727604933598,Sunderland chief executive Margaret Byrne has resigned in the wake of Adam Johnson's conviction on child sex offences.,Sunderland chief executive resigns over Adam Johnson case,link,http://www.goal.com/en/news/1862/premier-league/2016/03/08/21118272/sunderland-chief-executive-resigns-over-adam-johnson-case?utm_source=facebook.com&utm_medium=referral&utm_campaign=enfb,2016-03-08 11:14:11,,1002,11,4,997,1,1,0,1,2
25427813597_10153727596458598,PSG - Paris Saint-Germain lay down the smack talk on Diego Costa ahead of their showdown with Chelsea Football Club!,PSG label Costa a 'fraud'!,link,http://bit.ly/1W6dBRL,2016-03-08 11:09:25,,4293,43,15,4269,10,3,9,0,2
25427813597_10153727531408598,"Bad news for Arsenal, Chelsea Football Club and Manchester United!

FC Barcelona are set to sign one of Europe's most exciting youngsters!",RUMOURS: Barca lead chase for wonderkid,link,http://www.goal.com/en/news/14222/transfer-talk/2016/03/08/21116732/rumours-barcelona-leading-dembele-race?utm_source=facebook.com&utm_medium=referral&utm_campaign=enfb,2016-03-08 10:58:52,,5169,47,11,5138,16,11,2,1,1
25427813597_10153727468663598,Fifa has extended worldwide bans issued to a number of individuals in relation to match-fixing and illegal betting in Italy,Fifa extends bans in Italian match-fixing case,link,http://www.goal.com/en/news/723/serie-a/2016/03/08/21115652/fifa-extends-bans-in-italian-match-fixing-case?utm_source=facebook.com&utm_medium=referral&utm_campaign=enfb,2016-03-08 10:45:36,,1084,8,4,1084,0,0,0,0,0
25427813597_10153727326753598,Plenty of Premier League stars join the returning Leo Messi in Argentina's latest squad...,Argentina name squad for upcoming World Cup qualifiers,link,http://bit.ly/1QIPVzk,2016-03-08 10:16:35,,14172,68,45,14069,78,19,6,0,0
25427813597_10153727306073598,Is this the boost Manchester City FC need to win the Premier League title?,Man City handed MASSIVE boost for title run-in,link,http://bit.ly/1p55f23,2016-03-08 10:04:34,,3090,13,2,3083,1,0,6,0,0
25427813597_10153727228898598,REVEALED: Robin van Persie's biggest influence in football,Van Persie on his football inspiration and Premier League idols,link,http://www.goal.com/en/news/13712/extra-time/2016/03/08/21115302/revealed-van-persies-biggest-influence-in-football?utm_source=facebook.com&utm_medium=referral&utm_campaign=enfb,2016-03-08 09:45:00,,3499,14,4,3488,9,2,0,0,0
25427813597_10153727246308598,Is Zlatan Ibrahimovic REALLY the reason PSG - Paris Saint-Germain are yet to win the Champions League?,'Ibrahimovic is obssessed with being PSG's Champions League saviour',link,http://bit.ly/1U1wEyI,2016-03-08 09:27:19,,5372,35,13,5350,11,4,7,0,0
25427813597_10153727209668598,EXCLUSIVE: Who's the best player in the world? There's only one answer for Jorge Sampaoli,Sampaoli: Only FOOLS don't rate Messi as the best,link,http://www.goal.com/en/news/596/exclusive/2016/03/08/21114172/sampaoli-messis-the-worlds-best-youre-a-fool-if-you-think?utm_source=facebook.com&utm_medium=referral&utm_campaign=enfb,2016-03-08 09:15:00,,14822,604,287,14599,123,23,68,0,9
25427813597_10153727214273598,We have a new manager in the Bundesliga!,Eintracht Frankfurt appoint new manager,link,http://www.goal.com/en/news/11/transfer-zone/2016/03/08/21114402/relegation-threatened-frankfurt-appoint-kovac-as-head-coach?utm_source=facebook.com&utm_medium=referral&utm_campaign=enfb,2016-03-08 09:02:35,,1285,5,0,1283,0,1,1,0,0
25427813597_10153727179498598,REVEALED: The perfect striker for Manchester United,Louis Saha tells Man Utd to sign 'perfect' striker,link,http://www.goal.com/en/news/11/transfer-zone/2016/03/08/21113582/lukaku-perfect-for-manchester-united-saha?utm_source=facebook.com&utm_medium=referral&utm_campaign=enfb,2016-03-08 09:00:02,,4201,39,9,4182,15,2,1,0,1
25427813597_10153727208693598,Does Leo Messi REALLY get preferential treatment?!,La Liga president weighs in on Messi debate,link,http://www.goal.com/en/news/722/la-liga/2016/03/08/21113952/messi-does-not-get-special-treatment-insists-la-liga?utm_source=facebook.com&utm_medium=referral&utm_campaign=enfb,2016-03-08 08:57:40,,13717,102,27,13594,78,13,25,0,7
25427813597_10153727190203598,Francesco Totti icon first played at Real Madrid C.F.'s home in 1995... and could feature one last time on Tuesday (By Ben Hayward),"Twenty years on, the Bernabeu bids farewell to Totti",link,http://www.goal.com/en/news/1716/champions-league/2016/03/08/21109052/twenty-years-on-the-bernabeu-bids-farewell-to-totti?utm_source=facebook.com&utm_medium=referral&utm_campaign=enfb,2016-03-08 08:41:18,,3433,47,27,3393,24,10,5,1,0
25427813597_10153727189618598,EXCLUSIVE: Former Chile coach Jorge Sampaoli explains the brilliance behind Pep Guardiola,'He changes wingers for forwards...but the players go out there and play',link,http://www.goal.com/en/news/1716/champions-league/2016/03/08/21113782/sampaoli-guardiola-has-a-great-mind-gets-his-stars-playing?utm_source=facebook.com&utm_medium=referral&utm_campaign=enfb,2016-03-08 08:40:40,,2563,3,16,2550,7,5,1,0,0
25427813597_10153727166713598,REVEALED: Robin van Persie's career choice BEFORE football,Van Persie: I was almost not a footballer!,link,http://www.goal.com/en/news/13712/extra-time/2016/03/08/21113192/revealed-van-persie-career-choice-before-football?utm_source=facebook.com&utm_medium=referral&utm_campaign=enfb,2016-03-08 08:35:00,,6556,42,15,6522,12,16,3,1,2
25427813597_10153727143013598,Jorge Sampaoli has talked to Goal about Leo Messi's struggles with Argentina National Football Team,Sampaoli on Messi,video,https://www.facebook.com/goal/videos/10153727143013598/,2016-03-08 08:20:22,01:01,2050,57,138,2005,33,6,5,0,1
25427813597_10153727124278598,Some HUGE injury news for Chelsea Football Club ahead of facing PSG - Paris Saint-Germain,"TEAM NEWS: Two IN, one OUT as Chelsea train",link,http://www.goal.com/en/news/1716/champions-league/2016/03/08/21113492/diego-costa-pedro-train-with-chelsea-ahead-of-psg-clash?utm_source=facebook.com&utm_medium=referral&utm_campaign=enfb,2016-03-08 08:05:00,,2900,25,4,2891,3,0,4,1,1
25427813597_10153727137903598,Our Real Madrid C.F. correspondent Alberto Piñero Goal brings us the latest on the R.Madrid - AS Roma from the Santiago Bernabeu stadium,Alberto Piñero Goal,video,https://www.facebook.com/AlbertoPineroGoal/videos/985164688238861/,2016-03-08 08:02:55,,407,1,0,401,3,1,2,0,0
25427813597_10153727037848598,Look who's back at Liverpool FC!,Suarez makes surprise return to Liverpool,link,http://www.goal.com/en/news/13712/extra-time/2016/03/08/21112002/video-suarez-makes-surprise-return-to-liverpool?utm_source=facebook.com&utm_medium=referral&utm_campaign=enfb,2016-03-08 07:45:00,,10412,93,34,10289,71,30,13,3,6
25427813597_10153727093653598,Can we add another team to the Premier League's battle against relegation?,"""It's just not easy to get points in this league.""",link,http://www.goal.com/en/news/1862/premier-league/2016/03/08/21112542/chester-west-brom-not-safe-yet?utm_source=facebook.com&utm_medium=referral&utm_campaign=enfb,2016-03-08 07:28:51,,1215,3,0,1213,1,0,1,0,0
25427813597_10153727085623598,Nani has named his choice for the GREATEST player of all time,"""When he was at his best nobody could compare.""",link,http://www.goal.com/en/news/60/south-america/2016/03/08/21112062/ronaldinho-is-the-best-player-in-history-nani?utm_source=facebook.com&utm_medium=referral&utm_campaign=enfb,2016-03-08 07:23:11,,8160,119,54,8083,49,17,8,0,3
25427813597_10153727028933598,Liverpool FC's controversial win has NOT gone down well with Crystal Palace Football Club fans... Time for a petition then!,'Ban Benteke & dock Liverpool six points!',link,http://www.goal.com/en/news/13712/extra-time/2016/03/08/21110062/ban-benteke-dock-liverpool-points-crystal-palace-fans?utm_source=facebook.com&utm_medium=referral&utm_campaign=enfb,2016-03-08 07:20:01,,2530,117,27,2487,6,0,35,0,2
25427813597_10153727029263598,Check out Real Madrid C.F.'s shooting skills and the best goal of the weekend from FC Barcelona's Masia academy in today's Social Snap!,,video,https://www.facebook.com/goal/videos/10153727029263598/,2016-03-08 07:13:57,01:13,2458,10,30,2400,35,17,3,1,2
25427813597_10153726995578598,"Chelsea Football Club fans, it could be time to get very excited...

Antonio Conte is targeting five HUGE summer signings!",RUMOURS: Conte's five-man transfer shortlist,link,http://www.goal.com/en/news/11/transfer-zone/2016/03/08/21108272/rumours-cavani-heads-up-contes-five-man-chelsea-wishlist?utm_source=facebook.com&utm_medium=referral&utm_campaign=enfb,2016-03-08 07:00:01,,1878,24,9,1872,5,1,0,0,0
25427813597_10153727020718598,Jamie Vardy has pulled himself away from Call of Duty to discuss the Premier League title race,Vardy on Premier League title race pressures,link,http://www.goal.com/en/news/1862/premier-league/2016/03/08/21109572/vardy-job-not-done-yet?utm_source=facebook.com&utm_medium=referral&utm_campaign=enfb,2016-03-08 06:49:19,,3908,12,16,3893,4,3,7,1,0
25427813597_10153727005403598,How much will Real Madrid C.F. miss Karim Benzema tonight? We take a look at the Frenchman's stats in our UEFA Champions League Goal Kings series http://bit.ly/1THg73m,UCL Goal Kings: Karim Benzema,video,https://www.facebook.com/goal/videos/10153727005403598/,2016-03-08 06:38:18,01:22,2364,24,63,2321,28,13,0,2,0
25427813597_10153727003523598,Juan Mata is VERY excited about one particular Manchester United youngster!,"""He plays like he's been at Man Utd for 10 years!""",link,http://www.goal.com/en/news/1862/premier-league/2016/03/08/21108932/mata-varela-plays-like-hes-been-at-man-utd-for-10-years?utm_source=facebook.com&utm_medium=referral&utm_campaign=enfb,2016-03-08 06:34:06,,6068,31,8,6038,22,5,1,0,2
25427813597_10153726966048598,"Maria Sharapova, Diego Maradona, Lance Armstrong and sport's most famous drug cheats",Sharapova and sport's most famous drug cheats,link,http://www.goal.com/en/news/7180/galleries/2016/03/08/21099602/sharapova-maradona-armstrong-and-sports-most-famous-drug?utm_source=facebook.com&utm_medium=referral&utm_campaign=enfb,2016-03-08 06:30:01,,2089,74,35,2003,7,7,9,47,16
25427813597_10153726987668598,Has Mats Hummels put his poor form at Borussia Dortmund behind him?,Watzke on Hummels form for Dortmund,link,http://www.goal.com/en/news/725/bundesliga/2016/03/08/21107602/world-class-hummels-is-the-right-man-to-captain-dortmund?utm_source=facebook.com&utm_medium=referral&utm_campaign=enfb,2016-03-08 06:20:19,,2378,6,1,2373,2,0,0,0,3
25427813597_10153726980513598,Keylor Navas has had his say on Zinedine Zidane's impact at Real Madrid C.F. so far...,"""Adapting to new ideas takes time. The pieces need to slot into place.""",link,http://www.goal.com/en/news/722/la-liga/2016/03/08/21105732/zidane-can-achieve-big-things-at-real-madrid-navas?utm_source=facebook.com&utm_medium=referral&utm_campaign=enfb,2016-03-08 06:17:35,,5626,13,5,5600,19,1,2,0,4
25427813597_10153726972033598,Eva Carneiro's demand for a public apology from Jose Mourinho turns out less rosy than she expected... (by Omar Momani),CARTOON: Mourinho apology not so rosy,link,http://www.goal.com/en/news/3947/cartoon-of-the-day/2016/03/08/20866272/cartoon-of-the-day-march?utm_source=facebook.com&utm_medium=referral&utm_campaign=enfb,2016-03-08 06:08:04,,1075,25,14,1048,6,1,19,0,1
25427813597_10153726856083598,http://www.goal.com/en/news/13712/extra-time/2016/03/08/21106592/leicester-city-causing-earthquakes-with-title-charge?utm_source=facebook.com&utm_medium=referral&utm_campaign=enfb,Leicester City goal celebrations causing earthquakes,link,http://www.goal.com/en/news/13712/extra-time/2016/03/08/21106592/leicester-city-causing-earthquakes-with-title-charge?utm_source=facebook.com&utm_medium=referral&utm_campaign=enfb,2016-03-08 06:02:00,,1551,25,6,1536,3,5,7,0,0
25427813597_10153726892138598,Gabriel does not agree with Arsene Wenger's latest criticism...,"""I am training very hard... I think I'm doing well.""",link,http://www.goal.com/en/news/1862/premier-league/2016/03/08/21107492/gabriel-responds-to-wenger-concerns-i-already-understand-my-team-?utm_source=facebook.com&utm_medium=referral&utm_campaign=enfb,2016-03-08 05:55:15,,1697,32,4,1686,6,0,5,0,0
25427813597_10153726866218598,Pep Guardiola meets with Manchester City FC to discuss summer plans (By Sam Lee),Guardiola & Begiristain meet in Amsterdam,link,http://www.goal.com/en/news/11/transfer-zone/2016/03/08/21106932/guardiola-begiristain-meet-in-amsterdam-to-step-up-man-city?utm_source=facebook.com&utm_medium=referral&utm_campaign=enfb,2016-03-08 05:49:08,,2515,9,10,2512,1,2,0,0,0
25427813597_10153726852448598,Ashley Cole makes our Major League Soccer (MLS) Team of the Week... but who joins him?,LA Galaxy dominate MLS Team of the Week,link,http://www.goal.com/en/news/7180/galleries/2016/03/08/21104092/mls-team-of-the-week-super-sub-magee-leads-week-1-standouts?utm_source=facebook.com&utm_medium=referral&utm_campaign=enfb,2016-03-08 05:37:22,,1333,2,4,1330,1,0,0,0,2
25427813597_10153726848158598,"Do you agree with our Liverpool FC Correspondent Melissa Reddy that Roberto Firmino, who has contributed 15 Premier League goals in 19 starts, deserves more credit?",Melissa Reddy,link,http://www.goal.com/en-gb/news/2896/premier-league/2016/03/07/21081672/how-firmino-is-outgunning-alexis-sanchez-sterling-payet-at?ICID=HP_BN_1,2016-03-08 05:31:56,,750,35,0,740,9,0,1,0,0
25427813597_10153726844108598,One former Tottenham Hotspur player is hoping to further dent Arsenal's faltering season... tonight!,"""We certainly do have some history with Arsenal.""",link,http://www.goal.com/en/news/780/fa-cup/2016/03/08/21104482/dawson-wants-fa-cup-revenge-on-arsenal?utm_source=facebook.com&utm_medium=referral&utm_campaign=enfb,2016-03-08 05:25:39,,2172,9,1,2170,2,0,0,0,0
25427813597_10153726836098598,Atlético de Madrid have ONE main aim this season... and it's not good news for Real Madrid C.F.!,"""I do not know if we can, but we must win every game.""",link,http://www.goal.com/en/news/722/la-liga/2016/03/08/21104292/carrasco-atletico-want-to-finish-above-real-madrid?utm_source=facebook.com&utm_medium=referral&utm_campaign=enfb,2016-03-08 05:16:40,,5710,36,16,5659,26,4,16,1,4
25427813597_10153726808913598,Will Blaise Matuidi -Page Officielle- and Marco Verratti be fit to face Chelsea Football Club?,How will PSG line up against Chelsea?,link,http://www.goal.com/en/news/1716/champions-league/2016/03/08/21104692/matuidi-verratti-injuries-give-blanc-a-headache-how-will-psg?utm_source=facebook.com&utm_medium=referral&utm_campaign=enfb,2016-03-08 04:55:52,,5023,46,33,4994,16,6,3,1,3
25427813597_10153726787453598,How can Uefa prevent a European Super League breakaway? (by Peter M Staunton),Make the rich even richer: How can Uefa prevent a European breakaway?,link,http://www.goal.com/en/news/1716/champions-league/2016/03/08/21103862/make-the-rich-even-richer-how-can-uefa-prevent-a-european?utm_source=facebook.com&utm_medium=referral&utm_campaign=enfb,2016-03-08 04:38:03,,2220,40,16,2208,1,5,3,0,3
25427813597_10153726770563598,EXCLUSIVE: Cicinho tips AS Roma star Miralem Pjanic to shine at Real Madrid C.F.,Cicinho: Pjanic would be a good fit for Real Madrid,link,http://www.goal.com/en/news/1716/champions-league/2016/03/08/21058892/cicinho-pjanic-would-be-a-good-fit-for-real-madrid?utm_source=facebook.com&utm_medium=referral&utm_campaign=enfb,2016-03-08 04:21:46,,2795,30,3,2789,4,1,1,0,0
25427813597_10153726674618598,Will Gareth Bale return to the Real Madrid C.F. starting XI?,How will Real Madrid line up against Roma?,link,http://www.goal.com/en/news/1716/champions-league/2016/03/08/21095492/bale-to-return-james-set-to-start-how-will-real-madrid-line?utm_source=facebook.com&utm_medium=referral&utm_campaign=enfb,2016-03-08 04:02:51,,7739,48,15,7694,27,9,7,0,2
25427813597_10153726659213598,Conte to Chelsea Football Club...Mancini to the Italy national team?,Mancini responds to Italy links,link,http://www.goal.com/en/news/10/italian-football/2016/03/08/21103222/mancini-plays-down-italy-links?utm_source=facebook.com&utm_medium=referral&utm_campaign=enfb,2016-03-08 03:51:01,,1570,4,2,1568,1,1,0,0,0
25427813597_10153726648238598,Roberto Martinez is on the receiving end of some heavy criticism!,'Martinez is becoming a joke and an embarrassment!',link,http://www.goal.com/en/news/1862/premier-league/2016/03/08/21104112/roberto-martinez-is-becoming-a-joke-and-an-embarrassment-at?utm_source=facebook.com&utm_medium=referral&utm_campaign=enfb,2016-03-08 03:34:25,,1164,18,2,1162,2,0,0,0,0
25427813597_10153726636223598,REVEALED: The buyout clause added to Jamie Vardy's contract!,RUMOURS: Buyout clause added to Vardy contract,link,http://www.goal.com/en/news/14222/transfer-talk/2016/03/08/21103792/rumours-leicester-striker-has-vardy-has-30m-buyout-clause?utm_source=facebook.com&utm_medium=referral&utm_campaign=enfb,2016-03-08 03:17:27,,2113,31,6,2105,4,0,2,2,0
25427813597_10153726627878598,"COMMENT: A message to Real Madrid C.F. president Florentino Perez, from Ben Hayward","Listen, Perez: Madrid players want Zidane to stay - whatever happens in the Champions League",link,http://www.goal.com/en/news/722/la-liga/2016/03/08/21097262/listen-perez-madrid-players-want-zidane-to-stay-whatever-happens-?utm_source=facebook.com&utm_medium=referral&utm_campaign=enfb,2016-03-08 03:04:47,,6680,58,31,6632,35,3,9,0,1
25427813597_10153726601988598,"Top of the league, but one player isn't happy with life at Leicester City Football Club",'It makes me sick!',link,http://www.goal.com/en-gb/news/2896/premier-league/2016/03/08/21103192/inler-lack-of-leicester-game-time-makes-me-sick?utm_source=facebook.com&utm_medium=referral&utm_campaign=enfb,2016-03-08 02:42:15,,1634,36,7,1613,3,1,3,6,8
25427813597_10153726045948598,Has Arsene Wenger cracked under the pressure? 😰,PAPERS: Tuesday's football headlines!,link,http://www.goal.com/en/news/755/europe/2016/03/08/21100162/wenger-blasts-boring-critics-as-madrid-prepare-to-dominate?utm_source=facebook.com&utm_medium=referral&utm_campaign=enfb,2016-03-08 02:00:00,,1222,22,3,1219,3,0,0,0,0
25427813597_10153726085663598,Will this stop Manchester United landing Pochettino?,RUMOURS: Spurs have Pochettino masterplan,link,http://www.goal.com/en/news/14222/transfer-talk/2016/03/08/21100582/rumours-tottenham-to-offer-pochettino-new-deal?utm_source=facebook.com&utm_medium=referral&utm_campaign=enfb,2016-03-08 01:00:01,,1937,12,3,1932,4,1,0,0,0
25427813597_10153726061008598,"Who said THIS about Real Madrid's last manager?

CLUE: It's not Cristiano Ronaldo!",'Benitez wasn't the problem at Real Madrid!',link,http://www.goal.com/en/news/722/la-liga/2016/03/08/21099812/benitez-wasnt-the-problem-for-real-madrid-claims-garcia?utm_source=facebook.com&utm_medium=referral&utm_campaign=enfb,2016-03-08 00:00:00,,7040,47,15,6993,20,8,15,0,4
25427813597_10153726033688598,"This couldn't happen, could it?! 😵",Did Pique make a PROMISE over his next club?,link,http://www.goal.com/en/news/13712/extra-time/2016/03/07/21097062/are-mascherano-and-pique-planning-barca-exodus-to-river?utm_source=facebook.com&utm_medium=referral&utm_campaign=enfb,2016-03-07 23:00:01,,7776,32,19,7718,28,4,18,3,5
25427813597_10153725957463598,Is a Chelsea summer exit now inevitable? 👋,RUMOURS: PSG ready to lure Chelsea star,link,http://www.goal.com/en/news/14222/transfer-talk/2016/03/07/21098492/rumours-chelsea-could-lose-diego-costa-to-psg?utm_source=facebook.com&utm_medium=referral&utm_campaign=enfb,2016-03-07 22:00:00,,6888,23,20,6856,22,1,7,1,1
25427813597_10153726028363598,It's not just Arsenal fans who aren't happy with Coquelin...!,MORE bad news for Coquelin,link,http://www.goal.com/en/news/13822/news/2016/03/07/21098412/coquelin-no-contact-with-deschamps-over-france-call-up?utm_source=facebook.com&utm_medium=referral&utm_campaign=enfb,2016-03-07 21:00:00,,3249,39,8,3233,5,1,3,1,6
25427813597_10153726013533598,Has Raheem Sterling just taken a swipe at Liverpool FC?!,'With 10 games to go I've matched it already!',link,http://www.goal.com/en/news/1862/premier-league/2016/03/08/21099542/sterling-aguero-is-behind-my-man-city-goal-rush?utm_source=facebook.com&utm_medium=referral&utm_campaign=enfb,2016-03-07 20:00:00,,3513,53,7,3487,7,4,2,0,13
25427813597_10153725985228598,What has Ancelotti had to say about Cristiano Ronaldo & Real Madrid C.F.?,'Something is being done extremely badly',link,http://www.goal.com/en/news/722/la-liga/2016/03/07/21098342/ancelotti-on-real-madrid-injuries-something-is-badly-wrong?utm_source=facebook.com&utm_medium=referral&utm_campaign=enfb,2016-03-07 19:06:16,,11842,56,33,11731,42,35,19,11,4
25427813597_10153725939013598,Arsene Wenger has LOST IT! 😤,Wenger in ASTONISHING rant over job security,link,http://www.goal.com/en/news/1862/premier-league/2016/03/07/21098542/wenger-launches-scathing-attack-against-boring-media?utm_source=facebook.com&utm_medium=referral&utm_campaign=enfb,2016-03-07 18:32:46,,1393,42,9,1377,0,1,8,4,3
25427813597_10153725890253598,Surely Adnan Januzaj MUST be unleashed against Liverpool now...?!,Will THIS convince LVG to start Januzaj?,link,http://www.goal.com/en/news/1862/premier-league/2016/03/07/21098212/januzaj-pushes-for-first-team-recall-with-u21s-double?utm_source=facebook.com&utm_medium=referral&utm_campaign=enfb,2016-03-07 18:00:22,,5535,33,13,5517,5,6,5,0,2
25427813597_10153725678833598,Could Anthony Martial be Manchester United's answer to Cristiano Ronaldo?,'Martial showing shades of replicating Ronaldo',link,http://bit.ly/1LaFS9i,2016-03-07 16:32:55,,6781,119,18,6726,20,5,29,1,0
25427813597_10153725658678598,Is there about to be a second Suarez arriving at FC Barcelona?,Denis Suarez's agent responds to Barcelona links,link,http://bit.ly/1R3G1Oi,2016-03-07 16:17:48,,4871,41,21,4860,10,1,0,0,0
25427813597_10153725614063598,Did Mohamed Elneny do enough to warrant a regular Arsenal starting spot against Spurs?,Elneny: I showed I can be an Arsenal regular,link,http://bit.ly/1RPa7lw,2016-03-07 15:49:45,,3913,66,11,3885,13,4,10,0,1
25427813597_10153725532858598,"Gent back themselves to pull off what would be a ""miracle"" in the UEFA Champions League, says their coach!",Gent ready to pull off Champions League 'miracle',link,http://bit.ly/1R3z0wR,2016-03-07 14:55:38,,1937,19,1,1935,1,1,0,0,0
25427813597_10153725520398598,"When these eyebrows give you a warning, you listen.",Hecking issues Wolfsburg warning,link,http://bit.ly/21TldhE,2016-03-07 14:46:09,,544,7,0,544,0,0,0,0,0
25427813597_10153725505088598,"Can Luciano Spalletti inspire AS Roma to ""do the impossible"" and beat Real Madrid C.F.?",'I'm asking Roma to do the impossible!',link,http://bit.ly/1R3x2fP,2016-03-07 14:35:00,,2237,93,7,2215,3,1,17,1,0
25427813597_10153725482973598,Are FC Barcelona ready to raid Borussia Dortmund for TWO of their star players?!,SPOTTED: Barca director watches Dortmund stars,link,http://bit.ly/1p2NEYx,2016-03-07 14:21:45,,8287,50,31,8238,21,13,7,0,8
25427813597_10153725474688598,Alberto Piñero Goal and Ben Hayward are LIVE talking Real Madrid C.F. - get involved!,Alberto Piñero Goal,video,https://www.facebook.com/AlbertoPineroGoal/videos/984857334936263/,2016-03-07 14:18:35,,236,4,0,233,1,0,0,0,2
25427813597_10153725450823598,Is Steve McClaren's time up at Newcastle United?,Perez admits: Something must change at Newcastle!,link,http://bit.ly/1pbibUI,2016-03-07 14:05:53,,1162,14,3,1159,2,1,0,0,0
25427813597_10153725441988598,Tottenham Hotspur starlet Dele Alli played the whole of the north London derby despite carrying an injury!,Pochettino warns: 'Alli is not a machine!',link,http://bit.ly/1LMvPHw,2016-03-07 13:58:52,,1718,7,2,1713,4,0,1,0,0
25427813597_10153725436873598,Juventus boss Massimiliano Allegri is awarded Italy's top prize for coaching!,Allegri named Serie A's best coach,link,http://bit.ly/1nrQtRR,2016-03-07 13:55:11,,1585,99,15,1577,6,0,0,0,2
25427813597_10153725433783598,Didier Drogba will spend an undetermined amount of time with a California club...,Didier Drogba to train with Sacramento Republic FC - Goal.com,link,http://www.goal.com/en-us/news/1110/major-league-soccer/2016/03/07/21093852/didier-drogba-to-train-with-sacramento-republic-fc,2016-03-07 13:52:31,,1994,14,15,1988,3,1,0,1,1
25427813597_10153725425283598,Arsenal boss Arsene Wenger wants football to take the next step in adding technology...,Wenger: The technology I want next in football is...,link,http://bit.ly/1TmN2K6,2016-03-07 13:46:36,,2402,92,10,2388,7,0,2,1,4
