status_id,status_message,link_name,status_type,status_link,status_published,status_video_length,num_reactions,num_comments,num_shares,num_likes,num_loves,num_wows,num_hahas,num_sads,num_angrys
25427813597_10153778821068598,One club are preparing a MAJOR offer for Arsenal's Alex Oxlade-Chamberlain,Arsenal to receive MAJOR offer for Oxlade-Chamberlain,link,http://www.goal.com/en/news/11/transfer-zone/2016/03/23/21623092/rumours-oxlade-chamberlain-to-be-offered-arsenal-escape?utm_source=facebook.com&utm_medium=referral&utm_campaign=enfb,2016-03-23 10:40:14,,2166,24,8,2152,0,1,5,5,3
25427813597_10153778799078598,Is it too early to call in Christian Pulisic to the #USMNT?,Is it too soon to bring in Christian Politic? - Goal.com,link,http://www.goal.com/en-us/news/1679/us-national-team/2016/03/23/21607992/is-it-too-soon-for-klinsmann-to-call-up-christian-pulisic?ICID=HP_HN_1,2016-03-23 10:34:03,,1512,9,5,1507,2,1,2,0,0
25427813597_10153778239273598,"Paolo Maldini v Franz Beckenbauer

Two of the games greatest defenders, but who was the best?",Paolo Maldini v Franz Beckenbauer,video,https://www.facebook.com/goal/videos/10153778239273598/,2016-03-23 10:15:00,01:47,1056,97,76,1033,17,3,2,1,0
25427813597_10153778729168598,Edi Cavani is nearing a return to Serie A TIM but NOT back at SSC Napoli...,Cavani's agent & brother says Serie A return is 'possible',link,http://www.goal.com/en/news/723/serie-a/2016/03/23/21620152/cavani-move-to-juventus-possible?utm_source=facebook.com&utm_medium=referral&utm_campaign=enfb,2016-03-23 10:06:27,,3008,21,9,3000,3,1,3,0,1
25427813597_10153778196073598,"The Legends World Cup has begun - cast your vote now!

Paolo Maldini v Franz Beckenbauer http://bit.ly/22EU2nI",Timeline Photos,photo,https://www.facebook.com/goal/photos/a.112071118597.98899.25427813597/10153778196073598/?type=3,2016-03-23 10:00:01,,159,29,3,159,0,0,0,0,0
25427813597_10153778616363598,Three from Arsenal and NONE from Manchester United... Gianluigi Buffon's best Premier League XI!,REVEALED: Buffon's best Premier League XI!,link,http://www.goal.com/en/news/13712/extra-time/2016/03/23/21619122/ozil-costa-and-kane-buffon-picks-his-best-premier-league-xi?utm_source=facebook.com&utm_medium=referral&utm_campaign=enfb,2016-03-23 09:26:15,,3280,117,18,3253,12,1,8,4,2
25427813597_10153778565808598,Joachim Low has revealed the extent of Bastian Schweinsteiger's injury...,Low on Schweinsteiger injury: It doesn't look positive,link,http://www.goal.com/en/news/468/international-football/2016/03/23/21618592/it-does-not-look-positive-low-confirms-schweinsteiger-will?utm_source=facebook.com&utm_medium=referral&utm_campaign=enfb,2016-03-23 09:10:15,,2084,24,4,2057,5,2,0,18,2
25427813597_10153778286853598,"WOW! Ronaldo Nazário de Lima v Cristiano Ronaldo

Who is the 'real' Ronaldo?",,video,https://www.facebook.com/goal/videos/10153778286853598/,2016-03-23 09:10:00,01:47,6077,389,523,5943,86,36,10,0,2
25427813597_10153778008748598,"The Legends World Cup is under way - cast your vote!

Johan Cruyff v Alfredo Di Stéfano http://bit.ly/1WHHDvu",Timeline Photos,photo,https://www.facebook.com/goal/photos/a.112071118597.98899.25427813597/10153778008748598/?type=3,2016-03-23 09:00:00,,185,37,5,185,0,0,0,0,0
25427813597_10153778523038598,Chelsea Football Club have told Real Madrid C.F. how much they want for Thibaut Courtois,Chelsea demand world-record transfer fee for Courtois,link,http://www.goal.com/en/news/11/transfer-zone/2016/03/23/21619902/rumours-chelsea-demand-73m-for-courtois?utm_source=facebook.com&utm_medium=referral&utm_campaign=enfb,2016-03-23 08:54:04,,7719,102,21,7661,15,6,31,3,3
25427813597_10153778446443598,Manchester United are tracking one of Serie A TIM's finest defenders...,RUMOURS: Man Utd keeping tabs on Serie A star,link,http://www.goal.com/en/news/14222/transfer-talk/2016/03/23/21617582/rumours-man-utd-keeping-tabs-on-koulibaly?utm_source=facebook.com&utm_medium=referral&utm_campaign=enfb,2016-03-23 08:26:12,,2199,20,3,2196,1,2,0,0,0
25427813597_10153778264083598,"Old school FC Barcelona v Real Madrid C.F.

Johan Cruyff v Alfredo Di Stéfano - who wins?",Cruyff v Di Stefano,video,https://www.facebook.com/goal/videos/10153778264083598/,2016-03-23 08:20:00,01:47,1512,87,81,1490,14,3,4,1,0
25427813597_10153778399373598,Vicente del Bosque admits he is concerned by one Spain star...,Spain star told to improve by Del Bosque,link,http://www.goal.com/en/news/13822/news/2016/03/23/21612262/del-bosque-concerned-by-moratas-inconsistent-form?utm_source=facebook.com&utm_medium=referral&utm_campaign=enfb,2016-03-23 08:07:30,,3133,21,13,3121,8,4,0,0,0
25427813597_10153778387488598,Jurgen Klopp reveals Mesut Özil's biggest weakness!,REVEALED: Mesut Ozil's biggest weakness!,link,http://www.goal.com/en/news/1862/premier-league/2016/03/23/21617762/klopp-ozil-reus-schurrle-cannot-head-the-ball?utm_source=facebook.com&utm_medium=referral&utm_campaign=enfb,2016-03-23 08:02:41,,3280,45,9,3266,5,5,4,0,0
25427813597_10153777839508598,"VOTE NOW in our Legends World Cup!

Leo Messi v Ronaldinho Gaúcho http://bit.ly/1UF1q0P",Timeline Photos,photo,https://www.facebook.com/goal/photos/a.112071118597.98899.25427813597/10153777839508598/?type=3,2016-03-23 08:00:00,,318,140,15,310,5,0,3,0,0
25427813597_10153778325323598,"FC Bayern München trickster Franck Ribéry, Everton Football Club ace Gerard Deulofeu and Real Madrid C.F. ace Marcelo show off their skills in Goal's latest Social Snap!",,video,https://www.facebook.com/goal/videos/10153778325323598/,2016-03-23 07:59:11,01:29,2703,35,75,2627,29,41,6,0,0
25427813597_10153778331683598,"Vote now in our key Legends World Cup battle!

Ronaldo Nazário de Lima v Cristiano Ronaldo",LEGENDS WORLD CUP: Ronaldo v Cristiano Ronaldo,link,http://www.goal.com/en/news/19252/legends-world-cup/2016/03/23/20944552/legends-world-cup-cristiano-ronaldo-v-ronaldo?utm_source=facebook.com&utm_medium=referral&utm_campaign=enfb,2016-03-23 07:41:04,,5186,834,46,5145,23,5,13,0,0
25427813597_10153778283793598,One of Mourinho's signings admits his move to Chelsea Football Club hasn't gone as planned...,'My move to Chelsea hasn't gone as planned',link,http://www.goal.com/en/news/11/transfer-zone/2016/03/23/21617172/my-move-to-chelsea-hasnt-gone-as-planned?utm_source=facebook.com&utm_medium=referral&utm_campaign=enfb,2016-03-23 07:18:58,,2524,26,8,2513,3,2,6,0,0
25427813597_10153778047723598,"Leo Messi v Ronaldinho Gaúcho - One v One 

Who wins?",Leo Messi v Ronaldinho Gaúcho,video,https://www.facebook.com/goal/videos/10153778047723598/,2016-03-23 07:13:41,01:46,4131,316,271,4035,69,23,4,0,0
25427813597_10153778219058598,"SIX clubs are targeting the same Arsenal star

But FC Bayern München are leading the race...",SIX clubs want to sign Arsenal star this summer,link,http://www.goal.com/en/news/11/transfer-zone/2016/03/23/21615202/rumours-bellerin-wanted-by-six-clubs?utm_source=facebook.com&utm_medium=referral&utm_campaign=enfb,2016-03-23 06:47:23,,2238,45,14,2225,4,6,2,1,0
25427813597_10153778197398598,"The UEFA Champions League Goal Kings series, presented by Nissan, continues. Next up we take a look at Thomas Müller http://bit.ly/1Rg0gq1",UCL Goal Kings: Thomas Muller,video,https://www.facebook.com/goal/videos/10153778197398598/,2016-03-23 06:40:18,01:16,225,4,10,219,5,0,0,0,1
25427813597_10153778195398598,"The Legends World Cup has begun - cast your vote now!

Paolo Maldini v Franz Beckenbauer",LEGENDS WORLD CUP: Maldini v Beckenbauer,link,http://www.goal.com/en/news/19252/legends-world-cup/2016/03/23/20944402/legends-world-cup-maldini-v-beckenbauer?utm_source=facebook.com&utm_medium=referral&utm_campaign=enfb,2016-03-23 06:37:08,,1217,142,7,1217,0,0,0,0,0
25427813597_10153778178673598,Belgium's friendly with Portugal has been postponed,Belgium postpone Portugal match after terror attacks,link,http://www.goal.com/en/news/468/international-football/2016/03/23/21615552/breaking-belgium-cancel-portugal-clash-after-terror-attacks?utm_source=facebook.com&utm_medium=referral&utm_campaign=enfb,2016-03-23 06:26:11,,3676,20,22,3639,5,1,0,29,2
25427813597_10153778146438598,One Liverpool FC star has HIT OUT at Jurgen Klopp!,Liverpool star slams Klopp over team selection,link,http://www.goal.com/en/news/11/transfer-zone/2016/03/23/21611242/benteke-hits-out-at-klopp-over-lack-of-playing-time-for?utm_source=facebook.com&utm_medium=referral&utm_campaign=enfb,2016-03-23 06:11:43,,2774,46,8,2765,1,2,6,0,0
25427813597_10153778054278598,EXCLUSIVE: Hector Bellerin commits future to Arsenal!,EXCLUSIVE: Bellerin commits future to Arsenal!,link,http://www.goal.com/en/news/1862/premier-league/2016/03/23/21590972/bellerin-my-future-is-with-arsenal?utm_source=facebook.com&utm_medium=referral&utm_campaign=enfb,2016-03-23 05:46:01,,6855,51,20,6803,36,7,3,4,2
25427813597_10153778070258598,,Brasil Global Tour,link,http://www.goal.com/brasilglobaltour/en/news/5457/brasil-global-tour/2016/03/23/21612122/willian-and-costa-but-no-coutinho-or-oscar-brazils-first?ICID=HP_BN_1,2016-03-23 05:43:59,,939,32,0,937,2,0,0,0,0
25427813597_10153778029843598,BREAKING: Manchester United star injured on international duty!,INJURED: Man Utd star 'will undergo an MRI scan',link,http://www.goal.com/en/news/468/international-football/2016/03/23/21614012/breaking-news-schweinsteiger-injured-with-germany?utm_source=facebook.com&utm_medium=referral&utm_campaign=enfb,2016-03-23 05:25:51,,3236,37,12,3197,3,0,2,17,17
25427813597_10153778008153598,"The Legends World Cup is under way - cast your vote now!

Johan Cruyff v Alfredo Di Stéfano",LEGENDS WORLD CUP: Cruyff v Di Stefano,link,http://www.goal.com/en/news/19252/legends-world-cup/2016/03/23/20944252/legends-world-cup-cruyff-v-di-stefano?utm_source=facebook.com&utm_medium=referral&utm_campaign=enfb,2016-03-23 05:15:04,,1171,103,5,1162,3,5,0,0,1
25427813597_10153777973343598,"CARTOON: Mesut Özil reveals the secret to his silky touch...

(by Omar Momani)",CARTOON: Could Mesut Ozil juggle... the planet!?,link,http://www.goal.com/en/news/3947/cartoon-of-the-day/2016/03/23/20866272/cartoon-of-the-day-march?utm_source=facebook.com&utm_medium=referral&utm_campaign=enfb,2016-03-23 05:11:56,,1863,9,5,1836,5,3,19,0,0
25427813597_10153777943568598,One Manchester United star admits he would love the chance to play with Zlatan Ibrahimovic at Old Trafford,Manchester United star urges club to sign Ibrahimovic,link,http://www.goal.com/en/news/11/transfer-zone/2016/03/23/21613022/mata-keen-to-link-up-with-ibrahimovic-at-manchester-united?utm_source=facebook.com&utm_medium=referral&utm_campaign=enfb,2016-03-23 04:55:48,,10214,49,28,10166,28,7,11,0,2
25427813597_10153777928023598,,Goal.com's cover photo,photo,https://www.facebook.com/goal/photos/a.10150710367773598.402680.25427813597/10153777928023598/?type=3,2016-03-23 04:51:46,,7670,157,39,7611,39,14,1,1,4
25427813597_10153777875728598,Lukas Podolski tells us one Galatasaray star would be the PERFECT fit for Arsenal,Check out our EXCLUSIVE interview with Podolski,link,http://www.goal.com/en/news/596/exclusive/2016/03/23/21605502/podolski-sneijder-is-an-arsenal-kind-of-player?utm_source=facebook.com&utm_medium=referral&utm_campaign=enfb,2016-03-23 04:30:52,,1715,11,6,1714,0,0,1,0,0
25427813597_10153777835158598,"The Legends World Cup is under way - get your vote in now!

Leo Messi v Ronaldinho Gaúcho",LEGENDS WORLD CUP: Messi v Ronaldinho,link,http://www.goal.com/en/news/19252/legends-world-cup/2016/03/23/20942432/legends-world-cup-messi-v-ronaldinho?utm_source=facebook.com&utm_medium=referral&utm_campaign=enfb,2016-03-23 04:08:32,,8709,1157,101,8635,45,25,3,1,0
25427813597_10153777777298598,FC Barcelona have signed Argentina's 'new Leo Messi' from under the noses of Real Madrid C.F.!,RUMOURS: Barcelona sign 'new Messi' from under Madrid's nose,link,http://www.goal.com/en/news/11/transfer-zone/2016/03/23/21609352/rumours-barcelona-steal-new-messi-from-under-madrids-nose?utm_source=facebook.com&utm_medium=referral&utm_campaign=enfb,2016-03-23 03:44:34,,11688,130,89,11562,58,4,56,2,6
25427813597_10153777735593598,"Christian Benteke may have a way out of Liverpool FC this summer

And he could be playing in the UEFA Champions League!",CONFIRMED: Premier League club reveal Benteke interest,link,http://www.goal.com/en/news/11/transfer-zone/2016/03/23/21609912/west-ham-admire-benteke-but-admit-they-cant-afford-the-liverpool-?utm_source=facebook.com&utm_medium=referral&utm_campaign=enfb,2016-03-23 03:21:37,,2441,31,2,2435,4,2,0,0,0
25427813597_10153777672428598,Guardiola faces a potential clash with Jose Mourinho this summer as Manchester United take on Manchester City FC!,CONFIRMED: Manchester United announce date for fixture vs Guardiola's City,link,http://www.goal.com/en/news/1862/premier-league/2016/03/23/21609012/manchester-united-to-face-guardiolas-city-during-pre-season?utm_source=facebook.com&utm_medium=referral&utm_campaign=enfb,2016-03-23 02:54:10,,2290,24,17,2283,4,0,3,0,0
25427813597_10153776790633598,The reaction across the continent following Tuesday's atrocities in Brussels...,BACK PAGES: Europe unites after Belgium attacks,link,http://www.goal.com/en/news/7180/galleries/2016/03/23/21605532/europe-unites-after-brussels-atrocities-goals-european-newspaper-?utm_source=facebook.com&utm_medium=referral&utm_campaign=enfb,2016-03-23 02:40:00,,559,7,6,557,1,0,0,0,1
25427813597_10153776792293598,Arsene Wenger has his eye on a new left-back to replace Kieran Gibbs...,RUMOURS: Arsenal line up Gibbs replacement,link,http://www.goal.com/en/news/14222/transfer-talk/2016/03/23/21605572/rumours-arsenal-line-up-replacement-for-gibbs?utm_source=facebook.com&utm_medium=referral&utm_campaign=enfb,2016-03-23 02:20:01,,1449,18,6,1449,0,0,0,0,0
25427813597_10153776770818598,A Premier League giant has reportedly opened secret talks with Pierre-Emerick Aubameyang!,RUMOURS: Is Aubameyang bound for the Premier League?,link,http://www.goal.com/en/news/14222/transfer-talk/2016/03/23/21604752/rumours-manchester-united-open-aubameyang-transfer-talks?utm_source=facebook.com&utm_medium=referral&utm_campaign=enfb,2016-03-23 02:00:00,,5507,42,10,5481,12,2,9,2,1
25427813597_10153776769283598,Ricardo Kakà reveals a former Arsenal striker is set to join him in Orlando,Kaka welcomes Brazilian to Orlando City,link,http://www.goal.com/en/news/14202/mls/2016/03/23/21605212/baptista-set-for-orlando-city-according-to-kaka?utm_source=facebook.com&utm_medium=referral&utm_campaign=enfb,2016-03-23 01:00:01,,5407,10,9,5395,7,2,3,0,0
25427813597_10153776750343598,Could these two fire France to UEFA EURO 2016 glory?,"'Whatever's going on with him, Benzema always responds on the pitch'",link,http://www.goal.com/en/news/722/la-liga/2016/03/23/21605012/griezmann-backs-under-fire-benzema-he-always-responds-on-the?utm_source=facebook.com&utm_medium=referral&utm_campaign=enfb,2016-03-23 00:00:00,,4331,20,2,4315,12,4,0,0,0
25427813597_10153776754233598,Embarrassed by Marcus Rashford...but set to START for Argentina?!,Demichelis in line for Argentina start against Chile,link,http://www.goal.com/en/news/14552/world-cup-2018/2016/03/23/21603792/messi-aguero-and-demichelis-man-city-defender-in-line-for?utm_source=facebook.com&utm_medium=referral&utm_campaign=enfb,2016-03-22 23:00:00,,3770,39,5,3729,5,4,24,0,8
25427813597_10153776739388598,Luis Suarez v Neymar. A burger at stake.,Luis Suarez reveals his bet with Barcelona team-mate Neymar,link,http://www.goal.com/en/news/468/international-football/2016/03/22/21603982/suarez-reveals-neymar-wager-ahead-of-brazil-uruguay-clash?utm_source=facebook.com&utm_medium=referral&utm_campaign=enfb,2016-03-22 22:00:00,,22276,61,65,22088,107,6,71,1,3
25427813597_10153776727053598,One Italian who knows FC Bayern München has given Carlo Ancelotti the seal of approval...,'Ancelotti is a winner... he's the perfect coach for Bayern Munich',link,http://www.goal.com/en/news/725/bundesliga/2016/03/22/21603102/ancelotti-perfect-for-bayern-toni?utm_source=facebook.com&utm_medium=referral&utm_campaign=enfb,2016-03-22 21:00:00,,4444,15,12,4428,10,1,1,4,0
25427813597_10153776708423598,Manchester City FC believe they could one day lure Leo Messi to England,RUMOURS: Could 'Pep effect' lure Messi to Man City?,link,http://www.goal.com/en/news/14222/transfer-talk/2016/03/22/21603452/rumours-could-pep-effect-lure-messi-to-man-city?utm_source=facebook.com&utm_medium=referral&utm_campaign=enfb,2016-03-22 20:26:52,,16421,252,61,16217,53,8,129,0,14
25427813597_10153776491108598,Nathan Ake has spoken out amid rumours he could join Watford FC permanently...,Watford loanee Ake speaks out on Chelsea future,link,http://www.goal.com/en/news/1862/premier-league/2016/03/22/21600322/ake-wants-chelsea-return?utm_source=facebook.com&utm_medium=referral&utm_campaign=enfb,2016-03-22 19:09:50,,1624,8,2,1619,3,0,0,0,2
25427813597_10153776438493598,Antoine Griezmann's sister escaped the Bataclan concert hall when Paris was attacked in November.,Griezmann: Brussels attack brought back painful memories,link,http://www.goal.com/en/news/468/international-football/2016/03/22/21600412/griezmann-brussels-attack-brought-up-painful-memories?utm_source=facebook.com&utm_medium=referral&utm_campaign=enfb,2016-03-22 18:47:36,,4954,15,13,4881,7,2,2,61,1
25427813597_10153776344823598,"Could this be the solution to Arsenal's midfield problem?

Juventus, A.C. Milan and Tottenham Hotspur will also take note...",Zenit star wants to follow Villas-Boas OUT of Russia,link,http://www.goal.com/en/news/11/transfer-zone/2016/03/22/21601642/witsel-wants-zenit-exit?utm_source=facebook.com&utm_medium=referral&utm_campaign=enfb,2016-03-22 18:17:30,,1802,14,3,1796,0,3,1,2,0
25427813597_10153776124133598,Can Leo Messi ever do what Diego Maradona did?,Can Leo Messi ever do what Diego Maradona did?,video,https://www.facebook.com/goal/videos/10153776124133598/,2016-03-22 18:11:55,00:57,2966,159,107,2899,29,7,11,0,20
25427813597_10153776276618598,,Brasil Global Tour,link,http://www.goal.com/brasilglobaltour/en/news/5457/brasil-global-tour/2016/03/22/21602612/neymar-vs-suarez-craques-collide?ICID=OP_HN_1,2016-03-22 17:54:23,,1475,26,0,1463,6,6,0,0,0
25427813597_10153776233123598,Zlatan Ibrahimovic ended one man's England Football Team career,'Zlatan ruined my career!',link,http://www.goal.com/en/news/468/international-football/2016/03/22/21602852/ibrahimovic-ended-my-england-career-says-shawcross?utm_source=facebook.com&utm_medium=referral&utm_campaign=enfb,2016-03-22 17:41:23,,10397,65,47,10291,32,6,59,6,3
25427813597_10153776136168598,Thibaut Courtois says Chelsea Football Club are conceding too many goals - and he prefers playing with the Belgium back four!,Courtois: I prefer Belgium's defence to Chelsea's,link,http://www.goal.com/en/news/1862/premier-league/2016/03/22/21602202/courtois-i-prefer-belgiums-defence-to-chelseas?utm_source=facebook.com&utm_medium=referral&utm_campaign=enfb,2016-03-22 17:13:09,,7232,181,37,7144,17,5,50,8,8
25427813597_10153775986573598,Was Ronaldinho Gaúcho at his best better than Leo Messi at his best?,The best of Ronaldinho!,video,https://www.facebook.com/goal/videos/10153775986573598/,2016-03-22 17:07:57,00:57,10917,567,540,10627,205,67,10,3,5
25427813597_10153776063683598,"Don't judge Jurgen Klopp yet, Liverpool FC fans!",Barnes: Don't judge Klopp on this season,link,http://www.goal.com/en/news/1862/premier-league/2016/03/22/21599592/barnes-dont-judge-klopp-on-this-season?utm_source=facebook.com&utm_medium=referral&utm_campaign=enfb,2016-03-22 16:48:07,,1975,17,4,1969,3,1,2,0,0
25427813597_10153775991153598,Memphis Depay feared he wouldn't get a call-up for the latest Netherlands squad,Memphis Depay desperate to prove his worth,link,http://www.goal.com/en/news/468/international-football/2016/03/22/21599352/depay-desperate-to-prove-worth-to-netherlands?utm_source=facebook.com&utm_medium=referral&utm_campaign=enfb,2016-03-22 16:22:24,,5280,11,9,5269,7,2,2,0,0
25427813597_10153775978433598,"Ronaldo Nazário de Lima or Cristiano Ronaldo?

Who wins? You decide!",Legends World Cup: Ronaldo v Ronaldo - Goal.com,link,http://www.goal.com/en-gb/news/7182/galleries/2016/03/21/21544582/messi-maradona-ronaldo-the-16-stars-competing-in-the-legends?ICID=AR_GA_LG_5,2016-03-22 16:16:58,,14008,2116,131,13843,85,17,54,2,7
25427813597_10153775924448598,Jonas Gutierrez opens up about the moment he was told by Alan Pardew he could leave Newcastle United after his cancer diagnosis - and the apology he received from the manager,Jonas: Newcastle thought I was a liability,link,http://www.goal.com/en/news/1862/premier-league/2016/03/22/21598922/newcastle-considered-me-a-liability-after-cancer-gutierrez?utm_source=facebook.com&utm_medium=referral&utm_campaign=enfb,2016-03-22 16:02:56,,1224,11,4,1205,0,3,0,3,13
25427813597_10153775884188598,Laurent Koscielny admits Arsenal have failed at some key moments this season,"""We failed in some important games""",link,http://www.goal.com/en/news/1862/premier-league/2016/03/22/21599022/arsenal-still-have-title-hope-insists-koscielny?utm_source=facebook.com&utm_medium=referral&utm_campaign=enfb,2016-03-22 15:47:14,,3210,40,11,3200,1,0,2,6,1
25427813597_10153775850423598,"COMMENT

Chelsea Football Club will regret letting Nathan Ake go - especially if they sell for as little as £3 million!",Ake could end up a Chelsea regret - just like Matic,link,http://www.goal.com/en/news/11/transfer-zone/2016/03/22/21598802/watford-starlet-ake-could-end-up-another-chelsea-regret-like?utm_source=facebook.com&utm_medium=referral&utm_campaign=enfb,2016-03-22 15:31:07,,1827,44,7,1817,4,2,2,2,0
25427813597_10153775163748598,We're pitting 16 of the game's greatest players against each other. The Legends World Cup begins tomorrow.,Goal's Legends World Cup,video,https://www.facebook.com/goal/videos/10153775163748598/,2016-03-22 15:00:00,00:55,93,8,4,91,2,0,0,0,0
25427813597_10153775715773598,SV Werder Bremen are fighting Chelsea Football Club flop Papy Djilobodji's ban for a throat-slitting gesture...,Werder Bremen appeal Djilobodji ban,link,http://bit.ly/1WGiaTb,2016-03-22 14:49:48,,1171,11,3,1169,0,0,0,2,0
25427813597_10153775642008598,"When in doubt, sign a midfielder. © Arsenal",RUMOURS: Arsenal in talks for Bundesliga midfielder,link,http://bit.ly/21FS8AQ,2016-03-22 14:29:54,,1301,31,5,1297,2,0,2,0,0
25427813597_10153775594478598,Manchester City FC fans are ramping up the pressure on ticket prices - the latest from correspondent Sam Lee!,Man City fans crank up pressure on ticket prices,link,http://bit.ly/1T5tKZa,2016-03-22 14:16:47,,1503,9,3,1501,1,1,0,0,0
25427813597_10153775560983598,EXCLUSIVE: Alen Halilovic on his prospects since joining FC Barcelona!,'I've improved since joining Barcelona!',link,http://bit.ly/1MAkYvp,2016-03-22 14:09:15,,4314,36,9,4295,14,2,3,0,0
25427813597_10153775531888598,"Diego Costa can be the man to push Spain to Euro 2016 glory, says Luis Garcia!",'Diego Costa can lead Spain to glory!',link,http://bit.ly/1UiG61C,2016-03-22 14:01:13,,7420,94,19,7387,12,3,17,1,0
25427813597_10153775476853598,Congratulations to Gareth Bale!,Bale announces arrival of second child,link,http://bit.ly/1MAhKYQ,2016-03-22 13:45:18,,21692,119,97,21552,93,34,11,0,2
25427813597_10153775446233598,Our man Loic Tanzi was there as Paul Labile Pogba & Co. were put through training with France!,Loic Tanzi,video,https://www.facebook.com/LTanziGoal/videos/247023365639185/,2016-03-22 13:36:01,,193,3,0,193,0,0,0,0,0
25427813597_10153775433748598,Is this the pool of 17 players from which Pep Guardiola wants to buy when he joins Manchester City FC this summer?,RUMOURS: Guardiola's transfer shortlist revealed?,link,http://bit.ly/1SfYhkC,2016-03-22 13:32:27,,2611,32,17,2600,6,1,4,0,0
25427813597_10153775154693598,REVEALED: The first-round pairings are in our special Legends World Cup wallchart! Who will make it all the way through to win?,Timeline Photos,photo,https://www.facebook.com/goal/photos/a.112071118597.98899.25427813597/10153775154693598/?type=3,2016-03-22 13:30:01,,298,102,11,296,2,0,0,0,0
25427813597_10153775418823598,Which players are in danger of being let go when Jurgen Klopp begins his summer reconstruction? Our Liverpool FC Correspondent Melissa Reddy shares her analysis of the squad...,Melissa Reddy,link,http://www.goal.com/en-gb/news/2892/transfer-zone/2016/03/22/21585162/kloppstruction-the-players-under-threat?ICID=TP_HN_HP_RI_0_2,2016-03-22 13:25:21,,340,12,0,339,0,1,0,0,0
25427813597_10153775411008598,FC Barcelona midfielder Ivan Rakitić gets a prognosis on his injury...,Injury blow for Barcelona's Rakitic,link,http://bit.ly/21FLwlW,2016-03-22 13:22:02,,13734,77,28,13526,33,11,17,144,3
25427813597_10153775404248598,Ives Galarcep talks U.S. Soccer and more! Ask your questions below...,Ives Galarcep,video,https://www.facebook.com/SoccerByIves/videos/1725335681075770/,2016-03-22 13:18:15,,318,10,0,317,1,0,0,0,0
25427813597_10153775393198598,Has the grass really been any greener at Manchester City FC than at Liverpool FC?,'Sterling made a mistake in joining Man City',link,http://bit.ly/1WG4qb6,2016-03-22 13:13:42,,3600,109,18,3548,5,0,38,1,8
25427813597_10153775362698598,Loic Tanzi is with the FFF - Fédération Française de Football squad at their training camp in Clairefontaine.,Loic Tanzi,video,https://www.facebook.com/LTanziGoal/videos/246951292313059/,2016-03-22 13:04:13,,156,5,0,156,0,0,0,0,0
25427813597_10153775354673598,Manchester United are ready to launch a €50 MILLION bid for one Real Madrid C.F. star,Manchester United to launch €50m bid for Madrid star,link,http://www.goal.com/en/news/11/transfer-zone/2016/03/22/21596002/rumours-manchester-united-to-launch-50-million-kroos-bid?utm_source=facebook.com&utm_medium=referral&utm_campaign=enfb,2016-03-22 13:00:35,,21945,99,72,21804,70,19,40,4,8
