status_id,status_message,link_name,status_type,status_link,status_published,status_video_length,num_reactions,num_comments,num_shares,num_likes,num_loves,num_wows,num_hahas,num_sads,num_angrys
61511025427_10154499971895428,,21 Restaurant Copycat Recipes that Just May Be Better Than the Real Thing,link,http://spr.ly/618981EFP,2016-11-06 16:05:03,,5425,39,4069,0,0,0,0,0,0
61511025427_10154499727060428,"""I made this huge taco salad to bring to a party and people were scrambling to figure out who made it. Needless to say I only brought home an empty bowl and the guests went home with a full stomach! Everyone loves this taco salad recipe."" —Lisa Homer, Avon, New York",Taco Salad for a Large Crowd Recipe,link,http://spr.ly/61888E5hj,2016-11-06 14:34:02,,8160,103,7577,0,0,0,0,0,0
61511025427_10154499548505428,"""Every year when the cranberries are harvested, my family looks forward to eating this cheesecake."" —Nairda Monroe, Webberville, Michigan",Cranberry Cheesecake Recipe,link,http://spr.ly/61868E5xp,2016-11-06 13:13:02,,3028,35,1164,0,0,0,0,0,0
61511025427_10154499393225428,,25 Foolproof Ground Beef Casserole Recipes,link,http://spr.ly/61888EgMg,2016-11-06 12:12:01,,4083,43,4126,0,0,0,0,0,0
61511025427_10154499147815428,"""These nicely spiced soft cookies are perfect for folks who like the flavor of ginger but don't care for crunchy gingersnaps."" —Barbara Gray, Boise, Idaho",Big Soft Ginger Cookies Recipe,link,http://spr.ly/61868E5Zy,2016-11-06 11:11:03,,6007,84,6324,0,0,0,0,0,0
61511025427_10154498950590428,"""Whenever I serve these make-ahead appetizers, they disappear fast. When a friend at the office shared them with me, I knew in one bite I'd be bringing her recipe home for the holidays."" —Diane Martin, Brown Deer, Wisconsin",Fiesta Pinwheels Recipe,link,http://spr.ly/618581DRb,2016-11-06 10:10:02,,2863,30,2103,0,0,0,0,0,0
61511025427_10154498817390428,"""I work full time but love to make home-cooked meals for my husband and son. It's a comfort to walk in and smell this simmering roast that I know will be fall-apart tender and delicious.""—Gina Jackson, Ogdensburg, New York",Slow Cooker Pot Roast Recipe,link,http://spr.ly/61808Eky2,2016-11-06 09:09:01,,11783,158,8386,0,0,0,0,0,0
61511025427_10154498497885428,"""I first tasted this quick and easy dip at a friend's Christmas party. I kept going back for more."" —Karen Wydrinski, Woodstock, Georgia",Apple Brickle Dip Recipe,link,http://spr.ly/61878E58c,2016-11-06 07:10:02,,1701,34,1632,0,0,0,0,0,0
61511025427_10154498392060428,"""The taste of a good bacon cheeseburger is hard to beat until you try this chowder! It's hearty, convenient and family friendly."" —Kristin Stone, Little Elm, Texas",Bacon-Cheeseburger Chowder Recipe,link,http://spr.ly/61878E5wb,2016-11-06 06:06:02,,2155,26,1591,0,0,0,0,0,0
61511025427_10154497990360428,"""This was one of my mom's favorite pie recipes. She was a great cook and was always generous with her recipes, yet she rarely shared this special one."" —Ruth Ferris, Billings, Montana",Mom's Marshmallow Pumpkin Pie Recipe,link,http://spr.ly/61828E58e,2016-11-06 01:45:02,,4228,63,3383,0,0,0,0,0,0
61511025427_10154497868470428,"""I wanted to make a more festive version of chocolate chip cookies for the holidays. Since my mom's thumbprints are what I look forward to most, I decided to combine the two.""—Crystal Schlueter, Northglenn, Colorado",Chocolate Chip & Cookie Butter Thumbprints Recipe,link,http://spr.ly/61888E5Bj,2016-11-06 00:14:02,,647,6,218,0,0,0,0,0,0
61511025427_10154497683940428,"""I tweaked my beefy skillet cobbler until it achieved the wow factor. I must have gotten it right, as it's now a family tradition. Top it off with lettuce, avocado, cherry tomatoes and a dollop of sour cream."" —Gloria Bradley, Naperville, Illinois",Fiesta Beef & Cheese Skillet Cobbler Recipe,link,http://spr.ly/61808EFCE,2016-11-05 23:09:02,,1603,19,778,0,0,0,0,0,0
61511025427_10154497577950428,,The 13x9 Thanksgiving,link,http://spr.ly/61888Ee58,2016-11-05 22:08:03,,1039,17,407,0,0,0,0,0,0
61511025427_10154497451295428,"I often freeze this soup and thaw it for a fast easy meal. Since it's hearty, all I need to add are rolls or bread and a salad. —Ann Heine, Mission Hill, South Dakota",Cheddar Ham Chowder Recipe,link,http://spr.ly/61898EF71,2016-11-05 21:04:02,,1504,22,1364,0,0,0,0,0,0
61511025427_10154497331350428,"""These bars make a great fall dessert. We like to warm individual servings in the microwave and serve with a scoop of vanilla ice cream. It quickly became a family favorite. Maybe it'll become one of your family's, too."" —Carol Stuber, Osawatomie, Kansas",Caramel Apple Bars Recipe,link,http://spr.ly/61848EkGg,2016-11-05 20:04:02,,3518,28,2761,0,0,0,0,0,0
61511025427_10154497208370428,"""I love eclairs but making the actual pastry is difficult so I came up with this recipe as a substitute. It still satisfies my cravings with the same wonderful flavors.""—Thelma Beam, Esbon, Kansas",Thelma's Chocolate Eclair Recipe,link,http://spr.ly/61898EkHZ,2016-11-05 19:03:02,,6075,69,4211,0,0,0,0,0,0
61511025427_10154497082035428,"""Cauliflower and carrots share the stage in this cheesy soup that's sure to warm you up on the chilliest nights. We like it with hot pepper sauce; however, it can be omitted with equally tasty results.—Debbie Ohlhausen Chilliwack, British Columbia",Cauliflower Soup Recipe,link,http://spr.ly/618781BO9,2016-11-05 18:02:03,,5988,102,7103,0,0,0,0,0,0
61511025427_10154496918185428,"""With all its fresh ingredients, this pretty salad was my grandma's favorite. Even my little ones like it (but don't tell them spinach is good for them)!"" —Shelley Riebel, Armada, Michigan",Grandma's Spinach Salad Recipe,link,http://spr.ly/61888EdWo,2016-11-05 17:02:02,,3573,27,2162,0,0,0,0,0,0
61511025427_10154496733615428,,30 Slow-Cooked Sunday Dinners,link,http://spr.ly/6180816a0,2016-11-05 16:00:03,,5080,57,5221,0,0,0,0,0,0
61511025427_10154496348785428,"Simple ingredients, quick prep and classic taste make this the only sugar cookie recipe you'll ever need.

FULL RECIPE for Amish Sugar Cookies: http://spr.ly/61878Ehs5",Amish Sugar Cookies,video,https://www.facebook.com/tasteofhome/videos/10154496348785428/,2016-11-05 14:04:04,00:51,27565,1008,222216,0,0,0,0,0,0
61511025427_10154496213035428,"""I came up with these brownies as a way to use up my son's leftover Halloween candy!"" —Elisabeth Larsen, Pleasant Grove, Utah",Candy Bar Cheesecake Brownies Recipe,link,http://spr.ly/61898Ecm7,2016-11-05 13:03:01,,1454,15,542,0,0,0,0,0,0
61511025427_10154496010010428,"""These creamy tasty potatoes can be made the day before and stored in the refrigerator until you're ready to pop them in the oven (I often do that). The garlic powder and chives add zip, and the shredded cheese adds color."" —Sharon Mensing, Greenfield, Iowa",Party Potatoes Recipe,link,http://spr.ly/61848EdHC,2016-11-05 11:32:03,,1899,16,1064,0,0,0,0,0,0
61511025427_10154495807600428,,43 of Grandma's Best Desserts,link,http://spr.ly/61868EdEa,2016-11-05 10:11:02,,6525,53,5650,0,0,0,0,0,0
61511025427_10154495653645428,"""I got this recipe from a woman at our church, Lois Henry, when I needed a way to use up our bounty of home-canned tomatoes. My husband loves it, and I like that it's easy to warm up for a carefree dinner in the winter months.""—Marcia Clay, Truman, Minnesota",Favorite Hamburger Stew Recipe,link,http://spr.ly/61808Ed6p,2016-11-05 09:09:02,,8388,151,9745,0,0,0,0,0,0
61511025427_10154495512090428,"""This pie combines the ingredients everyone loves in its classic cake cousin. It's so silky and smooth, you won't be able to put your fork down."" —Anna Jones, Coppell, Texas",Coconut-Pecan German Chocolate Pie Recipe,link,http://spr.ly/61888EkD8,2016-11-05 08:08:02,,13182,401,32652,0,0,0,0,0,0
61511025427_10154495207910428,"""Everyone will enjoy these fork-tender pork chops with a creamy, light gravy. Serve with mashed potatoes and coleslaw or a salad."" —Sue Bingham, Madisonville, Tennessee",Slow Cooker Pork Chops Recipe,link,http://spr.ly/61838Ej77,2016-11-05 06:03:02,,2551,27,2096,0,0,0,0,0,0
61511025427_10154494702555428,"""This pumpkin cake roll is a must-have for our family parties. The luscious whipped cream filling has specks of toffee and a mild rum flavor. It's so yummy."" —Betty Fulks, Onia, Arkansas",Pumpkin-Toffee Cake Roll Recipe,link,http://spr.ly/61878Ece9,2016-11-05 01:27:04,,1493,13,525,0,0,0,0,0,0
61511025427_10154494603320428,"""This dazzling treat tastes like a Snickers bar but has homemade flavor beyond compare. When I entered it in a recipe contest at our harvest festival, it won five ribbons, including grand prize and the judges' special award."" —Jane Meek, Pahrump, Nevada",Chocolate Caramel Candy Recipe,link,http://spr.ly/61868Ecdk,2016-11-05 00:14:02,,4460,44,3254,0,0,0,0,0,0
61511025427_10154494455255428,"""An enticing aroma wafts through my house when this tender cake-like pumpkin bread is in the oven. I bake extra loaves to give as holiday gifts. My friends wait eagerly for it every year."" —Linda Burnett, Prescott, Arizona",Delicious Pumpkin Bread Recipe,link,http://spr.ly/61808Eng2,2016-11-04 23:14:01,,7262,76,5639,0,0,0,0,0,0
61511025427_10154494341005428,"""A package of yellow cake mix sets this tasty crisp apart from others. Serve it a la mode for an extra special treat."" —Ruby Hodge, Richland Center, Wisconsin",Oat Apple Crisp Recipe,link,http://spr.ly/61858EngJ,2016-11-04 22:13:02,,5408,47,3743,0,0,0,0,0,0
61511025427_10154493556595428,"Bake up a batch of pull-apart sliders for your next gathering! 

FULL RECIPE for Bacon Cheeseburger Slider Bake: http://spr.ly/6186BfgNY",Bacon Cheeseburger Slider Bake,video,https://www.facebook.com/tasteofhome/videos/10154493556595428/,2016-11-04 21:03:00,01:01,4706,106,4899,0,0,0,0,0,0
61511025427_10154494078520428,"""The pleasing flavor of this golden corn pudding side dish makes it real comfort food. And because the recipe calls for a packaged corn mix, it's easy to prepare."" —P. Lauren Fay-Neri, Syracuse, New York",Corn Pudding Recipe,link,http://spr.ly/61848En5e,2016-11-04 20:01:02,,3490,59,2848,0,0,0,0,0,0
61511025427_10154493955380428,"""This is my husband's version of store-bought pizza rolls, and our family loves them. Although they take some time to make, they freeze well. So when we're through, we get to enjoy the fruits of our labor for a long time!"" —Julie Gaines, Normal, Illinois",Pizza Rolls Recipe,link,http://spr.ly/61828Eiqr,2016-11-04 19:03:02,,2629,34,1464,0,0,0,0,0,0
61511025427_10154493136975428,Friday PIE DAY! Pie season is here! Nick & Sarah show you how to make decorative crusts and delicious fillings for the best holiday pies.,,video,https://www.facebook.com/tasteofhome/videos/10154493136975428/,2016-11-04 14:02:45,57:11,2138,541,738,0,0,0,0,0,0
61511025427_10154492862295428,Perfect game day snack! (via Skinny Ms. ),5-Ingredient Stuffed Potato Skins Recipe,link,http://spr.ly/61878ELGR,2016-11-04 12:31:04,,1715,8,607,0,0,0,0,0,0
61511025427_10154492697955428,,30 Desserts Ready in 30 Minutes,link,http://spr.ly/61868EFW8,2016-11-04 11:28:03,,6342,82,5109,0,0,0,0,0,0
61511025427_10154492466735428,Take ordinary deviled eggs and kick them up a notch or two in flavor! This awesome appetizer recipe is brought to you by our friends at Eggland's Best.,Salsa Deviled Eggs Recipe,link,https://ad.doubleclick.net/ddm/clk/312882061;139898947;y,2016-11-04 10:32:00,,702,16,258,0,0,0,0,0,0
61511025427_10154492375435428,"""I've been making my version of Dad's potatoes for years, and it goes great with any meal. Browning the butter gives the potatoes a whole new taste."" —Anne Pavelak, Endicott, Washington",Browned Butter Red Potatoes Recipe,link,http://spr.ly/61858ELsT,2016-11-04 09:31:03,,2503,21,1592,0,0,0,0,0,0
61511025427_10154492140985428,"""Give traditional lemon bars a tasty twist with the addition of almonds and coconut."" —Taste of Home Test Kitchen",Almond-Coconut Lemon Bars Recipe,link,http://spr.ly/61828EdvA,2016-11-04 08:02:02,,2373,21,1006,0,0,0,0,0,0
61511025427_10154491862825428,,39 Meat Loaf Recipes You'll Actually Love,link,http://spr.ly/61898Dwtd,2016-11-04 06:02:02,,2917,30,2231,0,0,0,0,0,0
61511025427_10154491378700428,"""These easy cookies use only five ingredients and taste very similar to a store-bought cookie. Of course, everything's better from your own kitchen!""—Crystal Schlueter, Northglenn, Colorado",Easy Oatmeal Cream Pies Recipe,link,http://spr.ly/61848EnkO,2016-11-04 01:32:01,,1339,11,616,0,0,0,0,0,0
61511025427_10154491201005428,"""It doesn't get much easier than whipping together this colorful, crisp treat. These nacho look-alikes will delight any guest with a sweet tooth!"" —RaeAnn Gnatkowski, Carrollton, Michigan",Apple Nachos Recipe,link,http://spr.ly/61828EnXs,2016-11-04 00:12:01,,1102,14,451,0,0,0,0,0,0
61511025427_10154490938035428,"""Mom fixed these meatballs for all sorts of family dinners, potluck suppers and PTA meetings. The scent of browning meat is intoxicating. Add to that the sweet smell of onions caramelizing, and everyone's mouth starts watering."" —Marybeth Mank, Mesquite, Texas",Mom's Swedish Meatballs Recipe,link,http://spr.ly/61868EnpE,2016-11-03 23:07:01,,4516,53,3216,0,0,0,0,0,0
61511025427_10154490767010428,"""I served this dish at a church luncheon and I had to laugh when one gentleman told me his distaste for vegetables. He, along with many others, were surprised how much they loved this veggie-filled quiche!"" —Melinda Calverley, Janesville, Wisconsin",Crustless Spinach Quiche Recipe,link,http://spr.ly/61868EnRp,2016-11-03 22:06:02,,7025,115,7158,0,0,0,0,0,0
61511025427_10154490505535428,"""Instead of a traditional pie, I like to surprise holiday guests with a silky cheesecake. Make it a day ahead and let it chill overnight. It's one less thing you'll have to make on the big day."" —Dorothy Smith, El Dorado, Arkansas",Pumpkin Cheesecake with Sour Cream Topping Recipe,link,http://spr.ly/61808DdhQ,2016-11-03 21:07:02,,6168,95,4419,0,0,0,0,0,0
61511025427_10154490263375428,"""This is the best shepherd's pie I've ever tasted. It's very quick to make, and I usually have most—if not all—of the ingredients already on hand."" —Tirzah Sandt, San Diego, California",Skillet Shepherd's Pie Recipe,link,http://spr.ly/61848EnuI,2016-11-03 20:04:02,,3256,35,2327,0,0,0,0,0,0
61511025427_10154489949485428,25 Stuffing Recipes for your Thanksgiving Dinner!,25 Stuffing Recipes for Thanksgiving,link,http://spr.ly/61898Evov,2016-11-03 19:02:03,,2178,21,1639,0,0,0,0,0,0
61511025427_10154489648910428,"""I started roasting veggies and serving them often with dinner. Now my children say, 'Is it OK to finish the veggies?' Pinch me."" —Joan Duckworth, Lee's Summit, Missouri",Oven-Roasted Spiced Carrots Recipe,link,http://spr.ly/61868EnrA,2016-11-03 18:01:02,,3378,48,2260,0,0,0,0,0,0
61511025427_10154488687895428,"Bliss in a bread bowl: This version of cheesy broccoli soup tastes just like a restaurant favorite!

FULL RECIPE to Cheesy Broccoli Soup: http://spr.ly/61888EqWr",Cheesy Broccoli Soup,video,https://www.facebook.com/tasteofhome/videos/10154488687895428/,2016-11-03 15:34:12,00:55,9537,339,13898,0,0,0,0,0,0
61511025427_10154488234840428,"""My son James created these zesty chops spiced with paprika and cayenne. He keeps the spice rub in a jar to use with chops or chicken."" —Molly Seidel, Edgewood, NM",Lemon-Garlic Pork Chops Recipe,link,http://spr.ly/61878EnPZ,2016-11-03 14:04:02,,1137,4,338,0,0,0,0,0,0
61511025427_10154487984210428,,23 of Our Most Decadent Chocolate Desserts,link,http://spr.ly/61898En3L,2016-11-03 12:04:02,,4530,50,2877,0,0,0,0,0,0
61511025427_10154487689600428,"""A bread machine hurries along the dough-making process, but chopped vegetables, bacon and cheese make the buttery wreath unforgettable."" —Christi Ross, Guthrie, Texas",Veggie Pull-Apart Bread Recipe,link,http://spr.ly/61878EUrD,2016-11-03 10:03:03,,738,13,268,0,0,0,0,0,0
61511025427_10154487127115428,,24 Casserole Recipes Made in a 13x9 Pan,link,http://spr.ly/61878EcUz,2016-11-03 06:03:02,,2313,23,1915,0,0,0,0,0,0
61511025427_10154486771005428,"""My grandmother occasionally brought over this wonderful cake warm from the oven. The spicy apple flavor combined with the sweet cream cheese frosting made this dessert a treasured recipe.""  —Lauris Conrad, Turlock, California",Gran's Apple Cake Recipe,link,http://spr.ly/61858EnKF,2016-11-03 01:38:01,,4186,52,3296,0,0,0,0,0,0
61511025427_10154486661015428,"""Pecans and butter give this cake the same irresistible flavor as the popular ice cream."" —Becky Miller, Tallahassee, Florida",Butter Pecan Layer Cake Recipe,link,http://spr.ly/61898EnKH,2016-11-03 00:07:02,,7986,140,8224,0,0,0,0,0,0
61511025427_10154486479215428,"""This recipe is very popular here in the South. It's a particular favorite at our house because we always have plenty of sweet potatoes in our garden. Try it with a dollop of whipped cream."" —Bonnie Holcomb, Fulton, Mississippi",Southern Sweet Potato Pie Recipe,link,http://spr.ly/61838E1BR,2016-11-02 23:05:02,,3246,37,2305,0,0,0,0,0,0
61511025427_10154486379040428,"""Start this warming one-pot meal before you head out for the day. By the time you get home, the well-seasoned meat will be tender and mouthwatering.""—Stephanie Rabbitt-Schappacher, West Chester, Ohio",Stephanie's Slow Cooker Stew Recipe,link,http://spr.ly/61868E16M,2016-11-02 22:04:03,,3059,32,1842,0,0,0,0,0,0
61511025427_10154486283040428,"""I first made this recipe when I was a professional nanny. It comes together quickly at dinnertime when the kids are hungry."" —Danette Forbes, Overland Park, Kansas",Chicken and Bows Recipe,link,http://spr.ly/61808EECI,2016-11-02 21:03:02,,2929,26,2050,0,0,0,0,0,0
61511025427_10154486161395428,"""Soft gingersnaps embody the tastes and smells of the season. Enjoy cloves, cinnamon and ginger blended into one delicious cookie. These are perfect for Thanksgiving and fall gatherings."" —Lara Pennell, Mauldin, South Carolina",Lara's Tender Gingersnaps Recipe,link,http://spr.ly/61858EV1H,2016-11-02 20:03:02,,5083,71,4808,0,0,0,0,0,0
61511025427_10154486054105428,"""This beautiful, golden pan bread is especially good with a steaming bowl of homemade soup. The oats give it a distinctive flavor, and we really like the herb and Parmesan cheese topping.""—Karen Bourne, Magrath, Alberta",Herbed Oatmeal Pan Bread Recipe,link,http://spr.ly/61818EVDv,2016-11-02 19:02:03,,1928,15,1016,0,0,0,0,0,0
61511025427_10154485926760428,"Use waffle-cut fries to scoop up this cheesy bacon and chive dip, which tastes just like a baked potato topper. Find this yummy appetizer, plus tons more easy recipes, in our Simple & Delicious Cookbook Binder, available wherever books are sold!",Loaded Baked Potato Dip Recipe,link,http://spr.ly/618788EHx,2016-11-02 18:04:03,,1446,11,659,0,0,0,0,0,0
61511025427_10154482628035428,"Everyone needs a creamy, versatile buttercream icing. Give this one a swirl!

FULL RECIPE: http://www.tasteofhome.com/recipes/easy-vanilla-buttercream-frosting",Easy Buttercream Frosting,video,https://www.facebook.com/tasteofhome/videos/10154482628035428/,2016-11-02 15:36:00,00:48,9876,183,11557,0,0,0,0,0,0
61511025427_10154485220745428,Show off your Turkey Day smarts!  (via Reader's Digest),Quiz: What's Your Thanksgiving Trivia IQ?,link,http://spr.ly/61898EVpz,2016-11-02 13:33:08,,147,6,23,0,0,0,0,0,0
61511025427_10154485037510428,"""I keep frozen Tater Tots on hand for meals like this yummy casserole. It's a super brunch, breakfast or side dish for kids of all ages."" —Nancy Heishman, Las Vegas, NV",Loaded Tater Tot Bake Recipe,link,http://spr.ly/61828EVOG,2016-11-02 12:11:03,,1751,20,1349,0,0,0,0,0,0
61511025427_10154484764765428,,95 Low Carb Dinner Ideas That Don't Taste Like Cardboard,link,http://spr.ly/61888Ej3w,2016-11-02 10:01:03,,1760,35,1664,0,0,0,0,0,0
61511025427_10154482643145428,"Get the kids to help! Mark & Lauren are preparing breakfast-on-a-stick ideas that are sure to make an ordinary morning extraordinary. Brought to you by our friends at Hungry Jack! 

For more, click here: www.tasteofhome.com/BreakFEAST",Breakfast Kebobs,video,https://www.facebook.com/tasteofhome/videos/10154482643145428/,2016-11-02 09:04:00,02:14,211,5,80,0,0,0,0,0,0
61511025427_10154484524635428,"""A friend gave me this recipe when I first moved into my neighborhood 40 years ago. It might seem more time consuming than it is, but it's easy and the results are incredible."" —Monique Caron, Buxton, Maine",Marshmallow-Filled Banana Cupcakes Recipe,link,http://spr.ly/61868EVMi,2016-11-02 08:06:02,,2728,39,1553,0,0,0,0,0,0
61511025427_10154484241885428,,20 Classic Comfort Food Dinner Recipes,link,http://spr.ly/61838EZ7U,2016-11-02 06:03:03,,822,9,342,0,0,0,0,0,0
61511025427_10154483881585428,"""My birthday is in late November so my mom often morphed the Thanksgiving pumpkin pie into my birthday 'cake' and had all the family sing for me. This is an update on her recipe, adding lots more of our mutual favorite ingredient, ginger. The pie's best after it's nice and chilled. Birthday candles optional."" —Emily Tyra, Milwaukee, Wisconsin",Gingery Pumpkin Pie Recipe,link,http://spr.ly/61848EV80,2016-11-02 01:37:02,,991,15,222,0,0,0,0,0,0
61511025427_10154483523200428,"""This is a rich and surprisingly tasty rendition of all the Tex-Mex dishes molded into one packed, beautiful casserole. Best of all, it's ready in no time!"" —Janet McCormick, Proctorville, Ohio",Salsa Verde Chicken Casserole Recipe,link,http://spr.ly/61838DdKz,2016-11-01 23:06:02,,1153,14,584,0,0,0,0,0,0
61511025427_10154483408375428,"""In fall or any time of year, this nutty, rich and delicious pie is one I am proud to serve. While it seems very special, it's a snap to make."" —Becky Ruff, Monona, Iowa",Caramel-Pecan Cheesecake Pie Recipe,link,http://spr.ly/61858EpuW,2016-11-01 22:05:01,,8542,212,62017,0,0,0,0,0,0
61511025427_10154483301430428,"""I get lots of compliments and recipe requests whenever I make this eye-catching cake. The filling is similar to German chocolate cake."" —Judy Lamon, Louisville, Tennessee",Butterscotch Cake Recipe,link,http://spr.ly/61818EXLF,2016-11-01 21:04:07,,2445,24,1378,0,0,0,0,0,0
61511025427_10154483084085428,"""My friends threaten not to come by unless this dip is on the menu! The rich spread bakes right in the bread bowl and goes well with almost any dipper. Plus, cleanup is a breeze."" — Nicole Marcotte, Smithers, British Columbia",Warm Bacon Cheese Spread Recipe,link,http://spr.ly/61818DFyv,2016-11-01 20:04:02,,4093,51,3799,0,0,0,0,0,0
61511025427_10154482862080428,"""To serve a dozen people without any extra effort, simply double this recipe and prepare two of these hearty pasta bakes."" —Elaine Neukirch, Genoa, Illinois",Baked Rigatoni & Sausage Recipe,link,http://spr.ly/61838DF1t,2016-11-01 19:02:03,,1876,14,953,0,0,0,0,0,0
61511025427_10154482711030428,,23 Classic Cake Recipes Made from Scratch,link,http://spr.ly/61818EpCb,2016-11-01 18:02:02,,2645,10,1736,0,0,0,0,0,0
61511025427_10154482574235428,"Be taken back to childhood with this homey favorite. This heartwarming recipe, and more like it, is found in the latest issue of Modern Comfort, on newsstands now.",The BEST Chicken & Dumplings Recipe,link,http://spr.ly/618188EDU,2016-11-01 17:00:02,,4051,55,3163,0,0,0,0,0,0
61511025427_10154482164720428,"Tuck Grandma's homemade apple filling into flaky crust to make mini pies that are big on love. 

FULL RECIPE: http://spr.ly/61878EpGU",Hand-Held Apple Pies,video,https://www.facebook.com/tasteofhome/videos/10154482164720428/,2016-11-01 14:32:14,01:01,10905,210,13607,0,0,0,0,0,0
61511025427_10154481988410428,It's a Fork Fight! Would you rather make and/or eat Stuffed Peppers or Cabbage Rolls and why? Tell us below (PLEASE include your city and state/province) and we'll share some comments and a yummy recipe for your top choice in an upcoming issue of Taste of Home magazine.,,status,,2016-11-01 13:10:00,,265,426,10,0,0,0,0,0,0
61511025427_10154481758480428,,17 Ways to Love Green Beans—Outside of the Casserole,link,http://spr.ly/61898ERf9,2016-11-01 11:29:03,,1200,10,411,0,0,0,0,0,0
61511025427_10154481589960428,"""I've always loved pork and apples together, and this recipe combines them nicely to create a comforting main dish. It calls for a bit of preparation, but my family and I agree that its wonderful flavor makes it well worth the extra effort."" —Suzanne Strocsher, Bothell, Washington",Farmhouse Pork and Apple Pie Recipe,link,http://spr.ly/61828DF8p,2016-11-01 10:02:02,,607,3,214,0,0,0,0,0,0
61511025427_10154481512075428,"""Making these cookies is therapeutic for me. I often watch a movie while I put them together. I take a lot of cookies to fundraisers, and these gingersnaps are quite popular. If you'd like, you can make variations by changing the cookie base or varying the nuts.""",Gooey Caramel-Topped Gingersnaps Recipe,link,http://spr.ly/61898EP4X,2016-11-01 09:33:03,,633,1,255,0,0,0,0,0,0
61511025427_10154481152780428,"""Loaded with veggies, meatballs and spices, this meal-in-one soup is hearty enough to warm up any cold winter day. It's a recipe you'll make again and again!"" — Penny Fagan, Mobile, Alabama",Veggie Soup with Meatballs Recipe,link,http://spr.ly/61838EOal,2016-11-01 07:16:03,,1532,17,910,0,0,0,0,0,0
61511025427_10154480626695428,"""One of my mom's friends gave her this recipe when I was a child and it has been a family favorite ever since. When your 'chocolate sweet tooth' acts up, this really hits the spot!""—Linda Yeamans, Ashland, Oregon",Spiced Devil's Food Cake Recipe,link,http://spr.ly/61868EE0n,2016-11-01 01:31:01,,1262,8,342,0,0,0,0,0,0
