status_id,status_message,link_name,status_type,status_link,status_published,status_video_length,num_reactions,num_comments,num_shares,num_likes,num_loves,num_wows,num_hahas,num_sads,num_angrys
61511025427_10154538449240428,"""When I dig out my best cookie recipes, they remind me of baking when my children were little. These thumbprints with cherries elicit sweet memories."" —Deborah Puette, Lilburn, GA",Chocolate Covered Cherry Thumbprints Recipe,link,http://spr.ly/61888G4L0,2016-11-18 02:23:02,,1981,13,1201,0,0,0,0,0,0
61511025427_10154538375740428,"""My mind works overtime to plan treats that surprise the family. They give this cranberry pie a 'wow' and invite friends over to share it. —Lorraine Caland, Shuniah, ON",Cranberry Cheese Crumb Pie Recipe,link,http://spr.ly/61898GBaJ,2016-11-18 01:15:01,,789,11,391,0,0,0,0,0,0
61511025427_10154538236025428,"""For my niece's annual holiday party, I make glazed meatballs and deliver them in the slow cooker so they're spicy, sweet and ready to eat.""—Gail Borczyk, Boca Raton, Florida",Sweet and Spicy Asian Meatballs Recipe,link,http://spr.ly/61838G6wU,2016-11-18 00:14:04,,2952,32,2089,0,0,0,0,0,0
61511025427_10154538133125428,"""My muffins are a frequent request from everyone in the family. I usually make them on Sunday nights, so when we're running late on weekday mornings, the kids can grab these to eat on the bus."" —Irene Wayman, Grantsville, Utah",On-the-Go Breakfast Muffins Recipe,link,http://spr.ly/61848Hppw,2016-11-17 23:09:02,,1779,20,1037,0,0,0,0,0,0
61511025427_10154538015305428,"""My mother made this cake for my brothers and me when we were kids. It's an excellent choice for potlucks any time of year."" —Edie DeSpain, Logan, Utah",Potluck German Apple Cake Recipe,link,http://spr.ly/61828G6p8,2016-11-17 22:06:02,,4533,53,3523,0,0,0,0,0,0
61511025427_10154537908375428,"""I really enjoy potato soup, and this rich creamy version is different than most I've tried. I like its lemon and cilantro flavors, but you can adjust the ingredients to best suit your family's taste buds.""  — Hollie Powell, St. Louis, Missouri",Roasted Pepper Potato Soup Recipe,link,http://spr.ly/61868HTFu,2016-11-17 21:04:03,,1708,21,854,0,0,0,0,0,0
61511025427_10154537711455428,,18 Easy Overnight Desserts,link,http://spr.ly/61868G4I8,2016-11-17 20:03:02,,4160,26,3066,0,0,0,0,0,0
61511025427_10154537458375428,"""Pierogies are dumplings or tiny pies stuffed with a filling, often potatoes and cheese, and boiled, then cooked in butter. Our friends always ask us to bring them to potlucks."" —Diane Gawrys, Manchester, Tennessee",Homemade Pierogies Recipe,link,http://spr.ly/61868G63C,2016-11-17 19:02:03,,3659,113,2580,0,0,0,0,0,0
61511025427_10154511331125428,"Need to bring a dish to pass this holiday season? This make-ahead layered dessert will disappear quickly at get-togethers.

Recipe for Strawberry Pretzel Dessert: http://www.tasteofhome.com/recipes/strawberry-pretzel-dessert",Strawberry Pretzel Dessert,video,https://www.facebook.com/tasteofhome/videos/10154511331125428/,2016-11-17 16:31:00,01:03,15520,1277,47358,0,0,0,0,0,0
61511025427_10154536909865428,,27 Recipes for One-Pot Meals,link,http://spr.ly/61828Gri8,2016-11-17 15:04:02,,2278,18,1771,0,0,0,0,0,0
61511025427_10154536644505428,"""I turned sour cream raisin pie into a cookie bar with a crunchy oatmeal crust, custard-style filling and crisp topping."" —Shelly Bevington, Hermiston, OR",Sour Cream & Cranberry Bars Recipe,link,http://spr.ly/61858HPBP,2016-11-17 13:03:02,,615,6,362,0,0,0,0,0,0
61511025427_10154536388595428,,16 Traditional Thanksgiving Recipes,link,http://spr.ly/61868GrYn,2016-11-17 11:01:02,,613,3,313,0,0,0,0,0,0
61511025427_10154535909865428,"""I got this wonderful chili recipe from my sister-in-law, who made a big batch and served a crowd one night. It was a hit. Plus, it's easy and quick, which is helpful since I'm a college student. In all my years of 4-H cooking, I've never had another dish get so many compliments."" —Laura Brewer, Lafayette, Indiana",Creamy White Chili Recipe,link,http://spr.ly/61888G6Dg,2016-11-17 07:03:03,,2048,31,1771,0,0,0,0,0,0
61511025427_10154535604480428,"""When my children were young, they loved this apple dessert—and they still do 45 years later! I like it served plain at room temperature, but it's hard to resist when served warm with a small scoop of vanilla ice cream."" —Barbara Estabrook, Rhinelander, Wisconsin",Apple-Almond Bake Recipe,link,http://spr.ly/61868G68n,2016-11-17 02:36:03,,1329,6,486,0,0,0,0,0,0
61511025427_10154535499635428,"""My son and I eat this every day for breakfast. It's a hearty, healthy breakfast to jump start our day.""— Elisabeth Reitenbach, Terryville, Connecticut",Peanut Butter Oatmeal Recipe,link,http://spr.ly/61848G66k,2016-11-17 01:17:02,,980,30,417,0,0,0,0,0,0
61511025427_10154535328880428,"""For the holidays, I usually serve the traditional foods plus a new spin or two on family favorites. I put together these creamy potatoes the night before and simply bake the day of to save precious holiday time."" —Wendy Ball, Battle Creek, Michigan",Make-Ahead Creamy Potatoes Recipe,link,http://spr.ly/61808HJDp,2016-11-17 00:16:02,,998,5,346,0,0,0,0,0,0
61511025427_10154535191935428,"""This rich cake is ideal for special occasions."" —Priscilla Prescott, Forest City, North Carolina",Mud Cake Recipe,link,http://spr.ly/618081hx4,2016-11-16 23:11:04,,6976,88,5265,0,0,0,0,0,0
61511025427_10154535087395428,"""My cinnamon rolls have been known to vanish quickly. Once I dropped off a dozen rolls for my brothers, and they emptied the pan in 10 minutes."" —Regina Farmwald, West Farmington, Ohio",Can't-Eat-Just-One Cinnamon Rolls Recipe,link,http://spr.ly/618081haj,2016-11-16 22:09:02,,5093,37,3436,0,0,0,0,0,0
61511025427_10154534964035428,"""This is my family's favorite casserole recipe. I make it every week or two and we never tire of it. I like that I can clean my kitchen and then relax while it bakes. It won't disappoint!"" —Carmen Vanosch, Vernon, British Columbia",Chicken Penne Casserole Recipe,link,http://spr.ly/618381htf,2016-11-16 21:08:02,,2522,30,1519,0,0,0,0,0,0
61511025427_10154534223925428,"Put delicious homemade cranberry butter on this year's food gift list. 

FULL RECIPE for Cranberry Honey Butter: http://spr.ly/61888H61C",Cranberry Honey Butter,video,https://www.facebook.com/tasteofhome/videos/10154534223925428/,2016-11-16 15:15:36,00:31,11531,348,17066,0,0,0,0,0,0
61511025427_10154534008005428,"These easy dinner rolls have a honey-garlic topping. Yum! This recipe, and more that make baking easy, can be found in our Simple & Delicious Cookbook Binder, available wherever books are sold!",Baker's Dozen Yeast Rolls Recipe,link,http://spr.ly/618988zJT,2016-11-16 14:02:03,,1453,6,692,0,0,0,0,0,0
61511025427_10154533899450428,,15 Southern Thanksgiving Recipes,link,http://spr.ly/61888HDD8,2016-11-16 13:06:03,,1044,10,487,0,0,0,0,0,0
61511025427_10154533671320428,"""As a busy mom, I love my slow cooker meals! Beef tips remind me of a childhood favorite. I cook them with mushrooms and red wine, then serve over brown rice, noodles or mashed potatoes."" —Amy Lents, Grand Forks, ND",Slow Cooker Beef Tips Recipe,link,http://spr.ly/618581hsV,2016-11-16 11:05:02,,3658,34,2971,0,0,0,0,0,0
61511025427_10154533433290428,,30 Weekend Breakfast Recipes Ready in 30 Minutes,link,http://spr.ly/61888GhYq,2016-11-16 09:02:04,,3329,29,2232,0,0,0,0,0,0
61511025427_10154533167195428,"""My mother-in-law raves about the chicken and rice soup we serve at our house. I tweaked the recipe several times to get it just right."" —Teresa Jacobson, St. Johns, Florida",Quick Chicken & Wild Rice Soup Recipe,link,http://spr.ly/618881hqm,2016-11-16 07:00:03,,2925,25,2173,0,0,0,0,0,0
61511025427_10154532830095428,"""Festive buttery shortbreads are even better when dipped in chocolate and sprinkled with crushed candy."" —Dahlia Abrams, Detroit, Michigan",Mint-Chocolate Dipped Shortbread Cookies Recipe,link,http://spr.ly/618981hU5,2016-11-16 02:32:02,,1041,13,487,0,0,0,0,0,0
61511025427_10154532720920428,"""I've always been a big fan of peanut butter. Then I found chocolaty Nutella hazelnut spread and I was hooked! I even changed one of my all-time favorite pie recipes by substituting that ingredient.""—Lisa Varner, El Paso, Texas",Creamy Hazelnut Pie Recipe,link,http://spr.ly/618081hos,2016-11-16 01:11:04,,1082,9,328,0,0,0,0,0,0
61511025427_10154532556635428,"""This comforting dessert is a wonderful way to end any meal. As a girl, I always waited eagerly for the first heavenly bite. Today, my husband likes to top his with a scoop of ice cream."" —Sandra Melnychenko, Grandview, Manitoba",Old-Fashioned Rice Pudding Recipe,link,http://spr.ly/618881Fnp,2016-11-16 00:09:02,,5137,104,5267,0,0,0,0,0,0
61511025427_10154532456195428,"""A local restaurant serves a similar soup but wouldn't share its recipe with me. So I developed my own, modifying a recipe for potato soup. I was really pleased at the way this all-American soup turned out."" —Joanie Shawhan, Madison, Wisconsin",Cheeseburger Soup Recipe,link,http://spr.ly/61898GA4Z,2016-11-15 23:08:04,,1914,48,1657,0,0,0,0,0,0
61511025427_10154532355015428,"""Whenever I've taken these to church coffees, I've had women come into the kitchen and request the recipe. You'll enjoy this sugar cookie's secret ingredient—brown sugar!"" —Annabel Cox, Olivet, South Dakota",Angel Sugar Crisps Recipe,link,http://spr.ly/61808G6qw,2016-11-15 22:07:02,,6824,63,7422,0,0,0,0,0,0
61511025427_10154532253590428,"""For a book club event, I created pastrami roll-ups with cream cheese and a pickle. Those tasty roll-ups quickly pulled a disappearing act."" —Merritt Heinrich, Oswego, Illinois",Pastrami Roll-Ups Recipe,link,http://spr.ly/61848G6qK,2016-11-15 21:06:04,,849,35,399,0,0,0,0,0,0
61511025427_10154532041090428,,27 Favorite Mini Desserts,link,http://spr.ly/618281Frg,2016-11-15 19:05:03,,4016,32,3520,0,0,0,0,0,0
61511025427_10154531520770428,"An easy, old-fashioned corn pudding just like Grandma made is the ultimate in side dish success. 

FULL RECIPE for Corn Pudding: http://spr.ly/61808Gsym",Corn Pudding,video,https://www.facebook.com/tasteofhome/videos/10154531520770428/,2016-11-15 15:30:09,00:39,3292,113,5185,0,0,0,0,0,0
61511025427_10154531354725428,"Let's go back to school! Tell us: What was your favorite school lunch? Did your school cook have a specialty? Leave your answers in the comments below, and we'll publish a few in an upcoming issue of Taste of Home magazine (please include your city and state/province with your answer).",,status,,2016-11-15 14:05:00,,259,771,41,0,0,0,0,0,0
61511025427_10154531217410428,"""My husband and I avoid fried foods, but potatoes are part of our menu almost every day. These delectable sliced potatoes get nice and crispy and give our meals a likable lift."" — Mary Lou Kelly, Scottdale, Pennsylvania",Oven Parmesan Chips Recipe,link,http://spr.ly/618781FRW,2016-11-15 13:03:02,,2202,22,1414,0,0,0,0,0,0
61511025427_10154531007245428,,41 Things to Do with Crescent Dough Besides Make Rolls,link,http://spr.ly/61898GLvV,2016-11-15 11:34:02,,3238,33,2937,0,0,0,0,0,0
61511025427_10154530848745428,"""My mother got this recipe from a woman named Emmie Oddie, a well-known home economist in Canada who had a column in a farming newspaper. She would test reader recipes in her own kitchen and write about it. These tasty sweets are so rich that you only need a small piece.""—Judy Olson, Whitecourt, Alberta",Cherry-Coconut Slices Recipe,link,http://spr.ly/618881FBq,2016-11-15 10:10:03,,717,9,401,0,0,0,0,0,0
61511025427_10154530764065428,"Spread good cheer at every gathering with recipes for buttery cookies, party meatballs, tender crescent rolls, a classic crown roast and so many more joyful family favorites. Find them all inside the December issue of Taste of Home.Looking to subscribe? Click here----> http://bit.ly/2eJZRxm",Taste of Home's cover photo,photo,https://www.facebook.com/tasteofhome/photos/a.10150730349590428.456242.61511025427/10154530764065428/?type=3,2016-11-15 09:26:04,,228,9,26,0,0,0,0,0,0
61511025427_10154530446140428,"""My husband really likes roast beef, and I really like my slow cooker. I brought in Asian influences for an all-day pot roast with some oomph."" —Lisa Varner, El Paso, TX",Soy-Ginger Pot Roast Recipe,link,http://spr.ly/61828Gami,2016-11-15 07:08:03,,598,3,257,0,0,0,0,0,0
61511025427_10154530138830428,"""When I get toffee bits, butterscotch chips and cashews together in one cookie, the sweet and salty combo is nearly impossible to resist."" —Crystal Schlueter, Northglenn, CO",Salted Toffee Cashew Cookies Recipe,link,http://spr.ly/6188810Cj,2016-11-15 02:32:02,,1391,11,1063,0,0,0,0,0,0
61511025427_10154530041725428,"""I live in apple country, and a delicious apple crisp is one good way to use them that doesn't take a lot of time to make."" —Gertrude Bartnick, Portage, Wisconsin",Winning Apple Crisp Recipe,link,http://spr.ly/6188810x6,2016-11-15 01:13:02,,3575,30,2266,0,0,0,0,0,0
61511025427_10154529883655428,"""My stepmother passed on the recipe for this delicious yeast coffee cake that's shaped into pretty rings. When I make it for friends, they always ask for seconds."" —June Gilliland, Hope, Indiana",Maple Butter Twists Recipe,link,http://spr.ly/61898GQ53,2016-11-15 00:08:02,,1070,7,415,0,0,0,0,0,0
61511025427_10154529797430428,"Egg rolls are so easy with this recipe, you'll wonder why you haven't been making them all along! Look for a good dipping sauce in the Asian aisle at your supermarket. —Angel Randol, Apple Valley, California",Effortless Egg Rolls Recipe,link,http://spr.ly/6183810QB,2016-11-14 23:06:02,,4558,54,3299,0,0,0,0,0,0
61511025427_10154529613675428,"""Chicken and dumplings harken back to my childhood and nippy days when we devoured those cute little balls of dough swimming in hot, rich broth.""—Erika Monroe-Williams, Scottsdale, AZ",The Best Chicken & Dumplings Recipe,link,http://spr.ly/61888GQDA,2016-11-14 22:05:02,,3502,42,2551,0,0,0,0,0,0
61511025427_10154529412115428,,25 Potluck Desserts to Feed a Crowd,link,http://spr.ly/6183810qW,2016-11-14 21:04:02,,1081,9,454,0,0,0,0,0,0
61511025427_10154529159705428,"""When my husband and I were first married, he refused to eat meat loaf because he said it was bland and dry. Then I prepared this version, and it became his favorite meal."" —Suzanne Codner, Starbuck, Minnesota",Melt-in-Your-Mouth Meat Loaf Recipe,link,http://spr.ly/6181810Ux,2016-11-14 20:02:02,,3243,27,1918,0,0,0,0,0,0
61511025427_154217931716652,"The Taste of Home Cooking School is coming to Sturgis, MI on Thursday, November 17th!  Taste of Home Culinary Specialist, Dana Elliott, will share her home cooking tips and tricks while demonstrating step-by-step recipes for the season's best dishes.  

Join us!  Find out for yourself, why people love the Taste of Home Cooking School!  Click for more info >  http://www.tasteofhome.com/cooking-schools/find-a-class/show-detail/mi/sturgis/9771","Taste of Home Cooking School LIVE - Sturgis, MI",event,https://www.facebook.com/events/154217931716652/,2016-11-14 18:04:21,,104,2,0,0,0,0,0,0,0
61511025427_10154511306595428,"Pressed for time? A soft shell chicken taco and casserole mashup is ready in 30 minutes. Hot, bubbly, yum! 

FULL RECIPE for Salsa Verde Chicken Casserole: http://spr.ly/6184BhHAu",Salsa Verde Chicken Casserole,video,https://www.facebook.com/tasteofhome/videos/10154511306595428/,2016-11-14 17:01:00,00:41,9813,378,20835,0,0,0,0,0,0
61511025427_10154527784990428,"This comfy, delicious side is straight from grandma's recipe box! Find this recipe, and more classics made easy, in the latest issue of Modern Comfort, on newsstands now",Scalloped Sweet Corn Casserole Recipe,link,http://spr.ly/618488Ezj,2016-11-14 14:32:02,,1010,7,567,0,0,0,0,0,0
61511025427_10154527022060428,,41 Ways to Love Jell-O (Because We Know You Do),link,http://spr.ly/61808G6oI,2016-11-14 12:31:02,,2914,32,1904,0,0,0,0,0,0
61511025427_10154526897620428,"""We keep bananas on hand, but with just two of us in the house they ripen faster than we can eat them. That makes them perfect for roasting and baking into this cheesecake with a nutty crust."" —Patricia Harmon, Baden, PA",Roasted Banana & Pecan Cheesecake Recipe,link,http://spr.ly/6188810mg,2016-11-14 11:29:03,,1318,21,544,0,0,0,0,0,0
61511025427_10154526609840428,,30 Appetizer Recipes Ready in 15 Minutes,link,http://spr.ly/6182810lm,2016-11-14 10:08:02,,1430,7,922,0,0,0,0,0,0
61511025427_10154518592515428,Serve this delicious sausage and vegetable stuffing to your family for a holiday meal they won't forget!,Traditional Sausage Stuffing Recipe,link,http://www.tasteofhome.com/recipes/traditional-sausage-stuffing,2016-11-14 09:12:00,,215,2,67,0,0,0,0,0,0
61511025427_10154526093795428,"""For a busy-day supper, my family loves to have big steaming, delicious bowls of this soup, along with fresh bread from our bread machine."" —Dotty Egge, Pelican Rapids, Minnesota",No-Fuss Potato Soup Recipe,link,http://spr.ly/61878GYmf,2016-11-14 07:06:02,,2664,37,1877,0,0,0,0,0,0
61511025427_10154525757260428,"""Refrigerated pie pastry and a muffin tin make it easy to create these delicious spiced pumpkin tartlets. Dollop with whipped cream and you're done!"" — Jessie Oleson, Santa Fe, New Mexico",Pumpkin Tartlets Recipe,link,http://spr.ly/61848G6Wu,2016-11-14 02:21:02,,817,10,297,0,0,0,0,0,0
61511025427_10154525640395428,"""This is a favorite recipe that has been in our family for over 20 years. My aunt taught me how to make it when I was 12 years old and I am still making it today."" —Jhana Seidler, Venice, Florida",Penuche Fudge Recipe,link,http://spr.ly/61898G6mS,2016-11-14 01:01:03,,3644,81,3862,0,0,0,0,0,0
61511025427_10154525435460428,"""Here's my best version of my favorite food—lasagna! The recipe is a winner, so it's worth the extra prep. You'll have plenty of time to plan side dishes while the main dish is cooking."" —Suzanne Smith, Bluffton, Indiana",Slow Cooker Cheesy White Lasagna Recipe,link,http://spr.ly/61828E4WG,2016-11-13 23:12:03,,2526,19,1609,0,0,0,0,0,0
61511025427_10154525348645428,,30 Soup Recipes Ready in 30 Minutes,link,http://spr.ly/61878Gi9t,2016-11-13 22:10:02,,4042,30,4759,0,0,0,0,0,0
61511025427_10154525244050428,"""Try as I might, I can never follow a recipe exactly, so here's what I came up with when I made a family friend's scalloped potatoes in my own kitchen. They're so awesome, you just keep going back for more."" —Susan Simons, Eatonville, Washington",Sharp Cheddar Scalloped Potatoes Recipe,link,http://spr.ly/61838GipH,2016-11-13 21:08:02,,4291,31,2762,0,0,0,0,0,0
61511025427_10154525142060428,"""My version of the classic cookie is based on a recipe from a bakery in California called Hungry Bear. It's big, thick and chewy—perfect for dunking."" —Irene Yeh, Mequon, Wisconsin",Big & Buttery Chocolate Chip Cookies Recipe,link,http://spr.ly/61888E4Um,2016-11-13 20:09:02,,5054,36,4045,0,0,0,0,0,0
61511025427_10154525027290428,"These cuties pack eggs, hash browns and bacon in single-serving cups. Grab one and go!

FULL RECIPE for Scrambled Egg Hash Brown Cups: http://spr.ly/61848Gk8O",Scrambled Egg Hash Brown Cups,video,https://www.facebook.com/tasteofhome/videos/10154525027290428/,2016-11-13 19:07:10,00:51,14129,694,31415,0,0,0,0,0,0
61511025427_10154524904355428,,How to Make Homemade Tortillas,link,http://spr.ly/61868E4ta,2016-11-13 18:03:02,,3739,48,2888,0,0,0,0,0,0
61511025427_10154524778360428,"""This tangy and sweet casserole is full of flavor. We've served it at many celebrations over the years and it's always been a bit hit!"" —Gloria Mezikofsky, Wakefield, Massachusetts",Sweet Potato & Carrot Casserole Recipe,link,http://spr.ly/61898E4Qx,2016-11-13 17:03:03,,1720,25,1067,0,0,0,0,0,0
61511025427_10154524566115428,,19 Warm and Cozy Fall Dinner Recipes,link,http://spr.ly/61878E4aD,2016-11-13 16:02:02,,2192,13,1807,0,0,0,0,0,0
61511025427_10154524348710428,"""I love the excellent texture of this old-fashioned streusel-topped coffee cake. Always a crowd-pleaser, its pleasing vanilla flavor enriched by sour cream may remind you of breakfast at Grandma's!"" —Eleanor Harris, Cape Coral, Florida",Cinnamon Coffee Cake Recipe,link,http://spr.ly/61878E4aF,2016-11-13 14:33:02,,7948,104,7156,0,0,0,0,0,0
61511025427_10154524161220428,,14 Thanksgiving Dinner Recipes for Four,link,http://spr.ly/61868GBHm,2016-11-13 13:10:02,,1426,5,648,0,0,0,0,0,0
61511025427_10154523981300428,"""When juicy pot roast simmers in garlic, onions and veggies, everyone comes running to ask, 'When can we eat?' The answer? Just wait…it will be worth it."" —Taste of Home Test Kitchen",Ultimate Pot Roast Recipe,link,http://spr.ly/61818Gg1D,2016-11-13 12:05:03,,3857,36,1752,0,0,0,0,0,0
61511025427_10154523826945428,,20 Recipes for Homemade Rolls,link,http://spr.ly/61858E409,2016-11-13 11:06:02,,1656,12,1051,0,0,0,0,0,0
61511025427_10154523524555428,"""I love this recipe because it makes me look like an expert candy maker...it's so easy! This candy graces our table from Thanksgiving through the New Year."" —Janice Sage, Garretson, South Dakota",Almond Toffee Recipe,link,http://spr.ly/618681a7s,2016-11-13 10:04:02,,13499,198,20603,0,0,0,0,0,0
61511025427_10154523388050428,"""My daughter, Lisa Sand, brought 10 pans of these yummy chicken enchiladas to my wedding reception and they were the biggest hit of all the food. So many guests wanted the recipe, we sent it out with our Christmas cards."" —Pat Coffee, Kingston, Washington",Creamy Chicken Enchiladas Recipe,link,http://spr.ly/61838EfHR,2016-11-13 09:02:02,,7638,140,8354,0,0,0,0,0,0
61511025427_10154523095610428,"""This pumpkin cake roll is great to keep in the freezer for a quick dessert for my family or unexpected guests, to take to a gathering or to give as a yummy gift. The recipe is in such demand, I use a 29-ounce can of pumpkin to make four rolls at a time."" —Erica Berchtold, Freeport, Illinois",Favorite Pumpkin Cake Roll Recipe,link,http://spr.ly/61858Efyl,2016-11-13 07:03:02,,6291,85,5871,0,0,0,0,0,0
61511025427_10154522724705428,"""Sweet chocolate, creamy peanut butter and salty pretzels create a to-die-for truffle. It's a little bite of decadence and a special indulgence for the holiday season.""—Ashley Wisniewski, Champaign, Illinois",Chocolate-Covered Peanut Butter & Pretzel Truffles Recipe,link,http://spr.ly/618481a7n,2016-11-13 02:32:03,,3530,46,3388,0,0,0,0,0,0
61511025427_10154522565570428,"""A neighbor brought over a pan of these rich brownies along with the recipe when I came home from the hospital with our baby daughter. I've made them ever since for family occasions, potlucks and parties at work."" —Sue Soderlund, Elgin, Illinois",Frosted Fudge Brownies Recipe,link,http://spr.ly/61898Ef3U,2016-11-13 01:07:02,,4902,44,4150,0,0,0,0,0,0
61511025427_10154522425380428,"""I put a twist on one of my favorite comfort foods from my grandmother's recipes. I look forward to passing this down to my kids."" —Jamie Chase, Rising Sun, Indiana",Slow-Cooked Loaded Potato Soup Recipe,link,http://spr.ly/618981aA7,2016-11-13 00:10:01,,2012,18,1040,0,0,0,0,0,0
61511025427_10154522343445428,,"30 Ways to Cook Boneless, Skinless Chicken Breasts",link,http://spr.ly/61858E4OJ,2016-11-12 23:08:01,,4831,47,5930,0,0,0,0,0,0
61511025427_10154522233045428,"""This recipe is an interesting way to use apples. I usually make them on Fridays, so when family and friends drop in on the weekend, I have a nice dessert to serve. They bake flaky and golden brown outside and moist inside."" —Lila Eller, Everett, Washington",Golden Apple Bundles Recipe,link,http://spr.ly/61818E43b,2016-11-12 22:07:03,,1969,8,1045,0,0,0,0,0,0
61511025427_10154522114220428,"""This is the dish I take most often to potlucks, and the pan comes home empty every time. It has the irresistible taco taste that everybody craves."" —Kim Stoller, Smithville, Ohio",Potluck Taco Casserole,link,http://spr.ly/61808GdgC,2016-11-12 21:06:02,,4716,44,4471,0,0,0,0,0,0
61511025427_10154522010395428,"""We always called this Mama's 'never fail' recipe. I guess the same holds true for me, since I've entered this cake in contests and won with it. This tasty dessert is popular in our family, and it always brings back fond memories of Mama.""—Carrie Bartlett, Gallatin, Tennessee",Moist Lazy Daisy Cake Recipe,link,http://spr.ly/61848E4zO,2016-11-12 20:05:02,,2522,31,1625,0,0,0,0,0,0
61511025427_10154521900095428,"""A cousin in North Carolina gave me the recipe for these delicious honey-glazed rolls. Using my bread machine to make the dough saves me about 2 hours compared to the traditional method. The rich, buttery taste of these rolls is so popular with family and friends that I usually make two batches so I have enough!"" —Sara Wing, Philadelphia, Pennsylvania",Golden Honey Pan Rolls Recipe,link,http://spr.ly/61898E4KB,2016-11-12 19:04:02,,4780,31,3873,0,0,0,0,0,0
61511025427_10154521783385428,,How to Make Gravy,link,http://spr.ly/61898E4yt,2016-11-12 18:04:02,,1400,16,970,0,0,0,0,0,0
61511025427_10154521595180428,,17 Fall Cookie Recipes,link,http://spr.ly/61808Gja0,2016-11-12 17:03:02,,3888,32,3778,0,0,0,0,0,0
61511025427_10154521261700428,"Classic cranberry fluff never goes out of style. 

FULL RECIPE for Creamy Cranberry Salad: http://spr.ly/61818Gk6c",Creamy Cranberry Salad,video,https://www.facebook.com/tasteofhome/videos/10154521261700428/,2016-11-12 15:02:04,00:37,17914,896,65513,0,0,0,0,0,0
61511025427_10154521065220428,,42 Holiday Party Snacks Every Host Should Know,link,http://spr.ly/618481aAk,2016-11-12 14:01:02,,4180,29,5019,0,0,0,0,0,0
